name,full_name,description,created_at,pushed_at,language
react-auditor,chesteralan/react-auditor,"A blazing-fast Rust CLI to scan JS/TS/React code for best practices, quality, and security issues.",2026-07-01T06:01:17Z,2026-07-01T08:13:39Z,Rust
Face-Attendence-SYS-CV,2024f-mulug-1293-tech/Face-Attendence-SYS-CV,"A blazing-fast, serverless AI Face Recognition Attendance System built for Minhaj University Lahore. Features real-time edge biometrics, Supabase cloud sync, and automated matrix analytics.https://face-attendence-sys-cv.vercel.app/",2026-07-01T03:16:22Z,2026-07-01T04:40:06Z,JavaScript
hangstop,bad-indentation/hangstop,Blazingly fast Hangman solver using information theory,2026-06-30T23:44:24Z,2026-06-30T23:46:43Z,Rust
formula1-minimal-api,giliardolv/formula1-minimal-api,"A high-performance, minimalist Formula 1 API built with Fastify and TypeScript. Lightweight, blazingly fast, and designed with a clean architecture to serve F1 teams and drivers data.",2026-06-30T19:16:03Z,2026-06-30T19:21:56Z,TypeScript
Log-Parser,and1mo/Log-Parser,"A blazing fast, optimized log parser written in go ",2026-06-30T17:35:08Z,2026-06-30T18:09:11Z,Go
Custom-C-DNN-for-supervised-learning,KitsuneX7/Custom-C-DNN-for-supervised-learning,"A blazing-fast deep neural network with 30 input neurons, 5 hidden layers of 16 neurons, and an output neuron, meant to be applied specifically in a credit card fraud detection supervised learning problem.",2026-06-30T16:07:27Z,2026-06-30T16:47:31Z,C++
Pro-Invoice-Gen,Somesh-Thakur/Pro-Invoice-Gen,"A blazing-fast, local desktop invoice generator built with Python and HTML/JS. Features OTA updates, smart Excel databases, and pixel-perfect print layouts.",2026-06-30T14:50:52Z,2026-06-30T15:51:48Z,HTML
Calcupress,divyanshkatiyar/Calcupress,"Material3 Expressive Scientific Calculator & Unit Converter built using HTML,CSS,JavaScript Perform Advanced Scientific CalculationsInstantly convert Length/Area/Volume/Mass/Temperature/Speed/Time/DataEnjoy Dynamic Material You ThemesLight/Dark mode HistoryResponsive DesignSmooth AnimationsIntuitive menus , Clean, blazing-fast UI",2026-06-30T12:50:13Z,2026-06-30T12:56:16Z,HTML
Python-Web-Scraping-Data-Extraction-Specialist-Excel-Automation,hamropac970/Python-Web-Scraping-Data-Extraction-Specialist-Excel-Automation,"Blazing Fast Speed: I use multi-threading (ThreadPoolExecutor) to extract data 5x-10x faster than standard bots.  Anti-Ban Architecture: My scrapers bypass security systems using IP Proxy rotation, dynamic User-Agents, and human-like delays.",2026-06-30T11:23:03Z,2026-06-30T11:26:07Z,Python
laserpoint,jede/laserpoint,Spotlight app launcher replacement for macOS. Designed to be blazing fast.,2026-06-30T11:12:09Z,2026-06-30T11:45:11Z,Swift
subix,youwannahackme/subix,"Subix is a blazing-fast, hybrid subdomain enumeration engine written in Go. It combines 42 passive OSINT sources with advanced active capabilities like multi-threaded DNS resolution, smart wildcard filtering, recursive scanning, and a permutation engine. Say goodbye to complex CLI chainingSubix handles the entire discovery pipeline in one run.",2026-06-30T08:09:42Z,2026-06-30T08:11:09Z,Go
metal-dca,ParkWardRR/metal-dca,"Blazing fast, Metal-accelerated GPU Differential Computation Analysis (DCA) engine for advanced side-channel research, white-box cryptography analysis, and Pearson correlation testing on Apple Silicon. Bypasses Python bottlenecks for parallelized execution.",2026-06-30T05:43:41Z,2026-07-01T00:31:53Z,Go
DB-Search,GreatSaadi/DB-Search,"Blazing-fast, multi-threaded, multi-format file & database search tool for your terminal",2026-06-30T02:46:19Z,2026-06-30T02:51:23Z,Python
LiteIAM,brahdian/LiteIAM," A blazing-fast, lightweight, multi-tenant IAM platform built on FastAPI-users.",2026-06-29T19:12:22Z,2026-07-01T03:16:22Z,Python
erno,advgnd/erno,A blazing fast Rubik's Cube library written in Rust.,2026-06-29T15:17:41Z,2026-06-30T11:35:04Z,Rust
convert-rs,farhnkrnapratma/convert-rs,A simple and blazingly fast unit conversion API powered by Rust,2026-06-29T14:36:37Z,2026-07-01T07:47:21Z,Rust
zap,AndyFree96/zap,A blazing-fast developer port and process manager for the command line.,2026-06-29T13:53:13Z,2026-06-29T14:50:02Z,TypeScript
SuperMarioBros-Nes-turbo,tsilva/SuperMarioBros-Nes-turbo, Blazing fast SuperMarioBros-Nes environment for RL research ,2026-06-29T13:22:25Z,2026-06-30T20:14:56Z,Rust
zeromatch,orielhaim/zeromatch,"Blazing-fast, picomatch-compatible glob matching, powered by a linear-time Rust bytecode VM",2026-06-29T10:46:05Z,2026-06-29T11:31:17Z,Rust
motion,florianwolz/motion,Rust-based motion graphics engine for blazing fast presentations,2026-06-29T06:48:36Z,2026-06-29T06:48:37Z,
rutken_static_analyzer,WRenchJr42/rutken_static_analyzer,A blazing-fast Android static analysis engine for APKs.,2026-06-29T02:47:52Z,2026-07-01T05:06:06Z,Rust
tmx,krunalparmarem/tmx,"tmx is a blazing-fast, Rust-based CLI wrapper around `tmux` designed specifically for AI Developers and Multi-Agent Orchestration.",2026-06-28T23:13:11Z,2026-06-29T22:34:34Z,Rust
nvimgt,yonasuriv/nvimgt,"nvimGT is a blazing fast, aesthetic and extensible neovim configuration with a refined UI, strong defaults, and a carefully selected plugin set designed for a smooth out-of-the-box experience.",2026-06-28T22:47:31Z,2026-06-29T20:42:48Z,Lua
dvm,LetsMelon/dvm,Blazingly fast stack based language with an custom interpreter written in Rust .,2026-06-28T18:17:09Z,2026-06-28T18:23:07Z,Rust
folio,SinghArindam/folio,"A blazing-fast, magazine-styled static book reader for Markdown content.",2026-06-28T15:46:45Z,2026-06-29T05:58:22Z,HTML
SourceSniff,CoskunKaan1/SourceSniff,"A blazing-fast, locally hosted code search engine powered by an Inverted Index architecture.",2026-06-28T14:45:16Z,2026-06-28T14:49:34Z,Python
pinout-cli,ceenorby/pinout-cli,"A blazing-fast, offline terminal-based hardware pinout lookup tool for engineering students and lab troubleshooting.",2026-06-28T14:40:01Z,2026-06-28T21:10:21Z,Python
iex-deep-parser,acauntbogdana/iex-deep-parser,Blazing fast IEX DEEP 1.0 pcap.gz  Parquet converter. Rust engine + Python pipeline with automatic download & processing.,2026-06-28T13:39:32Z,2026-06-30T03:30:59Z,Rust
shadow_scan,goateddhifdisfbds/shadow_scan,"A blazing fast, multi-threaded secrets and credentials scanner written in Rust with Git history audit and CI/CD integration.",2026-06-28T12:31:09Z,2026-06-28T12:31:10Z,
BlazeKV,Giga30/BlazeKV,"A blazing fast, single-threaded in-memory key-value store built with Linux epoll and a custom binary protocol.",2026-06-28T10:01:19Z,2026-06-28T10:01:20Z,
QuietForge,anbuhckr/QuietForge,"A blazing-fast AI coding agent that uses native Git worktrees, SQLite task memory, and concurrent Swarms to autonomously build massive codebases.",2026-06-28T09:13:53Z,2026-07-01T06:02:49Z,Go
lunchbox-ide,sumanmanna134/lunchbox-ide,"Say goodbye to environment setup. Lunchbox is a blazing-fast, real-time collaborative coding platform with instant remote execution and seamless GitHub integration. The ultimate workspace is almost here.",2026-06-28T07:07:40Z,2026-06-28T07:09:47Z,Java
vec_db,blackeagle686/vec_db,"VecDB is a highly optimized vector database engine built entirely from scratch in Rust. Designed with strict systems architecture principles, it focuses on memory efficiency, zero-cost abstractions, and blazing-fast approximate nearest neighbor (ANN) search capabilities.",2026-06-27T21:09:39Z,2026-06-30T16:41:21Z,Rust
SummarizeAI-Premium_Text_Summarizer,add-win/SummarizeAI-Premium_Text_Summarizer,"A modern, high-performance, and visually stunning AI text summarizer application built with Streamlit and powered by the blazing-fast Groq Cloud API (utilizing the llama-3.3-70b-versatile model).",2026-06-27T13:42:21Z,2026-06-27T13:42:25Z,Python
CollectThemAll,serplay/CollectThemAll,"A blazingly fast, cross-platform desktop overlay and mobile map tracker for game collectibles. Built with Tauri v2, Svelte 5, and Leaflet.",2026-06-27T12:50:27Z,2026-06-30T23:11:48Z,Svelte
Terminal-Based-Pattern-Matcher,IamGeniusORG/Terminal-Based-Pattern-Matcher,"A blazing fast, multi-threaded command-line text search tool (grep clone) built in Rust, featuring Regex support, memory-safe buffered I/O, and recursive directory scanning.",2026-06-27T08:26:54Z,2026-06-27T08:33:41Z,Rust
oxiterm,oxiterm/oxiterm,"Oxiterm is a blazing-fast, memory-safe, cross-platform terminal emulator  built from the ground up in Rust.",2026-06-27T03:28:37Z,2026-06-27T20:38:23Z,Rust
VPN-Core,hamzamahelsayed2016-lang/VPN-Core,"VPN Core  Beyond Security. Stop using heavy, bloated VPNs. VPN Core gives you the raw power of a high-performance network tunnel. Lightweight, blazing-fast, and built for those who value privacy and absolute isolation",2026-06-26T20:58:16Z,2026-06-26T21:03:36Z,Go
fast-bytelevel-bpe-go,yunnian/fast-bytelevel-bpe-go,"A blazing-fast Go trainer for HuggingFace-compatible ByteLevel BPE tokenizers, optimized for large JSONL datasets and up to 6x faster in local benchmarks.",2026-06-26T17:54:23Z,2026-06-27T01:35:21Z,Go
blazing-viz-stack,beatleboy501/blazing-viz-stack,A blazing fast Data Visualization app by2026 standards,2026-06-26T16:45:24Z,2026-06-26T16:51:57Z,TypeScript
Blazing-URL-Shortner,alokspacy/Blazing-URL-Shortner,"A modern, blazing-fast URL shortener web application that generates, manages, and shares shortened links through a clean and responsive interface.",2026-06-26T16:06:38Z,2026-06-27T08:56:09Z,JavaScript
CamalityV3,IJcool33-tech/CamalityV3,"CamalityV3 is a fast, lightweight code editor forked from Zed and optimized for Windows. Built in Rust with a GPU-accelerated UI and integrated ConPTY terminal support, it delivers blazing-fast performance and an efficient editing workflow. ",2026-06-26T14:27:24Z,2026-06-30T23:21:02Z,
chrono-fetch,bypanenikrishna2617-stack/chrono-fetch,"A blazingly fast, Rust-based CLI utility that seamlessly navigates your Git history to instantly recover lost files, deleted functions, or overwritten code blocks without needing to manually checkout older commits. Think of it as a time machine for your local repository.",2026-06-26T14:13:08Z,2026-06-26T14:13:09Z,
temp-port,tanbaycu/temp-port,"A blazing fast, auto-scanning CLI tool to expose your localhost to the internet instantly with Custom Subdomains and QR Codes.",2026-06-26T13:16:21Z,2026-06-27T04:09:40Z,JavaScript
rash,luluxe008/rash,A blazing fast rust  implementation of my cash shell,2026-06-26T12:16:12Z,2026-06-26T12:23:18Z,Rust
nyxwm,NyxOkkotsu/nyxwm,"nyxwm is a feature-rich, ultra-lightweight, and blazingly fast tiling window manager for X11",2026-06-26T09:50:59Z,2026-06-29T18:30:40Z,C
fastdog,GoodZheng/fastdog,"A blazing-fast, minimalist text search tool for Windows powered by ripgrep. Clean UI, zero config, built for developers.",2026-06-26T08:14:37Z,2026-07-01T09:30:57Z,C#
SGCC-App,SoftwareDesigner007/SGCC-App,"Rome wasn't built in a day, and neither was the SGCC App. This productivity powerhouse turns studying into a breeze! Featuring instant study resources, dark mode, and a blazing-fast AI chatbot. Dive into the code and witness the alchemy of hard work and cutting-edge technology.",2026-06-26T07:30:58Z,2026-06-26T15:46:14Z,Dart
ai-cache-cleaner,hnthnh/ai-cache-cleaner,"A blazing fast CLI tool to clean up AI cache, weights, and logs (HuggingFace, Ollama, PyTorch, Pip, Cursor)",2026-06-26T04:36:16Z,2026-06-26T04:55:25Z,Rust
cloudflare-kv-bulk-deleter,rockz5555/cloudflare-kv-bulk-deleter,"Blazing-fast, interactive KV namespace cleaner with a gorgeous CLI experience.",2026-06-26T01:27:50Z,2026-06-26T01:56:38Z,JavaScript
as-sound-switch,Nuno69/as-sound-switch,Blazingly fast audio input/output switching for Emacs,2026-06-25T21:23:00Z,2026-06-25T21:25:43Z,Emacs Lisp
deepgram-batch,tomkabel/deepgram-batch,Blazing-fast batch speech-to-text for 50+ languages via DeepGram Nova-3,2026-06-25T18:45:49Z,2026-06-25T18:46:19Z,Go
aptimaster-ai,sundaralingamduraisamy/aptimaster-ai," An AI-powered aptitude training platform built with React, Node.js, and Groq's blazing-fast Llama-3 models. Features dynamic question generation and an interactive AI tutor for placement preparation.",2026-06-25T09:54:43Z,2026-06-25T09:56:40Z,TypeScript
Pedestrians,connysamp/Pedestrians,"A highly optimized, open.mp compatible pedestrian system for SA-MP. Uses lightweight Actors instead of player-slot NPCs. Features dynamic AI: pedestrians react to gunshots, fall when hit by vehicles, and raise hands when aimed at. Powered by a blazing-fast C++ pathfinding plugin for zero server lag and massive scalability.",2026-06-25T08:03:30Z,2026-06-25T19:48:50Z,C++
watchr,ShashidharaGM/watchr,A blazing fast file watcher CLI built in Rust. Watches any folder and runs any command when files change. Works with every language and framework.,2026-06-25T00:03:52Z,2026-06-25T00:08:28Z,Rust
polarscope,pytoned/polarscope,Blazingly fast [Polars] dataframe stats  describe() on steroids,2026-06-24T22:10:36Z,2026-06-25T13:34:57Z,Python
inputd,jasperwoodchuck/inputd,"A blazingly fast, lightweight input remapper for Linux written in Rust.",2026-06-24T19:19:24Z,2026-06-26T17:27:15Z,Rust
opencode2api-super,fushuain-collab/opencode2api-super,"Super enhanced OpenCode2API - Tools enabled, streaming optimized, blazing fast",2026-06-24T18:58:42Z,2026-06-25T15:14:28Z,JavaScript
hxdo,mtsoltan/hxdo,Static-linked blazing-fast human-like keyboard and mouse automation in Rust. Use ethically!,2026-06-24T16:47:08Z,2026-06-25T09:47:47Z,Rust
safestream,MuhammadArslanKhan96/safestream,"A blazing-fast, zero-disk-footprint database and VPS snapshot orchestrator written in Go. Streams real-time compressed data blocks directly to Cloudflare R2, AWS S3, and Google Drive using native io.Pipe concurrency.",2026-06-24T13:46:23Z,2026-06-24T13:46:32Z,Go
PortScope,mamawe/PortScope," See what's running on your ports, then decide what to kill. A blazing-fast macOS menu bar app for port management  built with Tauri + React + Rust.",2026-06-24T08:59:42Z,2026-06-24T09:09:53Z,
ytplay-tui,ucmz851/ytplay-tui," A blazing-fast, vim-slick, eye-friendly YouTube TUI written in Rust. Search, manage, and stream your favorite content directly from the terminal! ",2026-06-24T08:14:50Z,2026-06-24T09:04:08Z,Rust
code-analyzer-cli,briancai/code-analyzer-cli,"A blazing-fast, Rust-based code analysis CLI powered by tree-sitter. Analyze code structure, track dependencies, and explore call graphs across multiple languages. Optimized for AI coding agents",2026-06-24T06:53:40Z,2026-06-24T12:19:44Z,Rust
FlipFlopper,AraujoJordan/FlipFlopper,One cockpit for every CLI AI coding agent. A blazingly fast Tauri + SolidJS desktop GUI.,2026-06-24T00:49:59Z,2026-06-25T16:24:17Z,Rust
dispatch,OpusNano/dispatch,"Blazing-fast, deterministic complexity router for OpenCode; classifies requests across four tiers using active task-frame extraction and routes each to the right OpenRouter model.",2026-06-23T18:50:17Z,2026-06-27T09:54:39Z,Go
dead_link_detector,Ribzee/dead_link_detector,a blazingly fast rust detector of a page's dead links,2026-06-23T15:47:15Z,2026-06-24T10:16:07Z,Rust
ZynSearch,TheProject24/ZynSearch,"ZynSearch is a blazing-fast, disk-persistent search engine written in Rust. No neural networks, no black boxes  just deterministic, reproducible keyword search at sub-millisecond latency. Embed it directly as a Rust crate, or deploy it as a standalone service and connect from any language via HTTP or gRPC.",2026-06-23T09:51:56Z,2026-07-01T07:22:02Z,Rust
ActionCut,naveenneog/ActionCut,"A blazing-fast, CapCut-inspired Android video editor  Jetpack Compose, Media3, multi-track timeline, LUT filters & platform export presets.",2026-06-23T09:22:02Z,2026-06-26T06:24:40Z,Kotlin
Real-Time-Stock-Screener,mayankraj019/Real-Time-Stock-Screener," Scan thousands of stocks in real time. Filter by RSI, MACD, volume, and more  live WebSocket updates, instant alerts, and a blazing-fast React UI. Built with FastAPI + Kafka + Redis.",2026-06-23T09:01:33Z,2026-06-23T09:02:15Z,Python
rust_ultimate_performance_guide,Laugharne/rust_ultimate_performance_guide,"Rust is known for speed, but is your Rust code truly optimized? In this 12 minute guide, you'll learn how to go beyond the basics and master the tools, techniques, and strategies that make Rust applications blazingly fast.",2026-06-23T08:17:24Z,2026-06-23T08:22:26Z,
codelines,Muneer320/codelines," A blazing-fast, parallel Lines of Code counter with beautiful terminal UI",2026-06-23T05:17:24Z,2026-06-23T06:14:00Z,Python
fastpool,xlauro/fastpool,"A blazing-fast, lightweight, and zero-dependency promise concurrency limiter for Node.js, Bun, and the browser.",2026-06-23T02:10:55Z,2026-06-23T02:19:24Z,TypeScript
voice-tts-box,cdmasd/voice-tts-box,"A blazing-fast, offline Desktop TTS app built with Wails, React, and Kokoro AI.",2026-06-23T02:03:30Z,2026-06-23T02:09:43Z,NSIS
Tenpack,trevorblacklock/Tenpack,Blazingly fast tensor operations with an API similar to NumPy,2026-06-23T01:44:54Z,2026-06-23T21:52:57Z,C++
cli,BitVanes/cli,"Blazing fast terminal ETL for local RAG pipelines. Zero-trust document parsing, PII scrubbing, and text chunking to Apache Arrow.",2026-06-23T00:47:27Z,2026-06-24T23:02:09Z,Rust
LIbGX-Broswerr,kamilazlzddd/LIbGX-Broswerr,"A lightweight, blazing fast, and fully open-source web browser powered by LibGX. Redefining your browsing experience.",2026-06-22T18:36:25Z,2026-06-22T18:39:08Z,JavaScript
LIbGX-Broswer,kamilazlzddd/LIbGX-Broswer,"A lightweight, blazing fast, and fully open-source web browser powered by LibGX. Redefining your browsing experience.",2026-06-22T18:32:54Z,2026-06-22T18:32:55Z,
batchleaguereplays,vorlie/batchleaguereplays,"A blazing fast, modern PyQt6 desktop utility to batch browse historical League of Legends match history data and trigger old replay file downloads directly through Riot's local Client UX (LCU) API framework.",2026-06-22T14:17:50Z,2026-06-22T14:43:09Z,Python
PnoNote,balovess/PnoNote,"A blazing-fast, line-based rich-text markup language and plugin SDK in Rust. Features 0ms parsing on 2GB files via Ropey, noise-free formatting, and a stdin/stdout runtime for local scripts (Python, Node, etc.) with automatic dependency healing.",2026-06-22T13:59:05Z,2026-06-22T14:00:16Z,
URL_SHORTENER,Karthikeyanm07/URL_SHORTENER,"Sniply is a modern, blazing-fast, and secure URL shortening platform built to transform long, messy web links into clean, trackable, and easily shareable short URLs. Designed with privacy, speed, and clean user experience in mind, the platform features a professional dashboard for managing links, tracking analytics, and securing user accounts.",2026-06-22T12:53:34Z,2026-06-22T13:55:59Z,TypeScript
NexusHR-AI-Enabled-Enterprise-HR-and-Workforce-Intelligence-Platform-Frontend,Tanishq-btech-cse/NexusHR-AI-Enabled-Enterprise-HR-and-Workforce-Intelligence-Platform-Frontend,"A modern, blazing-fast React and Vite frontend for the NexusHR Enterprise HR & Workforce Intelligence Platform. Styled using Tailwind CSS, featuring interactive dashboards, automated employee workflows, and real-time analytics.",2026-06-22T09:12:38Z,2026-06-26T14:45:48Z,JavaScript
apollo,promitheas-nikou/apollo,"A utility program for sorting music files based on metadata, blazing fast written in rust",2026-06-21T23:15:20Z,2026-06-22T11:35:40Z,Rust
kitty-tabs,Kammu2000/kitty-tabs,A blazingly fast fuzzy tab picker for kitty terminal written in pure C,2026-06-21T21:13:34Z,2026-06-22T23:41:49Z,C
studyforge-toolkit,tawhid110/studyforge-toolkit,"A blazing-fast, offline-first study toolkit. Features a PDF merger, OCR scanner, citation builder, and flashcard maker built entirely in pure Vanilla JS and HTML5.  The README.md Description",2026-06-21T17:35:46Z,2026-06-21T18:43:14Z,JavaScript
imapped,esaiaswestberg/imapped,"Speed up your email workflow with a local IMAP mirror. Built in Rust with PostgreSQL, Redis, and S3-compatible storage for blazing-fast caching and search.",2026-06-21T17:13:42Z,2026-06-24T15:58:56Z,Rust
kp,lawandothman/kp,Kill whatever is listening on a port blazingly fast.,2026-06-21T14:46:08Z,2026-06-21T15:32:38Z,Rust
kubectl-notify,ebuildy/kubectl-notify,"Notification blazing fast for kubenertes, fluxcd, argocd events",2026-06-21T12:46:44Z,2026-06-23T16:09:25Z,Go
exercises_rust,andresyebra/exercises_rust,"Rust is a systems programming language that runs blazingly fast, prevents segfaults, and guarantees thread safety. It aims to bring modern language design and an advanced type system to systems programming. Rust does not use a garbage collector, using advanced static analysis to provide deterministic drops instead.",2026-06-20T22:31:43Z,2026-06-21T22:02:33Z,Rust
ChComboParser,Ch4120N/ChComboParser," Blazing-fast, multi-threaded C++ utility to parse, extract, filter, and deduplicate credential combo lists (user:pass). Built for pentesters, OSINT researchers, and red teamers. By Ch4120N.",2026-06-20T20:14:26Z,2026-06-22T21:24:55Z,C++
agy-statusline,Sam-297/agy-statusline,"A blazing-fast, zero-dependency status line for the Antigravity CLI.",2026-06-20T14:46:05Z,2026-06-21T14:11:05Z,JavaScript
bookmarks,cowburrs/bookmarks,A blazingly fast rust bashmarks alternative,2026-06-20T12:58:29Z,2026-06-25T07:20:08Z,Rust
killport,Harshidpatel12/killport,"A lightweight, blazing-fast CLI utility written in Go to easily find and kill processes running on specific ports.",2026-06-20T12:47:10Z,2026-06-25T06:03:50Z,Go
ecpp,KAAZamapiloT/ecpp," blazingly fast, AAA-grade Archetype Entity Component System (ECS) header-only library for C++17.",2026-06-20T07:11:46Z,2026-06-24T04:49:45Z,C++
glassy,alliecatowo/glassy,"A minimal, blazing-fast, GPU-accelerated terminal emulator in Rust  built to run Claude Code. Lighter & faster than ghostty.",2026-06-20T01:20:52Z,2026-06-26T21:05:34Z,Rust
ApexPyro,ThingEngineer/ApexPyro,"Open-source, ESP32-based pyrotechnics controller. It features a blazing-fast WebSocket Web UI, real-time continuity testing, and strict hardware safety interlocks to precisely manage up to zones with zero external dependencies.",2026-06-19T22:27:44Z,2026-06-23T22:34:33Z,C++
MacMail,d-sanoj/MacMail,"A blazing fast, 100% native macOS email client for Gmail and Google Calendar. Built with Swift, SwiftUI, and local SQLite caching.",2026-06-19T19:17:50Z,2026-06-22T19:27:46Z,Swift
CherryHTML,PeepingSeagull/CherryHTML,"A blazing-fast, high-performance HTML parser and DOM manipulation library for Node.js, written in Rust. Inspired by cheerio.",2026-06-19T16:41:35Z,2026-06-29T14:28:33Z,Rust
git-zen,achill06/git-zen,A blazing-fast Go CLI extension and interactive TUI for git branch management with fuzzy search and live GitHub PR statuses.,2026-06-19T15:44:22Z,2026-06-23T22:50:15Z,Go
JeTTY,bozdemir/JeTTY," JeTTY  a blazing-fast GPU-accelerated center-summon terminal in Rust (Yakuake-style F9, beloved themes, X11 & Wayland). Collaborators wanted!",2026-06-19T14:54:01Z,2026-06-30T20:12:23Z,Rust
FeatherCast,GenericLeon0/FeatherCast,"A blazing-fast, ultra-lightweight command launcher inspired by Raycast. Built for maximum productivity with zero bloat. Launch apps, execute scripts, and automate your workflow instantlyall with a minimal RAM and CPU footprint.",2026-06-19T07:41:06Z,2026-06-26T14:08:42Z,C++
lazyskills,alvinunreal/lazyskills,Blazing-fast mission control for agent skills.,2026-06-19T06:20:40Z,2026-07-01T01:14:48Z,Go
rusticc,PoubeIIe/rusticc,A Blazingly Fast C compiler (It's really just a toy compiler),2026-06-18T18:43:29Z,2026-06-27T22:03:06Z,C
tcb,krishnachandran-u/tcb,"Blazing-fast, keyboard-driven terminal overlay to search and recall past clips.",2026-06-18T17:42:06Z,2026-06-30T10:40:19Z,C
synapse-proxy,dudutti/synapse-proxy,"Blazing Fast Semantic Cache & API Optimizer for LLMs (OpenAI, Anthropic, Gemini)",2026-06-18T08:50:17Z,2026-07-01T05:31:45Z,TypeScript
bedrock-gateway-rust,sunerpy/bedrock-gateway-rust,"A 100% Rust, OpenAI-compatible API gateway for AWS Bedrock  drop-in, single-binary, blazingly fast. Chat Completions, Responses API, embeddings, prompt caching & extended thinking.",2026-06-18T07:34:21Z,2026-07-01T06:31:35Z,Rust
context-engine-cli,zain333ux/context-engine-cli,"A blazing-fast Python CLI that aggregates entire codebases into a single, clean text file optimized for Large Language Models (LLMs).",2026-06-18T02:07:55Z,2026-06-24T21:09:37Z,Python
tekflash,tekk/tekflash,"Blazingly fast bit-to-bit and file-level backup & flashing tool for block devices, supporting simultaneous compression and post-quantum encryption",2026-06-17T23:04:53Z,2026-06-24T18:54:41Z,Rust
snap-paste,RacheliShayzada/snap-paste,"A lightweight, blazing-fast desktop utility built with Tauri and React to instantly access and paste your frequently used permanent texts, snippets, and commands using system-wide shortcuts.",2026-06-17T16:47:18Z,2026-06-21T18:03:29Z,TypeScript
fhir-server,wso2/fhir-server," A blazing-fast, lightweight FHIR server written in Go.",2026-06-17T16:46:48Z,2026-07-01T08:51:21Z,Go
galley,achref-soua/galley,"A local-first, blazing-fast LaTeX studio. Pull a proof.",2026-06-17T13:50:04Z,2026-06-21T20:07:21Z,TypeScript
Futon,KabosuNeko/Futon,"A blazingly fast, minimalist TUI manga reader written in Go",2026-06-17T13:05:00Z,2026-06-24T14:26:22Z,Go
ts-glob,shahradelahi/ts-glob," Blazing fast, compiler-grade glob matcher with strict syntax checking",2026-06-17T12:55:03Z,2026-06-29T10:15:56Z,TypeScript
chawseek,samsouta/chawseek," ChawSeek  Your personal search engine for local files.  Index and search documents, PDFs, notes, markdown files, source code, and more with blazing-fast performance. Built for developers, creators, and businesses who need to find information instantly.",2026-06-17T08:55:51Z,2026-06-29T15:45:54Z,Python
LynxOCR,tabortao/LynxOCR,"LynxOCR is a blazing-fast, cross-platform desktop application for offline OCR text recognition.",2026-06-17T02:34:00Z,2026-07-01T02:43:06Z,TypeScript
