name,full_name,description,created_at,pushed_at,language
zack,moamenhredeen/zack,"Zack, blazing fast http testing tool",2024-09-12T20:24:50Z,2026-06-30T22:39:56Z,Rust
Bolt,The-True-Hooha/Bolt,a blazingly fast modern terminal based file manager written in go,2024-09-09T12:27:30Z,2026-06-26T02:37:40Z,Go
dicom-echo,rusty-dicom/dicom-echo,A blazingly fast implementation of the C-ECHO DICOM procedure ,2024-08-24T20:00:45Z,2026-06-29T20:02:18Z,Python
overleash,Iandenh/overleash,Override your Unleash feature flags blazing fast,2024-08-06T21:36:52Z,2026-06-26T08:55:47Z,Go
FERS_core,Jeroen124/FERS_core,"Blazingly fast solver for FEM beam calculations, written in Rust",2024-07-30T04:03:36Z,2026-06-30T10:09:38Z,Python
foxi-astro-theme,oxygenna-themes/foxi-astro-theme,"Foxi is an Astro theme crafted with Tailwind CSS, designed for blazing-fast performance and seamless user experience. Perfect for creating modern, responsive SaaS websites with minimal effort.",2024-07-01T13:17:06Z,2026-06-24T05:40:21Z,Astro
rbuilder,flashbots/rbuilder,"rbuilder is a blazingly fast, state of the art Ethereum MEV-Boost block builder written in Rust",2024-07-01T07:26:00Z,2026-06-22T06:24:22Z,Rust
unplugin-isolated-decl,unplugin/unplugin-isolated-decl, A blazing-fast tool for generating isolated declarations.,2024-06-25T12:12:48Z,2026-06-30T09:10:50Z,TypeScript
Utils,ValeriiKoniushenko/Utils,"Blazing fast C++ primitives for everyday coding - strings, colors, positions, delegates, and morefeaturing the insanely fast StringAtom",2024-06-23T19:52:04Z,2026-06-30T22:02:32Z,C++
Portfolio,TheLinuxGuy-ssh/Portfolio,A highly optimised and blazing fast website that i created for my portfolio,2024-05-19T07:03:07Z,2026-06-30T03:44:08Z,Svelte
KMLightSpigotFree,radek203/KMLightSpigotFree,Minecraft blazing fast 1.8-1.12.2 limbo server,2024-05-11T10:52:51Z,2026-06-29T15:29:05Z,Java
stwo-cairo,starkware-libs/stwo-cairo,"Prove Cairo programs with the blazing-fast S-two prover, powered by the cryptographic breakthrough of Circle STARKs.",2024-04-24T13:23:25Z,2026-06-30T14:03:21Z,Rust
python-uv,a5chin/python-uv,"A production-ready Python development environment template using modern tools: uv for blazing-fast package management, Ruff for lightning-fast linting and formatting, ty for fast and reliable type checking, and VSCode Dev Containers for reproducible development environments.",2024-04-05T13:04:20Z,2026-06-28T23:08:05Z,Python
anti-spam-matrix,mokurin000/anti-spam-matrix,A anti-spam Matrix Bot that runs blazingly fast ,2024-03-31T01:40:07Z,2026-06-29T22:49:45Z,Rust
talosctx,bdronneau/talosctx,Blazing fast switcher for your talos contexts,2024-03-05T15:57:24Z,2026-06-23T09:11:32Z,Go
days-since-blazingly-fast,ninpnin/days-since-blazingly-fast,,2024-02-28T22:05:33Z,2026-06-30T09:53:22Z,Python
bevy_serde_lens,mintlu8/bevy_serde_lens,"Blazingly fast, schema based human-readable serialization crate for the bevy engine.",2024-02-28T20:20:33Z,2026-06-23T02:53:23Z,Rust
magicblock-validator,magicblock-labs/magicblock-validator,Blazing-Fast SVM Ephemeral Validator,2024-02-15T19:16:13Z,2026-07-01T09:49:30Z,Rust
complexipy,rohaquinlop/complexipy,"Blazingly fast cognitive complexity analysis for Python, written in Rust.",2024-01-21T07:11:09Z,2026-06-26T23:30:05Z,Python
yazelix,luccahuguet/yazelix,"Yazi and Zellij with smart defaults & awesome plugins give helix/nvim a powerful yazi sidebar, git integrations, a configurable popup system (lazygit, a config ui, etc), zoxide integrations, zjstatus widgets, and more. Your terminal IDE.  Written in rust and blazingly fast. Available via flake/home-manager. One line install.",2024-01-20T21:15:45Z,2026-06-29T22:25:18Z,Rust
popcorn-pluse-svelte,sujeetjaiswara/popcorn-pluse-svelte," Blazing-fast movie database demo with Svelte. Features: dynamic UI, API integration, popcorn-ready!",2024-01-10T20:13:50Z,2026-06-28T13:42:06Z,Svelte
turbo-cache-server,brunojppb/turbo-cache-server,Blazingly fast Turborepo remote cache server written in Rust as a Github Action with Docker support for Linux and MacOS,2023-12-31T21:48:21Z,2026-06-29T07:07:12Z,Rust
dotfiles,tiesen243/dotfiles,Aesthetic and blazingly fast Arch Linux / CachyOS dotfiles driven by Niri / Hyprland.,2023-12-29T21:07:52Z,2026-06-30T06:37:16Z,Lua
naparajith,DrInfinite/naparajith,"My developer portfolio built with advanced web standards, optimised SEO and blazingly fast performance.",2023-12-27T10:19:58Z,2026-06-28T19:27:34Z,JavaScript
rindexer,joshstevens19/rindexer,A no-code or framework to build blazing fast EVM indexers - built in rust.,2023-12-26T23:24:26Z,2026-06-24T14:50:43Z,Rust
NpgsqlRest,NpgsqlRest/NpgsqlRest,"Transform Your PostgreSQL Database into a Production-Ready, Blazing-Fast Standalone REST API Web Server With Static Type Checking and Automatic Code Generation",2023-12-15T10:14:38Z,2026-06-26T13:01:11Z,C#
blazefetch,rifsxd/blazefetch, A lite & blazing fast system info fetch utility.,2023-11-27T05:29:53Z,2026-06-27T19:34:03Z,C++
picomatch-lua,Roblox/picomatch-lua,Blazing fast and accurate glob matcher written in Luau. This is a read-only mirror.,2023-10-23T21:53:18Z,2026-06-30T08:12:12Z,Luau
text-embeddings-inference,huggingface/text-embeddings-inference,A blazing fast inference solution for text embeddings models,2023-10-13T13:36:51Z,2026-06-22T18:32:39Z,Rust
FlyPhotos,riyasy/FlyPhotos,A blazing fast ultra-light photo viewer replacement for Windows. Works similar to Picasa Photo Viewer.,2023-10-12T09:54:03Z,2026-07-01T03:07:20Z,C#
server,ZilaWS/server,ZilaWS is a blazingly fast and very lightweight library that provides an extremely easy-to-use way to transmit data via websockets between clientside and serverside using eventhandlers and async waiters. ,2023-10-04T13:57:11Z,2026-06-29T17:26:49Z,TypeScript
sif,vmfunc/sif,the blazing-fast pentesting suite.,2023-09-01T14:58:27Z,2026-06-26T12:43:38Z,Go
ANTIRTOS,WeSpeakEnglish/ANTIRTOS,"Unleash your interrupts with an ultra-fast task manager, delivering tens of thousands of push/pull TPS even on simple MCUs. Interrupts stay blazing fast by enqueueing parameterized tasks instead of executing logic immediately. Whenever the program must wait, useful tasks run insteadeliminating blocking and dummy wait loops. The simplicity matter! ",2023-08-21T16:02:14Z,2026-06-23T08:55:00Z,C++
seshat,Xqhare/seshat,"Seshat is a small, lightweight, lean, free-ranged, sustainable, eco-friendly, crypto-friendly and BLAZINGLY FAST text editor.",2023-08-20T20:38:20Z,2026-06-24T09:21:13Z,Rust
client,ZilaWS/client,ZilaWS is a blazingly fast and very lightweight library that provides an extremely easy-to-use way to transmit data via websockets between clientside and serverside using eventhandlers and async waiters.,2023-08-01T15:08:42Z,2026-06-29T21:09:51Z,TypeScript
goscrapy,tech-engine/goscrapy,"GoScrapy: Harnessing Go's perfomance for blazingly fast web scraping, inspired by Python's Scrapy framework.",2023-07-27T06:47:50Z,2026-06-26T08:13:16Z,Go
bang,wajeht/bang,your personal command center for blazingly fast web navigation,2023-07-08T22:00:32Z,2026-07-01T00:08:41Z,TypeScript
yazi,sxyazi/yazi," Blazing fast terminal file manager written in Rust, based on async I/O.",2023-07-08T11:45:55Z,2026-06-27T18:24:34Z,Rust
starknet-foundry,foundry-rs/starknet-foundry,Blazing fast toolkit for developing Starknet contracts.,2023-07-05T22:27:04Z,2026-07-01T07:01:12Z,Rust
tectonic-api,winstxnhdw/tectonic-api,"A blazingly fast API for compiling La/TeX offline with Tectonic, hosted on Hugging Face Spaces.",2023-06-29T18:48:07Z,2026-06-29T10:05:09Z,Rust
markdown-it-pyrs,chrisjsewell/markdown-it-pyrs,"A Python interface for markdown-it.rs, using Rust for blazingly fast parsing  ",2023-06-08T11:59:45Z,2026-06-29T21:32:31Z,Rust
algoliasearch-client-dart,algolia/algoliasearch-client-dart, A fully-featured and blazing-fast Dart/Flutter API client to interact with Algolia,2023-05-15T15:43:35Z,2026-06-24T16:07:00Z,Dart
lutgen-rs,ozwaldorf/lutgen-rs,Blazingly fast interpolated LUT generator and applicator for arbitrary and popular color palettes.,2023-05-13T01:25:59Z,2026-06-27T01:52:53Z,Rust
pyromark,monosans/pyromark,Blazingly fast Markdown parser for Python written in Rust.,2023-05-07T12:54:53Z,2026-06-30T13:32:47Z,Python
txlogger,roffe/txlogger,"Blazing fast data logging for Trionic 5, 7 & 8 ",2023-05-06T10:12:06Z,2026-06-28T19:02:30Z,Go
fory,apache/fory,"A blazingly fast multi-language serialization framework for idiomatic domain objects, schema IDL, and cross-language data exchange.",2023-04-28T03:57:00Z,2026-07-01T06:33:45Z,Java
solar,paradigmxyz/solar,"Blazingly fast, modular and contributor friendly Solidity compiler, written in Rust",2023-04-21T18:39:28Z,2026-07-01T05:31:21Z,Rust
shurtle-ts,danihengeveld/shurtle-ts,"The open source, blazingly fast URL shortener.",2023-04-13T21:45:42Z,2026-06-29T14:31:19Z,TypeScript
haylxon,pwnwriter/haylxon, Blazing-fast tool to grab screenshots of your domain list right from terminal. ,2023-03-19T04:47:43Z,2026-07-01T07:21:00Z,Rust
setup-duckdb-action,opt-nc/setup-duckdb-action, Blazing Fast and highly customizable Github Action to setup a DuckDb runtime,2023-03-14T04:24:53Z,2026-06-30T20:44:36Z,TypeScript
react-native-pdf-renderer,douglasjunior/react-native-pdf-renderer," A zoomable, blazing fast, zero dependencies, pure native, typed PDF Renderer for Android and iOS.",2023-03-09T11:19:24Z,2026-06-27T00:43:15Z,Java
whichlang,quickwit-oss/whichlang,A blazingly fast and lightweight language detection library for Rust,2023-03-07T05:32:29Z,2026-06-24T22:52:45Z,Rust
year-progress,mbacalan/year-progress,Years are passing blazingly fast,2023-03-03T21:28:04Z,2026-07-01T04:02:45Z,Rust
shotit,shotit/shotit,"Shotit is a screenshot-to-video search engine tailored for TV & Film, blazing-fast and compute-efficient.",2023-02-13T07:02:02Z,2026-06-29T01:34:43Z,
nvim-config,oyinss/nvim-config," My Neovim Configuration in Lua - Powered by LazyVim  for a Blazing-Fast, Modular Workflow.",2023-02-07T07:22:17Z,2026-06-23T09:25:28Z,Lua
imagetext-py,nathanielfernandes/imagetext-py,A blazing fast text drawing library,2023-01-18T22:28:55Z,2026-06-26T00:44:54Z,Rust
grappling-hook,chrisgrieser/grappling-hook,Obsidian Plugin for blazingly fast file switching. For those who find the Quick Switcher still too slow.,2023-01-09T13:57:14Z,2026-06-22T08:03:32Z,TypeScript
advent-of-code-rust,maneatingape/advent-of-code-rust,"Blazing fast Rust solutions for every Advent of Code puzzle from 2015 to 2025, solving 524 stars in less than 1 second.",2023-01-02T17:53:47Z,2026-06-29T23:45:05Z,Rust
ruby-polars,ankane/ruby-polars,Blazingly fast DataFrames for Ruby,2022-11-22T05:59:48Z,2026-06-29T21:49:39Z,Ruby
chhoto-url,SinTan1729/chhoto-url,"A simple, blazingly fast, selfhosted URL shortener with no unnecessary features; written in Rust.",2022-11-21T01:37:06Z,2026-07-01T09:16:34Z,Rust
milosz08,milosz08/milosz08,"Personal website build on top of the my own blazing fast and concurrency Java SSG engine, powered with markdown and HBS templates.",2022-11-13T04:34:22Z,2026-06-30T11:46:37Z,Java
rapidyaml-python,biojppm/rapidyaml-python,Blazing fast YAML parsing - Python package,2022-10-16T17:55:46Z,2026-06-25T17:33:46Z,Python
reth,paradigmxyz/reth,"Modular, contributor-friendly and blazing-fast implementation of the Ethereum protocol, in Rust",2022-09-15T23:05:57Z,2026-07-01T09:51:34Z,Rust
DHOS-Reborn,DragonHeartOS/DHOS-Reborn,DragonHeartOS: Blazingly fast desktop general purpose operating system,2022-08-06T10:01:49Z,2026-06-23T16:16:47Z,C++
nvim,veyxov/nvim,Blazingly fast neovim configuration,2022-07-03T11:36:38Z,2026-06-29T12:13:30Z,Lua
lsp-bridge,manateelazycat/lsp-bridge,A blazingly fast LSP client for Emacs,2022-05-03T00:08:34Z,2026-06-27T06:35:49Z,Emacs Lisp
rules_oci,DataDog/rules_oci,blazing fast Bazel rules for building OCI Images,2022-01-10T20:50:39Z,2026-06-28T14:19:33Z,Go
node-trashkek,meetmonday/node-trashkek,blazing fast () hooeta ,2022-01-06T20:08:18Z,2026-06-27T21:07:26Z,TypeScript
shapeshift,sapphiredev/shapeshift,Blazing fast input validation and transformation ,2021-12-10T15:21:09Z,2026-06-30T12:12:12Z,TypeScript
gefyra,gefyrahq/gefyra,"Blazingly-fast :rocket:, rock-solid, local application development :arrow_right: with Kubernetes.",2021-11-18T16:57:16Z,2026-07-01T08:09:11Z,Python
tctx,maraisr/tctx,Blazing fast w3c Trace Contexts for any JS runtime,2021-11-18T07:47:48Z,2026-07-01T09:47:03Z,TypeScript
Mandelbrot-2,Divetoxx/Mandelbrot-2,"Mandelbrot GUI: Visualizer with Perturbation Theory. The high-precision reference trajectory is computed exactly once, enabling blazing-fast math for billions of pixels using hardware-native double registers (with a 1e-308 hardware limit). Revolutionary Reference Reset to Zero implementation. ",2021-09-28T18:08:09Z,2026-06-21T15:30:49Z,C++
foundry,foundry-rs/foundry,"Foundry is a blazing fast, portable and modular toolkit for Ethereum application development written in Rust.",2021-09-08T11:23:11Z,2026-07-01T09:42:05Z,Rust
quaterion,qdrant/quaterion,Blazing fast framework for fine-tuning similarity learning models,2021-08-31T16:26:51Z,2026-06-23T10:20:22Z,Python
nvim,Allaman/nvim,"Minimal, blazingly fast, and pure Lua based Neovim configuration for my work as DevOps/Cloud Engineer with batteries included for Python, Golang, Terraform, and, of course, YAML",2021-08-07T11:45:29Z,2026-06-23T22:54:35Z,Lua
100ms-docs,100mslive/100ms-docs," Blazing fast 100ms Documentation built with nextjs, preact , mdx , next-mdx-remote",2021-06-04T08:12:51Z,2026-06-24T17:50:42Z,TypeScript
parallel-disk-usage,KSXGitHub/parallel-disk-usage,"Highly parallelized, blazing fast directory tree analyzer",2021-05-16T07:03:18Z,2026-06-29T22:54:23Z,Rust
word-cloud,knowledgepicker/word-cloud,Fast word cloud library for .NET. Uses Quadtrees for blazing-fast performance. Maintained by the KnowledgePicker team.,2021-02-26T10:11:45Z,2026-06-24T19:04:26Z,C#
qsv,dathere/qsv,Blazing-fast Data-Wrangling toolkit,2020-12-11T04:08:39Z,2026-07-01T06:03:04Z,Rust
t-rec-rs,sassman/t-rec-rs,Blazingly fast terminal recorder that generates animated gif images for the web written in rust,2020-10-08T23:16:40Z,2026-06-30T22:23:28Z,Rust
vc-frontend,VirtoCommerce/vc-frontend,Virto Commerce Frontend - B2B SPA is a fresh look on the field of eCommerce solutions. This is a place where common B2B and B2C scenarios are combined with the most bleeding edge technologies to deliver blazing fast and fully functional solution. It implements common business use-cases needed for a vast majority of projects we build.,2020-09-17T13:32:49Z,2026-07-01T08:28:42Z,TypeScript
debug-log-analyzer,certinia/debug-log-analyzer,"Salesforce Apex debug log analyzer for VS Code - blazing-fast: flame charts, SOQL/DML, Apex insights & more",2020-09-03T15:39:24Z,2026-06-24T02:23:34Z,TypeScript
bld,Kani-Maki-Gang/bld,A simple and BLAZINGLY fast CI/CD in the making,2020-08-31T19:59:00Z,2026-06-30T18:32:51Z,Rust
deno_lint,denoland/deno_lint,Blazing fast linter for JavaScript and TypeScript written in Rust,2020-03-28T12:31:24Z,2026-06-30T17:44:47Z,Rust
gitui,gitui-org/gitui,Blazing  fast terminal-ui for git written in rust ,2020-03-16T14:38:01Z,2026-07-01T09:35:03Z,Rust
file.d,ozontech/file.d,"A blazing fast tool for building data pipelines: read, process and output events. Our community: https://t.me/file_d_community",2020-02-14T10:59:20Z,2026-06-29T10:02:41Z,Go
qiankun,umijs/qiankun,"  Blazing fast, simple and complete solution for micro frontends.",2019-05-15T05:27:23Z,2026-06-23T08:05:40Z,TypeScript
MNN,alibaba/MNN,"MNN: A blazing-fast, lightweight inference engine battle-tested by Alibaba, powering high-performance on-device LLMs and Edge AI.",2019-04-15T07:40:18Z,2026-07-01T07:38:34Z,C++
starship,starship/starship,"  The minimal, blazing-fast, and infinitely customizable prompt for any shell!",2019-04-02T03:23:12Z,2026-06-29T01:23:13Z,Rust
FastAsyncWorldEdit,IntellectualSites/FastAsyncWorldEdit,"Blazingly fast world manipulation for artists, builders and everyone else.",2018-12-20T17:22:31Z,2026-06-23T15:46:27Z,Java
devolutions-gateway,Devolutions/devolutions-gateway,A blazing fast relay server adaptable to different protocols and desired levels of traffic inspection.,2018-12-18T18:39:09Z,2026-06-30T22:34:41Z,Rust
ignixa-fhir,brendankowitz/ignixa-fhir,"A blazing-fast multi-FHIR, multi-tenant, multi-database, data streaming reference implementation FHIR Server built in dotnet.",2018-11-16T12:32:09Z,2026-06-30T18:48:44Z,C#
algoliasearch-client-kotlin,algolia/algoliasearch-client-kotlin, A fully-featured and blazing-fast Kotlin/Android API client to interact with Algolia.,2018-10-16T11:19:09Z,2026-06-24T16:07:10Z,Kotlin
iced,icedland/iced,"Blazing fast and correct x86/x64 disassembler, assembler, decoder, encoder for Rust, .NET, Java, Python, Lua",2018-09-07T19:30:25Z,2026-06-29T08:42:29Z,Rust
ParserNG,gbenroscience/ParserNG,"ParserNG is a pure-Java, blazing-fast, scalable math expression parser with Vector API (JDK 21+) Turbo mode for massive bulk performance. It supports symbolic/numeric differentiation, integration, equation solving, matrices, statistics and more. Millions of ops/sec.",2018-08-08T11:41:30Z,2026-06-30T01:52:01Z,Java
graphql-engine-heroku,hasura/graphql-engine-heroku,"Blazing fast, instant realtime GraphQL APIs on Postgres with fine grained access control, also trigger webhooks on database events.",2018-06-21T01:52:56Z,2026-06-22T19:17:42Z,Dockerfile
graphql-engine,hasura/graphql-engine,"Blazing fast, instant realtime GraphQL APIs on all your data with fine grained access control, also trigger webhooks on database events.",2018-06-18T07:57:36Z,2026-06-22T19:11:31Z,TypeScript
fast-stringify,planttheidea/fast-stringify,A blazing fast stringifier that safely handles circular objects,2018-06-02T13:47:19Z,2026-06-22T21:57:22Z,TypeScript
fast-copy,planttheidea/fast-copy,A blazing fast deep object copier,2018-05-11T10:25:00Z,2026-06-22T21:57:36Z,JavaScript
micro-memoize,planttheidea/micro-memoize,A blazing fast memoization library that is tiny but feature-rich.,2018-01-14T14:16:17Z,2026-06-22T21:57:40Z,TypeScript
fast-equals,planttheidea/fast-equals,"A blazing fast equality comparison, either shallow or deep",2017-10-15T13:07:00Z,2026-06-22T21:58:10Z,TypeScript
martin,maplibre/martin,"Blazing fast and lightweight PostGIS, MBtiles and PMtiles tile server, tile generation, and mbtiles tooling.",2017-09-30T10:53:46Z,2026-06-30T15:25:44Z,Rust
CoreProtect,PlayPro/CoreProtect,CoreProtect is a blazing fast data logging and anti-griefing tool for Minecraft servers.,2017-08-21T21:59:13Z,2026-06-30T02:31:33Z,Java
lwc,salesforce/lwc," LWC - A Blazing Fast, Enterprise-Grade Web Components Foundation",2017-07-28T21:21:56Z,2026-06-29T15:33:14Z,JavaScript
odict,TheOpenDictionary/odict,"A blazingly-fast, offline-first format and toolchain for lexical data ",2017-07-03T04:47:38Z,2026-06-29T04:25:21Z,Rust
silvestre,enzoftware/silvestre,"A blazingly fast, cross-platform image processing library. Built on a highly optimized Rust core, Silvestre delivers high-performance image filters and graphical actions to Flutter (Dart), Android (Kotlin), and iOS (Swift) with zero-overhead FFI bindings.",2017-05-24T02:59:02Z,2026-06-24T17:28:28Z,Rust
nsyslog,solzimer/nsyslog,"Blazing fast, modular, next gen logagent",2017-05-05T13:01:36Z,2026-06-23T08:06:28Z,JavaScript
C-Simple-JSON-Parser,whyisitworking/C-Simple-JSON-Parser,"Extremely lightweight, easy-to-use & blazing fast JSON parsing library written in C89",2017-02-28T23:56:35Z,2026-06-27T13:55:20Z,C
ui-box,segmentio/ui-box,Blazing Fast React UI Primitive,2017-02-25T03:11:51Z,2026-06-25T23:25:10Z,TypeScript
nanomq,nanomq/nanomq,An ultra-lightweight and blazing-fast Messaging  Bus/MQTT Broker for Edge & SDV,2016-11-13T06:18:34Z,2026-07-01T08:13:54Z,C
algoliasearch-client-java,algolia/algoliasearch-client-java, A fully-featured and blazing-fast Java API client to interact with Algolia.,2016-07-05T10:16:19Z,2026-06-26T08:37:27Z,Java
web-maker,chinchang/web-maker,A blazing fast & offline frontend code editor,2016-05-02T11:42:54Z,2026-06-30T20:03:47Z,JavaScript
react-native-update,reactnativecn/react-native-update, Blazing Fast Hot Updates for React Native,2016-02-06T14:16:37Z,2026-07-01T08:38:54Z,TypeScript
algoliasearch-client-scala,algolia/algoliasearch-client-scala, A fully-featured and blazing-fast Scala API client to interact with Algolia.,2015-11-16T14:57:49Z,2026-06-24T16:07:20Z,Scala
table-js,bpmn-io/table-js,A blazing fast library for viewing and editing tables,2015-06-09T07:39:00Z,2026-06-26T17:29:15Z,JavaScript
algoliasearch-client-swift,algolia/algoliasearch-client-swift, A fully-featured and blazing-fast Swift API client to interact with Algolia.,2015-02-11T07:30:57Z,2026-06-24T16:07:23Z,Swift
algoliasearch-client-go,algolia/algoliasearch-client-go, A fully-featured and blazing-fast Go API client to interact with Algolia.,2014-03-14T05:41:02Z,2026-06-24T16:07:02Z,Go
blaze,http4s/blaze,Blazing fast NIO microframework and Http Parser,2014-01-06T03:59:24Z,2026-06-29T03:59:36Z,Scala
algoliasearch-client-csharp,algolia/algoliasearch-client-csharp, A fully-featured and blazing-fast C# API client to interact with Algolia.,2013-07-10T14:52:10Z,2026-06-24T16:06:57Z,C#
algoliasearch-client-ruby,algolia/algoliasearch-client-ruby, A fully-featured and blazing-fast Ruby API client to interact with Algolia.,2013-05-24T20:07:36Z,2026-06-24T16:07:18Z,Ruby
algoliasearch-client-python,algolia/algoliasearch-client-python, A fully-featured and blazing-fast Python API client to interact with Algolia.,2013-05-22T13:57:40Z,2026-06-24T16:07:15Z,Python
algoliasearch-client-javascript,algolia/algoliasearch-client-javascript, A fully-featured and blazing-fast JavaScript API client to interact with Algolia.,2013-05-20T14:35:15Z,2026-06-24T16:07:07Z,TypeScript
algoliasearch-client-php,algolia/algoliasearch-client-php, A fully-featured and blazing-fast PHP API client to interact with Algolia.,2013-05-20T12:37:37Z,2026-06-24T22:15:32Z,PHP
ws,websockets/ws,"Simple to use, blazing fast and thoroughly tested WebSocket client and server for Node.js",2011-11-09T22:32:45Z,2026-06-22T19:42:57Z,JavaScript
