name,full_name,description,created_at,pushed_at,language
fimbul-ts,fimbul-works/fimbul-ts,"Fimbul is a TypeScript library for elegant dependency resolution in computation graphs - powerful, minimal, and blazingly fast..",2023-10-25T19:56:26Z,2025-01-19T03:34:08Z,TypeScript
hexzen,renshyle/hexzen,"a simple, blazingly fast hex editor",2023-10-17T20:54:58Z,2024-12-31T12:27:36Z,Rust
cojocarudavid.me,cojocaru-david/cojocarudavid.me,Blazing fast personal website built with Astro.js and styled with Tailwind CSS. ,2023-10-16T19:36:58Z,2024-12-18T15:42:51Z,Astro
text-embeddings-inference,huggingface/text-embeddings-inference,A blazing fast inference solution for text embeddings models,2023-10-13T13:36:51Z,2025-01-08T13:28:37Z,Rust
unplugin-favicons,anolilab/unplugin-favicons,Generate favicons for your project with caching for blazing fast rebuilds.,2023-10-08T18:42:07Z,2025-01-17T08:36:05Z,TypeScript
server,ZilaWS/server,ZilaWS is a blazingly fast and very lightweight library that provides an extremely easy-to-use way to transmit data via websockets between clientside and serverside using eventhandlers and async waiters. ,2023-10-04T13:57:11Z,2024-12-19T11:23:17Z,TypeScript
advent-of-code-js,JoanaBLate/advent-of-code-js,"Clear, and blazingly fast solutions for the Advent Of Code puzzles, in JavaScript.",2023-09-23T17:02:09Z,2025-01-18T19:24:50Z,JavaScript
beff,lucasavila00/beff,Efficient validators from Typescript types generated by a blazing fast compiler,2023-08-28T02:32:08Z,2024-12-18T14:28:30Z,Rust
nathan.rs,nathan-barry/nathan.rs,My personal site using Hugo for static site generation. Blazingly Fast.,2023-08-27T00:03:29Z,2025-01-12T02:03:18Z,HTML
bfcc,kugiyasan/bfcc,Blazingly Fast C Compiler (written in Rust),2023-08-25T05:15:24Z,2025-01-17T03:11:25Z,Rust
gateway,Portkey-AI/gateway,"A blazing fast AI Gateway with integrated guardrails. Route to 200+ LLMs, 50+ AI Guardrails with 1 fast & friendly API.",2023-08-23T11:52:47Z,2025-01-18T14:38:23Z,TypeScript
seshat,Xqhare/seshat,"Seshat is a small, lightweight, lean, free-ranged, sustainable, eco-friendly, crypto-friendly and BLAZINGLY FAST text editor.",2023-08-20T20:38:20Z,2024-12-11T13:47:54Z,Rust
br,phenpessoa/br,"A blazingly fast  go library to validate and generate Brazilian documents such as CNPJ, CPF, CNH, CNS etc",2023-08-16T18:16:04Z,2025-01-04T18:57:40Z,Go
Creative-Portofolio,AlfeusMartinus/Creative-Portofolio,"Creative Portofolio  Vite, a next-generation frontend tooling that offers blazing fast development and production performance. React, a popular JavaScript library for building user interfaces with components and hooks. Tailwind CSS, a utility-first CSS framework that allows you to style your website without writing any CSS code.",2023-08-14T16:39:01Z,2025-01-06T08:21:56Z,JavaScript
airup,sisungo/airup," Airup is a modern, portable and blazingly fast implementation of service supervisor and the init daemon.",2023-08-14T09:25:45Z,2024-12-14T13:24:02Z,Rust
CoDriver,RickyDane/CoDriver,Blazingly fast file explorer.,2023-08-13T10:40:59Z,2024-12-22T09:37:25Z,JavaScript
ciphercanvas-rs,walker84837/ciphercanvas-rs,CipherCanvas is a blazingly fast Wi-Fi QR code generator.,2023-07-31T16:47:13Z,2024-12-13T07:53:17Z,Rust
lla,chaqchase/lla,blazing fast `ls` replacement with superpowers,2023-07-31T13:51:59Z,2025-01-13T11:16:43Z,Rust
IceNvim,Shaobin-Jiang/IceNvim,"A beautiful, powerful and customizable neovim config that is blazing fast",2023-07-30T08:22:55Z,2025-01-19T08:04:50Z,Lua
goscrapy,tech-engine/goscrapy,"GoScrapy: Harnessing Go's power for blazingly fast web scraping, inspired by Python's Scrapy framework.",2023-07-27T06:47:50Z,2024-12-13T20:41:18Z,Go
grpcxx,uatuko/grpcxx, Blazing fast gRPC server (C++),2023-07-20T21:46:03Z,2025-01-10T18:00:48Z,C++
brontes,SorellaLabs/brontes,A blazingly fast general purpose blockchain analytics engine specialized in systematic mev detection,2023-07-11T13:01:46Z,2024-12-05T19:08:07Z,Rust
yazi,sxyazi/yazi," Blazing fast terminal file manager written in Rust, based on async I/O.",2023-07-08T11:45:55Z,2025-01-19T08:09:35Z,Rust
starknet-foundry,foundry-rs/starknet-foundry,Blazing fast toolkit for developing Starknet contracts.,2023-07-05T22:27:04Z,2025-01-17T16:10:22Z,Rust
otterscan,Zilliqa/otterscan,"A blazingly fast, local, Ethereum block explorer built on top of Erigon",2023-07-04T16:13:30Z,2025-01-17T05:56:29Z,TypeScript
PASPAS,berkaygediz/PASPAS," Blazing-fast, all-in-one system optimizer. Improve your computer's efficiency with powerful cleaning and tuning tools.",2023-06-22T01:26:30Z,2025-01-18T23:49:13Z,C#
vduckdb,rodabt/vduckdb,"A blazing-fast DuckDB wrapper built with the V language, making it easier to leverage its power in your projects. ",2023-06-20T22:49:30Z,2024-12-26T19:07:15Z,V
nvim-pkaiser,PreussenKaiser/nvim-pkaiser,My BLAZINGLY FAST NeoVim config,2023-06-14T02:13:09Z,2024-12-31T19:45:43Z,Lua
markdown-it-pyrs,chrisjsewell/markdown-it-pyrs,"A Python interface for markdown-it.rs, using Rust for blazingly fast parsing  ",2023-06-08T11:59:45Z,2025-01-13T23:31:45Z,Rust
hictk,paulsengroup/hictk,Blazing fast toolkit to work with .hic and .cool files,2023-06-07T20:27:51Z,2025-01-13T22:51:21Z,C++
Kasper,The-StreamFlow-Software-Org/Kasper,"Kasper is a scalable, persistent, in-memory nested key-value database designed for asynchronous operations and blazingly fast access. With relationships and references, Kasper also works as a Graph Database. Kasper is NOT a caching layer. Built with Java.",2023-05-23T07:57:45Z,2025-01-08T10:56:06Z,Java
song-stitch,SongStitch/song-stitch,A blazingly fast web app for generating LastFM collages.,2023-05-20T21:07:46Z,2025-01-13T22:23:34Z,Go
algoliasearch-client-dart,algolia/algoliasearch-client-dart, A fully-featured and blazing-fast Dart/Flutter API client to interact with Algolia,2023-05-15T15:43:35Z,2025-01-16T22:17:22Z,Dart
lutgen-rs,ozwaldorf/lutgen-rs,Blazingly fast interpolated LUT generator and applicator for arbitrary and popular color palettes.,2023-05-13T01:25:59Z,2024-12-06T23:54:05Z,Rust
pyromark,monosans/pyromark,Blazingly fast Markdown parser for Python written in Rust.,2023-05-07T12:54:53Z,2025-01-18T21:22:41Z,Python
txlogger,roffe/txlogger,"Blazing fast data logging for Trionic 5, 7 & 8 ",2023-05-06T10:12:06Z,2025-01-18T15:28:34Z,Go
nvim,ChmielewskiKamil/nvim,"My blazingly fast Neovim config for Solidity, Rust and Go.",2023-04-29T14:38:40Z,2025-01-18T10:56:42Z,Lua
fury,apache/fury,A blazingly fast multi-language serialization framework powered by JIT and zero-copy.,2023-04-28T03:57:00Z,2025-01-19T02:22:46Z,Java
mrbeam,divasilevski/mrbeam,MrBeam - blazingly fast beam calculator.,2023-04-25T11:21:47Z,2025-01-10T14:54:18Z,TypeScript
solar,paradigmxyz/solar,"Blazingly fast, modular and contributor friendly Solidity compiler, written in Rust",2023-04-21T18:39:28Z,2025-01-19T04:43:38Z,Rust
shurtle-ts,danihengeveld/shurtle-ts,"The open source, blazingly fast URL shortener.",2023-04-13T21:45:42Z,2025-01-13T11:51:06Z,TypeScript
transeptor-bundler,transeptorlabs/transeptor-bundler,"A light weight blazing fast, modular ERC4337 TypeScript bundler built with functional programming.",2023-04-09T19:51:47Z,2025-01-12T03:09:10Z,TypeScript
3x1l,exil0867/3x1l,"My Personal page web app written in Rust with Yew framework, WebAssembly and Trunk for blazing fast performance. (migrated from React)",2023-04-02T03:03:34Z,2025-01-07T01:28:47Z,Rust
sqlgen,si3nloong/sqlgen,"SQL code generator, no extra runtime cost! It's blazingly fast!!! ",2023-03-22T01:52:26Z,2025-01-16T12:58:45Z,Go
haylxon,pwnwriter/haylxon, Blazing-fast tool to grab screenshots of your domain list right from terminal. ,2023-03-19T04:47:43Z,2025-01-10T03:25:21Z,Rust
dsc,lucascompython/dsc,A blazingly fast Data Serialization Language Convertor,2023-03-19T02:14:25Z,2024-12-06T13:12:15Z,Rust
setup-duckdb-action,opt-nc/setup-duckdb-action, Blazing Fast and highly customizable Github Action to setup a DuckDb runtime,2023-03-14T04:24:53Z,2025-01-13T08:57:32Z,JavaScript
react-native-pdf-renderer,douglasjunior/react-native-pdf-renderer," A zoomable, blazing fast, zero dependencies, pure native, typed PDF Renderer for Android and iOS.",2023-03-09T11:19:24Z,2025-01-18T01:01:57Z,Java
BlazeDB,Voyrox/BlazeDB,BlazeDB is a blazing fast NoSQL database built for modern applications. It provides a lightweight and easy-to-use data storage solution that is designed to scale with your application. ,2023-03-07T02:42:48Z,2025-01-18T12:34:38Z,JavaScript
year-progress,mbacalan/year-progress,Years are passing blazingly fast,2023-03-03T21:28:04Z,2025-01-19T01:25:14Z,Rust
cloudtrail-cli,guessi/cloudtrail-cli,Blazing fast single purpose cli for CloudTrail log filtering,2023-02-23T17:55:28Z,2025-01-04T17:27:03Z,Go
hyper-db,tableau/hyper-db,"Documentation for Hyper, the blazingly fast SQL engine powering analytics at Tableau and Salesforce",2023-02-21T13:32:22Z,2025-01-17T09:26:25Z,TypeScript
lost,snprajwal/lost,A Blazingly Fast general-purpose programming language,2023-02-14T07:41:10Z,2024-12-06T20:31:18Z,Rust
Neovim-Config,Sawansunar56/Neovim-Config,This is the config files that I would use to start a life of a superior programmer. I will go blazingly Fast now. ,2023-02-05T20:48:10Z,2025-01-16T06:17:42Z,Lua
blazingly-fast,shakhzodkudratov/blazingly-fast,my approach in getting blazingly fast,2023-02-05T00:18:07Z,2025-01-17T08:56:31Z,Nix
wonda,wondergram-org/wonda,"A light, blazing fast framework for developing capable bots.",2023-02-01T05:28:16Z,2025-01-02T16:58:43Z,Python
modeline.nvim,nvimdev/modeline.nvim,neovim statusline plugin blazing fast than any statusline plugin,2023-01-31T04:56:38Z,2025-01-18T11:52:42Z,Lua
hollywood,anthdm/hollywood,Blazingly fast and light-weight Actor engine written in Golang,2023-01-27T14:36:30Z,2025-01-14T18:03:45Z,Go
codeforces-extractor,yunusey/codeforces-extractor,Blazingly fast codeforces problem extractor! Rust btw!,2023-01-25T00:23:31Z,2024-12-21T23:35:02Z,Rust
rapid-draughts,loks0n/rapid-draughts,"A super speedy, blazing fast, rocket-powered TypeScript draughts/checkers engine with move validation, AI and game history.",2023-01-24T15:14:43Z,2024-12-31T15:36:23Z,TypeScript
pogchamp,antonandresen/pogchamp,blazing fast utility library,2023-01-21T10:24:11Z,2025-01-10T14:37:13Z,TypeScript
gBar,scorpion-26/gBar,Blazingly fast status bar written with GTK,2023-01-13T15:19:25Z,2024-12-17T17:38:31Z,C++
grappling-hook,chrisgrieser/grappling-hook,Obsidian Plugin for blazingly fast file switching. For those who find the Quick Switcher still too slow.,2023-01-09T13:57:14Z,2024-12-30T00:35:03Z,TypeScript
Interstellar,UseInterstellar/Interstellar,One of the most popular modern web proxies with blazing fast speeds and a variety of games.,2023-01-05T21:57:19Z,2025-01-18T15:28:45Z,JavaScript
editor-configs,ImperialOps/editor-configs,Blazingly fast config,2023-01-03T20:09:19Z,2025-01-15T12:46:26Z,Lua
iter,sabiwara/iter,A blazing fast compile-time optimized alternative to the `Enum` and `Stream` modules,2022-12-25T07:26:10Z,2024-12-13T10:47:32Z,Elixir
hashgen,cyclone-github/hashgen,hashgen - the blazingly fast hash generator,2022-12-16T02:27:27Z,2024-12-12T05:31:37Z,Go
OptiGUI,opekope2/OptiGUI,Blazing fast custom GUI textures on Fabric and Quilt with built-in OptiFine custom GUI resource pack support,2022-12-15T21:34:41Z,2025-01-16T15:16:01Z,Kotlin
dukkOS,DakshG07/dukkOS,"DukkOS, the blazingly fast reproducible revolutionary game-changing operating system for radicals.",2022-12-10T22:21:20Z,2025-01-18T03:50:21Z,C
Fetchy,ClementNerma/Fetchy,A basic but blazingly fast and simple file-based package manager,2022-12-02T09:57:52Z,2025-01-09T13:41:17Z,Rust
magnetar,StardustXR/magnetar,"Workspaces client for Stardust, now blazingly fast in rust",2022-11-26T05:05:41Z,2024-12-29T19:06:58Z,Rust
BridgeNet2,ffrostfall/BridgeNet2,A blazing fast networking library for Roblox,2022-11-23T06:35:36Z,2024-12-27T16:37:03Z,Luau
starkli,xJonathanLEI/starkli,"Starkli (/strkla/), a  blazing  fast  CLI tool for Starknet powered by  starknet-rs ",2022-11-23T04:41:50Z,2025-01-14T06:50:20Z,Rust
ruby-polars,ankane/ruby-polars,Blazingly fast DataFrames for Ruby,2022-11-22T05:59:48Z,2025-01-02T17:19:41Z,Ruby
chhoto-url,SinTan1729/chhoto-url,"A simple, blazingly fast, selfhosted URL shortener with no unnecessary features; written in Rust.",2022-11-21T01:37:06Z,2025-01-18T05:45:15Z,Rust
fuz,Magnushhoie/fuz,"Fuz is a blazingly fast text, file and folder search tool",2022-11-20T19:40:14Z,2025-01-07T11:10:33Z,Shell
RapidIntegrationTesting,hash-code-io/RapidIntegrationTesting,Opinionated integration testing libraries for a blazingly fast testing experience,2022-11-17T20:53:50Z,2025-01-08T10:11:21Z,C#
milosz08,milosz08/milosz08,"My own blazing fast and concurrency Java SSG engine, powered with markdown and HBS templates.",2022-11-13T04:34:22Z,2025-01-17T07:32:22Z,Java
zap,elbywan/zap,Another [insert blazing fast synonyms] JavaScript package manager ,2022-11-06T20:24:08Z,2024-12-07T07:28:55Z,Crystal
poeticmetric,th0th/poeticmetric,"PoeticMetric is a free as in freedom, open source, privacy-first, regulation-compliant, and blazingly fast Google Analytics alternative.",2022-11-02T10:44:19Z,2025-01-15T20:46:15Z,TypeScript
ityfuzz,fuzzland/ityfuzz,Blazing Fast Bytecode-Level Hybrid Fuzzer for Smart Contracts,2022-10-25T00:09:33Z,2024-12-25T00:07:41Z,Rust
dotfiles,valfur03/dotfiles,My blazing fast dotfiles,2022-10-15T07:58:33Z,2025-01-17T09:27:43Z,Lua
reth,paradigmxyz/reth,"Modular, contributor-friendly and blazing-fast implementation of the Ethereum protocol, in Rust",2022-09-15T23:05:57Z,2025-01-19T03:33:22Z,Rust
tchatchers,nag763/tchatchers,tchatchers is a blazing fast chat application built with Axum and Yew.rs,2022-08-27T08:49:18Z,2025-01-04T23:45:53Z,Rust
academic-forum-bot,Academic-Forum/academic-forum-bot,Blazingly fast discord bot ,2022-08-27T01:16:41Z,2025-01-07T08:28:17Z,Rust
package_rename,OutdatedGuy/package_rename,A Blazingly Fast way to configure your Bleeding Edge flutter project to be production ready.,2022-08-14T03:48:29Z,2024-12-19T20:01:43Z,Dart
gb_lang,shakesbeare/gb_lang,"A ""blazingly fast"" interpreted language written in rust as an exercise.",2022-08-06T16:01:53Z,2024-12-22T21:50:39Z,Rust
todo-app-rs,jbutterwick/todo-app-rs,The blazingly fast Todo App!,2022-08-05T18:05:13Z,2025-01-05T05:40:11Z,Rust
dockerfuse,dguerri/dockerfuse,"Interact with filesystem in deployed Docker containers, via FUSE. Blazing fast :)",2022-08-05T13:08:06Z,2025-01-02T11:11:55Z,Go
kenway,dheshalj/kenway,A Blazingly Fast Local No-SQL Database with a Pre-Made API,2022-08-05T03:46:44Z,2024-12-13T08:57:14Z,TypeScript
FastAD,C4T-BuT-S4D/FastAD,Blazing fast Attack & Defence CTF platform,2022-07-27T19:37:36Z,2025-01-12T18:15:11Z,Go
rsonpath,rsonquery/rsonpath,Blazing fast JSONPath query engine written in Rust.,2022-07-09T13:28:54Z,2025-01-15T08:37:27Z,Rust
rgit,w4/rgit, blazingly fast web frontend for git repositories,2022-07-06T00:09:01Z,2025-01-08T08:43:53Z,Rust
nvim,veyxov/nvim,Blazingly fast neovim configuration,2022-07-03T11:36:38Z,2024-12-23T09:10:33Z,Lua
hyprpaper,hyprwm/hyprpaper,Hyprpaper is a blazing fast wayland wallpaper utility with IPC controls.,2022-07-01T18:16:44Z,2025-01-06T16:33:44Z,C++
fidget,mkeeter/fidget,blazing fast implicit surface evaluation,2022-06-24T23:12:47Z,2025-01-11T23:00:30Z,Rust
pulsar,exein-io/pulsar,"A modular and blazing fast runtime security tool for the IoT, powered by eBPF.",2022-06-18T15:38:05Z,2025-01-09T18:23:12Z,Rust
expressit,witchcraftjs/expressit,"A blazing fast, customizable, error-tolerant expression parser that creates safe to eval expressions + a few other goodies.",2022-05-15T16:13:07Z,2024-12-16T01:20:45Z,TypeScript
hugo-bootstrap-theme,filipecarneiro/hugo-bootstrap-theme,"Hugo theme for a secure, blazing fast and SEO-ready static website, using Bootstrap 5.",2022-05-15T11:23:56Z,2024-12-03T11:47:14Z,SCSS
server,StardustXR/server,"Stardust XR Reference Server, now blazingly fast in Rust :D",2022-05-12T03:49:39Z,2025-01-17T05:27:38Z,Rust
nvim,zmird/nvim,A blazing fast nvim configuration,2022-05-09T05:53:29Z,2025-01-19T01:32:21Z,Lua
lsp-bridge,manateelazycat/lsp-bridge,A blazingly fast LSP client for Emacs,2022-05-03T00:08:34Z,2025-01-19T00:07:58Z,Emacs Lisp
core,StardustXR/core,"libstardustxr, written from scratch blazingly fast in Rust!",2022-04-30T05:52:17Z,2024-12-12T09:09:50Z,Rust
SupaComments,mcnaveen/SupaComments," A blazing fast, lightweight, and open source comment system for your static website, blogs powered by Supabase",2022-04-09T17:18:07Z,2024-12-09T04:24:50Z,JavaScript
aetherjs.github.io,aetherjs/aetherjs.github.io,Blazing Fast new personal website - using SvelteKit and Tailwind CSS,2022-03-02T18:33:42Z,2025-01-18T21:03:57Z,TypeScript
nvim,NTBBloodbath/nvim,My personal blazingly fast Neovim setup,2022-02-22T13:45:02Z,2025-01-15T01:53:08Z,Lua
rules_oci,DataDog/rules_oci,blazing fast Bazel rules for building OCI Images,2022-01-10T20:50:39Z,2025-01-08T16:44:42Z,Go
pkg_search,OpenBSDGuy/pkg_search,Blazing fast intutive search for OpenBSD packages,2021-12-24T12:10:33Z,2024-12-29T12:31:54Z,Shell
nvim,wochap/nvim,Blazingly fast nvim config inspired by NvChad and LazyVim,2021-12-12T22:07:58Z,2025-01-17T17:52:04Z,Lua
shapeshift,sapphiredev/shapeshift,Blazing fast input validation and transformation ,2021-12-10T15:21:09Z,2025-01-19T04:53:32Z,TypeScript
gefyra,gefyrahq/gefyra,"Blazingly-fast :rocket:, rock-solid, local application development :arrow_right: with Kubernetes.",2021-11-18T16:57:16Z,2025-01-17T18:38:14Z,Python
tctx,maraisr/tctx,Blazing fast w3c Trace Contexts for any JS runtime,2021-11-18T07:47:48Z,2025-01-17T23:35:21Z,TypeScript
Passivhaus,wszczawinski/Passivhaus,This project leverages Gatsby with TypeScript and Sass to create a blazing-fast website with WordPress as headless CMS and automated deployment through GitHub Actions CI/CD.,2021-10-16T17:03:26Z,2025-01-05T22:00:34Z,TypeScript
yas,wormtql/yas,Blazingly fast Genshin Impact/Honkai: Starrail artifacts scanner,2021-10-06T08:10:53Z,2025-01-12T09:27:31Z,Rust
themes,warpdotdev/themes,"Custom themes repository for Warp, a blazingly fast modern terminal built in Rust.",2021-09-23T01:19:51Z,2025-01-17T16:31:27Z,Python
erl_snowflake,petrkozorezov/erl_snowflake,"Blazing fast, small and hackable snowflake id generator for erlang ",2021-09-19T09:10:24Z,2024-12-17T09:38:18Z,Erlang
foundry,foundry-rs/foundry,"Foundry is a blazing fast, portable and modular toolkit for Ethereum application development written in Rust.",2021-09-08T11:23:11Z,2025-01-19T00:55:02Z,Rust
yamlfmt,UltiRequiem/yamlfmt, Blazing fast YAML formatter,2021-09-07T01:03:35Z,2024-12-28T15:23:48Z,Go
quaterion,qdrant/quaterion,Blazing fast framework for fine-tuning similarity learning models,2021-08-31T16:26:51Z,2025-01-06T18:01:09Z,Python
hello-world.rs,mTvare6/hello-world.rs,"Memory safe, blazing fast, configurable, minimal hello world written in rust() in a few lines of code with few(1247) dependencies",2021-08-13T05:57:31Z,2024-12-27T07:28:23Z,RenderScript
nvim,Allaman/nvim,"Minimal, blazingly fast, and pure Lua based Neovim configuration for my work as DevOps/Cloud Engineer with batteries included for Python, Golang, and, of course, YAML",2021-08-07T11:45:29Z,2025-01-18T11:04:06Z,Lua
imbl,jneem/imbl,Blazing fast immutable collection datatypes for Rust.,2021-08-06T16:40:40Z,2025-01-17T09:29:24Z,Rust
otterscan,otterscan/otterscan,"A blazingly fast, local, Ethereum block explorer built on top of Erigon",2021-07-01T18:22:12Z,2025-01-16T19:02:46Z,TypeScript
blaze,kwai/blaze,Blazing-fast query execution engine speaks Apache Spark language and has Arrow-DataFusion at its core.,2021-06-28T07:29:43Z,2025-01-19T07:51:10Z,Rust
dupers,bengarrett/dupers,Dupers is the blazing-fast file duplicate checker and filename search tool.,2021-06-10T00:17:47Z,2025-01-02T10:27:23Z,Go
100ms-docs,100mslive/100ms-docs," Blazing fast 100ms Documentation built with nextjs, preact , mdx , next-mdx-remote",2021-06-04T08:12:51Z,2025-01-16T07:51:42Z,TypeScript
ethereum-wallet-generator,Planxnx/ethereum-wallet-generator,Blazing fast multiple Ethereum and Crypto vanity wallet generator Generate a ten thousand beautiful crypto wallets in a sec  Awesome ethereum vanity address generator,2021-05-29T18:46:09Z,2024-12-27T18:02:26Z,Go
sonic,bytedance/sonic,A blazingly fast JSON serializing & deserializing library,2021-05-25T03:52:51Z,2025-01-14T03:44:31Z,Assembly
parallel-disk-usage,KSXGitHub/parallel-disk-usage,"Highly parallelized, blazing fast directory tree analyzer",2021-05-16T07:03:18Z,2025-01-15T07:31:40Z,Rust
pyPLNmodels,PLN-team/pyPLNmodels,Blazing fast inference of PLN models built on top of Python and PyTorch,2021-04-01T10:07:18Z,2025-01-17T17:37:03Z,Python
advent-of-code,MeanderingProgrammer/advent-of-code,Advent of Code - All Years - Blazingly Fast,2021-03-24T23:38:18Z,2025-01-18T23:20:08Z,Python
NvChad,NvChad/NvChad,"Blazing fast Neovim framework providing solid defaults and a beautiful UI, enhancing your neovim experience.",2021-03-07T14:33:17Z,2025-01-13T06:48:17Z,Lua
heaven,rayattack/heaven,"Extremely Stupid Simple, Blazing Fast, Get Out of your way immediately Microframework for building Python Web Applications.",2021-03-06T20:18:53Z,2024-12-30T00:33:12Z,Python
word-cloud,knowledgepicker/word-cloud,Fast word cloud library for .NET. Uses Quadtrees for blazing-fast performance. Maintained by the KnowledgePicker team.,2021-02-26T10:11:45Z,2025-01-10T13:55:24Z,C#
blog,khuedoan/blog,"My personal website (written in Rust, blazingly fast, deployed on Kubernetes, <insert a bunch of random buzzwords here>, just lack content)",2020-12-26T07:53:02Z,2025-01-19T04:44:50Z,Rust
qsv,dathere/qsv,Blazing-fast Data-Wrangling toolkit,2020-12-11T04:08:39Z,2025-01-18T23:02:52Z,Rust
xmas_tree,markkovari/xmas_tree,"Blazingly fast commitment issues fixer, greenmaker",2020-12-01T01:22:21Z,2024-12-22T20:58:58Z,Rust
blades,grego/blades,Blazing fast dead simple static site generator,2020-10-11T20:02:05Z,2025-01-14T10:42:02Z,Rust
t-rec-rs,sassman/t-rec-rs,Blazingly fast terminal recorder that generates animated gif images for the web written in rust,2020-10-08T23:16:40Z,2025-01-15T10:35:45Z,Rust
vc-frontend,VirtoCommerce/vc-frontend,Virto Commerce Frontend - B2B SPA is a fresh look on the field of eCommerce solutions. This is a place where common B2B and B2C scenarios are combined with the most bleeding edge technologies to deliver blazing fast and fully functional solution. It implements common business use-cases needed for a vast majority of projects we build.,2020-09-17T13:32:49Z,2025-01-17T14:06:13Z,TypeScript
bld,Kani-Maki-Gang/bld,A simple and BLAZINGLY fast CI/CD in the making,2020-08-31T19:59:00Z,2025-01-13T19:48:42Z,Rust
fuel-specs,FuelLabs/fuel-specs," Specifications for the Fuel protocol and the FuelVM, a blazingly fast blockchain VM.",2020-08-27T21:08:42Z,2025-01-16T15:23:27Z,
kompute,KomputeProject/kompute,"General purpose GPU compute framework built on Vulkan to support 1000s of cross vendor graphics cards (AMD, Qualcomm, NVIDIA & friends). Blazing fast, mobile-enabled, asynchronous and optimized for advanced GPU data processing usecases. Backed by the Linux Foundation.",2020-07-29T05:23:33Z,2024-12-10T06:15:26Z,C++
issue-status,tadhglewis/issue-status,"A flexible, modern and blazingly fast  status page",2020-06-08T03:41:22Z,2025-01-06T23:15:47Z,TypeScript
logdna-agent-v2,logdna/logdna-agent-v2,"The blazingly fast, resource efficient log collection client",2020-04-30T10:31:39Z,2025-01-14T17:18:08Z,Rust
react-substate,Harvtronix/react-substate,"Blazing-fast, centralized state management with auto-guaranteed, immutable state changes",2020-04-12T19:58:59Z,2025-01-01T01:46:47Z,TypeScript
deno_lint,denoland/deno_lint,Blazing fast linter for JavaScript and TypeScript written in Rust,2020-03-28T12:31:24Z,2025-01-09T17:02:48Z,Rust
gitui,extrawurst/gitui,Blazing  fast terminal-ui for git written in rust ,2020-03-16T14:38:01Z,2025-01-16T08:32:00Z,Rust
sort-es,cosimochellini/sort-es,"Blazing fast, tree-shakeable, type-safe, modern utility library to sort any type of array",2020-02-16T14:58:28Z,2025-01-02T11:18:05Z,TypeScript
file.d,ozontech/file.d,"A blazing fast tool for building data pipelines: read, process and output events. Our community: https://t.me/file_d_community",2020-02-14T10:59:20Z,2025-01-17T19:47:10Z,Go
jukeboxjay,jukeboxjay/jukeboxjay, Blazing fast blog built with Gatsby and Cosmic JS ,2019-12-09T20:35:20Z,2025-01-02T22:31:03Z,JavaScript
osprey-delight,kdevo/osprey-delight,Osprey Delight is the free-minded artist's choice for a clutter-free and blazingly fast single-page portfolio.,2019-11-23T13:03:41Z,2025-01-17T08:23:33Z,SCSS
FastEMRIWaveforms,BlackHolePerturbationToolkit/FastEMRIWaveforms,Blazingly fast EMRI waveforms,2019-11-22T21:09:08Z,2025-01-17T16:30:41Z,C++
spacing-helper,binjospookie/spacing-helper,A tiny (117 bytes) and blazing fast standalone helper for creating consistent spacing between the elements of your UI,2019-11-09T13:51:56Z,2025-01-01T02:53:58Z,JavaScript
aws-neuron-sdk,aws-neuron/aws-neuron-sdk,"Powering AWS purpose-built machine learning chips. Blazing fast and cost effective, natively integrated into PyTorch and TensorFlow and integrated with your favorite AWS services",2019-11-06T02:12:59Z,2025-01-18T00:27:11Z,Python
selene,Kampfkarren/selene,A blazing-fast modern Lua linter written in Rust,2019-10-01T06:45:12Z,2025-01-14T03:06:00Z,Rust
nitrobase,Alwatr/nitrobase,"Nitrobase is a blazingly fast, lightweight database built on JSON. It stores data entirely in memory for lightning-quick access, while also providing a JSON file backup for persistence. You can easily serve your data over the web using our high-performance accelerated Nginx server.",2019-09-01T14:29:07Z,2025-01-16T00:38:38Z,TypeScript
