name,full_name,description,created_at,pushed_at,language
glu,Vixel2006/glu,"A light-weight, unbloated, blazingly fast robotics communication protocol built in zig.",2026-06-15T16:09:57Z,2026-06-30T13:07:24Z,Zig
dupblaster,fulcrumgenomics/dupblaster,"Blazingly fast, streaming duplicate detection for NGS data",2026-06-14T11:38:34Z,2026-06-26T11:21:31Z,Rust
trishna-go,radcolor/trishna-go,Personal dc/tg assistant/helper and notifier bot written in golang! Blazingly fast. From trishna-rs,2026-06-13T15:07:14Z,2026-06-23T08:36:39Z,Go
picoconf,JacobCallahan/picoconf,"The tiny, opinionate, blazingly fast, config loader!",2026-06-12T19:23:09Z,2026-06-26T22:28:05Z,Rust
bmp-rs,ih8js-git/bmp-rs,A Blazingly fast Balatro Engine written in Rust,2026-06-12T19:12:15Z,2026-06-30T17:14:30Z,Rust
watch-together,abbasiandev/watch-together," Blazing-fast Rust CLI for synchronized video watching - no account, no app, just one command. CRDT sync engine, P2P-first, WebSocket signaling. Built for FIFA World Cup 2026 and every big moment after.",2026-06-12T18:16:59Z,2026-06-21T18:08:51Z,TypeScript
news-cli,xw-meow/news-cli,"A minimal, blazing-fast command-line news reader. Browse, filter, and read the latest headlines directly in your terminalno browser, no GUI, no context switching.",2026-06-12T08:42:01Z,2026-06-30T12:24:03Z,TypeScript
rastray,balangyaoejuspher/rastray,"Blazing-fast static analysis CLI for security, dependency, and performance audits.",2026-06-12T07:17:12Z,2026-06-29T11:35:06Z,Rust
Pasty,IvyGain/Pasty,"A blazing-fast, local-first, open-source clipboard manager for macOS  the upper-compatible successor to Paste, free under MIT. Spotlight + bottom strip + notch-hover triad.",2026-06-12T06:32:39Z,2026-06-29T09:45:01Z,Swift
scryglass,cameronkinsella/scryglass,"A lightweight, feature-rich, blazing-fast image viewer",2026-06-11T19:13:53Z,2026-06-26T03:37:44Z,Rust
rift,exYze/rift,"A blazing-fast, Rust-powered TUI for terminal-native AI code intelligence and assisted development.",2026-06-11T15:02:33Z,2026-07-01T02:13:55Z,Rust
NomadEXP,ssreenandh069-debug/NomadEXP,"A lightweight, privacy-first file manager powered by local AI and a blazing fast C-based NTFS MFT scanner.",2026-06-11T04:26:37Z,2026-06-28T18:31:05Z,Python
protoagent,nMaroulis/protoagent,"A blazing-fast, local-first AI agent ecosystem. Orchestrate local LLMs with Python, run them in a native Rust terminal, or integrate directly into your editor via ACP.",2026-06-09T22:36:14Z,2026-06-29T18:44:06Z,Rust
unitsling,IndraTensei/unitsling," A blazing-fast terminal unit converter with 100+ units and whimsical conversions (coffeecode, whaleselephants)",2026-06-09T04:38:22Z,2026-06-24T08:44:48Z,Python
bunti,zakmandhro/bunti,"A Bun-native Terminal UI library with zero dependencies, blazing-fast performance, and beautiful human + agent-optimized APIs.",2026-06-08T21:52:18Z,2026-06-26T17:26:23Z,TypeScript
quick-json-viewer,evyatar/quick-json-viewer,A blazing-fast macOS JSON tree viewer written in Rust. Navigate and search massive JSON files without the memory overhead of traditional editors.,2026-06-08T19:13:13Z,2026-06-28T13:40:05Z,Rust
Locsight,ThanhNguyxnOrg/Locsight,"Blazing-fast codebase health, security, and refactoring hotspot analyzer built with Rust and Tauri v2.",2026-06-08T16:56:53Z,2026-06-28T19:15:13Z,TypeScript
Uni-OCR,yuanweize/Uni-OCR,"UniOCR - Unified multilingual OCR service. Supports PaddleOCR / Apple Vision engines with deep MLX-VLM neural network hardware acceleration. A blazing-fast, local-first API for enterprise AI workflows (n8n/Bob).",2026-06-08T13:18:33Z,2026-06-24T17:47:19Z,Python
sloppoke,peeramid-labs/sloppoke,Blazing-fast AI-slop firewall,2026-06-07T16:22:26Z,2026-06-27T06:37:10Z,Rust
Commiv,grechman/Commiv,Blazingly fast vehicle-routing / TSP engine in Zig,2026-06-07T08:21:52Z,2026-06-28T21:07:53Z,Zig
corvette-core,tmtygnz/corvette-core,"Robust & blazingly fast NVR suite for residential and small business use, with AI integration.",2026-06-06T04:00:07Z,2026-06-30T13:36:47Z,Go
synaptik-cms,synaptikcms/synaptik-cms,"A blazing fast, lightweight, highly customizable flat-file CMS to create websites in minutes.",2026-06-05T18:01:55Z,2026-06-27T04:16:57Z,PHP
toki,usetoki/toki," A blazing-fast network framework for Node.js with a native Zig engine and a thin, fully-typed TypeScript API.",2026-06-05T02:43:48Z,2026-06-26T11:35:38Z,TypeScript
progit,libertaria-project/progit,"Git-First Project Management - Blazing-fast terminal issue tracker with Kanban, Forgejo/GitLab sync, and plugin marketplace",2026-06-03T16:41:21Z,2026-06-23T10:15:59Z,Rust
hermes-metal,jaeHbk/hermes-metal,"Blazingly fast second brain, optimized for Mac with llama.cpp Metal",2026-06-03T15:30:13Z,2026-06-23T23:37:54Z,Python
photon-ui,sunbeamdotpt/photon-ui,"A blazing fast, minimal terminal UI framework for Rust",2026-06-02T19:42:43Z,2026-06-29T19:11:00Z,Rust
Anomalous_Model_Browser,DemonGatanjieu/Anomalous_Model_Browser,"A blazing-fast, zero-dependency model browser & gallery for ComfyUI. Features O(1) Civitai scraping, seamless workflow drag-and-drop, and a self-healing engine that magically auto-resolves missing models via metadata hash injection. ",2026-06-02T03:14:24Z,2026-06-29T10:17:51Z,JavaScript
AI-Assistant-App,Abhyuday-gpt24/AI-Assistant-App,"Experience seamless productivity with our next-gen AI Assistant app! Built with a blazing-fast Next.js frontend for an instant, responsive UI and real-time streaming. It is powered by a robust Python backend for advanced machine learning, deep contextual understanding, and scalable performance.",2026-06-01T07:24:07Z,2026-06-27T19:12:38Z,Python
keirouter,mydisha/keirouter,"Your friendly, blazing-fast, self-hostable AI gateway",2026-05-31T09:02:50Z,2026-07-01T09:53:50Z,Go
lekh,dcryptoniun/lekh,"Lekh  A modern, beautiful, and blazing-fast markdown editor built for every platform (Tauri v2 + React).",2026-05-30T15:20:25Z,2026-06-23T08:25:54Z,TypeScript
cjsonx,tiw302/cjsonx,"Blazing fast C11 JSON parser (1+ GB/s) featuring a 16-byte Flat-DOM, SIMD acceleration, Eisel-Lemire float engine, and zero-allocation mode.",2026-05-30T14:08:52Z,2026-06-23T00:12:36Z,C
Hayate,ShiinaSaku/Hayate,"A blazing-fast, completion-based CLI and engine for secure file and directory transfers across local networks.",2026-05-29T09:15:16Z,2026-06-30T12:03:05Z,Rust
codescope,adventurewave-labs/codescope,"Single-binary, blazing-fast code-intelligence engine for AI coding agents  indexes any repo into a queryable structural graph and serves it over MCP, CLI, and JSON with token-budgeted output. No cloud, no DB, no Python.",2026-05-28T16:57:01Z,2026-06-27T15:00:37Z,Rust
kodanu,raaiden666/kodanu,Kodanu - blazing fast game engine in Rust,2026-05-26T15:40:01Z,2026-06-30T18:14:08Z,Rust
lattice,ggmaldo/lattice,"Blazing-fast, concurrent in-memory KV store for AI/LLM workloads, written in Rust.",2026-05-26T15:38:01Z,2026-06-23T16:37:03Z,Rust
DeepFind,nadav-cheung/DeepFind,"Blazing-fast file search for macOS, inspired by Windows Everything",2026-05-26T02:44:40Z,2026-06-29T00:35:09Z,Rust
tailr,flolibio/tailr,"A blazing-fast log tail & search server. Single binary, web UI, real-time streaming.",2026-05-25T05:57:38Z,2026-06-30T12:11:55Z,Rust
Hoatzin,Levi477/Hoatzin,"Fast. Powerful. Effortless. A blazing-fast workflow orchestration engine built in Rust for seamless, local-first automation",2026-05-25T05:06:54Z,2026-06-27T12:15:03Z,Rust
pg_cuvs,ysys143/pg_cuvs, Blazing-fast GPU vector search for PostgreSQL powered by NVIDIA cuVS.,2026-05-24T14:53:14Z,2026-06-26T19:17:37Z,C
SmartiAI-Agent-for-Windows,menachem-dadon/SmartiAI-Agent-for-Windows,"A lightweight, blazing-fast AI agent for Windows. Automate your OS via CLI control, built-in tools, MCP tools, custom Python scripts, and expandable skills. Fully autonomous.",2026-05-24T09:55:49Z,2026-06-30T01:00:03Z,Python
kblog,st-shivam/kblog,A blazingly fast K8s log & event timeline TUI. Drops into K9s or runs standalone. Features chronological event interleaving & interactive JSON trees.,2026-05-24T08:13:48Z,2026-06-22T08:25:50Z,Go
wrongsv,irrit-us/wrongsv,Blazing fast proxy server impl in Rust. Entrust privacy to protocol security.,2026-05-23T16:20:40Z,2026-06-27T15:03:48Z,Rust
gobby,sweetpalma/gobby,Blazing fast gremlin agent that never leaves your machine.,2026-05-22T01:37:01Z,2026-06-26T13:37:46Z,TypeScript
smarter-faster-better-mcp,iHaiduk/smarter-faster-better-mcp,"A blazing fast, ultra-lightweight Model Context Protocol (MCP) server for AST-based code intelligence and semantic discovery. Powered by Bun and oxc-parser with zero native build dependencies, it enables seamless code searching and dependency mapping optimized for small local LLMs and giant commercial models alike.",2026-05-21T13:47:09Z,2026-06-23T13:29:59Z,TypeScript
Spotlite,sunneydev/Spotlite,"A blazing-fast, bloat-free Spotlight replacement for macOS. Opens your apps. Nothing else.",2026-05-20T12:45:47Z,2026-06-26T17:05:43Z,Swift
omneval,omneval/omneval,The lightweight and blazingly fast LLM tracing tool.,2026-05-19T20:09:50Z,2026-06-27T15:43:56Z,Go
dravoo,mannatkhaan01-blip/dravoo,"An elite, web-based video studio built with a futuristic cyberpunk neon UI. Dravoo delivers blazing-fast client-side video trimming directly inside the browser with zero server lag. Optimized layout, high-speed JS processing, and premium dark aesthetics for modern creators. Developed by Mudassir Shabbir.",2026-05-17T09:47:19Z,2026-06-29T17:12:26Z,HTML
smart-novel-api,theusmandev/smart-novel-api,"A blazing-fast, typo-tolerant serverless API for querying 1 lac+ Urdu novels. Built with Vercel Serverless Functions and Supabase PostgreSQL",2026-05-17T03:54:03Z,2026-07-01T09:31:11Z,JavaScript
typst_flutter,ajmalbuv/typst_flutter,A Flutter plugin bridging the Rust-based Typst engine natively to Dart. Embed the compiler to generate blazing-fast PDFs and interactive previews on mobile and desktop.,2026-05-15T19:55:14Z,2026-06-22T14:25:55Z,Dart
Limericks,Next-Mountain-Ventures-LLC/Limericks,Repository for Astrobot.design: Futuristic AI-Powered Blazing Fast Websites with Human Designer Collaboration,2026-05-13T17:22:18Z,2026-06-29T13:34:03Z,TypeScript
PK-Movie-Hub,PhakapholDherachaisuphakij/PK-Movie-Hub,"A premium, high-performance web application for curated movie and series collections. Built with a modern tech stack focused on blazing-fast performance, stunning aesthetics, and a dynamic user experience.",2026-05-13T05:50:22Z,2026-06-24T09:19:47Z,TypeScript
VelociRust,AabhaJahagirdar/VelociRust,"A highly optimized, blazing fast code editor engine written entirely in Rust.",2026-05-12T12:41:25Z,2026-07-01T03:23:41Z,Rust
Strara2,hashimnaim/Strara2,Blazing fast module loader.,2026-05-09T13:20:05Z,2026-06-23T16:08:02Z,Luau
bzf-http,blazing-fast/bzf-http,A simple and blazing fast http server,2026-05-08T16:55:30Z,2026-06-23T16:05:05Z,C
sqlab,fhsgoncalves/sqlab,"A blazing-fast, memory-efficient SQL editor",2026-05-08T02:27:51Z,2026-06-29T12:29:26Z,Rust
lite-dom-binder,PeshoVurtoleta/lite-dom-binder,"Blazing-fast, zero-GC CSSOM updater. Bypasses framework diffing by piping raw Float32Array matrices directly to DOM transforms with hardware-level dirty checking.",2026-05-07T04:09:55Z,2026-06-30T23:38:55Z,JavaScript
Deskdrop,ChinmayyK/Deskdrop,"A blazing-fast, decentralized device ecosystem. Connect an unlimited number of macOS, Android, Windows, and Linux machines to securely relay clipboards, files, and system states over your local network.",2026-05-06T17:39:22Z,2026-06-30T18:36:28Z,Rust
Whale,usewhale/Whale,"Whale  blazingly fast, terminal-first AI coding agent for DeepSeek. ~98% prompt cache hit rate, 1M context, MCP tools, dynamic workflows.",2026-05-06T07:01:36Z,2026-07-01T09:40:32Z,Go
chilen,tpaau/chilen,"Fully offline, blazingly fast music player for your library",2026-05-05T19:10:41Z,2026-07-01T09:13:13Z,Rust
renderit.themes,zmdy/renderit.themes,renderit.themes is the official theme and addon repository for the renderit.builder engine  a static site generator built with Vanilla JS that takes HTML templates with Magic Tags and JSON content files to render blazing-fast static sites with native SEO and zero dependencies.,2026-05-02T02:03:57Z,2026-06-24T20:19:23Z,HTML
smartLearn-AI,Nav33dCodes/smartLearn-AI,"The ultimate contextual AI engine. Blazing-fast RAG pipelines, generative UI, and multi-model fallback routing built on FastAPI & React.",2026-05-01T10:05:01Z,2026-06-23T17:44:58Z,JavaScript
golab,hoangnecon/golab,"A blazing-fast, native Golang Model Context Protocol (MCP) Server for controlling and scraping Google Colab locally.",2026-04-27T15:45:13Z,2026-06-22T14:52:43Z,Go
git-hygiene,chitranklabs/git-hygiene,"The ultimate zero-dependency metadata validator for modern Git workflows. Enforce conventional commits, branch naming patterns, and PR titles with blazing-fast native Node.js performance.",2026-04-26T05:43:36Z,2026-07-01T01:30:33Z,TypeScript
portfolio-v1,noumanhafeez/portfolio-v1,"A sleek, performant personal portfolio built with React 18, TypeScript, TanStack Query (for blazing-fast data fetching & caching), Tailwind CSS (for responsive, utility-first styling), and Vite (for lightning-quick builds).",2026-04-25T19:18:11Z,2026-06-30T05:08:56Z,TypeScript
KrakenMC,itarqos5/KrakenMC,"A blazingly fast, multi-threaded Minecraft server & proxy built in Rust",2026-04-24T14:35:30Z,2026-06-30T17:12:15Z,Rust
Neuro,pd241008/Neuro,"NEURO is a blazing-fast, memory-safe, polyglot Compiler Pipeline built with Rust, C#, C++, and C. Designed with a ""security-first"" philosophy, NEURO acts as a strict validator for execution-critical software, ensuring memory safety and logical consistency at the language level.",2026-04-24T11:31:01Z,2026-06-28T05:22:57Z,Rust
yt-dlp_fast_downloader,foreverforbidden/yt-dlp_fast_downloader,Makes yt-dlp downloads blazingly fast through the use of CMD and presets,2026-04-24T11:26:30Z,2026-06-25T08:52:55Z,PowerShell
avenx-js,Avenx-JS/avenx-js,"Avenx.js is a compiler-driven, blazingly fast JavaScript framework with proxy-based reactivity.",2026-04-22T18:55:15Z,2026-06-30T20:15:42Z,JavaScript
ohmynvim,4thel00z/ohmynvim," OhMyNvim - A modern, blazing-fast Neovim configuration for polyglot developers. IDE-like features with <50ms startup. LSP, DAP, Treesitter, and more!",2026-04-20T04:43:59Z,2026-06-26T22:44:55Z,Lua
Toxic-MD-Test,xhclintohn/Toxic-MD-Test, Toxic-MD  Lightning-fast WhatsApp bot. Multi-device. CommonJS. Blazing IPC startup.,2026-04-20T00:22:10Z,2026-06-23T18:23:35Z,JavaScript
cheenhub,loject/cheenhub,Blazing fast gamers voice chat,2026-04-19T06:20:53Z,2026-07-01T09:20:29Z,Rust
OpenPDF-Extension,bsandeepreddy/OpenPDF-Extension,"OpenPDF heralds Privacy-by-Design. A client-side triumph over SaaS, its free, blazing-fast, and 100% privateno servers, no spying. It democratizes pro PDF tools for every browser user: students in South America to lawyers in Europe. More than a viewerits your data, your rules. Powerful software, free for all.",2026-04-17T23:08:27Z,2026-06-24T23:27:44Z,JavaScript
corganizer,zedxihan/corganizer,"A blazing fast, memory-safe CLI tool to automatically organize your cluttered files",2026-04-17T03:39:09Z,2026-06-25T05:51:46Z,C
svelte-check-native,harshmandan/svelte-check-native,Blazing fast svelte-check (<1.0s) built with Rust,2026-04-16T17:41:52Z,2026-06-29T06:12:21Z,Rust
BigBox,podheitor/BigBox,All your messaging apps in one blazing-fast window. Lightweight Rambox alternative built with Tauri v2 + Rust.,2026-04-16T01:16:47Z,2026-06-30T21:15:33Z,Rust
minifetch,Ayush2006128/minifetch,A blazing fast fetch command for executing at login,2026-04-13T14:31:05Z,2026-06-24T07:46:23Z,Rust
SArixa,AtanuGhosh2701/SArixa,"SArixa is a blazing-fast, 100% secure Image to PDF converter. Built entirely with HTML, CSS, and JS. All processing happens in your browser, so no files are ever uploaded to a server.",2026-04-13T06:40:55Z,2026-06-30T12:15:37Z,JavaScript
Bridge-Search,Sarakael78/Bridge-Search,Blazing-fast WSL2 to Windows file search bridge for AI Agents via MCP,2026-04-12T11:13:57Z,2026-06-29T16:23:54Z,Python
rs-pug,JustRoccat/rs-pug,"Blazing fast, terminal music player (TUI) written in Rust. Extensible via Lua plugins, built on Ratatui, MPV, and YT-DLP. Listen to YouTube, SoundCloud, and local files directly from your terminal. Lightweight, headless, ads-free.",2026-04-11T16:35:57Z,2026-06-30T13:44:13Z,Rust
dblitz,tstone-1/dblitz,Blazingly fast SQLite browser  Rust + Tauri + Svelte,2026-04-09T12:19:58Z,2026-06-29T13:13:09Z,Rust
PipeChecker,Ayyankhan101/PipeChecker,"Blazingly fast CI/CD pipeline auditor that validates GitHub Actions, GitLab CI, and CircleCI workflows locally. Catch circular dependencies, secrets issues, and syntax errors instantly - before wasting time on CI failures. Features: auto-detection, interactive TUI, watch mode, pre-commit hooks. Built with Rust.",2026-04-07T11:47:35Z,2026-06-27T10:04:23Z,Rust
Cpp-uWS-Redis-Demo,elmyrockers/Cpp-uWS-Redis-Demo,A blazing-fast C++ real-time chat demo built with the powerful uWebSockets library and Redis for extreme performance and scalability.,2026-04-06T11:10:02Z,2026-07-01T06:59:21Z,HTML
rstlrx,The-Fisher-Slopworks-Co/rstlrx," A blazingly fast, memory-safe, lightweight Spotify lyrics viewer for your terminal. ",2026-04-05T21:16:47Z,2026-06-23T18:42:26Z,Rust
LoomFramework,PatAmigo0/LoomFramework,Blazing fast framework for roblox based on ByteNet,2026-04-05T14:30:41Z,2026-06-21T18:26:40Z,Luau
sqlpilot,EVWorth/sqlpilot,"A blazing-fast, AI-powered MySQL GUI  built with Rust & React. Think MySQL Workbench, but actually good.",2026-04-05T03:02:41Z,2026-06-29T02:02:28Z,TypeScript
massively-optimized,k4sprl/massively-optimized,"Blazingly fast, privacy first, and zero clutter.",2026-04-03T11:51:38Z,2026-06-26T14:23:58Z,HTML
sakuin.nvim,AlexandrosAlexiou/sakuin.nvim,Blazing-fast Neovim plugin for instant full-text search via indexed codebase.,2026-04-03T08:32:05Z,2026-06-30T11:09:59Z,Rust
vips,outskirtslabs/vips,Blazing fast image and photo processing for Clojure powered by libvips,2026-04-02T15:21:36Z,2026-06-29T10:18:12Z,Clojure
contrack,arvarik/contrack,"Contrack: An AI-powered, blazing-fast personal CRM built with Express 5, React 19, and Vite 8. Features intelligent deduplication, networking analytics, and automated context gathering.",2026-04-01T19:31:37Z,2026-06-23T21:39:03Z,TypeScript
LANSync,XronTrix10/LANSync,"A blazing-fast, cross-platform local file and clipboard synchronization tool. Built with Go, React (Wails), and Jetpack Compose for seamless peer-to-peer sharing over Wi-Fi.",2026-04-01T13:50:01Z,2026-06-29T15:09:08Z,Kotlin
nvim-config,RaulOn18/nvim-config,"A modern, modular, and blazing-fast Neovim configuration forked from NvChad, optimized for JavaScript/TypeScript, Go, Flutter, Kotlin, SQL, and Node.js development.",2026-03-31T07:35:37Z,2026-06-27T18:49:24Z,Lua
grapha,wenext-limited/grapha,Blazingly fast code intelligence that gives AI agents compiler-grade understanding of your codebase,2026-03-30T10:19:32Z,2026-06-27T08:29:09Z,Rust
sockslender,tailsmails/sockslender,"A lightweight, blazing-fast SOCKS5 proxy failover tool written in V",2026-03-28T19:08:57Z,2026-06-29T06:35:17Z,V
qfetch,quixaq/qfetch,"A blazing fast, highly configurable and lightweight fetch tool written in Rust.",2026-03-28T18:44:46Z,2026-06-27T21:43:03Z,Rust
buff-json-java,suboptimal-solutions/buff-json-java,Blazingly fast  JSON serialization and deserialization for Protocol Buffer messages in Java  up to ~10x faster than protobuf-java-util's JsonFormat.,2026-03-28T15:48:16Z,2026-06-30T17:39:05Z,Java
mediadrop,SONUVERMA11/mediadrop,"A blazing-fast, decentralized file sharing and media transfer application. Features end-to-end encryption, peer-to-peer WebRTC connections, and an intuitive drag-and-drop interface for secure data exchange.",2026-03-28T05:30:59Z,2026-06-26T16:38:19Z,Kotlin
dynamic-markdown-site,LarsArtmann/dynamic-markdown-site," A blazing-fast markdown site generator with live reload, built in Go",2026-03-27T21:38:15Z,2026-06-28T18:56:36Z,Go
pulldown-cmark-node,Axyor/pulldown-cmark-node,"Blazingly fast Markdown to HTML renderer for Node.js, powered by Rust's pulldown-cmark. Native, safe, and CommonMark compliant.",2026-03-26T21:51:59Z,2026-06-22T20:01:39Z,Rust
pulsar,Krv-Labs/pulsar,Blazing-fast multiverse data exploration   based on our Nature Energy 2025 publication,2026-03-26T12:22:35Z,2026-06-23T21:53:45Z,Python
filefinder,NianJiuZst/filefinder,A blazing fast local file search tool written in Rust,2026-03-26T06:38:30Z,2026-06-29T03:17:39Z,Rust
Sipp,noumena-labs/Sipp,"AI inference, packed simply. A blazing-fast, zero-dependency WebGPU runtime to run GGUF models directly in the browser. Features a symmetric API for seamless local execution and cloud provider routing. Built with Rust & C++.",2026-03-25T16:46:05Z,2026-07-01T04:49:58Z,Rust
runfile,Skiley/runfile,"Runfile: a blazingly-fast, batteries-included task runner.",2026-03-25T03:08:28Z,2026-06-26T21:26:05Z,Rust
blf,elentok/blf,Blazingly Fast CLI utilities,2026-03-24T21:20:13Z,2026-06-30T20:50:34Z,Go
ZeptoDB,ZeptoDB/ZeptoDB,Blazing fast in-memory time-series database,2026-03-24T14:54:41Z,2026-06-24T16:46:38Z,C++
markymap,mohamedgshoaib/markymap,"Turn your thoughts into beautiful, interactive mindmaps instantly. Write in Markdown on the left, visualize your ideas dynamically on the right, and never lose your work with local auto-saving. Features a blazing-fast Next.js 16 UI, Web Audio sound design, dark mode, and seamless file import/export.",2026-03-24T06:34:41Z,2026-06-23T03:46:13Z,TypeScript
brutecraber,Erikgavs/brutecraber,"A blazing-fast, multithreaded hash cracker built with Rust.",2026-03-23T12:26:40Z,2026-06-29T14:50:59Z,Rust
terraform-runs-on,dryvist/terraform-runs-on," Blazing fast, dirt cheap self-hosted GitHub Actions runners on AWS spot instances  because waiting for CI is so 2023",2026-03-22T06:51:18Z,2026-06-24T15:56:22Z,HCL
Mandelbrot-Video,Divetoxx/Mandelbrot-Video,"Mandelbrot CLI: Renderer with Perturbation Theory. The high-precision reference trajectory is computed exactly once, enabling blazing-fast math for billions of pixels using hardware-native double registers (with a 1e-308 hardware limit). Revolutionary Reference Reset to Zero implementation. ",2026-03-21T18:42:54Z,2026-06-21T15:27:44Z,C++
MakeuownTools,2363186247/MakeuownTools,"A collection of serverless, blazing-fast web tools: Docker Compose Generator, LLM VRAM Calculator, NAS RAID Capacity, and Nginx Reverse Proxy Builder.",2026-03-21T04:37:49Z,2026-07-01T09:08:07Z,Astro
fast-bpe-rs,zhixiangli/fast-bpe-rs,"A blazing-fast Rust tokenizer for Byte Pair Encoding (BPE), a fundamental building block of modern LLMs that converts text into tokensfeaturing Python bindings for training, encoding, and decoding.",2026-03-20T01:47:16Z,2026-06-28T05:59:40Z,Rust
butter,Temikus/butter,A blazingly fast AI proxy gateway.,2026-03-18T20:57:20Z,2026-06-30T17:12:05Z,Go
fulgur,fulgur-rs/fulgur,Blazing fast HTML to PDF engine built on blitz and krilla,2026-03-17T17:30:22Z,2026-07-01T09:28:03Z,Rust
EdenExplorer,mtucciarone/EdenExplorer," Blazing-fast, fully open-source Windows 11 file explorer built in Rust. A modern, lightweight, high-performance replacement for File Explorer.",2026-03-17T09:42:17Z,2026-06-25T09:17:40Z,Rust
ferox,frkdrgt/ferox,A blazing-fast PostgreSQL client built in Rust. No Electron. No JVM. No bloat.,2026-03-16T12:40:42Z,2026-06-23T19:34:38Z,Rust
openwrt-darkboard,Anilexis/openwrt-darkboard,"A blazing-fast, single-file SPA dashboard for OpenWrt routers in dark theme",2026-03-16T08:51:48Z,2026-06-24T13:50:34Z,HTML
json-gui,pingsrl/json-gui,a blazing-fast app to navigate your JSON files,2026-03-14T23:09:53Z,2026-06-29T17:10:55Z,Rust
dockernativemanager,pedrofariasx/dockernativemanager,"A modern, native, and blazing-fast desktop application to manage your Docker environments.",2026-03-13T04:06:05Z,2026-06-29T11:48:12Z,TypeScript
dev,mttk2004/dev,"`dev` is a blazing-fast, interactive Terminal User Interface (TUI) tool written in Go. It is designed to automate the tedious tasks of setting up and managing web development environments on **Arch Linux** (with **Zsh**).",2026-03-10T03:00:05Z,2026-06-23T12:45:31Z,Go
psysonic,Psychotoxical/psysonic,"A gorgeous, modern, and blazing fast Navidrome desktop client. Inspired by Winamp, built for the future with Tauri & React.",2026-03-09T17:58:53Z,2026-07-01T09:29:42Z,TypeScript
zccache,zackees/zccache,Blazing Fast cpp / rust / emscripten drop in replacement for sccache and ccache,2026-03-08T18:23:35Z,2026-06-30T19:31:42Z,Rust
passrat,versayr/passrat,Blazingly fast password storage app using ratatui,2026-03-06T21:22:19Z,2026-06-30T03:55:40Z,Rust
tauri-m3u8-downloader,watershy/tauri-m3u8-downloader,"A blazing-fast, cross-platform desktop application for downloading and merging M3U8 video streams. Built with Rust, Tauri, and Vue.",2026-03-04T23:01:30Z,2026-06-30T06:42:12Z,Rust
bedrock-api,feralbureau/bedrock-api,"Blazing fast music streaming aggregator for Spotify, SoundCloud, Deezer and others. Written in Go. gRPC streaming, Lyrics sync, No-Ads, Low memory usage.",2026-03-02T22:29:28Z,2026-07-01T09:28:52Z,Go
scrawl,dasunNimantha/scrawl,"Blazingly fast, self-hosted text sharing app with a single Go binary.",2026-03-02T17:57:47Z,2026-06-23T12:07:24Z,Go
sql-pipe,vmvarela/sql-pipe,"A blazing-fast, zero-dependency CLI that pipes CSV data from stdin into an in-memory SQLite database for instant SQL querying. Built with Zig.",2026-03-02T03:54:15Z,2026-07-01T06:06:32Z,Zig
vertexlauncher,SturdyFool10/vertexlauncher,A blazingly fast modern minecraft launcher based on egui,2026-02-28T12:08:14Z,2026-06-29T00:13:18Z,Rust
RSSentinel,UtkarshUmre/RSSentinel,A blazing-fast Go RSS aggregator that automatically harvests and organizes your feeds in one powerful hub. ,2026-02-27T06:41:25Z,2026-06-24T08:44:48Z,Go
port-scanner,H4ppy-04/port-scanner,Blazingly fast port scanner ,2026-02-26T07:45:57Z,2026-06-23T11:40:16Z,Rust
