name,full_name,description,created_at,pushed_at,language
cpyrcolate,simonschindler/cpyrcolate,"A blazing-fast Python package for bond percolation on general graphs. Powered by a C-optimized Newman-Ziff algorithm, it computes percolation statistics and spatial spanning clusters directly from NumPy edge lists.",2026-02-25T10:37:11Z,2026-06-30T14:42:43Z,Python
bunforge,IStetsyo/bunforge,"Blazingly fast Full-Stack application template using Bun, Elysia, Solid Start, oRPC",2026-02-23T20:51:47Z,2026-06-26T23:05:11Z,TypeScript
php-version-manager,WebProject-xyz/php-version-manager,"Native, blazing fast, zero-configuration PHP version manager for Arch Linux and other Linux/macOS environments, heavily inspired by fnm.",2026-02-21T22:10:17Z,2026-06-30T18:57:52Z,Rust
syz,connorzentner/syz,A blazingly fast system fetcher written in c.,2026-02-19T23:37:22Z,2026-06-24T19:44:58Z,C
aspara,prednext/aspara,"A blazingly fast, scalable metrics tracker for machine learning",2026-02-17T06:52:08Z,2026-06-28T10:57:56Z,Python
Cleanux,rusnakdima/Cleanux," A modern, blazingly fast system cleaner and optimizer for Linux. Built with Tauri 2.0, Rust, and Angular 21. Parallel processing for maximum efficiency. ",2026-02-16T17:40:02Z,2026-06-23T13:50:51Z,TypeScript
quasar,blueshift-gg/quasar,A blazing fast Solana program framework.,2026-02-16T17:09:16Z,2026-06-30T21:03:02Z,Rust
surge-wave,winmin/surge-wave, A blazingly fast M3U8/HLS downloader with Surge-inspired cyberpunk TUI,2026-02-11T08:32:25Z,2026-06-26T10:33:58Z,Rust
Lynkless,Sathvik-Nagesh/Lynkless,"A blazing-fast, zero-storage, peer-to-peer file transfer and chat platform built with WebRTC. Share files directly between browsers without any server storage  complete privacy by design.",2026-02-10T20:30:56Z,2026-06-30T21:53:57Z,TypeScript
hackertok.github.io,hackertok/hackertok.github.io,"An open-source, blazingly fast, progressive Hacker News client.",2026-02-10T17:52:29Z,2026-07-01T04:55:28Z,TypeScript
Groq-Streamlit-Chatbot,add-win/Groq-Streamlit-Chatbot,"A lightweight, modern, and responsive AI chatbot application built with Streamlit and powered by the blazing-fast Groq Cloud API (utilizing the llama-3.3-70b-versatile model).  This chatbot maintains continuous conversation history in Streamlit session state, allowing for natural, context-aware dialogues.",2026-02-10T08:36:33Z,2026-06-27T12:58:48Z,Python
urva-portfolio,urvagandhi/urva-portfolio,"Portfolio of Urva Gandhi - Full-Stack Developer & ML Enthusiast. Built with Next.js, Tailwind CSS & Framer Motion. Highlights hackathon wins, 150+ LeetCode solutions, and projects in AI, finance & healthcare. Features dark mode, smooth animations, responsive design, and modern glassmorphism aesthetics. Production-ready & blazing fast.",2026-02-08T12:44:55Z,2026-06-26T13:02:20Z,JavaScript
Mandelbrot,Divetoxx/Mandelbrot,"Mandelbrot CLI: Renderer with Perturbation Theory. The high-precision reference trajectory is computed exactly once, enabling blazing-fast math for billions of pixels using hardware-native double registers (with a 1e-308 hardware limit). Revolutionary Reference Reset to Zero implementation. ",2026-02-08T07:22:09Z,2026-06-21T15:31:57Z,C++
codewithbotina-blog,CodeWithBotinaOficial/codewithbotina-blog,"A blazing-fast static blog built with Astro, Fresh (Deno), Supabase, and deployed on Cloudflare Pages.",2026-02-05T22:35:07Z,2026-06-22T15:17:16Z,TypeScript
LitePhoton,IzomSoftware/LitePhoton,"A blazingly fast text file reader/scanner, made in Rust using rayon & memchr.",2026-02-05T19:33:21Z,2026-06-21T20:12:32Z,Rust
poexam,poexam/poexam,Blazingly fast PO linter.,2026-02-02T20:37:57Z,2026-06-28T09:05:55Z,Rust
FalchusChunks,Falchus/FalchusChunks,A blazingly fast chunk generator.,2026-02-01T15:58:00Z,2026-06-23T17:10:36Z,Java
KEALint,sanua356/KEALint,"Blazingly fast static configuration analyzer ISC KEA DHCP for version 3.x.x, written in Rust!",2026-02-01T06:30:16Z,2026-06-22T12:15:44Z,Rust
flux,killown/flux,"A blazingly fast, multi-threaded Linux file manager built with Rust and GTK4/Libadwaita. Features a reactive architecture via Relm4, utilizing Rayon for parallel file processing and Tokio for async I/O.",2026-02-01T02:15:52Z,2026-06-29T14:38:43Z,Rust
datafusion-sharp,nazarii-piontko/datafusion-sharp,".NET bindings for Apache DataFusion query engine - execute blazing-fast SQL queries on Parquet, CSV, and JSON with Apache Arrow",2026-01-30T20:44:31Z,2026-06-29T09:34:50Z,C#
Blazing.Json.JSONPath,valentin001-77/Blazing.Json.JSONPath," Streamline JSON data access with Blazing.Json.JSONPath, a fast and compliant library for querying JSON documents effortlessly.",2026-01-24T10:58:56Z,2026-07-01T09:36:14Z,C#
cc-relay,omarluq/cc-relay,Blazing fast LLMs API Gateway written in Go ,2026-01-20T23:32:16Z,2026-06-30T15:35:10Z,Go
smplx,BlockstreamResearch/smplx,"A blazingly-fast, ux-first simplicity development framework.",2026-01-20T17:49:38Z,2026-07-01T07:57:20Z,Rust
vetis,vetis-server/vetis,"A blazingly fast, minimalist HTTP server built for modern Rust applications.",2026-01-17T23:11:35Z,2026-06-29T21:15:17Z,Rust
fedra,trypsynth/fedra,"An open-source, accessible, blazing fast Mastodon client",2026-01-15T18:26:03Z,2026-06-30T23:09:39Z,Rust
datahugger-ng,EOSC-Data-Commons/datahugger-ng,blazing fast dataset downloader,2026-01-13T14:46:45Z,2026-06-29T22:24:27Z,Rust
omg,PyRo1121/omg,"The Fastest Unified Package Manager for Arch Linux + All Language Runtimes  OMG is a next-generation package manager designed for 2026 standards. It eliminates the friction of switching between pacman, yay, nvm, pyenv, and rustup by unifying them into a single, blazing-fast, Rust-native binary.",2026-01-13T10:08:19Z,2026-07-01T00:12:29Z,Rust
ThemeSwitcher,Medo-bit/ThemeSwitcher,"A blazing-fast, self-contained Windows 10/11 utility that dynamically switches your system theme between Light and Dark modes based on precise solar times. Built with .NET 10.",2026-01-12T11:23:32Z,2026-06-25T22:54:38Z,
al-call-hierarchy,SShadowS/al-call-hierarchy,Blazing-fast call hierarchy LSP server for AL (Business Central) using tree-sitter,2026-01-12T09:56:26Z,2026-06-28T13:33:54Z,Rust
letsblaze,thomaslaurenson/letsblaze,"Blazingly fast, highly opinionated flyweight Hugo theme",2026-01-07T19:42:36Z,2026-06-22T18:48:52Z,Shell
writing-a-c-compiler-sandler-rs,adhi-thirumala/writing-a-c-compiler-sandler-rs,implementing c compiler textbook nora sandler in rust blazing fast fire emoji crab emoji,2026-01-05T04:27:07Z,2026-06-28T09:08:32Z,Rust
ngx-bun,quinnjr/ngx-bun, Angular 19+ SSR adapter for Bun - High-performance server-side rendering with Bun's blazing fast runtime,2026-01-03T16:02:27Z,2026-06-29T13:06:50Z,TypeScript
TakaTime,Rtarun3606k/TakaTime,"TakaTime is a blazingly fast, privacy-first coding activity tracker and the open-source, self-hosted alternative to WakaTime.  Track your development activity across Neovim, VS Code, JetBrains IDEs, and Antigravity while generating rich analytics, beautiful dashboards, and GitHub profile statisticsall powered by your own MongoDB database.",2026-01-03T07:08:09Z,2026-07-01T00:41:36Z,Go
corsair-x,ghoxtbyte/corsair-x,"A blazing fast, asynchronous CORS misconfiguration scanner with built-in crawling, smart protocol detection, and advanced header support.",2025-12-31T23:38:14Z,2026-06-23T20:56:04Z,Python
nxv,utensils/nxv,nxv  Nix Version Index. A blazingly fast CLI for finding any version of any Nix package.,2025-12-31T16:43:30Z,2026-06-26T02:44:46Z,Rust
bore,Aditya-ds-1806/bore,"A blazing fast, free & open source TCP tunnel that exposes your localhost to the world.",2025-12-30T14:47:54Z,2026-06-30T15:29:39Z,Go
vize,ubugeeei-prod/vize,"Blazing fast Vue.js Toolchain. Compiler, Linter, Type Checker, Formatter, LSP, Story System, Editor Extensions. This already passed 7000+ test suites, includes real world E2E.",2025-12-27T08:32:00Z,2026-07-01T09:19:57Z,Rust
libredb-studio,libredb/libredb-studio,"A modern, blazing-fast SQL IDE for the cloud era. Query PostgreSQL, MySQL, SQLite & MongoDB from anywhere your browser is your new database studio.",2025-12-23T23:00:46Z,2026-06-29T23:10:42Z,TypeScript
simple-senior-fitness,ronnedahl/simple-senior-fitness,SimpleSeniorFitness.com - A content-focused SEO blog teaching traditional Japanese wellness practices for healthy aging. Built with Astro for blazing-fast performance and optimal Core Web Vitals.,2025-12-13T07:48:12Z,2026-06-28T19:33:13Z,Astro
Widcss,Myxo-victor/Widcss,"Widcss is a light weight css framework , works better with venjs for blazing speed and fast web applications",2025-12-12T12:47:53Z,2026-06-22T18:03:40Z,CSS
tablers,monchin/tablers,A blazingly fast PDF table extraction library with python API powered by Rust,2025-12-09T07:27:48Z,2026-06-30T02:33:07Z,Rust
veil-rs,mt4110/veil-rs,"CI/CDPIIRust / Prevent secret leaks at commit & CI/CD stage. A blazing fast, local-first scanner specialized in Japanese PII (My Number, etc.). Features commercial-grade reporting.",2025-12-07T23:01:58Z,2026-07-01T08:47:49Z,Rust
AkkaraDB,SwiftStorm-Studio/AkkaraDB,"The all-purpose KV store: blazing fast and reliably durable, scaling from tiny embedded cache to large-scale distributed database",2025-12-04T15:00:31Z,2026-06-26T18:50:05Z,C++
Ascent,Gabbar-v7/Ascent,"A blazing-fast Flutter mobile app for managing tasks, routines and focus sessions with intuitive gestures and smooth performance.",2025-11-25T08:02:27Z,2026-06-28T08:53:01Z,Dart
blog,marshallku/blog,"A blazing-fast, memory-efficient static site generator built in Rust ",2025-11-19T23:18:25Z,2026-06-30T11:34:22Z,Rust
react-vello,mblode/react-vello,Blazing fast React renderer powered by Vello,2025-11-13T22:16:41Z,2026-06-29T06:14:53Z,TypeScript
ComfyUI-RunpodDirect,MadiatorLabs/ComfyUI-RunpodDirect,Direct model downloads to your Runod pod with blazing-fast multi-connection support. No more downloading models to your local machine and re-uploading!,2025-11-12T14:58:59Z,2026-06-29T08:32:55Z,JavaScript
astro-canvas,krishna-santosh/astro-canvas,"Beautiful & Blazingly Fast Portfolio Website built with Astro 5, Svelte 5, Tailwind 4",2025-11-12T08:39:26Z,2026-06-30T17:41:18Z,Astro
zedis,vicanso/zedis,"Zedis: A blazing-fast, native Redis GUI built with Rust and GPUI.",2025-11-09T12:21:15Z,2026-06-30T22:36:21Z,Rust
rho,xipid/rho,"Composable networking primitives: blazing-fast Server/Client (QUIC alternative), trie-based Router (IP/BGP replacement), BFT name resolution, 0-RTT reconnection, AEAD encryption  runs on ESP32 and bare metal.",2025-11-05T11:44:47Z,2026-06-28T18:57:40Z,C++
RustForge,Chregu12/RustForge,"Full-stack Rust framework with CLI code generation, interactive REPL,   database migrations, background jobs, and event system. Blazingly fast.",2025-10-31T09:53:34Z,2026-06-29T18:41:57Z,Rust
Surge,SurgeDM/Surge,Blazing fast TUI download manager built in Go for power users,2025-10-29T05:00:15Z,2026-07-01T09:25:46Z,Go
eslint-plugin-oxfmt,ntnyq/eslint-plugin-oxfmt,:package: An ESLint plugin for formatting code with oxfmt - A blazing fast formatter powered by Rust.,2025-10-22T09:44:09Z,2026-06-30T05:41:36Z,TypeScript
openapi-php-sdk,openapi/openapi-php-sdk, A fully-featured and blazing-fast PHP API client to interact with @Openapi,2025-10-13T18:03:07Z,2026-06-29T15:16:54Z,PHP
image-optimizer,keif/image-optimizer,"Fast, modern image optimization service and CLI  built with Go + Next.js, powered by libvips for blazing-fast compression and format conversion.",2025-10-13T05:18:28Z,2026-06-29T16:27:08Z,TypeScript
Veloce-TS,ExcessHawk/Veloce-TS,"Veloce brings FastAPI's elegant developer experience to TypeScript. Built on Hono for blazing-fast performance (137k+ req/s), it combines decorators, automatic validation, OpenAPI docs, and dependency injection in a type-safe package that works everywhere.",2025-10-12T23:16:08Z,2026-06-28T06:02:09Z,TypeScript
fdv.lol.bot,Alpa8820/fdv.lol.bot,BLAZING-FAST client-side SOL memecoin radar with explainable GOOD/WATCH/SHILL.,2025-10-11T03:17:23Z,2026-07-01T01:38:06Z,JavaScript
fdv.lol.bot,hayaseta/fdv.lol.bot,BLAZING-FAST client-side SOL memecoin radar with explainable GOOD/WATCH/SHILL.,2025-10-11T02:29:29Z,2026-06-30T20:29:11Z,JavaScript
fdv.lol.bot,codekami45/fdv.lol.bot,BLAZING-FAST client-side SOL memecoin radar with explainable GOOD/WATCH/SHILL.,2025-10-11T02:17:32Z,2026-06-30T20:28:35Z,JavaScript
NRVM,adventurewave-labs/NRVM,"Node Rust Version Manager - Blazing fast Node.js version manager written in Rust. 10x faster than nvm with async operations, cross-platform support.",2025-10-07T02:10:39Z,2026-06-27T15:02:21Z,Rust
gh-enhance,dlvhdr/gh-enhance,A Blazingly Fast Terminal UI for GitHub Actions,2025-10-02T13:29:51Z,2026-06-27T09:02:38Z,Go
wasm-compiler,wasm-ecosystem/wasm-compiler,a lightweight and blazingly fast WebAssembly compiler and runtime library designed for use on resource-constrained embedded systems while seamlessly scaling to high-powered desktop and server systems,2025-09-23T02:31:03Z,2026-07-01T09:04:53Z,C++
garlic-gui,AgarwalKritik/garlic-gui,"Garlic Decompiler (GUI) - A modern C++/Qt6 desktop interface for the Garlic Decompiler, bringing blazing-fast APK, DEX, JAR, and CLASS decompilation to Windows, Linux, and macOS. ",2025-09-22T16:33:16Z,2026-06-26T07:27:55Z,C
vielzeug,helmuthdu/vielzeug,"Type-safe utilities, blazing-fast storage, flexible logging, and more  all in one monorepo.",2025-09-12T05:20:24Z,2026-06-29T16:45:37Z,TypeScript
art-porfolio-cardenas-pachecho,jfdg01/art-porfolio-cardenas-pachecho,Just a blazing fast portfolio for Cardenas Pacheco. Powered by the bleeding edge of the Svelte ecosystem.,2025-09-10T20:36:43Z,2026-06-25T09:04:21Z,Svelte
project-indexly,kimsgent/project-indexly,"Local File Search Tool with SQLite FTS5. Blazing-fast Search, Tagging and Export",2025-09-07T13:27:50Z,2026-06-27T23:49:00Z,Python
faupi,Martan03/faupi,Blazingly fast API Mock Server written in Rust.,2025-09-05T21:44:08Z,2026-06-27T18:07:53Z,Rust
ChronoGrapher,GitBrincie212/ChronoGrapher,"Powerful, developer-experience centric, blazingly fast and extensible job scheduler and workflow orchestration platform",2025-09-05T14:16:21Z,2026-06-29T13:08:35Z,Rust
rules_rs,hermeticbuild/rules_rs,"Next-gen Rust Bazel rules which provide a blazing-fast ergonomic `crate_universe` reimplementation, first-class Windows support, optimized toolchains, and more.",2025-09-05T12:43:28Z,2026-06-29T23:22:34Z,Starlark
LutinoDB,pochi0701/LutinoDB,"A blazing-fast, modern C++20 in-memory database engine with SQL-like featuresperfect for high-performance data management.",2025-08-28T08:05:40Z,2026-06-30T08:35:43Z,C++
wordperms,attilarepka/wordperms,blazing fast wordlist permutation generator,2025-08-08T18:04:55Z,2026-06-26T05:02:07Z,Rust
blaze,livewire/blaze,Pre-compile Blade components for blazing fast rendering performance,2025-08-08T01:00:41Z,2026-06-30T13:22:10Z,PHP
franken-php,yii2-extensions/franken-php,Supercharge your Yii2 applications with FrankenPHP blazing-fast HTTP server.,2025-08-03T16:39:17Z,2026-06-22T10:05:22Z,PHP
road-runner,yii2-extensions/road-runner,Supercharge your Yii2 applications with RoadRunner blazing-fast HTTP server.,2025-07-31T00:08:25Z,2026-06-29T13:09:36Z,PHP
flowfull-node,pubflow/flowfull-node,"The edge-native standard. Build blazing-fast, strongly-typed APIs with Hono and TypeScript that deploy anywhere.",2025-07-29T17:06:09Z,2026-06-30T22:39:42Z,TypeScript
funact,wareset/funact,"A lightweight, blazing fast React-like UI library based strictly on functional components and hooks",2025-07-29T10:45:52Z,2026-06-26T21:19:22Z,TypeScript
rsplug.nvim,gw31415/rsplug.nvim,A blazingly fast Neovim plugin manager written in Rust,2025-07-26T11:32:22Z,2026-07-01T09:44:22Z,Rust
v2go,Danialsamadi/v2go,"v2go is a blazingly fast Go V2Ray config aggregator that processes 20,000+ configurations in 11 seconds (99.7% faster than Python), automatically removing duplicates and generating fresh subscription files every 6 hours.",2025-07-22T21:41:02Z,2026-07-01T08:15:00Z,Go
batless,docdyhr/batless,"Minimal, blazing-fast syntax viewer for the terminal  never blocks, never pages, never hangs. Perfect for code, logs, and AI pipelines.",2025-07-22T19:36:29Z,2026-06-29T11:50:12Z,Rust
Foundatio.Mediator,FoundatioFx/Foundatio.Mediator,"Blazingly fast, convention-based C# mediator powered by source generators and interceptors.",2025-07-20T03:05:02Z,2026-07-01T00:34:42Z,C#
hyprviz,timasoft/hyprviz,"GUI for configuring Hyprland, written in blazingly fast Rust! ",2025-07-19T14:03:51Z,2026-06-29T15:04:16Z,Rust
rustytime,ImShyMike/rustytime, blazingly fast time tracking for developers,2025-07-15T22:21:44Z,2026-07-01T06:08:54Z,Rust
parsecio,ejacobhayes/parsecio," A blazing-fast, self-updating dashboard for your GitHub stars  smartly categorized, beautifully designed, and fully static with zero dependencies.",2025-07-15T07:46:19Z,2026-07-01T06:08:25Z,JavaScript
sage,majiayu000/sage,Blazing fast code agent in pure Rust,2025-07-15T03:33:39Z,2026-07-01T09:54:00Z,Rust
astro-routify,oamm/astro-routify," A high-performance API router for Astro, powered by a Trie-based matcher. Define clean route handlers with full HTTP method support, dynamic params, and blazing-fast lookup  without nested src/pages/api/ clutter.",2025-07-14T05:33:38Z,2026-06-28T19:04:11Z,TypeScript
zsync,GhostKellz/zsync,"zsync is a blazing fast, lightweight, and modular async runtime for Zig.",2025-07-13T20:37:11Z,2026-06-23T17:04:23Z,Zig
proto-migrate,jackchuka/proto-migrate,"Protocol Buffer migrations done right - AST-aware, safe, and blazing fast ",2025-07-11T14:37:57Z,2026-06-30T02:21:06Z,Go
yttria,element39/yttria,"blazingly fast, universal and easy-to-use programming language for anything you can imagine",2025-07-02T23:04:17Z,2026-06-25T21:25:13Z,TypeScript
fbuild,FastLED/fbuild,"A blazing fast build tool for Esp32, Teensy, Avr, Nrf, Raspberri PI, Stm, Mgm240 and more.",2025-06-29T20:47:28Z,2026-07-01T09:52:20Z,Rust
ComChan,Vaishnav-Sabari-Girish/ComChan,A Blazingly Fast Minimal Serial Monitor with serial plottter TUI and more,2025-06-28T05:29:51Z,2026-07-01T09:40:29Z,Rust
binius64,binius-zk/binius64,"Binary Proofs, Blazing Fast",2025-06-27T15:19:26Z,2026-07-01T08:17:02Z,Rust
mpv-music,FurqanHun/mpv-music,"A blazing-fast terminal music player and mpv-based music library browser with fuzzy search, metadata previews, and zero background daemons.",2025-06-27T11:23:54Z,2026-06-29T18:42:54Z,Rust
portfolio,mezotv/portfolio,"Blazingly fast portfolio built with Next.js & tailwind. With integrated shadcn registry, blog and fully AI ready!",2025-06-22T13:37:03Z,2026-06-28T18:07:29Z,TypeScript
xinfer,guoqingbao/xinfer,Blazing-fast LLM inference in pure Rust. No PyTorch and Python runtime.,2025-06-19T11:26:35Z,2026-06-30T11:19:03Z,Rust
zqlite,GhostKellz/zqlite,"zqlite is a blazing-fast, standalone, embedded SQL-compatible database built from scratch in Zig.",2025-06-16T23:26:37Z,2026-06-24T21:01:07Z,Zig
OnlineJudge,AyushGupta3900/OnlineJudge,"CodeX is a modern, feature-rich Data Structures & Algorithms (DSA) practice platform built on the MERN stack, Docker, Redux Toolkit, and AWS. It lets users solve coding problems, run and submit code in a sandboxed environment, track progress, view leaderboards  all with a blazing-fast, intuitive interface and a robust backend.",2025-06-08T06:51:55Z,2026-06-28T19:55:22Z,JavaScript
mu,zenlm/mu, Mu: Blazingly Fast and Embarrassingly Simple End-to-End Full-Length Song Generation with Latent Diffusion. ,2025-05-19T05:43:15Z,2026-06-29T04:02:06Z,Python
JBird,vsanthanam/JBird,"A blazing fast, type-safe library for working with JSON in Swift",2025-05-16T19:54:49Z,2026-06-30T02:02:03Z,Swift
modern_portfolio,ABISHEK086/modern_portfolio,"A modern and responsive web application built with React + Vite and styled using Tailwind CSS. Features a clean project structure, blazing-fast builds, and Hot Module Replacement (HMR) for smooth developer experience.",2025-05-15T04:12:35Z,2026-06-30T08:40:12Z,JavaScript
slideflare,MeatyAri/slideflare,"Blazing fast, interactive presentation tool for developers, educators, and creators to build beautiful slides effortlessly.",2025-05-10T12:35:09Z,2026-06-28T10:09:18Z,Rust
The-Pokedex-Database,hoangsonww/The-Pokedex-Database," An interactive Pokdex app built with Next.js, Tailwind CSS, and React Query for blazing-fast performance and smooth UX. Includes live search, item explorer, and a favorites system powered by browser storage.",2025-05-08T23:21:13Z,2026-06-22T14:09:43Z,TypeScript
dix,manic-systems/dix,A blazingly fast tool to diff Nix related things,2025-05-04T12:13:11Z,2026-06-29T08:25:27Z,Rust
hashgen,jaliyadev/hashgen,"hashgen - the blazingly fast hash generator argon, base58, base64, bcrypt, cyclone, generator, hash, hashcat, hashgen, md5, mdxfind, mosecode, multithreaded, ntlm, sha, sha1, sha256, sha3, threaded, yescrypt",2025-05-03T18:54:18Z,2026-07-01T08:28:52Z,Go
typescript-starter,skydiver/typescript-starter,A clean and modern setup for blazing-fast TypeScript development.,2025-04-23T03:12:43Z,2026-06-27T11:49:14Z,TypeScript
portfolio,cojocaru-david/portfolio,"A modern, high-performance personal portfolio and blog built with Astro.js. Designed to showcase your projects and technical writing with blazing-fast performance and exceptional SEO.",2025-04-22T09:53:18Z,2026-06-29T22:27:21Z,TypeScript
skeleton,tinymvc/skeleton,TinyMvc is a minimalist PHP framework to craft blazing-fast RESTful APIs and modern web apps.,2025-04-04T19:37:05Z,2026-07-01T05:52:09Z,PHP
WordWeaver,milkdrinkers/WordWeaver,A blazingly fast java translation library with Adventure support for Java 8 and up.,2025-04-02T02:38:24Z,2026-06-29T01:13:45Z,Java
tecs,tecs-dev/tecs,A blazing fast ECS and game framework for LuaJIT and Love2D,2025-03-28T04:26:06Z,2026-07-01T04:58:02Z,Teal
codestats,trypsynth/codestats,Blazing fast code analysis tool with tons of customization options.,2025-03-27T19:39:20Z,2026-07-01T00:17:27Z,Rust
2web,hudson-newey/2web,[WIP]  A compiler-based web framework for blazing fast web apps,2025-03-26T12:36:45Z,2026-06-29T11:29:10Z,Go
tgv,zeqianli/tgv,"Explore genomes in the terminal. Light, blazing fast , vim-motion.",2025-03-20T19:31:46Z,2026-06-28T17:45:57Z,Rust
tmux-fzf,tmux-contrib/tmux-fzf,"Blazing-fast project and session switching for tmux, powered by fzf",2025-03-17T11:03:21Z,2026-06-29T02:53:32Z,Shell
uncomment,Goldziher/uncomment,Blazingly fast CLI to remove comments from code using tree-sitter grammers,2025-03-05T06:11:12Z,2026-06-29T09:07:01Z,Rust
RTTM,NGLSG/RTTM,"Blazing-fast C++ reflection powered by pure standard C++ - Zero macros, compiler-automated type introspection",2025-02-21T09:47:23Z,2026-06-25T11:08:21Z,C++
JaxDEM,cdelv/JaxDEM,Easy to use and blazing fast JAX-based library for high-performance 2D/3D Discrete Element Method (DEM) simulations.,2025-02-19T15:46:49Z,2026-06-29T23:04:29Z,Python
bundlemonkey,mkobayashime/bundlemonkey,Bundlemonkey is a userscript bundler designed to make developing browser userscripts blazing fast and efficient.,2025-02-02T18:25:36Z,2026-06-30T17:09:53Z,TypeScript
binary-codec,SystemVll/binary-codec,A blazing-fast declarative parser & encoder for binary data,2025-01-30T09:53:38Z,2026-06-23T21:20:34Z,TypeScript
faster-chat,1337hero/faster-chat,"A blazingly fast, privacy first & OPEN AI Chat Interface",2025-01-18T07:25:52Z,2026-06-30T20:09:44Z,JavaScript
stats-cards,ilyhalight/stats-cards, Blazing fast stats cards for everything,2025-01-15T10:36:03Z,2026-06-28T00:16:07Z,Rust
justified-layout,immich-app/justified-layout,"A blazingly fast implementation of the justified layout gallery view popularized by Flickr, written in Rust and exported to WebAssembly.",2025-01-10T02:11:48Z,2026-06-30T23:09:58Z,Rust
oxidasim,AndrejOrsula/oxidasim,Blazing fast utilities for simulations,2025-01-01T16:36:20Z,2026-06-22T06:34:57Z,Rust
rapidvpi,ArcSpecter/rapidvpi,"Blazingly fast, modern C++ API using coroutines for efficient RTL verification and co-simulation via the VPI interface",2024-12-31T23:58:08Z,2026-06-22T08:38:54Z,C++
workshop,akshit-arora/workshop, A comprehensive DevX desktop toolkit for Laravel developers. Blazing fast Rust core + modern ReactUI.,2024-12-25T08:57:25Z,2026-06-24T06:33:54Z,TypeScript
Astra,ArkForgeLabs/Astra, Blazingly Fast  runtime environment for Lua,2024-12-21T08:17:31Z,2026-06-28T22:03:25Z,Rust
chicha-ip-proxy,matveynator/chicha-ip-proxy,The fastest and simplest solution for TCP and UDP port forwarding. Automatic setup. Blazing fast. ,2024-12-14T09:46:08Z,2026-07-01T09:51:20Z,Go
Labs,Barbarpotato/Labs,The Static Site Generation (SSG) Page for my labs article content. To ensures that users receive a blazing-fast experience with SEO-friendly pre-rendered pages,2024-12-14T00:37:28Z,2026-06-30T13:19:41Z,JavaScript
polars-bio,biodatageeks/polars-bio,Blazing-Fast Bioinformatic Operations on Python DataFrames,2024-11-26T16:58:18Z,2026-07-01T08:38:48Z,Python
epub2audiobook,haydonryan/epub2audiobook,Blazingly fast EPUB to Audiobook converter,2024-11-15T19:04:04Z,2026-06-27T14:20:27Z,Rust
sockudo,sockudo/sockudo,Blazingly fast pusher drop-in replacement written in rust,2024-11-09T22:01:43Z,2026-06-29T19:17:06Z,HTML
quarkus-fory,quarkiverse/quarkus-fory,A blazingly fast multi-language serialization framework powered by JIT and zero-copy.,2024-10-31T12:13:56Z,2026-06-30T07:00:34Z,Java
spotlight-search,pesnik/spotlight-search,"A blazingly fast file and application launcher for Windows, inspired by macOS Spotlight. Built with Rust for performance and reliability.",2024-10-28T20:55:31Z,2026-07-01T03:54:21Z,TypeScript
stormint,Confucian-e/stormint,A blazing fast crate that supports multi-account minting of FreeMint tokens,2024-10-24T09:26:18Z,2026-06-30T16:12:52Z,Rust
zendriver,cdpdriver/zendriver,"A blazing fast, async-first, undetectable webscraping/web automation framework based on ultrafunkamsterdam/nodriver. Now with Docker support!",2024-10-19T22:12:23Z,2026-06-27T18:06:09Z,Python
Diver,qompassai/Diver,Diver: Your blazingly Fast Everything Editor,2024-10-11T08:19:59Z,2026-07-01T01:29:40Z,Lua
