name,full_name,description,created_at,pushed_at,language
gdwfm,darkyboys/gdwfm,"A Simple & Open Source , Blazing Fast Full Stack File Explorer For Serving Server Side Files Via SSR. (Written In C++ For Speed)",2025-11-15T06:18:51Z,2025-11-15T06:46:01Z,C++
OpenChat,ZerosAndOnesLLC/OpenChat,A Blazing Fast Full Featured Chat Platform Powered By Rust,2025-11-14T20:35:48Z,2025-12-02T00:17:46Z,Rust
portkeyai,youssefsiam38/portkeyai,Go SDK for the Portkey AI Gateway - A blazing fast AI Gateway for routing to 200+ LLMs with a unified API.,2025-11-14T15:15:00Z,2025-11-14T16:30:08Z,Go
Blazingly-Fast-Discord-Client,Williamjacobsen/Blazingly-Fast-Discord-Client,,2025-11-13T23:04:51Z,2025-11-23T16:33:56Z,Rust
recent-enabler,R-udren/recent-enabler,Blazing fast Rust written recent and prefetch windows enabler with Iced GUI,2025-11-13T20:57:20Z,2025-11-17T17:45:04Z,Rust
The-New-Era-Codex,javirub/The-New-Era-Codex,"Blazingly fast, multilingual, open-source AI docs platform built with Astro + Starlight. Practical guides for devs, automation, and business: agents, RAG, prompts, n8n, LLMs.",2025-11-13T09:37:04Z,2025-11-17T16:04:43Z,MDX
react-css-highlight,yairEO/react-css-highlight,"A powerful, zero-dependency React component for highlighting text using the modern CSS Custom Highlight API with TreeWalker for blazing-fast DOM traversal",2025-11-13T08:19:37Z,2025-11-21T10:26:03Z,TypeScript
C-manga-downloader,jonasek369/C-manga-downloader,Subprocess for lmdx written in C for blazingly fast downloading of manga,2025-11-12T17:21:47Z,2025-11-25T22:21:04Z,C
ComfyUI-RunpodDirect,MadiatorLabs/ComfyUI-RunpodDirect,Direct model downloads to your Runod pod with blazing-fast multi-connection support. No more downloading models to your local machine and re-uploading!,2025-11-12T14:58:59Z,2025-11-19T20:54:13Z,JavaScript
mockers,pokatomnik/mockers,"HTTP mocking server (blazingly fast, of course) written in Rust",2025-11-12T14:54:38Z,2025-12-01T20:00:29Z,Rust
astro-canvas,krishna-santosh/astro-canvas,"Beautiful & Blazingly Fast Portfolio Website built with Astro 5, Svelte 5, Tailwind 4",2025-11-12T08:39:26Z,2025-11-17T17:03:52Z,Astro
bbosrp,paxmix/bbosrp,"Big Book of Small Python Projects, with blazing fast Rust solutions",2025-11-11T16:51:58Z,2025-11-16T13:16:11Z,Rust
logi-mx,RAprogramm/logi-mx,Blazing fast Logitech MX series mouse driver and configuration tool for Linux,2025-11-11T08:47:02Z,2025-12-02T04:49:08Z,Rust
see,zeusdijkstra/see,"A blazingly fast, cross-platform markdown previewer written in Go.",2025-11-11T06:26:37Z,2025-11-16T22:08:22Z,Go
ardage,HariharPrasadd/ardage,Generate markdown datasets from arXiv papers using natural language queries - blazing fast.,2025-11-11T04:25:37Z,2025-11-25T19:32:31Z,Python
the-desk,SarthakD187/the-desk,"A visually stunning, blazing-fast personal dashboard for macOS",2025-11-11T03:21:50Z,2025-11-21T22:22:40Z,JavaScript
ssdocs,marshallku/ssdocs,"blazing-fast, memory-efficient static site generator for my blog",2025-11-10T23:57:18Z,2025-11-19T15:10:19Z,Rust
dotfiles-helper,cyprich/dotfiles-helper,Blazingly fast TUI app to help install dotfiles,2025-11-10T21:05:04Z,2025-11-15T11:54:56Z,Rust
NyaLoader,Jinsens/NyaLoader,Multithreaded downloader  experience blazing-fast download speeds. NyaLoader,2025-11-10T13:22:35Z,2025-11-26T17:55:15Z,Kotlin
secure-node-auth,HimasRafeek/secure-node-auth,"Blazing fast, zero-config MySQL authentication system with JWT. Set up secure auth in seconds!",2025-11-10T11:51:16Z,2025-11-20T13:16:09Z,JavaScript
audx-android,rizukirr/audx-android,Blazingly fast Android library for real-time audio denoising with built-in Voice Activity Detection (VAD) base on Recurrent Neural Networks,2025-11-09T11:57:22Z,2025-11-26T15:16:32Z,Kotlin
lanjet,HuRuilizhen/lanjet,A blazing fast LAN file sharing tool built with Rust,2025-11-08T18:14:21Z,2025-11-16T17:23:27Z,Rust
flin,skshohagmiah/flin,"FLIN : A blazing-fast, distributed data platform combining Key-Value Store, Message Queue, Stream Processing, and Document Database in a single unified system.",2025-11-08T16:14:26Z,2025-11-28T08:30:20Z,Go
redactpii-node,wrannaman/redactpii-node, Blazing-fast (<1ms) regex PII redaction for Node.js/TypeScript. The zero-dependency alternative to slow AI.  Connects to redactpii.com for SOC 2 & HIPAA audit logs.,2025-11-08T14:34:02Z,2025-11-30T14:17:08Z,TypeScript
rust-healthcheck,zleetch/rust-healthcheck,"A lightweight and blazingly fast health check application built in Rust, designed to monitor the status and uptime of your web services and APIs.",2025-11-08T14:22:16Z,2025-12-01T15:44:35Z,Rust
rusplay,Muxutruk2/rusplay,"Memory safe, blazing fast Rugplay library written in Rust",2025-11-08T11:06:16Z,2025-11-20T16:09:32Z,Rust
gofer,aburizalpurnama/gofer,"A blazingly fast, DDL-first scaffolder for REST APIs",2025-11-08T02:15:48Z,2025-11-25T11:29:26Z,Smarty
mddb,tradik/mddb,"MDDB is a lightweight, embedded database specifically designed for storing and managing markdown documents with rich metadata. Built with Go and BoltDB, it provides blazing-fast document operations with full revision history, making it perfect for content management systems, documentation platforms, and knowledge bases.",2025-11-06T23:06:58Z,2025-11-23T12:53:49Z,Go
ZipGraph,wesleyscholl/ZipGraph," Blazing-fast graph processing engine in Rust with ML-powered optimization. 50-200x faster than Python/JS. Self-tuning algorithms, real-time anomaly detection, and sub-10ms queries on million-node graphs. ",2025-11-05T20:57:21Z,2025-11-20T03:43:08Z,Rust
ferry,AriBhuiya/ferry,A client-server command line application to transfer files and folders over parallel TCP connection. Blazing fast.,2025-11-05T12:40:16Z,2025-11-18T08:11:15Z,Rust
Sachiel,auraluvsu/Sachiel,"Sachiel is a blazing fast, lightweight notepad with the ultimate minimalist vibes. glassy background, no clutter or noise. Built for creativity",2025-11-04T18:31:59Z,2025-11-22T11:50:45Z,TypeScript
kodegen,cyrup-ai/kodegen,"Ultimate MCP Auto-Coding Toolset  KODEGEN. delivers a blazing-fast Rust-native MCP Server (Model Context Protocol) with 75 elite auto-coding tools designed for professional, autonomous code generation and predictable high-quality results. Every tool has been thoughtfully hyper-optimized for speed and context efficiency.",2025-11-03T17:28:04Z,2025-12-02T04:38:52Z,Rust
taskplexus,ndk123-web/taskplexus,A blazing-fast todo application built with Go backend and React frontend. This project is my journey into learning Go for backend development while building a simple yet performant full-stack application,2025-11-03T10:43:05Z,2025-12-01T11:56:37Z,TypeScript
uuidify,ilkereroglu/uuidify,Blazing-fast public UUID generator API  built with Go and deployed globally via Cloudflare Workers.,2025-11-02T20:00:20Z,2025-11-19T22:40:18Z,TypeScript
NexusLab,Waiphyoaung24/NexusLab,"Nexus Lab Portfolio: A sleek, blazing-fast static portfolio site built with Next.js. Showcasing our creative projects and skills.",2025-11-02T11:54:33Z,2025-11-17T08:19:19Z,TypeScript
ninjatype,VivekGupta137/ninjatype,"A minimalist, blazingly fast typing practice application built with Astro and React.",2025-11-01T06:30:49Z,2025-11-28T21:00:10Z,TypeScript
primerpincer,mauricebarrett/primerpincer, Blazingly fast and accurate tool for trimming primers from FASTQ files derived from long-read sequencing (ONT & PacBio).,2025-10-31T16:12:24Z,2025-11-21T16:46:42Z,Rust
RustForge,Chregu12/RustForge,"Full-stack Rust framework with CLI code generation, interactive REPL,   database migrations, background jobs, and event system. Blazingly fast.",2025-10-31T09:53:34Z,2025-11-30T15:21:41Z,Rust
zio,Kingrashy12/zio,"A blazing-fast, cross-platform file system utility built in Zig  designed for efficiency, reliability, and simplicity.",2025-10-29T14:34:02Z,2025-12-01T10:43:39Z,Zig
deadsimple,benjamonnguyen/deadsimple,suite of dead simple packages to get apps up and running blazingly fast,2025-10-29T08:33:05Z,2025-12-02T06:43:04Z,Go
crustly,jyjeanne/crustly,"A blazingly fast, memory-efficient terminal-based AI coding assistant written in Rust",2025-10-29T01:36:15Z,2025-11-30T21:36:30Z,Rust
quantpolars,matthewgson/quantpolars,A blazingly fast package for quantitative finance analysis using Polars,2025-10-27T21:09:20Z,2025-11-18T19:24:44Z,Python
auroraview,loonghao/auroraview,"A blazingly fast, lightweight WebView framework for DCC (Digital Content Creation) software, built with Rust and Python bindings.",2025-10-27T10:35:19Z,2025-12-01T18:27:08Z,Rust
JetPascal,tinyBigGAMES/JetPascal,"JetPascal - Accelerate Your Code!  A next-generation Pascal-to-C++ transpiler that turns your Delphi/Pascal code into blazing-fast native executables. Built with a clean polymorphic architecture that emits modern C++ code, then compiles it using the Zig toolchain for cross-platform deployment.",2025-10-27T01:59:50Z,2025-11-18T20:24:56Z,Pascal
skies,kaeeraa/skies,"That one daemon for *** panel. REST, C++, and blazingly fast (without rust)",2025-10-26T12:52:40Z,2025-11-26T12:17:17Z,C++
ViolaORM,EliasMShallouf/ViolaORM,"A blazing-fast, type-safe micro-ORM for Java. It leverages compile-time code generation to eliminate reflection overhead, paired with a powerful Fluent API for expressive, object-oriented SQL queries. Write fast, clean database access today!",2025-10-26T00:47:26Z,2025-11-19T20:58:28Z,Java
optimus-desktop,Geetansh-Jangid/optimus-desktop,Convert a minimal archinstall into a blazingly fast and productive desktop,2025-10-25T14:39:22Z,2025-11-16T08:37:55Z,Shell
Rafka,Mahir101/Rafka,"Rafka is a blazing-fast, experimental distributed asynchronous message broker inspired by Apache Kafka. Built with Rust and leveraging Tokio's async runtime, it delivers exceptional performance through its peer-to-peer mesh architecture and custom in-memory database for unparalleled scalability and low-latency message processing.",2025-10-24T04:02:55Z,2025-11-26T09:00:02Z,Rust
quicksilver,KozmunkasKalman/quicksilver,"Blazingly fast (fast to write, fast to compile, and fast at runtime) compiled programming language ",2025-10-23T10:58:28Z,2025-11-15T10:48:09Z,C++
nest-fastify-prisma-boilerplate,sahilbabu/nest-fastify-prisma-boilerplate,"A High performance, production-ready boilerplate for blazing-fast, type-safe REST APIs  NestJS + Fastify driver, Prisma, PostgreSQL, TypeScript, Swagger, structured logs via Pino, linting/formatting (ESLint, Prettier, EditorConfig), Git quality gates (Husky, lint-staged, commitlint), Axios-ready, Docker & error handling, Yarn berry enabled",2025-10-23T06:50:25Z,2025-11-15T06:53:03Z,TypeScript
microvector,loganpowell/microvector,Small Embedding Model + local vector store (persists to `.pickle`s) for blazing fast vector workloads,2025-10-22T17:15:19Z,2025-11-24T21:46:02Z,Python
HI-Sorter,benediktpaulus/HI-Sorter," HI-Sorter: Blazing-fast photo triage, powered by your intelligence, not AI. 100% local, no cloud.",2025-10-20T17:21:12Z,2025-11-18T19:37:03Z,Python
warpc,Akzestia/warpc,"WARPC is a blazingly fast RPC framework written in c++, with main focus on microservices and native desktop/android apps.",2025-10-17T14:55:52Z,2025-11-25T09:44:08Z,
cyclet,philxws692/cyclet,The blazingly fast cyclic redundancy check calculator package for Typst,2025-10-16T05:11:19Z,2025-11-17T14:35:15Z,Typst
blazebpf,mercadoalex/blazebpf,"BLAZEBPF revolutionizes eBPF development by combining cutting-edge web technologies with hardware-level security isolation. Build, compile, and deploy eBPF programs through an intuitive web interface backed by blazing-fast Firecracker microVMs.",2025-10-15T23:55:47Z,2025-11-29T22:12:54Z,HTML
Flint,SuperTapood/Flint,A BLAZING FAST Cloud Development Kit with a chance of meatballs.,2025-10-14T08:40:17Z,2025-11-28T11:41:48Z,Go
blazingly-fast,arrno/blazingly-fast,blazingly.fast app,2025-10-13T19:03:02Z,2025-11-18T00:13:04Z,TypeScript
openapi-nodejs-sdk,openapi/openapi-nodejs-sdk, A fully-featured and blazing-fast Node.js API client to interact with Openapi,2025-10-13T17:57:01Z,2025-11-27T17:25:44Z,JavaScript
amazon-ML-school,raptor7197/amazon-ML-school,"Multimodal price prediction pipeline (Secured The Top 40 rank  in Amazon ML Challenge 2025). Uses text, images, and tabular features with a cross-modal transformer and retrieval regressor. and fully reproducible and is Blazingly Fast . ",2025-10-13T10:57:07Z,2025-12-02T00:48:37Z,Jupyter Notebook
image-optimizer,keif/image-optimizer,"Fast, modern image optimization service and CLI  built with Go + Next.js, powered by libvips for blazing-fast compression and format conversion.",2025-10-13T05:18:28Z,2025-11-20T07:46:58Z,TypeScript
Goseek,LuoZihYuan/Goseek,"High-performance product search API built with Go  lightweight, scalable, and blazing fast.",2025-10-13T00:51:37Z,2025-11-15T20:14:09Z,HCL
fastjsonl,firelink-sh/fastjsonl,"Blazingly fast jsonl parsing and validation, with Arrow output support.",2025-10-12T16:48:40Z,2025-12-01T04:00:47Z,Rust
portshit,camden-git/portshit,"PortShit is a blazing fast  and memory safe, opinionated network scanner",2025-10-11T21:38:16Z,2025-11-22T04:39:41Z,Rust
fdv.lol.bot,Alpa8820/fdv.lol.bot,BLAZING-FAST client-side SOL memecoin radar with explainable GOOD/WATCH/SHILL.,2025-10-11T03:17:23Z,2025-12-01T23:15:39Z,JavaScript
fdv.lol.bot,hayaseta/fdv.lol.bot,BLAZING-FAST client-side SOL memecoin radar with explainable GOOD/WATCH/SHILL.,2025-10-11T02:29:29Z,2025-12-02T04:50:33Z,JavaScript
fdv.lol.bot,codekami45/fdv.lol.bot,BLAZING-FAST client-side SOL memecoin radar with explainable GOOD/WATCH/SHILL.,2025-10-11T02:17:32Z,2025-12-01T23:18:17Z,JavaScript
imgrs,GrandpaEJ/imgrs,"Imgrs for Python. A blazingly fast, modern image processing library for Python. Powered by rust.",2025-10-07T04:50:15Z,2025-11-30T15:56:21Z,Rust
shadowdevforge,shadowdevforge/shadowdevforge,"I'm a developer passionate about forging tools that are challenging. My work is driven by a simple philosophy: performance, modularity, and minimalism they are the standard. I believe in building environments that are not just functional, but blazingly fast, aesthetically cohesive, and useful bloatfree..",2025-10-05T07:14:37Z,2025-11-25T19:59:11Z,
rust-rule-engine,KSD-CO/rust-rule-engine,"A blazing-fast Rust rule engine with RETE algorithm, backward chaining inference, and GRL (Grule Rule Language) syntax. Features: forward/backward chaining, pattern matching, unification, O(1) rule indexing, TMS, expression evaluation, method calls, and custom functions. Production-ready for business rules, expert systems, and decision automation.",2025-10-01T08:26:44Z,2025-12-02T06:05:37Z,Rust
kdownload,compiledkernel-idk/kdownload,Blazing fast download manager written in rust,2025-09-30T17:35:54Z,2025-11-26T18:55:32Z,Rust
rivaas,rivaas-dev/rivaas,"Foundation of Rivaas  config, logging, and routing made simple and blazing fast.",2025-09-28T10:49:29Z,2025-11-30T18:42:43Z,Go
linediff,OthmaneBlial/linediff,"Linediff is a blazing-fast, syntax-aware diff tool that understands your code structure. Using advanced tree-sitter parsers, it generates meaningful diffs that highlight actual changes rather than just line differences. Perfect for developers who want smarter, more insightful code comparisons.",2025-09-23T23:20:11Z,2025-11-15T11:27:21Z,Python
wasm-compiler,wasm-ecosystem/wasm-compiler,a lightweight and blazingly fast WebAssembly compiler and runtime library designed for use on resource-constrained embedded systems while seamlessly scaling to high-powered desktop and server systems,2025-09-23T02:31:03Z,2025-11-25T08:15:43Z,C++
touchhouse,xolra0d/touchhouse,Blazingly fast column oriented OLAP database,2025-09-13T20:47:18Z,2025-11-28T10:56:12Z,Rust
codegraph-rust,Jakedismo/codegraph-rust,100% Rust GraphRAG implementation with a MCP server for indexing large codebases with blazingly fast speed and querying the graph with natural language,2025-09-12T01:07:58Z,2025-12-01T18:40:29Z,Rust
cif-tools,Differentiable-Electron-Crystallography/cif-tools,The blazingly fast cif toolchain,2025-09-10T14:47:56Z,2025-12-01T20:02:07Z,Rust
prismis,nickpending/prismis,"A local-first content intelligence daemon that fetches RSS/Reddit/YouTube content, analyzes it with AI for priority scoring, and provides a blazing-fast   TUI for consumption, turning your information streams into structured, queryable intelligence.",2025-09-08T18:39:43Z,2025-11-20T19:47:34Z,Python
VaultMotors,Saber1Y/VaultMotors,"VaultMotors leverages **Sonic's blazing-fast 400,000 TPS** and **sub-second finality** to create the world's most efficient NFT-based car marketplace. Built for the Sonic S Tier Hackathon, this project showcases how Sonic's infrastructure can revolutionize high-value asset trading.",2025-09-07T19:01:32Z,2025-11-29T10:05:21Z,TypeScript
project-indexly,kimsgent/project-indexly,"Local File Search Tool with SQLite FTS5. Blazing-fast Search, Tagging and Export",2025-09-07T13:27:50Z,2025-12-01T19:23:43Z,Python
vibesort-rs,WarpWing/vibesort-rs,Blazingly fast vibesort implementation in Rust using Llama 4 Maverick on Cerebras Cloud.,2025-09-06T20:25:48Z,2025-11-24T16:24:09Z,Rust
Seeder,shivansh-pataku/Seeder,"A lightweight, responsive, and blazingly fast task and notes management application",2025-09-05T20:05:35Z,2025-11-24T18:49:25Z,JavaScript
httpors,Anon-404/httpors,Blazing fast HTTP/HTTPS probing tool in C with stdin/stdout pipeline support,2025-09-05T15:01:13Z,2025-11-18T06:31:39Z,C
rustlet,mjrgr/rustlet,"Rustlet is a lightweight, blazing-fast init container tool built in Rust. It helps Kubernetes pods prepare their runtime environment by running initialization tasks before the main containers start.",2025-09-03T08:03:18Z,2025-11-19T14:46:44Z,Rust
declair-rs,timasoft/declair-rs,"A TUI app to find and add packages to your NixOS config, written in blazingly fast Rust!  ",2025-09-01T13:46:30Z,2025-11-25T00:01:27Z,Rust
fdv.lol,builders-toronto/fdv.lol,BLAZING-FAST client-side SOL memecoin radar with explainable GOOD/WATCH/SHILL.,2025-08-31T15:02:12Z,2025-12-01T23:36:30Z,JavaScript
fast-file,ronakgh97/fast-file,A rust based (blazingly fast) terminal file manager,2025-08-30T07:06:18Z,2025-11-24T06:15:47Z,Rust
blazediff,teimurjan/blazediff,Blazing-fast diff ecosystem for JavaScript applications,2025-08-29T10:59:23Z,2025-11-22T15:01:21Z,TypeScript
wallpaper,TimeBean/wallpaper,blazing fast!,2025-08-29T07:43:55Z,2025-11-26T21:21:17Z,Rust
LitePhoton,SyNdicateFoundation/LitePhoton,"A blazing fast text file reader/scanner, made in Rust using rayon & memchr & twoway.",2025-08-28T15:36:59Z,2025-12-01T09:09:11Z,Rust
live-server-speed-edition,Lololegeek/live-server-speed-edition,"A blazing-fast local HTTP server with live reload  built right into VS Code.  Live Server Speed Edition is a lightweight, no-fuss extension that lets you spin up a local HTTP server instantly and reloads your page automatically whenever you make changes.",2025-08-28T12:13:35Z,2025-11-30T11:11:37Z,TypeScript
fluxmq,gosuda/fluxmq,"Lightweight, blazing-fast message queue in Rust",2025-08-27T00:33:04Z,2025-11-24T08:44:30Z,Rust
Bootstrap,TheRickyZhang/Bootstrap,From zero to blazing fast workflow.,2025-08-26T17:03:46Z,2025-11-28T08:14:46Z,Lua
Code-Vibe,kannanpathania11/Code-Vibe,"Code-Vibe Editor is a blazing-fast, AI-integrated web IDE built entirely in the browser using Next.js App Router, WebContainers, Monaco Editor, and local LLMs via Ollama. It offers real-time code execution, an AI-powered chat assistant, and support for multiple tech stacks  all wrapped in a stunning developer-first UI.",2025-08-26T11:28:55Z,2025-11-27T19:25:19Z,TypeScript
simple-memory-mcp,chrisribe/simple-memory-mcp," Blazingly fast persistent memory for AI assistants. Sub-millisecond SQLite storage with smart tagging, full-text search, and automatic relationships. MCP server + CLI.",2025-08-22T13:56:46Z,2025-12-01T15:01:32Z,TypeScript
gopie,factly/gopie,"GoPie is an open-source platform for natural-language data analysis. GoPie turns datasets into blazing-fast, AI-ready databases with auto-generated APIs. No technical expertise required.",2025-08-22T03:51:04Z,2025-12-02T08:22:37Z,TypeScript
pathfinder,andrearcaina/pathfinder,"blazingly fast, lightweight CLI to map & track your codebase",2025-08-15T18:43:38Z,2025-11-26T15:25:12Z,Go
iitkgp-erp-login-rs,metakgp/iitkgp-erp-login-rs,ERP login package in Rust cuz why not. It is also blazingly fast! ,2025-08-14T16:32:13Z,2025-11-17T05:32:46Z,Rust
lupabase,sonicjhon1/lupabase,"Blazingly fast (work-in-progress) database written entirely in Rust and focuses on simplicity, portability with flexible storage backends",2025-08-13T11:37:12Z,2025-11-29T10:08:11Z,Rust
wordperms,attilarepka/wordperms,blazing fast wordlist permutation generator,2025-08-08T18:04:55Z,2025-11-28T07:14:51Z,Rust
UniversalFastDownloader,ryanzhaorx/UniversalFastDownloader,"UFD  Python  curl UFD is a blazingly fast, multi-threaded file downloader written in Python. It supports parsing curl commands for seamless authentication and headers.",2025-08-07T10:22:51Z,2025-11-17T13:36:57Z,Python
asuna,star-inc/asuna,"A blazing-fast, progressive microservice framework.",2025-08-05T02:30:28Z,2025-12-01T08:41:44Z,TypeScript
personal-site-v2,jakewaldrip/personal-site-v2,"Revamped, blazingly fast personal site using the Rust backend framework Rocket",2025-08-03T16:53:17Z,2025-11-29T06:45:23Z,CSS
franken-php,yii2-extensions/franken-php,Supercharge your Yii2 applications with FrankenPHP blazing-fast HTTP server.,2025-08-03T16:39:17Z,2025-11-24T13:57:40Z,PHP
Neurofy,bikash138/Neurofy,"Neurofy is a blazing-fast, offline-capable, and AI-powered second brain that helps you capture, organize, and rediscover thoughts  seamlessly synced across all your devices in real time.",2025-08-03T10:56:38Z,2025-11-30T14:46:31Z,TypeScript
watchclean.tv,Ka10kenHQ/watchclean.tv,Ad free blazingly fast scraper of mykadri.tv for movies in english,2025-08-02T09:08:14Z,2025-11-24T08:21:21Z,Go
road-runner,yii2-extensions/road-runner,Supercharge your Yii2 applications with RoadRunner blazing-fast HTTP server.,2025-07-31T00:08:25Z,2025-11-24T13:29:15Z,PHP
fast-calender-manager,KyleKlus/fast-calender-manager,"This is a web app based tool for modifying my GCal faster, for blazingly fast week planning xD",2025-07-29T12:55:26Z,2025-11-26T15:13:12Z,TypeScript
runmat,runmat-org/runmat,"RunMat is a fast runtime designed to run math workloads. Run MATLAB/Octave code blazing fast with cross-platform GPU support across Mac, Windows, Linux, NVIDIA / CUDA, ARM and more",2025-07-28T01:44:13Z,2025-12-02T06:55:24Z,Rust
Fin-Safari-,AleoSurf/Fin-Safari-," FinSafari | AI-Powered Stock Signal Tracker  AI Intelligence for investment, featuring LLM-based stock signal analysis to interpret market trends. offer  Real-time Monitoring with live tracking of 25 popular stocks.  User experience is Lightning Fast, ensuring a blazing speed experience powered by Vite + React",2025-07-26T22:48:53Z,2025-11-28T13:19:50Z,TypeScript
onfire-dwm,NilloGabriel/onfire-dwm,"A blazing fast, minimal and highly customizable dwm fork with essential patches applied.",2025-07-26T21:40:02Z,2025-11-16T14:27:11Z,C
v2go,Danialsamadi/v2go,"v2go is a blazingly fast Go V2Ray config aggregator that processes 20,000+ configurations in 11 seconds (99.7% faster than Python), automatically removing duplicates and generating fresh subscription files every 6 hours.",2025-07-22T21:41:02Z,2025-12-02T08:18:35Z,Go
batless,docdyhr/batless,"Minimal, blazing-fast syntax viewer for the terminal  never blocks, never pages, never hangs. Perfect for code, logs, and AI pipelines.",2025-07-22T19:36:29Z,2025-11-24T10:23:13Z,Rust
stepwise,cjp2600/stepwise,"Universal API testing framework for HTTP, gRPC, GraphQL, and more. Declarative YAML workflows, reusable components, CI/CD ready, blazing fast",2025-07-21T07:21:19Z,2025-11-27T17:28:49Z,Go
Foundatio.Mediator,FoundatioFx/Foundatio.Mediator,"Blazingly fast, convention-based C# mediator powered by source generators and interceptors.",2025-07-20T03:05:02Z,2025-11-26T01:19:00Z,C#
waitx,ejsch03/waitx,Blazingly-fast signaling.,2025-07-19T22:48:42Z,2025-11-26T18:29:23Z,Rust
hyprviz,timasoft/hyprviz,"GUI for configuring Hyprland, written in blazingly fast Rust! ",2025-07-19T14:03:51Z,2025-12-01T17:27:56Z,Rust
Phobos,ibrahmsql/Phobos,"Mythically inspired, blazing-fast port scanner built in Rust. Fear the divine ports ",2025-07-17T17:14:12Z,2025-11-30T22:52:37Z,Rust
fast-md5-web,XueHua-s/fast-md5-web,"Leveraging WebAssembly (WASM) and shared buffers, this library offers blazing-fast MD5 hash calculations for large files directly in the browser.  Synchronous Mode: Up to 8x faster than Spark-MD5.  Multi-threaded Mode: Up to 16x faster in specific scenarios with a worker pool.",2025-07-17T08:34:30Z,2025-11-27T07:52:18Z,TypeScript
Lumenite,OusmBlueNinja/Lumenite,"Lumenite is a blazing-fast, embeddable web server powered by C++ and Lua.",2025-07-16T22:14:44Z,2025-11-16T04:57:21Z,C++
rustytime,ImShyMike/rustytime, blazingly fast time tracking for developers,2025-07-15T22:21:44Z,2025-12-02T06:06:14Z,Rust
parsecio,ejacobhayes/parsecio," A blazing-fast, self-updating dashboard for your GitHub stars  smartly categorized, beautifully designed, and fully static with zero dependencies.",2025-07-15T07:46:19Z,2025-12-02T04:52:57Z,JavaScript
astro-routify,oamm/astro-routify," A high-performance API router for Astro, powered by a Trie-based matcher. Define clean route handlers with full HTTP method support, dynamic params, and blazing-fast lookup  without nested src/pages/api/ clutter.",2025-07-14T05:33:38Z,2025-11-26T23:31:46Z,TypeScript
blipmq,bravo1goingdark/blipmq,"BlipMQ simplifies real-time communication between microservices and distributed systems with a lightweight, blazing-fast broker that just works  no complex setup, no compromises.",2025-07-13T06:21:11Z,2025-11-23T00:45:23Z,Rust
proto-migrate,jackchuka/proto-migrate,"Protocol Buffer migrations done right - AST-aware, safe, and blazing fast ",2025-07-11T14:37:57Z,2025-12-01T03:22:38Z,Go
