name,full_name,description,created_at,pushed_at,language
zls,zuedev/zls, A blazingly fast ls replacement written in Rust with parallel processing and colorized output,2025-09-21T09:50:48Z,2025-09-21T12:26:58Z,HTML
BookFlow,stuffed-cat/BookFlow,"High-performance, blazing-fast BookStack rewrite in TypeScript  Vue 3 + Fastify + Prisma + PostgreSQL. Built for speed, scale, and modern DX. ",2025-09-21T09:17:50Z,2025-09-24T15:00:49Z,TypeScript
lager,shreeve/lager,Blazing-fast lexer generator using DFA minimization in pure TypeScript,2025-09-21T03:58:33Z,2025-09-21T03:59:48Z,
gDNS,GhostKellz/gDNS,"gDNS is a blazing-fast, secure DNS Server",2025-09-20T17:34:56Z,2025-09-20T17:49:45Z,Rust
http-sites.google.com.67boysgirls.com-de-me-ye,kingslayer11247/http-sites.google.com.67boysgirls.com-de-me-ye,One of the most popular modern web proxies with blazing fast speeds and a variety of games.,2025-09-20T15:18:42Z,2025-09-20T15:18:42Z,
.github,Alacritty-Mac-Terminal/.github,"Alacritty Mac Terminal is a blazing-fast, GPU-accelerated terminal emulator designed for macOS. It offers minimal latency, high performance, and extensive customization for developers and power users seeking efficiency.",2025-09-20T11:25:12Z,2025-09-28T21:50:49Z,
clean-node-modules,wangmiaozero/clean-node-modules,Blazingly fast scanner to find and clean `node_modules` across your disks. `node_modules` ,2025-09-20T09:54:43Z,2025-09-20T10:03:55Z,JavaScript
Prescripto_-Hospital_Managment_system,MahboobRasheed/Prescripto_-Hospital_Managment_system,"Prescripto  Frontend Application This project is a modern frontend application built using Vite, React, and Tailwind CSS. It provides a fast development environment, optimized build system, and clean responsive UI.  Key Features:   Vite for blazing-fast dev server and hot-reload.   Tailwind CSS",2025-09-20T08:07:30Z,2025-09-20T08:16:37Z,JavaScript
basse,mcendu/basse,Blazingly fast Base64 encoder and decoder,2025-09-19T13:06:45Z,2025-09-22T15:33:54Z,C
pokesearch-v2,vitorqf/pokesearch-v2,"A blazing fast web Pokdex, build and refactored with Next.js",2025-09-19T12:55:16Z,2025-09-19T12:55:36Z,TypeScript
zap-store,ritesh-tiwary/zap-store," ZapStore  Blazing-fast Firestore APIs with FastAPI, made simple.",2025-09-19T08:44:44Z,2025-09-19T11:35:57Z,Python
fastrepr,Jenniferjava/fastrepr,Blazing fast repr and eval like string encoding/decoding for python/go!,2025-09-19T07:00:48Z,2025-09-23T10:30:06Z,HTML
blog-mdx-nextjs-shadcn,kittydev4444/blog-mdx-nextjs-shadcn,"  Next.js 15 blog with MDX support, shadcn/ui components,   Tailwind CSS v4, and Turbopack for blazing-fast development",2025-09-18T14:55:19Z,2025-09-20T07:37:11Z,TypeScript
Redis-Plus-AzureOpenAI,Pranesh-2005/Redis-Plus-AzureOpenAI,"A blazing fast chat client using Redis semantic cache and Azure OpenAI, featuring language-aware memory, beautiful UI, and PWA support. Includes a Python backend (Gradio, Redis, Azure OpenAI) and a modern frontend with username persistence, Markdown chat, and cache utilities.",2025-09-18T14:12:36Z,2025-09-18T14:20:10Z,Python
Keal-messaging-video-calls-platform,Abdulrauf-Yunis/Keal-messaging-video-calls-platform,A next-gen messaging platform that fuses blazing-fast chat with ultra-clear video calls.,2025-09-18T11:46:09Z,2025-10-07T10:24:04Z,TypeScript
anvil,amruth-sn/anvil,"blazingly fast, universal, modern template engine.",2025-09-18T03:49:14Z,2025-10-01T17:27:50Z,Rust
The-Remedy-Toolkit,Cairo-Creative-Studios/The-Remedy-Toolkit,"An extremely lightweight production ready gameplay toolkit that can be plugged into any project with no tech debt or performance overhead due to highly optimized, opt-in features. Sporting a Script graph that is extremely user friendly, stupid simple to interface with in code, and blazing fast.",2025-09-17T17:57:51Z,2025-09-24T01:17:47Z,C#
pagination-harvest,dimsp4/pagination-harvest,"A blazing fast, parallelized, and simple data harvester for paginated APIs. Highly flexible for any backend, frontend, or custom API architecture.",2025-09-17T12:46:05Z,2025-09-19T09:15:54Z,TypeScript
gum,devmdo/gum,"A blazingly fast, elegant, and dependency-free library for building command-line interfaces in Go.",2025-09-17T06:37:35Z,2025-09-19T06:48:00Z,Go
ReScale,floofywoofles/ReScale,A blazing fast image/video upscaler,2025-09-14T19:56:29Z,2025-09-24T16:48:05Z,TypeScript
touchhouse,xolra0d/touchhouse,Blazingly fast column oriented OLAP database,2025-09-13T20:47:18Z,2025-10-05T19:26:47Z,Rust
dirnav,corepanic64/dirnav,Fast and simple directory navigation in your terminal. Blazingly fast,2025-09-13T14:54:49Z,2025-09-24T13:47:57Z,Rust
shadowcraft,GhostKellz/shadowcraft,"A selfhosted, PureRust developer platform  repos, issues/MRs, GPUaware CI/CD, and blazingfast code search.",2025-09-12T18:24:18Z,2025-09-24T23:36:40Z,Rust
vielzeug,helmuthdu/vielzeug,"Type-safe utilities, blazing-fast storage, flexible logging, and more  all in one monorepo.",2025-09-12T05:20:24Z,2025-10-08T08:03:46Z,TypeScript
codegraph-rust,Jakedismo/codegraph-rust,100% Rust GraphRAG implementation with a MCP server for indexing large codebases with blazingly fast speed and querying the graph with natural language,2025-09-12T01:07:58Z,2025-10-06T06:40:20Z,Rust
rust-micrograd,vonhathanh/rust-micrograd,"A blazing fast, portable and modular toolkit for fuzzing lover",2025-09-11T01:34:22Z,2025-10-06T14:45:27Z,Rust
neisanDB,neisanworks/neisanDB,"Embedded JSON-first database for TypeScript with Zod validation, model classes, async-safe operations, and blazing-fast lookups.",2025-09-11T00:12:40Z,2025-10-04T22:42:29Z,TypeScript
marwajs,memran/marwajs,MarwaJS Blazing Fast Compiler and Runtime  AOT-compiled JavaScript framework and zero-runtime overhead.,2025-09-09T22:21:22Z,2025-10-07T14:28:16Z,TypeScript
prismis,nickpending/prismis,"A local-first content intelligence daemon that fetches RSS/Reddit/YouTube content, analyzes it with AI for priority scoring, and provides a blazing-fast   TUI for consumption, turning your information streams into structured, queryable intelligence.",2025-09-08T18:39:43Z,2025-10-07T19:28:45Z,Python
project-indexly,kimsgent/project-indexly,"Local File Search Tool with SQLite FTS5. Blazing-fast Search, Tagging and Export",2025-09-07T13:27:50Z,2025-10-08T07:34:46Z,Python
vibesort-rs,WarpWing/vibesort-rs,Blazingly fast vibesort implementation in Rust using Llama 4 Maverick on Cerebras Cloud.,2025-09-06T20:25:48Z,2025-10-01T15:58:19Z,Rust
zv,weezy20/zv,Blazing fast zig version manager & project init,2025-09-06T11:29:49Z,2025-10-08T07:12:14Z,Rust
KeyDot,Titoot/KeyDot,"Blazingly Fast, Static Godot Engine Encryption Key Extractor",2025-09-04T14:57:15Z,2025-09-27T03:10:53Z,C++
strata,Mehulparekh144/strata,Blazing fast distributed KV Store ,2025-09-03T19:43:14Z,2025-09-24T14:56:18Z,Go
leptos-next-metadata,cloud-shuttle/leptos-next-metadata,"Next.js-style metadata management for Leptos v0.8+ with type-safe APIs, blazing-fast OG image generation, competitive analysis framework, and AI-assisted development. Part of the Cloud Shuttle ecosystem.",2025-09-02T15:01:06Z,2025-09-26T23:48:22Z,Rust
playlist-sync,marcofpadeiro/playlist-sync,Project to sync Spotify playlists with a local library of music (blazingly fast),2025-09-01T16:23:06Z,2025-10-01T21:41:29Z,Rust
declair-rs,timasoft/declair-rs,"A TUI app to find and add packages to your NixOS config, written in blazingly fast Rust!  ",2025-09-01T13:46:30Z,2025-10-06T23:30:12Z,Rust
fdv.lol,builders-toronto/fdv.lol,BLAZING-FAST client-side SOL memecoin radar with explainable GOOD/WATCH/SHILL.,2025-08-31T15:02:12Z,2025-10-08T08:03:09Z,JavaScript
fulgurance,roquess/fulgurance,"A blazing-fast, adaptive prefetching and caching library for Rust",2025-08-31T05:30:38Z,2025-09-21T20:58:58Z,Rust
oai_cc,kutipense/oai_cc,"A blazing-fast, memory-unsafe, probably buggy, and incomplete C client for the OpenAI Chat Completions API",2025-08-30T23:57:23Z,2025-09-21T19:43:54Z,C
fast-file,ronakgh97/fast-file,A rust based (blazingly fast) terminal file manager,2025-08-30T07:06:18Z,2025-10-08T06:45:38Z,Rust
manx,neur0map/manx,"Blazing-fast CLI tool for developers to find documentation, code snippets, and answers instantly, online or offline with or without LLM and RAG integration.",2025-08-30T00:27:16Z,2025-10-01T06:19:54Z,Rust
blazediff,teimurjan/blazediff,Blazing-fast diff ecosystem for JavaScript applications,2025-08-29T10:59:23Z,2025-10-06T06:24:50Z,TypeScript
ignitia,AarambhDevHub/ignitia,"Ignitia is a blazing fast, lightweight Rust web framework featuring async runtime, HTTP/1 and HTTP/2 support, extensible routing, middleware, WebSocket integration, multipart/form-data parsing, and strong security middleware for building modern web services efficiently.",2025-08-29T05:24:15Z,2025-10-04T04:20:06Z,Rust
Fission,groundbreakingmc/Fission,"A high-performance, zero-dependency library designed for blazing-fast file reading and character stream processing. Fission outperforms standard Java I/O by 20-100x in parsing operations while providing a clean, exception-free API.",2025-08-29T00:31:15Z,2025-09-27T15:11:21Z,Java
LutinoDB,pochi0701/LutinoDB,"A blazing-fast, modern C++20 in-memory database engine with SQL-like featuresperfect for high-performance data management.",2025-08-28T08:05:40Z,2025-09-30T13:13:33Z,C++
myPersonalPortfolio,nylciii/myPersonalPortfolio,"A modern personal portfolio website built with React, Vite, and Tailwind CSS. This project showcases my skills, projects, and experience in a clean, responsive, and fast-loading design.   Features:   Blazing fast performance with Vite   Fully responsive UI styled with Tailwind CSS   Sections for About Me, Projects, Skills, and Contact",2025-08-27T21:32:35Z,2025-09-23T15:01:41Z,JavaScript
testsvm,macalinao/testsvm,"TestSVM is a blazing fast testing framework for Solana programs, written in Rust.",2025-08-27T00:42:38Z,2025-10-06T06:39:03Z,Rust
fluxmq,gosuda/fluxmq,"Lightweight, blazing-fast message queue in Rust",2025-08-27T00:33:04Z,2025-09-24T15:17:59Z,Rust
bpe-qwen,sweepai/bpe-qwen,A blazing-fast BPE tokenizer for Qwen models built with Rust,2025-08-26T22:42:55Z,2025-09-26T22:06:46Z,Python
Tsukiyonvim,Abhra00/Tsukiyonvim,BLAZINGLY FAST NEOVIM SHUTTHEFUCKUP,2025-08-26T21:16:11Z,2025-09-24T15:23:30Z,Lua
gamacros,mishamyrt/gamacros, Blazing fast macOS service that turns your gamepad into macropad,2025-08-26T17:31:43Z,2025-09-22T21:29:23Z,Rust
Bootstrap,TheRickyZhang/Bootstrap,From zero to blazing fast workflow.,2025-08-26T17:03:46Z,2025-10-08T02:12:28Z,Lua
jambi,guttermonk/jambi,a blazing-fast voice transcription application built with Rust,2025-08-26T02:04:47Z,2025-10-02T02:59:12Z,Rust
seb-ultra-stack,sebhosting/seb-ultra-stack," The Ultimate WordPress Multisite + WooCommerce Stack  Nginx, PHP8.4, Redis, MariaDB, Cloudflare SSL, UFW & Fail2Ban. Secure. Scalable. Blazing Fast! ",2025-08-23T13:00:30Z,2025-09-29T09:25:49Z,Shell
arboris,theintrance/arboris, A blazing-fast HTML parser built with SIMD acceleration for maximum performance.,2025-08-23T06:45:40Z,2025-09-28T05:18:11Z,Python
simple-memory-mcp,chrisribe/simple-memory-mcp," Blazingly fast persistent memory for AI assistants. Sub-millisecond SQLite storage with smart tagging, full-text search, and automatic relationships. MCP server + CLI.",2025-08-22T13:56:46Z,2025-10-07T14:45:50Z,TypeScript
gopie,factly/gopie,"GoPie is an open-source platform for natural-language data analysis. GoPie turns datasets into blazing-fast, AI-ready databases with auto-generated APIs. No technical expertise required.",2025-08-22T03:51:04Z,2025-10-03T21:25:38Z,TypeScript
fstree,trinhminhtriet/fstree,"A blazing-fast directory tree viewer for terminalsminimalist, interactive, and packed with smart features!",2025-08-21T14:30:19Z,2025-10-02T13:21:00Z,Rust
SamlaRAG,SAMLA-io/SamlaRAG,"Blazing fast, multipurpose RAG framework for AI applications ",2025-08-20T16:53:05Z,2025-09-30T03:58:25Z,Python
SocioGo,divy404/SocioGo,"A blazing-fast, scalable social backend framework engineered in Go.",2025-08-19T17:18:40Z,2025-10-01T17:44:14Z,Go
zoekt.nvim,jupblb/zoekt.nvim,Neovim plugin for blazing-fast code search using Zoekt ,2025-08-17T14:54:38Z,2025-09-22T17:52:35Z,Lua
pyrauli,zeFresk/pyrauli,Blazing fast Quantum circuit simulator using Pauli Propagation,2025-08-16T10:09:08Z,2025-09-20T17:50:57Z,Python
blaze,rit3sh-x/blaze,"A blazing-fast Go ORM with a C++17 core engine, built for ultra-efficient PostgreSQL queries and smart migrations.",2025-08-15T13:45:41Z,2025-10-02T11:27:37Z,Go
ds-go,verlyn13/ds-go,Dead Simple - A blazing fast Git repository manager written in Go,2025-08-15T06:50:04Z,2025-09-30T20:51:44Z,Go
lupabase,sonicjhon1/lupabase,Blazingly fast (work-in-progress) database engine written entirely in Rust,2025-08-13T11:37:12Z,2025-10-01T08:04:24Z,Rust
portfolio,achrafouajid/portfolio,"Lightweight & 2G-Friendly Portfolio Fast, even on 2G. This portfolio is engineered to deliver critical content under ~14kB so it can load in a single TCP slow start window, making it blazing fast even on slow mobile networks.",2025-08-11T22:43:06Z,2025-10-06T22:27:25Z,TypeScript
HR_Interview_tool_using_streamlit,AnilKumarSingh9856/HR_Interview_tool_using_streamlit,"An AI-powered interview coach built with Streamlit and the Groq API for blazing-fast responses. Practice for behavioral interviews by customizing your role, experience level, and question difficulty. Get instant, detailed feedback on your performance to sharpen your skills and land your dream job.",2025-08-11T10:45:52Z,2025-09-23T17:52:01Z,Python
bfphyto,adiantopsis/bfphyto,Get your phytosociological parameters and reports done blazing fast,2025-08-09T20:36:45Z,2025-10-03T15:08:21Z,R
crustacean-invoice,hopisaurus/crustacean-invoice,"A blazingly fast, API-based invoice generator built with Rust!",2025-08-08T20:44:47Z,2025-10-06T02:29:18Z,Rust
wordperms,attilarepka/wordperms,blazing fast wordlist permutation generator,2025-08-08T18:04:55Z,2025-09-23T08:17:51Z,Rust
blaze,livewire/blaze,Pre-compile Blade components for blazing fast rendering performance,2025-08-08T01:00:41Z,2025-10-07T16:45:09Z,PHP
AanvraagApp,marcus302/AanvraagApp,Write proposals for whatever blazingly fast,2025-08-05T14:56:48Z,2025-09-29T16:37:04Z,Python
softadastra_backend,softadastra-group/softadastra_backend,"High-performance C++ backend powering the entire Softadastra ecosystem  commerce, chat, payments, storage, and more. Modular, scalable, blazing fast.",2025-08-04T10:16:53Z,2025-09-26T13:00:15Z,C++
BlazeDB,Mikedan37/BlazeDB,"BlazeDB is a blazing-fast Swift database with dynamic schemas, secondary indexes, and a fluent query DSL for macOS & iOS apps.",2025-08-03T18:27:00Z,2025-10-04T20:49:14Z,Swift
franken-php,yii2-extensions/franken-php,Supercharge your Yii2 applications with FrankenPHP blazing-fast HTTP server.,2025-08-03T16:39:17Z,2025-10-08T08:34:27Z,PHP
lib_sudoku,shaggysa/lib_sudoku,A blazing fast sudoku library built in rust,2025-08-01T01:14:04Z,2025-09-25T02:33:14Z,Rust
frontend_fashionLanding,aunghein-dev/frontend_fashionLanding,"A blazing-fast e-commerce frontend built with React, Vite, TanStack Query, TailwindCSS, and TypeScript  optimized for production and seamless user experience.",2025-07-31T14:30:20Z,2025-10-08T02:28:05Z,TypeScript
tinyminiscript,unldenis/tinyminiscript,"no_std, blazing fast Miniscript library.",2025-07-30T16:57:43Z,2025-09-24T10:43:08Z,Rust
leadr,barneyjackson/leadr,"A blazingly fast, single-tenant leaderboard API built for indie game developers",2025-07-30T15:25:21Z,2025-09-22T11:24:57Z,Rust
jumpdrive,UBC-iGEM/jumpdrive,"A minimal,  blazingly fast HTTP server with websocket support",2025-07-28T07:06:41Z,2025-10-08T06:33:54Z,Rust
MNIST-HW-Accelerator,roshandubey13/MNIST-HW-Accelerator,"A hardware accelerator framework designed for blazing fast neural network inference, built specifically for MNIST digit classification but easily adaptable for other neural network tasks.",2025-07-25T11:51:09Z,2025-10-01T16:24:53Z,SystemVerilog
tostishop,ProgrammerNomad/tostishop,"A blazing-fast, fully responsive WooCommerce theme designed for mobile-first eCommerce experiences.",2025-07-25T06:31:18Z,2025-09-26T18:25:21Z,PHP
student-management-system-flutter-hive,seshathri044/student-management-system-flutter-hive,"Student Management System (Flutter + Hive DB) is a mobile/web application built with Flutter that allows users to manage students by class (10th, 11th, 12th) using Hive, a lightweight and blazing-fast local NoSQL database.  This project demonstrates a complete CRUD implementation with a beautiful and responsive UI. It is ideal for learning Flutter.",2025-07-24T10:02:23Z,2025-09-26T12:18:11Z,Dart
dev-blog,devayoub99/dev-blog,"A personal development blog to share insights and tutorials. Built using Next.js 15 for blazing-fast performance, TypeScript for type safety, and Tailwind CSS for modern, responsive UI design.",2025-07-24T05:11:12Z,2025-10-02T06:14:23Z,TypeScript
v2go,Danialsamadi/v2go,"v2go is a blazingly fast Go V2Ray config aggregator that processes 20,000+ configurations in 11 seconds (99.7% faster than Python), automatically removing duplicates and generating fresh subscription files every 6 hours.",2025-07-22T21:41:02Z,2025-10-08T08:41:24Z,Go
gilltter,gilltter/gilltter,Git alternative written in 100% Blazingly Fast Rust ,2025-07-22T16:24:21Z,2025-10-03T15:18:56Z,Rust
P.U.R.G.E,Md-Siam-Mia-Man/P.U.R.G.E,"A blazing-fast, cross-platform, and user-friendly GUI for debloating Android devices, built with the safety and performance of Rust. This tool provides a simple and effective way to remove unwanted bloatware from your phone, freeing up resources and improving privacy.",2025-07-21T17:36:38Z,2025-09-29T01:45:10Z,Rust
noml-rust,noml-lang/noml-rust,"Rust library for NOML (Nested Object Markup Language) - blazing-fast config parser with variable interpolation, imports, and schema validation.",2025-07-21T13:01:14Z,2025-09-29T13:48:55Z,Rust
rusty-req,KAY53N/rusty-req, High-performance async HTTP client in Rust with Python bindings for blazing-fast batch requests.   Python HTTP Rust ,2025-07-21T08:49:01Z,2025-09-26T05:59:30Z,Rust
ecommerce,amangulia4610/ecommerce,"Full-stack ecommerce platform leveraging React, Redux Toolkit, and Express.js REST APIreal-time state, JWT-secured auth, MongoDB Atlas, and Vercel serverless deployment. Features blazing-fast UI, dynamic catalog, admin dashboard, and Cloudinary media, built for seamless health & wellness shopping.",2025-07-20T17:55:07Z,2025-09-25T14:52:17Z,JavaScript
Foundatio.Mediator,FoundatioFx/Foundatio.Mediator,"Blazingly fast, convention-based C# mediator powered by source generators and interceptors.",2025-07-20T03:05:02Z,2025-09-27T05:47:37Z,C#
hyprviz,timasoft/hyprviz,"GUI for configuring Hyprland, written in blazingly fast Rust! ",2025-07-19T14:03:51Z,2025-10-07T11:52:30Z,Rust
zeke.nvim,GhostKellz/zeke.nvim,"A powerful Neovim plugin for the Zeke AI platform - your Claude Code alternative, built with Rust for blazing-fast performance.",2025-07-17T21:52:56Z,2025-09-22T22:18:12Z,Lua
anytype-notify,aragami3070/anytype-notify,"    . Blazingly fast,   memory effective)))",2025-07-17T17:42:37Z,2025-09-28T11:26:57Z,Rust
Phobos,ibrahmsql/Phobos,"Mythically inspired, blazing-fast port scanner built in Rust. Fear the divine ports ",2025-07-17T17:14:12Z,2025-10-04T23:52:48Z,Rust
fast-md5-web,XueHua-s/fast-md5-web,"Leveraging WebAssembly (WASM) and shared buffers, this library offers blazing-fast MD5 hash calculations for large files directly in the browser.  Synchronous Mode: Up to 8x faster than Spark-MD5.  Multi-threaded Mode: Up to 16x faster in specific scenarios with a worker pool.",2025-07-17T08:34:30Z,2025-09-29T16:51:43Z,TypeScript
vue3-jod,manokimbr/vue3-jod,A sleek Vue 3 frontend powered by Vite to interact with the blazing-fast native Node.js 22 backend node-jod.,2025-07-16T16:57:34Z,2025-10-01T00:26:09Z,JavaScript
typeengine,edmolima/typeengine,"typeengine is a blazing-fast, minimal, and extensible rich text core for building the editors of tomorrow.",2025-07-16T16:55:59Z,2025-10-06T07:25:28Z,TypeScript
rustytime,ImShyMike/rustytime, blazingly fast time tracking for developers,2025-07-15T22:21:44Z,2025-10-07T18:30:24Z,Rust
parsecio,ejacobhayes/parsecio," A blazing-fast, self-updating dashboard for your GitHub stars  smartly categorized, beautifully designed, and fully static with zero dependencies.",2025-07-15T07:46:19Z,2025-10-08T04:43:24Z,JavaScript
reaper,GhostKellz/reaper,"Reaper is a blazing-fast, Rust-powered AUR helper and meta package manager for Arch Linux",2025-07-13T23:37:47Z,2025-09-25T18:49:07Z,Rust
zsync,GhostKellz/zsync,"zsync is a blazing fast, lightweight, and modular async runtime for Zig.",2025-07-13T20:37:11Z,2025-09-20T16:27:32Z,Zig
blipmq,bravo1goingdark/blipmq,"BlipMQ simplifies real-time communication between microservices and distributed systems with a lightweight, blazing-fast broker that just works  no complex setup, no compromises.",2025-07-13T06:21:11Z,2025-10-03T08:28:02Z,Rust
lsync,kaysman/lsync,A blazing-fast CLI tool to sync translations from Google Sheets and generate `.arb` files for your Flutter project.,2025-07-12T17:48:12Z,2025-10-06T07:19:16Z,Rust
proto-migrate,jackchuka/proto-migrate,"Protocol Buffer migrations done right - AST-aware, safe, and blazing fast ",2025-07-11T14:37:57Z,2025-10-01T17:13:27Z,Go
infohawk,ShiboshreeRoy/infohawk,"A blazing-fast, full-stack web search engine built with Ruby on Rails, PostgreSQL, Tailwind CSS, and Vanta.js. Lightweight, elegant, and powerful  InfoHawk helps you crawl, index, and search websites effortlessly.",2025-07-10T11:21:12Z,2025-10-07T21:24:55Z,Ruby
KvDeveloper-Client,Novfensec/KvDeveloper-Client,"Instantly load your app on mobile via QR code or Server URL. Experience blazing-fast Kivy app previews on Android with KvDeveloper Client, Its the Expo Go for Python devshot reload without the hassle.",2025-07-08T12:57:34Z,2025-09-26T01:44:12Z,Python
Khurma-Crypto,KPNLZH/Khurma-Crypto,"Secure and blazing-fast AES-256 encryption library for Windows, powered by Rust.",2025-07-08T03:49:33Z,2025-09-29T14:37:28Z,
zmanger-rce,bakir004/zmanger-rce," Blazingly fast, minimal remote code execution tool written in Rust    :o",2025-07-06T19:12:27Z,2025-09-22T18:54:06Z,Rust
flutter-wipe,AmanSikarwar/flutter-wipe,"A blazingly fast, cross-platform CLI tool written in Rust to recursively find and flutter clean all your projects to reclaim disk space.",2025-07-01T20:35:53Z,2025-09-29T12:11:20Z,Rust
rtfm,alexeev-prog/rtfm,RTFM - blazingly fast util for searching manuals & docs,2025-07-01T19:53:30Z,2025-10-01T02:05:06Z,Rust
pgram,XyncNet/pgram,Blazingly fast start async telegram bot on top of the aiogram and tortoise-orm with postgres channels,2025-06-29T11:33:03Z,2025-10-07T10:17:13Z,Python
parcel-preact-ts-tailwindcss-template,schrojf/parcel-preact-ts-tailwindcss-template," Minimal Parcel + Preact + TypeScript + Tailwind CSS Starter Template  A modern, zero-config web development starter kit with blazing-fast builds and type safety. Perfect for building lightweight, performant web applications with the latest tools and best practices.",2025-06-28T12:06:15Z,2025-09-29T15:03:01Z,TypeScript
binius64,IrreducibleOSS/binius64,"Binary Proofs, Blazing Fast",2025-06-27T15:19:26Z,2025-10-06T14:29:31Z,Rust
mdnotes-cli,brianchli/mdnotes-cli,A blazingly fast cli markdown note taking tool.,2025-06-26T06:55:17Z,2025-10-06T05:33:05Z,Rust
wraith,GhostKellz/wraith,"a modern, blazing-fast, secure reverse proxy and static site server that fully embraces modern web protocols like QUIC and HTTP/3, while offering a radically improved dev and ops experience.",2025-06-24T21:59:45Z,2025-10-05T05:01:12Z,Zig
Ascent,Gabbar-v7/Ascent,"A blazing-fast Flutter mobile app for managing tasks, notes, and focus sessions with intuitive gestures and smooth performance.",2025-06-23T19:27:03Z,2025-09-19T18:49:42Z,Dart
pakistan-ai,ShayanAliProgrammer/pakistan-ai,"Pakistan AI is a blazing fast, modern chat application built with Next.js, TypeScript, Drizzle ORM, and TRPC. It features real-time chat, authentication, user profiles, and a sleek, responsive UI.",2025-06-23T10:50:56Z,2025-09-29T03:15:22Z,TypeScript
ClipChronicle-Cross-Platform-App,hoangsonww/ClipChronicle-Cross-Platform-App," An open-source, AI-powered multi-platform Electron clipboard manager with local-first storage, blazing-fast search, and productivity-boosting features. Includes a desktop app, Chrome extension, and interactive landing site - all fully customizable.",2025-06-23T01:57:44Z,2025-10-08T04:22:10Z,TypeScript
gtk-status-bar,sergioahp/gtk-status-bar," Modern, transparent status bar for Hyprland - blazingly fast GTK4 + Rust + async",2025-06-21T09:31:59Z,2025-10-01T20:44:04Z,Rust
arbos-foundry,iosiro/arbos-foundry,"Foundry is a blazing fast, portable and modular toolkit for Ethereum application development written in Rust.",2025-06-18T08:22:22Z,2025-10-06T12:35:14Z,Rust
zqlite,GhostKellz/zqlite,"zqlite is a blazing-fast, standalone, embedded SQL-compatible database built from scratch in Zig.",2025-06-16T23:26:37Z,2025-10-04T04:18:43Z,Zig
hps,hyperse-io/hps,HPS is a blazing fast frontend build tool based on Rspack that powers modern web applications with exceptional performance and developer experience.,2025-06-14T07:52:55Z,2025-10-08T08:40:36Z,TypeScript
affilify-bot,bnfone/affilify-bot,  Smart Amazon link tagging for your server  earn while you chat. Open source & blazing fast.,2025-06-13T15:23:27Z,2025-09-29T11:38:50Z,Rust
go-locate,Gosayram/go-locate,Blazing fast file and folder locator written in Go.,2025-06-13T11:59:59Z,2025-10-07T09:24:21Z,Makefile
homopolymer_rs,OscarAspelin95/homopolymer_rs,Blazingly fast homopolymer counter for fasta files.,2025-06-12T11:12:39Z,2025-09-18T21:38:54Z,Rust
zendns,GhostKellz/zendns,"A blazing fast, async, DNS-over-UDP/DoT/DoH resolver for Arch Linux workstations",2025-06-09T12:08:13Z,2025-09-20T17:47:02Z,Rust
