name,full_name,description,created_at,pushed_at,language
ultimate-jekyll,itw-creative-works/ultimate-jekyll,"A boilerplate with Jekyll, Webpack, and Node.js to kickstart the development of blazingly fast, feature-rich, & SEO-ready static sites.",2019-08-24T02:23:42Z,2025-01-18T04:26:29Z,HTML
pro-gallery,wix-incubator/pro-gallery,Blazing fast & beautiful galleries built for the web,2019-08-14T16:53:50Z,2025-01-15T07:19:54Z,JavaScript
carculator,Laboratory-for-Energy-Systems-Analysis/carculator,Prospective environmental and economic life cycle assessment of vehicles made blazing fast.,2019-06-07T11:42:08Z,2025-01-16T15:14:07Z,Python
MNN,alibaba/MNN,"MNN is a blazing fast, lightweight deep learning framework, battle-tested by business-critical use cases in Alibaba",2019-04-15T07:40:18Z,2025-01-13T01:29:43Z,C++
starship,starship/starship,"  The minimal, blazing-fast, and infinitely customizable prompt for any shell!",2019-04-02T03:23:12Z,2025-01-19T04:21:29Z,Rust
Levenshtein,rljacobson/Levenshtein,A Blazingly Fast DamerauLevenshtein Edit Distance Function (UDF) for MySQL,2019-02-04T20:33:48Z,2024-12-13T18:37:47Z,C++
earlvlee,earllee/earlvlee,My personal website and blog. Blazing fast thanks to Gatsby.js.,2018-12-24T23:10:58Z,2025-01-13T02:36:42Z,JavaScript
FastAsyncWorldEdit,IntellectualSites/FastAsyncWorldEdit,"Blazingly fast world manipulation for artists, builders and everyone else: https://www.spigotmc.org/resources/13932/",2018-12-20T17:22:31Z,2025-01-18T18:14:22Z,Java
devolutions-gateway,Devolutions/devolutions-gateway,A blazing fast relay server adaptable to different protocols and desired levels of traffic inspection.,2018-12-18T18:39:09Z,2025-01-17T16:45:42Z,Rust
vim-flog,rbong/vim-flog,"A blazingly fast, stunningly beautiful, exceptionally powerful git branch viewer for Vim/Neovim.",2018-11-27T03:17:13Z,2024-12-26T11:34:45Z,Vim Script
validator,ValkyrieStudios/validator,A lightweight blazingly-fast highly extendable and configurable javascript validator that supports both standard objects and FormData,2018-11-19T19:26:40Z,2024-12-21T12:22:12Z,TypeScript
picomatch,micromatch/picomatch,"Blazing fast and accurate glob matcher written JavaScript, with no dependencies and full support for standard and extended Bash glob features, including braces, extglobs, POSIX brackets, and regular expressions. Used by GraphQL, Jest, Astro, Snowpack, Storybook, bulma, Serverless, fdir, Netlify, AWS Amplify, Revogrid, rollup, routify, open-wc, imba, ava, docusaurus, fast-glob, globby, chokidar, anymatch, cloudflare/miniflare, pts, and more than 5 million projects! Please follow picomatch's autho",2018-11-05T12:06:49Z,2025-01-14T12:27:57Z,JavaScript
algoliasearch-client-kotlin,algolia/algoliasearch-client-kotlin, A fully-featured and blazing-fast Kotlin/Android API client to interact with Algolia.,2018-10-16T11:19:09Z,2025-01-16T22:17:30Z,Kotlin
doom-config,ztlevi/doom-config,Blazing fast Doom Emacs private configuration,2018-10-03T05:50:55Z,2025-01-16T00:19:07Z,Emacs Lisp
blaze,unidentifieddeveloper/blaze,A blazing fast exporter for your Elasticsearch data.,2018-09-26T23:12:37Z,2024-12-10T07:36:05Z,C++
iced,icedland/iced,"Blazing fast and correct x86/x64 disassembler, assembler, decoder, encoder for Rust, .NET, Java, Python, Lua",2018-09-07T19:30:25Z,2025-01-13T08:37:59Z,Rust
sonicjs,lane711/sonicjs,SonicJs Headless CMS - Blazing Fast Headless CMS built on Cloudflare Workers. 100% Javascript Based,2018-08-15T22:49:14Z,2025-01-13T16:51:34Z,TypeScript
graphql-engine-heroku,hasura/graphql-engine-heroku,"Blazing fast, instant realtime GraphQL APIs on Postgres with fine grained access control, also trigger webhooks on database events.",2018-06-21T01:52:56Z,2024-12-05T15:44:33Z,Dockerfile
graphql-engine,hasura/graphql-engine,"Blazing fast, instant realtime GraphQL APIs on all your data with fine grained access control, also trigger webhooks on database events.",2018-06-18T07:57:36Z,2025-01-17T12:16:27Z,TypeScript
charm,neoground/charm,"Experience Charm, a blazing-fast PHP 8 framework tailored for high-performance web apps & APIs. Unleash your business potential with this sleek, lightweight powerhouse. Level up your development!",2018-05-16T19:28:20Z,2025-01-15T21:30:31Z,PHP
pixelpwnr-server,timvisee/pixelpwnr-server,:fireworks: Blazingly fast GPU accelerated pixelflut server written in Rust.,2018-02-12T20:41:07Z,2024-12-28T01:09:05Z,Rust
ioutils,hungptit/ioutils,A blazing fast tiny file I/O library,2018-01-26T15:44:10Z,2025-01-07T15:58:54Z,C++
ESP-DASH,ayushsharma82/ESP-DASH,"Blazing fast library to create a functional, on-device dashboard for ESP8266 / ESP32 / RP2040",2017-11-10T14:09:51Z,2024-12-05T07:58:17Z,C++
fast-equals,planttheidea/fast-equals,"A blazing fast equality comparison, either shallow or deep",2017-10-15T13:07:00Z,2025-01-18T15:46:12Z,TypeScript
martin,maplibre/martin,"Blazing fast and lightweight PostGIS, MBtiles and PMtiles tile server, tile generation, and mbtiles tooling.",2017-09-30T10:53:46Z,2025-01-15T02:55:24Z,Rust
CoreProtect,PlayPro/CoreProtect,CoreProtect is a blazing fast data logging and anti-griefing tool for Minecraft servers.,2017-08-21T21:59:13Z,2024-12-09T23:37:30Z,Java
utils,ValkyrieStudios/utils,Zero-dependency collection of blazing fast single-function utilities for common tasks,2017-08-21T17:41:38Z,2024-12-21T11:32:17Z,TypeScript
lwc,salesforce/lwc," LWC - A Blazing Fast, Enterprise-Grade Web Components Foundation",2017-07-28T21:21:56Z,2025-01-17T20:18:26Z,JavaScript
odict,TheOpenDictionary/odict,"A blazingly-fast, offline-first format and toolchain for lexical data ",2017-07-03T04:47:38Z,2025-01-16T16:42:47Z,Rust
amber,amberframework/amber,"A Crystal web framework that makes building applications fast, simple, and enjoyable. Get started with quick prototyping, less bugs, and blazing fast performance.",2017-04-17T18:02:35Z,2024-12-13T13:21:29Z,Crystal
pablopunk.com,pablopunk/pablopunk.com,Blazing fast I guess,2017-03-08T03:46:27Z,2025-01-15T12:40:13Z,Astro
chibisafe,chibisafe/chibisafe,Blazing fast file vault written in TypeScript! ,2017-01-13T07:28:41Z,2025-01-18T06:12:16Z,TypeScript
nanomq,nanomq/nanomq,An ultra-lightweight and blazing-fast Messaging broker/bus for IoT edge & SDV,2016-11-13T06:18:34Z,2025-01-14T14:58:23Z,C
algoliasearch-client-java,algolia/algoliasearch-client-java, A fully-featured and blazing-fast Java API client to interact with Algolia.,2016-07-05T10:16:19Z,2025-01-16T22:17:26Z,Java
funzzy,cristianoliveira/funzzy,A lightweight blazingly fast file watcher.,2016-03-21T20:15:36Z,2024-12-16T23:26:55Z,Rust
zap,uber-go/zap,"Blazing fast, structured, leveled logging in Go.",2016-02-18T19:52:56Z,2025-01-13T13:28:48Z,Go
zimfw,zimfw/zimfw,"Zim: Modular, customizable, and blazing fast Zsh framework",2015-12-15T05:13:58Z,2025-01-16T15:03:41Z,HTML
quaternions,ferd36/quaternions,A blazingly fast C++ library to work with quaternions :zap:,2015-12-14T16:59:58Z,2024-12-10T16:26:18Z,C++
algoliasearch-client-scala,algolia/algoliasearch-client-scala, A fully-featured and blazing-fast Scala API client to interact with Algolia.,2015-11-16T14:57:49Z,2025-01-16T22:17:38Z,Scala
table-js,bpmn-io/table-js,A blazing fast library for viewing and editing tables,2015-06-09T07:39:00Z,2025-01-19T08:19:33Z,JavaScript
algoliasearch-client-swift,algolia/algoliasearch-client-swift, A fully-featured and blazing-fast Swift API client to interact with Algolia.,2015-02-11T07:30:57Z,2025-01-16T22:17:40Z,Swift
MagentoWorkflow,vovayatsyuk/MagentoWorkflow,Blazing fast Magento 2 development in SublimeText 3/4,2014-10-17T09:22:35Z,2024-12-04T11:39:33Z,Python
algoliasearch-client-go,algolia/algoliasearch-client-go, A fully-featured and blazing-fast Go API client to interact with Algolia.,2014-03-14T05:41:02Z,2025-01-16T22:17:24Z,Go
blaze,http4s/blaze,Blazing fast NIO microframework and Http Parser,2014-01-06T03:59:24Z,2025-01-17T03:28:36Z,Scala
algoliasearch-client-csharp,algolia/algoliasearch-client-csharp, A fully-featured and blazing-fast C# API client to interact with Algolia.,2013-07-10T14:52:10Z,2025-01-16T22:17:20Z,C#
algoliasearch-client-ruby,algolia/algoliasearch-client-ruby, A fully-featured and blazing-fast Ruby API client to interact with Algolia.,2013-05-24T20:07:36Z,2025-01-16T22:17:36Z,Ruby
algoliasearch-client-python,algolia/algoliasearch-client-python, A fully-featured and blazing-fast Python API client to interact with Algolia.,2013-05-22T13:57:40Z,2025-01-16T22:17:34Z,Python
algoliasearch-client-javascript,algolia/algoliasearch-client-javascript, A fully-featured and blazing-fast JavaScript API client to interact with Algolia.,2013-05-20T14:35:15Z,2025-01-16T22:17:28Z,TypeScript
algoliasearch-client-php,algolia/algoliasearch-client-php, A fully-featured and blazing-fast PHP API client to interact with Algolia.,2013-05-20T12:37:37Z,2025-01-16T22:17:32Z,PHP
Pico,picocms/Pico,"Pico is a stupidly simple, blazing fast, flat file CMS.",2012-04-04T13:46:20Z,2024-12-31T12:43:15Z,PHP
ws,websockets/ws,"Simple to use, blazing fast and thoroughly tested WebSocket client and server for Node.js",2011-11-09T22:32:45Z,2025-01-14T13:29:47Z,JavaScript
