name,full_name,description,created_at,pushed_at,language
app,helioschat/app,"Blazing-fast, private & open-source SvelteKit LLM chat app",2025-06-08T19:30:58Z,2025-10-07T23:50:08Z,TypeScript
CacheBolt,msalinas92/CacheBolt,A blazing-fast reverse proxy with intelligent caching and multi-backend object storage support,2025-06-07T01:22:57Z,2025-09-29T02:22:48Z,Rust
Ghoost_Shell_Gpt_4o_Helper_V1,PeterInufinDEV/Ghoost_Shell_Gpt_4o_Helper_V1," Ghoost Shell - GPT-4o Terminal Helper Ghoost Shell is a  blazing-fast, terminal-based AI assistant powered by GPT-4o. Designed for developers, hackers, and terminal lovers, it brings AI magic right into your shell  no GUI, no distractions.",2025-06-05T18:05:37Z,2025-09-21T10:54:23Z,Python
Ferrix,mehranTaslimi/Ferrix,"Fast, modern, cross-platform download manager built with Rust and Tauri  supports resumable downloads, clean UI, and blazing performance.",2025-06-05T13:14:28Z,2025-10-02T14:51:14Z,TypeScript
margen,klemek/margen,"Marble-like pattern generator, blazing fast",2025-06-03T15:31:02Z,2025-09-24T14:15:48Z,C
SpitFireCKGE,claudemods/SpitFireCKGE,Unofficial Custom Arch Distribution Inspired By Windows Built On Blazingly Fast CachyOS!,2025-05-31T13:34:55Z,2025-10-02T22:23:59Z,Shell
interview_helper,billyowo/interview_helper,Interview Helper (Written in Rust Blazing Fast) ,2025-05-28T22:25:12Z,2025-09-25T01:36:41Z,TypeScript
kdriver,cdpdriver/kdriver,"A blazing fast, coroutine-first, undetectable web scraping / browser automation CDP-based library for Kotlin",2025-05-26T23:32:38Z,2025-10-05T17:06:12Z,Kotlin
arenredd.github.io,ArenRedd/arenredd.github.io,"Built a blazing-fast, privacy-respecting blog using the Chirpy Jekyll theme, but on Kali Linux  because why not go full rogue? This repo is a live dev journal of breaking things, fixing them, and documenting every gritty detail. Think of it as a how-not-to followed by a how-to. ",2025-05-22T17:25:49Z,2025-09-29T01:24:01Z,HTML
zli,mahiremirhan/zli," A blazing fast Zig CLI framework. Build ergonomic, high-performance command-line tools with ease.",2025-05-17T04:54:46Z,2025-10-08T07:56:36Z,Zig
JBird,vsanthanam/JBird,"A blazing fast, type-safe library for working with JSON in Swift",2025-05-16T19:54:49Z,2025-10-07T23:18:19Z,Swift
modern_portfolio,ABISHEK086/modern_portfolio,"A modern and responsive web application built with React + Vite and styled using Tailwind CSS. Features a clean project structure, blazing-fast builds, and Hot Module Replacement (HMR) for smooth developer experience.",2025-05-15T04:12:35Z,2025-09-29T06:14:20Z,JavaScript
rlnc,itzmeanjan/rlnc,Blazing Fast Erasure-Coding with Random Linear Network Coding (RLNC),2025-05-14T11:27:12Z,2025-10-07T05:51:46Z,Rust
The-Pokedex-Database,YAVUZGIYIM/The-Pokedex-Database," An interactive Pokdex app built with Next.js, Tailwind CSS, and React Query for blazing-fast performance and smooth UX. Includes live search, item explorer, and a favorites system powered by local storage.",2025-05-11T00:57:31Z,2025-10-08T07:50:32Z,TypeScript
slideflare,MeatyAri/slideflare,"Blazing fast, interactive presentation tool for developers, educators, and creators to build and share beautiful slides effortlessly.",2025-05-10T12:35:09Z,2025-09-18T15:20:09Z,Rust
moonpress,blueheron786/moonpress,"MoonPress is a static website generator, inspired by the amazing WordPress.  No code, blazing fast, and secure: it generates pure HTML and JS. No user accounts to hack or databases to compromise.",2025-05-09T23:27:38Z,2025-09-29T00:01:28Z,C#
The-Pokedex-Database,hoangsonww/The-Pokedex-Database," An interactive Pokdex app built with Next.js, Tailwind CSS, and React Query for blazing-fast performance and smooth UX. Includes live search, item explorer, and a favorites system powered by browser storage.",2025-05-08T23:21:13Z,2025-10-07T02:49:54Z,TypeScript
kingfisher,mongodb/kingfisher,"Kingfisher is a blazingly fast and highly accurate tool for secret detection and live validation across files, Git repos, GitHub, GitLab, Azure DevOps, BitBucket, Gitea, AWS S3, Docker images, Jira, Slack, and Confluence",2025-05-08T17:27:15Z,2025-10-06T05:01:45Z,Rust
safebox,harrytmthy/safebox,A blazing-fast drop-in replacement for EncryptedSharedPreferences on Android,2025-05-08T15:17:18Z,2025-10-07T02:56:10Z,Kotlin
lucia-rust,SirPigari/lucia-rust,"Lucia, but written in Rust, so its BLAZINGLY FAST",2025-05-06T21:02:56Z,2025-10-06T19:28:27Z,Rust
saga-reader,sopaco/saga-reader," Blazing-Fast and Extremely-Lightweight Internet Reader driven by AI! Your AI-Powered think tank assistant.(Built with Rust, Tauri & Svelte)",2025-05-06T12:33:39Z,2025-10-05T13:01:55Z,Rust
hashgen,Jhmmax/hashgen,"hashgen - the blazingly fast hash generator argon, base58, base64, bcrypt, cyclone, generator, hash, hashcat, hashgen, md5, mdxfind, mosecode, multithreaded, ntlm, sha, sha1, sha256, sha3, threaded, yescrypt",2025-05-03T18:54:18Z,2025-10-08T07:46:41Z,Go
wallrust,prime-run/wallrust, A blazingly fast and feature-rich tool to auto theme and rice everything! based on wallpaper/image colors  | written in Rust,2025-04-28T15:34:13Z,2025-10-01T01:23:20Z,Rust
Next-js-Protfolio,Md-Sifat-code/Next-js-Protfolio," Next.js Portfolio A blazing-fast  and modern  portfolio built with Next.js  perfect for showcasing your work , skills , and projects  with style  and performance . Fully responsive , SEO-friendly , and easy to customize !",2025-04-28T02:52:54Z,2025-10-07T12:24:36Z,JavaScript
Xtracta,V1vaStick/Xtracta,"Xtracta  blazingfast web XPath tester for XML/HTML with live node highlighting, largefile streaming & React+Node.js stack.",2025-04-26T21:12:04Z,2025-10-08T07:43:23Z,TypeScript
LiveCodeCraft,Kros13/LiveCodeCraft,"A blazing-fast online HTML/CSS/JS code playground built from scratch. Write code, see instant preview, and craft beautiful web snippets in real-time. Like your personal mini CodePen, made with  by Ajoy.",2025-04-25T10:56:06Z,2025-10-08T07:41:46Z,JavaScript
DispatchR,hasanxdev/DispatchR,"Fast, zero-alloc alternative to MediatR for .NET  minimal, blazing fast, and DI-friendly.",2025-04-23T17:15:10Z,2025-10-06T10:36:45Z,C#
rust-mcp-filesystem,rust-mcp-stack/rust-mcp-filesystem,"Blazing-fast, asynchronous MCP server for seamless filesystem operations.",2025-04-18T21:11:57Z,2025-10-06T20:48:36Z,Rust
liischte,VirtCode/liischte,a blazingly fast wayland bar for my personal use,2025-04-16T19:59:03Z,2025-10-02T15:02:11Z,Rust
solana-chio,4rjunc/solana-chio,setup your pinocchio project blazingly fast ,2025-04-16T04:01:44Z,2025-09-21T17:41:14Z,Rust
sqlite-browser,el-yawd/sqlite-browser,Blazingly fast and feature rich SQLite browser,2025-04-16T00:13:02Z,2025-09-21T20:52:40Z,Rust
noiz,ElliottjPierce/noiz,"A simple, configurable, blazingly fast noise library built for and with Bevy.",2025-04-14T14:35:13Z,2025-10-07T17:16:00Z,Rust
esimport,codingjoe/esimport,Blazing fast ESM compiler and importmap generator,2025-04-13T14:28:07Z,2025-10-06T16:07:42Z,JavaScript
Aquascript,wecoded-dev/Aquascript,"Welcome to   your fast, simple, and developer-friendly platform  for generating blazing-fast fake JSON data APIs , perfect for seamless development, testing, andprototyping  ",2025-04-13T12:11:46Z,2025-09-18T14:31:11Z,HTML
Snapchat-Username-Checker,RAJGAMERZ001/Snapchat-Username-Checker,A Go-based Snapchat username checker using the app's private gRPC API  proxy support + blazing fast.,2025-04-11T16:59:27Z,2025-10-08T07:36:01Z,Go
THE-CUBE,cybruGhost/THE-CUBE,"A Movie Streaming web-site experience built for thrill-seekers, binge-watchers, and late-night explorers. Minimal design, powerful interface, blazing fast playback.",2025-04-10T17:27:10Z,2025-09-30T04:32:01Z,
homework,lizardbar/homework,3-in-1 brand-new bleeding-edge blazingly-fast state-of-the-art purely-AI-proompted solution,2025-04-10T09:46:36Z,2025-09-26T19:16:36Z,Ruby
TransferRust,JavadTorabiKh/TransferRust,A blazing-fast and secure API built with Rust to create and submit transactions on a blockchain network.,2025-04-06T14:42:31Z,2025-09-20T11:38:39Z,Rust
WordWeaver,milkdrinkers/WordWeaver,A blazingly fast java translation library with Adventure support for Java 8 and up.,2025-04-02T02:38:24Z,2025-10-02T04:07:31Z,Java
OpenChat,ajanraj/OpenChat,"Every AI model, one blazing fast workspace - see how they think, schedule what you need",2025-03-30T14:34:28Z,2025-09-22T01:32:16Z,TypeScript
plansync,ehabhosam/plansync,"Blazing fast planning full-stack web app built with a React client, a Nest API and a Go service.",2025-03-29T13:25:48Z,2025-09-26T15:09:18Z,TypeScript
RmbgSharp,ZygoteCode/RmbgSharp,Enterprise-unique blazing-fast & precise C# .NET 9.0 library for background removal in C# using ONNX Runtime with DirectML. FP32 and FP16 versions! Always open for PRs. ,2025-03-21T17:21:20Z,2025-10-04T10:19:48Z,C#
tgv,zeqianli/tgv,"Explore genomes in the terminal. Light, blazing fast , vim-motion.",2025-03-20T19:31:46Z,2025-09-28T18:11:26Z,Rust
ApexCKGE,claudemods/ApexCKGE,Unofficial Custom Arch Distribution Inspired By Windows Built On Blazingly Fast CachyOS!,2025-03-20T10:43:28Z,2025-10-02T20:12:19Z,C++
PasswordManager-Backend,commmrade/PasswordManager-Backend,"Backend for Password Manager, written in 100% (literally) blazingly fast Rust",2025-03-13T05:14:12Z,2025-09-29T03:41:21Z,Rust
TemprJs,bonheur15/TemprJs,"Temprjs is a modern, configurable, and blazing fast template engine implemented in JavaScript. ",2025-03-11T21:45:07Z,2025-09-26T13:00:47Z,TypeScript
WorldEdit-CSharp,RussDev7/WorldEdit-CSharp,"A lightweight, blazing fast, csharp interpretation of the classic world edit.",2025-03-06T21:51:11Z,2025-10-07T21:32:44Z,C#
uncomment,Goldziher/uncomment,Blazingly fast CLI to remove comments from code using tree-sitter grammers,2025-03-05T06:11:12Z,2025-09-29T10:36:04Z,Rust
csv_validation,charro/csv_validation,Blazing fast CSV schema validations,2025-03-04T22:52:24Z,2025-10-07T16:58:42Z,Rust
portfolio,sarthakkimtani/portfolio,"A blazing-fast, no-nonsense developer portfolio resume built with Astro",2025-03-04T12:02:26Z,2025-10-02T16:57:35Z,Astro
fujin,ValerySidorin/fujin, Blazingly fast universal broker connector,2025-02-28T18:34:14Z,2025-10-04T10:24:24Z,Go
BlyFast,OrientalLines/BlyFast,"A blazingly fast Java framework for REST APIs, inspired by GoFiber and Express.js.",2025-02-24T23:28:52Z,2025-09-28T20:59:52Z,Java
timbal,timbal-ai/timbal,"Timbal is an open-source python framework for building reliable AI applications, battle-tested in production with simple, transparent architecture that eliminates complexity while delivering blazing fast performance, robust typing, and API stability in an ever-changing ecosystem.",2025-02-21T09:42:42Z,2025-10-08T08:21:34Z,Python
JaxDEM,cdelv/JaxDEM,Easy to use and blazing fast JAX-based library for high-performance 2D/3D Discrete Element Method (DEM) simulations.,2025-02-19T15:46:49Z,2025-10-07T14:11:56Z,Python
lintspec,beeb/lintspec,A blazingly fast linter for NatSpec comments in Solidity code,2025-02-14T12:44:21Z,2025-10-08T07:36:46Z,Rust
rnet,0x676e67/rnet,A blazing-fast Python HTTP Client with TLS fingerprint,2025-02-10T10:37:00Z,2025-10-08T03:40:26Z,Rust
bundlemonkey,mkobayashime/bundlemonkey,Bundlemonkey is a userscript bundler designed to make developing browser userscripts blazing fast and efficient ,2025-02-02T18:25:36Z,2025-10-08T05:57:23Z,TypeScript
tempotask,mirairoad/tempotask,"A lightweight tasker library inspired by BullMQ and LARAVEL HORIZON,  leveraging redis-streams and unique consumers with a blazing fast integrated dashboard.",2025-02-01T01:05:27Z,2025-09-30T21:09:52Z,TypeScript
tadoku,Eroge-Abyss/tadoku,Blazingly fast Visual Novel tracker,2025-01-30T16:06:37Z,2025-09-25T23:02:25Z,Rust
FlashSpace,wojciech-kulik/FlashSpace,FlashSpace is a blazingly fast virtual workspace manager for macOS ,2025-01-19T21:25:42Z,2025-10-01T18:25:47Z,Swift
timefold,jarvispact/timefold,"A blazingly fast, ecs powered game engine for the web",2025-01-12T07:48:35Z,2025-10-08T07:22:44Z,TypeScript
justified-layout,immich-app/justified-layout,"A blazingly fast implementation of justified layout, a gallery view popularized by Flickr, written in rust and exported to WASM.",2025-01-10T02:11:48Z,2025-10-07T04:57:17Z,Rust
orpheus,ajac-zero/orpheus,"A blazing fast OpenAI-compatible client for Python, written in Rust.",2025-01-05T05:53:11Z,2025-09-18T16:57:10Z,Rust
oxidasim,AndrejOrsula/oxidasim,Blazing fast utilities for simulations,2025-01-01T16:36:20Z,2025-10-06T06:18:31Z,Rust
Go-Fiber-CRUD-API,ArtiomStartev/Go-Fiber-CRUD-API,"Build a blazing-fast To-Do API using Golang, Fiber , and PostgreSQL ! Perfect for learning and implementing CRUD operations with a clean and scalable structure. ",2024-12-27T15:44:12Z,2025-09-28T14:35:46Z,Go
v4.20,cesswhite/v4.20,"Minimal, blazing fast, and designed with developers in mind, v4.20 is your go-to starting point for modern web projects with Nuxt",2024-12-21T23:10:05Z,2025-09-28T17:19:09Z,Vue
Astra,ArkForgeLabs/Astra, Blazingly Fast  web server runtime for Lua,2024-12-21T08:17:31Z,2025-10-04T19:56:37Z,Lua
wp-swift-pwa,Zilero232/wp-swift-pwa," Transform your WordPress site into a blazing-fast PWA! With just a few clicks, turn your website into an app-like experience that works offline, sends push notifications, and installs on any device. It's like giving your website superpowers! ",2024-12-12T20:03:49Z,2025-10-04T12:54:45Z,Vue
rrelayer,joshstevens19/rrelayer,A opensource blazing fast EVM relayer - built in rust.,2024-12-08T18:55:32Z,2025-10-07T17:48:35Z,Rust
blazefl,blazefl/blazefl,"A blazing-fast, minimalist, and researcher-friendly simulation framework for Federated Learning",2024-12-06T04:05:56Z,2025-10-06T12:14:25Z,Python
polars-bio,biodatageeks/polars-bio,Blazing-Fast Bioinformatic Operations on Python DataFrames,2024-11-26T16:58:18Z,2025-10-05T17:29:26Z,Python
zondexplorer,DigitalGuards/zondexplorer,"Quantum Resistant Ledger Proof-of-Stake explorer. It is blazing fast with a modern frontend using NextJS and Golang for the backend, stable and compatible with the Zond QRL network. ",2024-11-21T09:17:33Z,2025-10-01T17:42:28Z,JavaScript
katsini,arisecode/katsini," A blazing-fast, lightweight, and user-friendly tool built with Go for retrieving app information from major app stores.",2024-11-20T00:09:00Z,2025-10-08T04:04:30Z,Go
BFTML,npetrangelo/BFTML,Blazingly Fast Text Markup Language. Standards designed for web apps. Browser implementation in Rust.,2024-11-19T05:43:01Z,2025-09-28T05:57:31Z,Rust
Kataglyphis-Inference-Engine,Kataglyphis/Kataglyphis-Inference-Engine,Deploy your AI easily on Linux/Windows/iOS/Android/Web with blazingly fast inference times and native UI. ,2024-11-16T14:21:19Z,2025-10-07T20:38:01Z,Dart
epub2audiobook,haydonryan/epub2audiobook,Blazingly fast EPUB to Audiobook converter,2024-11-15T19:04:04Z,2025-10-06T14:34:30Z,Rust
sockudo,RustNSparks/sockudo,Blazingly fast pusher drop-in replacement written in rust,2024-11-09T22:01:43Z,2025-10-04T21:01:10Z,Rust
deep-prove,Lagrange-Labs/deep-prove,Framework to prove inference of ML models blazingly fast,2024-11-07T21:46:12Z,2025-10-01T12:26:26Z,Rust
skeletor,theGeekist/skeletor,A blazing-fast Rust scaffolding tool for structured project generation and snapshots.,2024-11-03T14:56:03Z,2025-09-30T02:19:11Z,Rust
quarkus-fory,quarkiverse/quarkus-fory,A blazingly fast multi-language serialization framework powered by JIT and zero-copy.,2024-10-31T12:13:56Z,2025-10-02T12:15:09Z,Java
PugiSwift,elihwyma/PugiSwift,Blazing fast XML Parser in Swift for all platforms,2024-10-29T14:13:50Z,2025-09-20T15:08:33Z,C++
trailbase,trailbaseio/trailbase,"A blazingly fast, open-source application server with type-safe APIs, built-in WebAssembly runtime, realtime, auth, and admin UI built on Rust, SQLite & Wasmtime.",2024-10-29T09:39:33Z,2025-10-07T20:41:44Z,Rust
WebLibrary,commmrade/WebLibrary,100% pure blazingly fast C++ library,2024-10-27T18:01:08Z,2025-10-08T05:56:01Z,C++
wazemmes,darkweak/wazemmes,"Wasm HTTP middleware, agnostic, efficient and blazing fast.",2024-10-26T20:22:56Z,2025-09-27T09:46:53Z,Go
stormint,Confucian-e/stormint,A blazing fast crate that supports multi-account minting of FreeMint tokens,2024-10-24T09:26:18Z,2025-10-07T04:39:13Z,Rust
dotfiles,sergei-durkin/dotfiles, Blazing fast dotfiles for a modern terminal workflow.,2024-10-20T20:05:54Z,2025-09-26T23:16:41Z,Lua
StartSCH,kir-dev/StartSCH, Blazingly fast news aggregator site for the Schnherz Dormitory,2024-10-11T12:32:24Z,2025-10-07T22:44:35Z,C#
Diver,qompassai/Diver,Diver: Your blazingly Fast Everything Editor,2024-10-11T08:19:59Z,2025-09-20T23:39:46Z,Lua
finmlkit,quantscious/finmlkit,"An open-source, lightweight, and blazing-fast financial machine learning library built with Numba. Process raw trades, generate advanced bars, features, and labels for quantitative research.",2024-10-04T08:53:59Z,2025-09-23T15:10:12Z,Python
Bolt,SynthesisLab/Bolt,Blazingly fast synthesis of LTL formulas!,2024-10-02T08:56:38Z,2025-10-02T13:09:25Z,Rust
fasttlogparser,Bogdanov-am/fasttlogparser,fasttlogparser - Blazing-Fast MAVLink .tlog Parser,2024-09-28T10:46:13Z,2025-10-07T17:02:32Z,C++
travbros-frontend-react,hashirsajid58200p/travbros-frontend-react,"TravBros is a frontend-only travel and tourism web application. It demonstrates modern React-based development with Vite for blazing fast builds. The site includes clean design, reusable components, and responsiveness across devices.",2024-09-10T19:24:24Z,2025-09-22T12:45:34Z,HTML
Frontend,viraxpress/Frontend,Energize your E-commerce with ViraXpress's blazing fast Magento New Front End + Elegant Theme + >95% SEO score + Open Source,2024-08-29T06:24:11Z,2025-10-06T07:36:28Z,HTML
owc-fantasy-rs,Quintec/owc-fantasy-rs,now blazingly fast,2024-08-16T19:40:45Z,2025-09-28T08:49:23Z,Rust
catboost-cgo,mirecl/catboost-cgo,"CatBoost a fast, scalable, high performance Gradient Boosting on Decision Trees library. Golang using Cgo for blazing fast inference CatBoost Model ",2024-08-13T15:53:52Z,2025-10-03T11:14:15Z,C
in-memory-azure-test-sdk,spotflow-io/in-memory-azure-test-sdk,"Drop-in fakes of Azure .NET SDKs to make your tests runnable locally, without real infrastructure, blazing-fast and reliable.",2024-08-09T13:40:48Z,2025-09-22T10:00:59Z,C#
overleash,Iandenh/overleash,Override your Unleash feature flags blazing fast,2024-08-06T21:36:52Z,2025-10-07T17:12:08Z,Go
FERS_core,Jeroen124/FERS_core,"Blazingly fast solver for FEM beam calculations, written in Rust",2024-07-30T04:03:36Z,2025-10-07T06:22:49Z,Python
CodeWhisper,gmickel/CodeWhisper,CodeWhisper: AI-Powered End-to-End Task Implementation & blazingly fast Codebase-to-LLM Context Bridge,2024-07-18T23:48:59Z,2025-10-01T04:08:23Z,TypeScript
hyprpaper,OpenMandrivaAssociation/hyprpaper,Blazing fast wayland wallpaper utility with IPC controls,2024-07-06T13:27:56Z,2025-10-05T06:13:48Z,
blazed.js,BlazeInferno64/blazed.js,"Blazing fast, light weight, high performance, promise based HTTP and DNS client for the Node",2024-07-03T13:24:41Z,2025-10-06T02:20:14Z,JavaScript
foxi-astro-theme,oxygenna-themes/foxi-astro-theme,"Foxi is an Astro theme crafted with Tailwind CSS, designed for blazing-fast performance and seamless user experience. Perfect for creating modern, responsive SaaS websites with minimal effort.",2024-07-01T13:17:06Z,2025-10-03T09:42:30Z,Astro
rbuilder,flashbots/rbuilder,"rbuilder is a blazingly fast, state of the art Ethereum MEV-Boost block builder written in Rust",2024-07-01T07:26:00Z,2025-10-08T07:57:19Z,Rust
Utils,ValeriiKoniushenko/Utils,"Blazing fast C++ primitives for everyday coding - strings, colors, positions, delegates, and morefeaturing the insanely fast StringAtom",2024-06-23T19:52:04Z,2025-10-07T18:24:07Z,C++
lotgen,TedKaczynskisCousin/lotgen,"Generates funny numbers blazingly fast. Based on the principle that gambler's fallacy is actually true, but the government doesn't want you to know this",2024-06-19T22:53:13Z,2025-10-07T13:44:43Z,Rust
seismic-foundry,SeismicSystems/seismic-foundry,"Seismic Foundry is a fork of Foundry: a blazing fast, portable and modular toolkit for Ethereum application development written in Rust",2024-06-18T15:38:56Z,2025-09-30T18:10:10Z,Rust
vk-gltf-viewer,stripe2933/vk-gltf-viewer,Blazingly fast Vulkan glTF Viewer,2024-06-05T16:11:33Z,2025-10-08T07:12:32Z,C++
splice,Voidheart88/splice,Splice - A blazingly fast Spice simulator,2024-05-28T11:27:10Z,2025-09-30T12:59:02Z,Rust
lmutils.r,GMELab/lmutils.r,Tools for blazingly fast statistical analysis in R,2024-05-24T21:34:28Z,2025-10-07T16:20:39Z,Rust
KMLightSpigotFree,radek203/KMLightSpigotFree,Minecraft blazing fast 1.8-1.12.2 limbo server,2024-05-11T10:52:51Z,2025-09-30T15:54:07Z,Java
eigen-db,Eigen-DB/eigen-db,The blazingly fast in-memory vector database ,2024-05-07T20:38:55Z,2025-09-27T02:18:34Z,Go
CileExplorer,OmarSiwy/CileExplorer,Blazingly Fast File Explorer using OpenCL,2024-04-30T21:34:16Z,2025-10-06T17:53:02Z,C++
stwo-cairo,starkware-libs/stwo-cairo,"Prove Cairo programs with the blazing-fast S-two prover, powered by the cryptographic breakthrough of Circle STARKs.",2024-04-24T13:23:25Z,2025-10-08T06:26:57Z,Rust
llm_with_fastRAG,allenwsh82/llm_with_fastRAG,"This project implements a blazing-fast RAG pipeline using LLMs and optimized retrievers. Its built for low-latency, high-throughput inferenceideal for production-grade document Q&A and enterprise demos.",2024-04-05T00:35:45Z,2025-09-29T12:22:02Z,Python
anti-spam-matrix,mokurin000/anti-spam-matrix,A anti-spam Matrix Bot that runs blazingly fast ,2024-03-31T01:40:07Z,2025-09-30T03:46:33Z,Rust
cacheus,ogxd/cacheus,Blazingly fast and ultra-efficient multi-protocol read-through caching proxy.,2024-03-06T09:58:10Z,2025-09-21T22:50:22Z,Rust
talosctx,bdronneau/talosctx,Blazing fast switcher for your talos contexts,2024-03-05T15:57:24Z,2025-10-04T08:44:58Z,Go
days-since-blazingly-fast,ninpnin/days-since-blazingly-fast,,2024-02-28T22:05:33Z,2025-10-07T08:42:22Z,Python
bevy_serde_lens,mintlu8/bevy_serde_lens,"Blazingly fast, schema based human-readable serialization crate for the bevy engine.",2024-02-28T20:20:33Z,2025-10-02T14:42:34Z,Rust
mistral.rs,EricLBuehler/mistral.rs,Blazingly fast LLM inference.,2024-02-26T22:30:06Z,2025-10-06T02:00:12Z,Rust
nvim,drewgrif/nvim," My custom Neovim config  blazing fast, Lua-based, with treesitter, telescope, markdown and  custom themes. Built by JustAGuy Linux.",2024-02-22T22:34:34Z,2025-10-02T19:19:34Z,Lua
bump2version,wiseaidev/bump2version," A blazingly fast, thread safe, git client agnostic, CLI for managing version numbers in your projects.",2024-02-19T12:29:15Z,2025-09-29T02:47:10Z,Rust
flamework-binary-serializer,Fireboltofdeath/flamework-binary-serializer,"A blazing fast binary serializer, or something",2024-02-18T21:01:28Z,2025-10-05T04:01:26Z,TypeScript
cve-rs,Speykious/cve-rs,"Blazingly  fast  memory vulnerabilities, written in 100% safe Rust. ",2024-02-16T00:34:34Z,2025-09-26T13:47:56Z,Rust
magicblock-validator,magicblock-labs/magicblock-validator,Blazing-Fast SVM Ephemeral Validator,2024-02-15T19:16:13Z,2025-10-08T08:29:46Z,Rust
witch-line,sontungexpt/witch-line,A blazing fast statusline for neovim based on reference concept ,2024-02-14T04:59:14Z,2025-10-08T08:36:33Z,Lua
complexipy,rohaquinlop/complexipy,"Blazingly fast cognitive complexity analysis for Python, written in Rust.",2024-01-21T07:11:09Z,2025-09-21T18:26:54Z,Python
hypertext,vidhanio/hypertext,A blazing fast type-checked HTML macro crate.,2024-01-12T03:34:30Z,2025-09-30T06:09:55Z,Rust
turbo-cache-server,brunojppb/turbo-cache-server,Blazingly fast Turborepo remote cache server written in Rust as a Github Action and Docker container,2023-12-31T21:48:21Z,2025-09-24T16:29:39Z,Rust
rindexer,joshstevens19/rindexer,A no-code or framework to build blazing fast EVM indexers - built in rust.,2023-12-26T23:24:26Z,2025-10-06T16:03:54Z,Rust
NpgsqlRest,NpgsqlRest/NpgsqlRest,"Transform Your PostgreSQL Database into a Production-Ready, Blazing-Fast Standalone REST API Web Server With Static Type Checking and Automatic Code Generation",2023-12-15T10:14:38Z,2025-10-06T12:56:01Z,C#
whisper,SectorLabs/whisper,"Whisper is a small, lightweight and blazingly fast CLI tool that can recursively gather parameters stored in the AWS Systems Manager (SSM) Parameter Store under a specific path.",2023-12-14T17:32:32Z,2025-10-03T06:26:47Z,Go
lqth,0x61nas/lqth, Simple but blazingly fast screenshot utility,2023-12-11T21:50:20Z,2025-09-29T18:35:02Z,Rust
echo-vault,coalaura/echo-vault,A blazing fast minimal ShareX backend written in golang.,2023-11-27T17:31:36Z,2025-10-04T23:37:25Z,Go
nrr,ryanccn/nrr,"Minimal, blazing fast npm scripts runner",2023-11-17T12:00:42Z,2025-10-06T11:55:47Z,Rust
SimpleW,stratdev3/SimpleW,SimpleW is Web server Library in .NET Core. Powerfully Simple and Blazingly Fast.,2023-11-05T12:58:38Z,2025-10-08T00:19:14Z,C#
picomatch-lua,Roblox/picomatch-lua,Blazing fast and accurate glob matcher written in Luau. This is a read-only mirror.,2023-10-23T21:53:18Z,2025-09-24T07:04:54Z,Lua
text-embeddings-inference,huggingface/text-embeddings-inference,A blazing fast inference solution for text embeddings models,2023-10-13T13:36:51Z,2025-09-25T17:04:18Z,Rust
FlyPhotos,riyasy/FlyPhotos,A blazing fast ultra-light photo viewer replacement for Windows. Works similar to Picasa Photo Viewer.,2023-10-12T09:54:03Z,2025-10-07T17:02:09Z,C#
server,ZilaWS/server,ZilaWS is a blazingly fast and very lightweight library that provides an extremely easy-to-use way to transmit data via websockets between clientside and serverside using eventhandlers and async waiters. ,2023-10-04T13:57:11Z,2025-10-04T13:47:22Z,TypeScript
smear,al8n/smear,"WIP: Blazing fast, fully spec-compliant, reusable parser combinators for standard GraphQL and GraphQL-like DSLs.",2023-09-07T05:51:11Z,2025-10-08T06:23:46Z,Rust
beff,lucasavila00/beff,Efficient validators from Typescript types generated by a blazing fast compiler,2023-08-28T02:32:08Z,2025-10-03T00:29:52Z,Rust
