name,full_name,description,created_at,pushed_at,language
nathan.rs,nathan-barry/nathan.rs,My personal site using Hugo for static site generation. Blazingly Fast.,2023-08-27T00:03:29Z,2025-09-29T13:35:45Z,HTML
gateway,Portkey-AI/gateway,"A blazing fast AI Gateway with integrated guardrails. Route to 200+ LLMs, 50+ AI Guardrails with 1 fast & friendly API.",2023-08-23T11:52:47Z,2025-10-07T14:06:00Z,TypeScript
velocy,ishtms/velocy,"A blazing fast, minimal backend framework for Node.js with 0 depenencies!",2023-08-22T04:25:35Z,2025-10-04T08:00:44Z,JavaScript
br,phenpessoa/br,"A blazingly fast  go library to validate and generate Brazilian documents such as CNPJ, CPF, CNH, CNS etc",2023-08-16T18:16:04Z,2025-10-03T22:15:36Z,Go
CoDriver,RickyDane/CoDriver,Blazingly fast file explorer.,2023-08-13T10:40:59Z,2025-09-25T11:57:24Z,JavaScript
client,ZilaWS/client,ZilaWS is a blazingly fast and very lightweight library that provides an extremely easy-to-use way to transmit data via websockets between clientside and serverside using eventhandlers and async waiters.,2023-08-01T15:08:42Z,2025-10-04T14:00:33Z,TypeScript
lla,chaqchase/lla,blazing fast `ls` replacement with superpowers,2023-07-31T13:51:59Z,2025-09-18T23:39:52Z,Rust
IceNvim,Shaobin-Jiang/IceNvim,"A beautiful, powerful and customizable neovim config that is blazing fast",2023-07-30T08:22:55Z,2025-10-04T05:55:35Z,Lua
bang,wajeht/bang,your personal command center for blazingly fast web navigation,2023-07-08T22:00:32Z,2025-10-07T12:08:06Z,TypeScript
yazi,sxyazi/yazi," Blazing fast terminal file manager written in Rust, based on async I/O.",2023-07-08T11:45:55Z,2025-10-06T16:02:32Z,Rust
starknet-foundry,foundry-rs/starknet-foundry,Blazing fast toolkit for developing Starknet contracts.,2023-07-05T22:27:04Z,2025-10-07T14:46:14Z,Rust
songstitch-ios,SongStitch/songstitch-ios,A blazingly fast iOS app for generating LastFM collages.,2023-06-10T02:10:33Z,2025-10-02T01:01:16Z,Swift
hictk,paulsengroup/hictk,Blazing fast toolkit to work with .hic and .cool files,2023-06-07T20:27:51Z,2025-10-07T15:12:00Z,C++
song-stitch,SongStitch/song-stitch,A blazingly fast web app for generating LastFM collages.,2023-05-20T21:07:46Z,2025-09-30T23:09:11Z,Go
algoliasearch-client-dart,algolia/algoliasearch-client-dart, A fully-featured and blazing-fast Dart/Flutter API client to interact with Algolia,2023-05-15T15:43:35Z,2025-10-07T10:23:38Z,Dart
pyromark,monosans/pyromark,Blazingly fast Markdown parser for Python written in Rust.,2023-05-07T12:54:53Z,2025-10-08T01:52:25Z,Python
txlogger,roffe/txlogger,"Blazing fast data logging for Trionic 5, 7 & 8 ",2023-05-06T10:12:06Z,2025-10-07T22:19:00Z,Go
lnkr,dasph/lnkr,"Blazingly fast, minimalistic link shortener.",2023-05-01T19:34:51Z,2025-10-04T16:00:08Z,TypeScript
fory,apache/fory,A blazingly fast multi-language serialization framework powered by JIT and zero-copy.,2023-04-28T03:57:00Z,2025-10-08T02:49:59Z,Java
Select20,4security/Select20,The todo app Select20 leverages language recognition to manage tasks more efficiently. The distraction-free and blazing fast app supports offline usage and compatibility to CalDav.,2023-04-23T07:06:19Z,2025-10-05T07:16:31Z,PHP
solar,paradigmxyz/solar,"Blazingly fast, modular and contributor friendly Solidity compiler, written in Rust",2023-04-21T18:39:28Z,2025-10-07T16:47:39Z,Rust
shurtle-ts,danihengeveld/shurtle-ts,"The open source, blazingly fast URL shortener.",2023-04-13T21:45:42Z,2025-10-06T11:53:37Z,TypeScript
indentmini.nvim,nvimdev/indentmini.nvim,A minimal and blazing fast indentline plugin,2023-04-13T09:54:52Z,2025-10-07T10:41:34Z,Lua
ohcrab,luizvbo/ohcrab, ohcrab helps you fix mistyped terminal commands with smart shell integration and blazing-fast performance.,2023-03-29T17:20:48Z,2025-10-06T13:58:36Z,Rust
demofile-net,saul/demofile-net,"Blazing fast cross-platform demo parser library for Counter-Strike 2 and Valve's Deadlock, written in C#.",2023-03-25T09:22:25Z,2025-09-22T18:28:32Z,C#
sqlgen,si3nloong/sqlgen,"SQL code generator, no extra runtime cost! It's blazingly fast!!! ",2023-03-22T01:52:26Z,2025-10-06T17:55:43Z,Go
setup-duckdb-action,opt-nc/setup-duckdb-action, Blazing Fast and highly customizable Github Action to setup a DuckDb runtime,2023-03-14T04:24:53Z,2025-10-08T08:05:55Z,JavaScript
h3o,extendr/h3o,Blazing fast Uber H3 gridding in R,2023-03-09T15:20:15Z,2025-09-25T19:11:50Z,Rust
react-native-pdf-renderer,douglasjunior/react-native-pdf-renderer," A zoomable, blazing fast, zero dependencies, pure native, typed PDF Renderer for Android and iOS.",2023-03-09T11:19:24Z,2025-10-04T01:06:14Z,Java
year-progress,mbacalan/year-progress,Years are passing blazingly fast,2023-03-03T21:28:04Z,2025-10-08T01:26:36Z,Rust
cloudtrail-cli,guessi/cloudtrail-cli,Blazing fast single purpose cli for CloudTrail log filtering,2023-02-23T17:55:28Z,2025-10-08T02:49:42Z,Go
wafrs,SphericalKat/wafrs,A blazingly fast pastebin/URL shortener built on cloudflare workers,2023-02-16T09:50:21Z,2025-10-08T06:29:25Z,HTML
blazingly-fast,shakhzodkudratov/blazingly-fast,my approach in getting blazingly fast,2023-02-05T00:18:07Z,2025-09-30T05:52:51Z,Lua
fivem-ts-boilerplate,natan-fernandes/fivem-ts-boilerplate,TypeScript boilerplate for FiveM with all of your resources source code at the same place! It also includes helpful utilities such as emitNetPromise and prisma ORM. Blazing fast builds with ESBuild!  ,2023-01-08T12:56:22Z,2025-09-23T01:58:14Z,TypeScript
Interstellar,UseInterstellar/Interstellar,One of the most popular modern web proxies with blazing fast speeds and a variety of games.,2023-01-05T21:57:19Z,2025-10-07T05:42:40Z,JavaScript
editor-configs,ImperialOps/editor-configs,Blazingly fast config,2023-01-03T20:09:19Z,2025-09-28T19:06:23Z,Lua
iter,sabiwara/iter,A blazing fast compile-time optimized alternative to the `Enum` and `Stream` modules,2022-12-25T07:26:10Z,2025-10-03T12:27:46Z,Elixir
hashgen,cyclone-github/hashgen,hashgen - the blazingly fast hash generator,2022-12-16T02:27:27Z,2025-09-21T04:21:06Z,Go
OptiGUI,opekope2/OptiGUI,Blazing fast custom GUI textures on Fabric and Quilt with built-in OptiFine custom GUI resource pack support,2022-12-15T21:34:41Z,2025-10-06T09:22:10Z,Kotlin
StreamTracker,ZorpEngur/StreamTracker,Get notified blazingly fast when your favorite streamer goes live.,2022-12-07T17:21:45Z,2025-09-21T20:28:20Z,Java
ruby-polars,ankane/ruby-polars,Blazingly fast DataFrames for Ruby,2022-11-22T05:59:48Z,2025-09-19T09:15:59Z,Ruby
chhoto-url,SinTan1729/chhoto-url,"A simple, blazingly fast, selfhosted URL shortener with no unnecessary features; written in Rust.",2022-11-21T01:37:06Z,2025-10-08T05:40:50Z,Rust
milosz08,milosz08/milosz08,"My own blazing fast and concurrency Java SSG engine, powered with markdown and HBS templates.",2022-11-13T04:34:22Z,2025-10-02T06:38:48Z,Java
es-git,toss/es-git,"A modern Git library built for Node.js with blazing-fast installation and rock-solid stability, powered by N-API.",2022-11-10T15:14:35Z,2025-09-27T09:47:57Z,Rust
reth,paradigmxyz/reth,"Modular, contributor-friendly and blazing-fast implementation of the Ethereum protocol, in Rust",2022-09-15T23:05:57Z,2025-10-08T08:09:21Z,Rust
dockerfuse,dguerri/dockerfuse,"Interact with filesystem in deployed Docker containers, via FUSE. Blazing fast :)",2022-08-05T13:08:06Z,2025-09-25T05:16:22Z,Go
rsonpath,rsonquery/rsonpath,Blazing fast JSONPath query engine written in Rust.,2022-07-09T13:28:54Z,2025-10-07T20:17:20Z,Rust
rgit,w4/rgit, blazingly fast web frontend for git repositories,2022-07-06T00:09:01Z,2025-10-01T19:04:44Z,Rust
nvim,veyxov/nvim,Blazingly fast neovim configuration,2022-07-03T11:36:38Z,2025-09-30T11:28:30Z,Lua
lsp-bridge,manateelazycat/lsp-bridge,A blazingly fast LSP client for Emacs,2022-05-03T00:08:34Z,2025-10-01T01:26:42Z,Emacs Lisp
BlockChanger,AbdulmohsenALB/BlockChanger,1.7 - 1.21.9 util that allows you to change blocks at blazing fast speeds,2022-04-19T18:00:55Z,2025-10-07T07:44:52Z,Java
SupaComments,mcnaveen/SupaComments," A blazing fast, lightweight, and open source comment system for your static website, blogs powered by Supabase",2022-04-09T17:18:07Z,2025-09-25T15:51:58Z,JavaScript
graphql-gateway,ViljarVoidula/graphql-gateway," A blazing-fast, polyglot microservices ecosystem with unified GraphQL gateway and enterprise-grade database migrations",2022-02-06T08:14:25Z,2025-10-01T17:43:24Z,TypeScript
rules_oci,DataDog/rules_oci,blazing fast Bazel rules for building OCI Images,2022-01-10T20:50:39Z,2025-09-25T18:24:36Z,Go
node-trashkek,meetmonday/node-trashkek,blazing fast () hooeta ,2022-01-06T20:08:18Z,2025-10-07T20:21:39Z,JavaScript
nvim,wochap/nvim,Blazingly fast nvim config inspired by NvChad and LazyVim,2021-12-12T22:07:58Z,2025-10-06T19:39:08Z,Lua
shapeshift,sapphiredev/shapeshift,Blazing fast input validation and transformation ,2021-12-10T15:21:09Z,2025-10-05T01:30:08Z,TypeScript
Passivhaus,wszczawinski/Passivhaus,This project leverages Gatsby with TypeScript and Sass to create a blazing-fast website with WordPress as headless CMS and automated deployment through GitHub Actions CI/CD.,2021-10-16T17:03:26Z,2025-09-30T20:29:44Z,TypeScript
foundry,foundry-rs/foundry,"Foundry is a blazing fast, portable and modular toolkit for Ethereum application development written in Rust.",2021-09-08T11:23:11Z,2025-10-08T08:37:48Z,Rust
placeholder-api,tharunoptimus/placeholder-api,Generate Placeholder images blazing fast. ,2021-08-15T15:57:43Z,2025-09-26T15:10:50Z,JavaScript
rosetta,wout/rosetta,A blazing fast internationalization (i18n) library for Crystal with compile-time key lookup.,2021-08-09T16:47:26Z,2025-10-01T11:45:33Z,Crystal
nvim,Allaman/nvim,"Minimal, blazingly fast, and pure Lua based Neovim configuration for my work as DevOps/Cloud Engineer with batteries included for Python, Golang, Terraform, and, of course, YAML",2021-08-07T11:45:29Z,2025-09-20T10:06:10Z,Lua
imbl,jneem/imbl,Blazing fast immutable collection datatypes for Rust.,2021-08-06T16:40:40Z,2025-10-07T20:33:52Z,Rust
resume,ekalkutin/resume,"A blazing-fast, 100% PageSpeed optimized portfolio website with server-side rendering. This project showcases modern web development techniques focused on performance and clean architecture.",2021-07-17T12:51:04Z,2025-10-07T16:57:45Z,TypeScript
otterscan,otterscan/otterscan,"A blazingly fast, local, Ethereum block explorer built on top of Erigon",2021-07-01T18:22:12Z,2025-10-06T16:08:45Z,TypeScript
dupers,bengarrett/dupers,Dupers is the blazing-fast file duplicate checker and filename search tool.,2021-06-10T00:17:47Z,2025-10-05T10:07:30Z,Go
ethereum-wallet-generator,Planxnx/ethereum-wallet-generator,Blazing fast multiple Ethereum and Crypto vanity wallet generator Generate a ten thousand beautiful crypto wallets in a sec  Awesome ethereum vanity address generator,2021-05-29T18:46:09Z,2025-10-02T06:50:00Z,Go
sonic,bytedance/sonic,A blazingly fast JSON serializing & deserializing library,2021-05-25T03:52:51Z,2025-09-29T01:35:51Z,Go
transcribe-anything,zackees/transcribe-anything,Multi-backend whisper app. Blazing fast. Mac-arm optimized. Easy install. Input a local file or url and this service will transcribe it using Whisper AI. Completely private and Free ,2021-05-09T00:41:07Z,2025-10-07T02:44:51Z,Python
okaeri-placeholders,OkaeriPoland/okaeri-placeholders,Simple blazing-fast placeholders library with yet unlimited capabilities,2021-04-06T19:49:04Z,2025-10-02T17:29:08Z,Java
advent-of-code,MeanderingProgrammer/advent-of-code,Advent of Code - All Years - Blazingly Fast,2021-03-24T23:38:18Z,2025-10-06T19:34:06Z,Rust
NvChad,NvChad/NvChad,"Blazing fast Neovim framework providing solid defaults and a beautiful UI, enhancing your neovim experience.",2021-03-07T14:33:17Z,2025-09-20T00:57:51Z,Lua
word-cloud,knowledgepicker/word-cloud,Fast word cloud library for .NET. Uses Quadtrees for blazing-fast performance. Maintained by the KnowledgePicker team.,2021-02-26T10:11:45Z,2025-10-02T10:28:04Z,C#
Fastback.jl,rbeeli/Fastback.jl,Blazing fast Julia backtester.,2021-02-25T01:12:34Z,2025-10-04T02:07:22Z,Julia
qsv,dathere/qsv,Blazing-fast Data-Wrangling toolkit,2020-12-11T04:08:39Z,2025-10-08T06:04:03Z,Rust
t-rec-rs,sassman/t-rec-rs,Blazingly fast terminal recorder that generates animated gif images for the web written in rust,2020-10-08T23:16:40Z,2025-09-29T04:19:36Z,Rust
vc-frontend,VirtoCommerce/vc-frontend,Virto Commerce Frontend - B2B SPA is a fresh look on the field of eCommerce solutions. This is a place where common B2B and B2C scenarios are combined with the most bleeding edge technologies to deliver blazing fast and fully functional solution. It implements common business use-cases needed for a vast majority of projects we build.,2020-09-17T13:32:49Z,2025-10-08T08:26:52Z,TypeScript
bld,Kani-Maki-Gang/bld,A simple and BLAZINGLY fast CI/CD in the making,2020-08-31T19:59:00Z,2025-09-21T15:55:02Z,Rust
fuel-specs,FuelLabs/fuel-specs," Specifications for the Fuel protocol and the FuelVM, a blazingly fast blockchain VM.",2020-08-27T21:08:42Z,2025-09-26T13:42:54Z,
kompute,KomputeProject/kompute,"General purpose GPU compute framework built on Vulkan to support 1000s of cross vendor graphics cards (AMD, Qualcomm, NVIDIA & friends). Blazing fast, mobile-enabled, asynchronous and optimized for advanced GPU data processing usecases. Backed by the Linux Foundation.",2020-07-29T05:23:33Z,2025-10-05T19:18:07Z,C++
issue-status,tadhglewis/issue-status,"A flexible, modern and blazingly fast  status page",2020-06-08T03:41:22Z,2025-10-06T23:05:03Z,TypeScript
gitui,gitui-org/gitui,Blazing  fast terminal-ui for git written in rust ,2020-03-16T14:38:01Z,2025-10-03T02:05:25Z,Rust
sort-es,cosimochellini/sort-es,"Blazing fast, tree-shakeable, type-safe, modern utility library to sort any type of array",2020-02-16T14:58:28Z,2025-09-20T15:20:31Z,TypeScript
file.d,ozontech/file.d,"A blazing fast tool for building data pipelines: read, process and output events. Our community: https://t.me/file_d_community",2020-02-14T10:59:20Z,2025-10-07T20:28:18Z,Go
FastEMRIWaveforms,BlackHolePerturbationToolkit/FastEMRIWaveforms,Blazingly fast EMRI waveforms,2019-11-22T21:09:08Z,2025-09-20T06:45:48Z,Python
aws-neuron-sdk,aws-neuron/aws-neuron-sdk,"Powering AWS purpose-built machine learning chips. Blazing fast and cost effective, natively integrated into PyTorch and TensorFlow and integrated with your favorite AWS services",2019-11-06T02:12:59Z,2025-09-26T22:35:55Z,Python
nitrobase,Alwatr/nitrobase,"Nitrobase is a blazingly fast, lightweight database built on JSON. It stores data entirely in memory for lightning-quick access, while also providing a JSON file backup for persistence. You can easily serve your data over the web using our high-performance accelerated Nginx server.",2019-09-01T14:29:07Z,2025-10-02T00:07:12Z,TypeScript
MNN,alibaba/MNN,"MNN is a blazing fast, lightweight deep learning framework, battle-tested by business-critical use cases in Alibaba. Full multimodal LLM Android App:[MNN-LLM-Android](./apps/Android/MnnLlmChat/README.md). MNN TaoAvatar Android - Local 3D Avatar Intelligence: apps/Android/Mnn3dAvatar/README.md",2019-04-15T07:40:18Z,2025-10-05T07:02:39Z,C++
starship,starship/starship,"  The minimal, blazing-fast, and infinitely customizable prompt for any shell!",2019-04-02T03:23:12Z,2025-10-07T20:24:41Z,Rust
FastAsyncWorldEdit,IntellectualSites/FastAsyncWorldEdit,"Blazingly fast world manipulation for artists, builders and everyone else: https://modrinth.com/plugin/fastasyncworldedit",2018-12-20T17:22:31Z,2025-10-08T05:29:39Z,Java
devolutions-gateway,Devolutions/devolutions-gateway,A blazing fast relay server adaptable to different protocols and desired levels of traffic inspection.,2018-12-18T18:39:09Z,2025-10-07T22:15:38Z,Rust
go-syslog,leodido/go-syslog,Blazing fast syslog parsers,2018-12-16T11:24:22Z,2025-10-06T00:09:04Z,Go
validator,ValkyrieStudios/validator,A lightweight blazingly-fast highly extendable and configurable javascript validator that supports both standard objects and FormData,2018-11-19T19:26:40Z,2025-09-30T20:37:21Z,TypeScript
algoliasearch-client-kotlin,algolia/algoliasearch-client-kotlin, A fully-featured and blazing-fast Kotlin/Android API client to interact with Algolia.,2018-10-16T11:19:09Z,2025-10-07T10:23:46Z,Kotlin
iced,icedland/iced,"Blazing fast and correct x86/x64 disassembler, assembler, decoder, encoder for Rust, .NET, Java, Python, Lua",2018-09-07T19:30:25Z,2025-10-03T18:06:14Z,Rust
sonicjs,lane711/sonicjs,SonicJs Headless CMS - Blazing Fast Headless CMS built on Cloudflare Workers. 100% Javascript Based,2018-08-15T22:49:14Z,2025-09-29T14:40:52Z,TypeScript
graphql-engine-heroku,hasura/graphql-engine-heroku,"Blazing fast, instant realtime GraphQL APIs on Postgres with fine grained access control, also trigger webhooks on database events.",2018-06-21T01:52:56Z,2025-10-01T22:05:10Z,Dockerfile
graphql-engine,hasura/graphql-engine,"Blazing fast, instant realtime GraphQL APIs on all your data with fine grained access control, also trigger webhooks on database events.",2018-06-18T07:57:36Z,2025-10-06T21:59:12Z,TypeScript
BBob,JiLiZART/BBob,"Blazing fast js bbcode parser, that transforms and parses bbcode to AST and transform it to HTML, React, Vue with plugin support in pure javascript, no dependencies ",2018-06-04T21:13:58Z,2025-10-05T15:45:28Z,TypeScript
fast-stringify,planttheidea/fast-stringify,A blazing fast stringifier that safely handles circular objects,2018-06-02T13:47:19Z,2025-09-26T10:20:09Z,TypeScript
charm,neoground/charm,"Experience Charm, a blazing-fast PHP 8 framework tailored for high-performance web apps & APIs. Unleash your business potential with this sleek, lightweight powerhouse. Level up your development!",2018-05-16T19:28:20Z,2025-09-24T09:28:23Z,PHP
fast-equals,planttheidea/fast-equals,"A blazing fast equality comparison, either shallow or deep",2017-10-15T13:07:00Z,2025-09-26T06:49:46Z,TypeScript
martin,maplibre/martin,"Blazing fast and lightweight PostGIS, MBtiles and PMtiles tile server, tile generation, and mbtiles tooling.",2017-09-30T10:53:46Z,2025-10-08T03:47:06Z,Rust
CoreProtect,PlayPro/CoreProtect,CoreProtect is a blazing fast data logging and anti-griefing tool for Minecraft servers.,2017-08-21T21:59:13Z,2025-10-02T17:23:00Z,Java
utils,ValkyrieStudios/utils,Zero-dependency collection of blazing fast single-function utilities for common tasks,2017-08-21T17:41:38Z,2025-09-30T20:30:48Z,TypeScript
lwc,salesforce/lwc," LWC - A Blazing Fast, Enterprise-Grade Web Components Foundation",2017-07-28T21:21:56Z,2025-10-07T23:28:21Z,JavaScript
odict,TheOpenDictionary/odict,"A blazingly-fast, offline-first format and toolchain for lexical data ",2017-07-03T04:47:38Z,2025-10-06T17:55:56Z,Rust
proteus,noboomu/proteus,Proteus is a blazing fast minimalist Java web server framework built atop Undertow.,2017-04-25T14:55:16Z,2025-10-07T19:19:25Z,Java
nanomq,nanomq/nanomq,An ultra-lightweight and blazing-fast Messaging Broker/Bus for IoT Edge & SDV,2016-11-13T06:18:34Z,2025-09-29T07:29:38Z,C
algoliasearch-client-java,algolia/algoliasearch-client-java, A fully-featured and blazing-fast Java API client to interact with Algolia.,2016-07-05T10:16:19Z,2025-10-07T10:23:42Z,Java
react-native-update,reactnativecn/react-native-update, Blazing Fast Hot Updates for React Native,2016-02-06T14:16:37Z,2025-09-28T15:23:21Z,TypeScript
zimfw,zimfw/zimfw,"Zim: Modular, customizable, and blazing fast Zsh framework",2015-12-15T05:13:58Z,2025-09-22T19:14:39Z,Shell
algoliasearch-client-scala,algolia/algoliasearch-client-scala, A fully-featured and blazing-fast Scala API client to interact with Algolia.,2015-11-16T14:57:49Z,2025-10-07T10:23:52Z,Scala
Corrfunc,manodeep/Corrfunc,Blazing fast correlation functions on the CPU.,2015-09-30T05:07:04Z,2025-10-01T20:51:42Z,C
fast-digits,Bodigrim/fast-digits,"Split integers into digits, blazingly fast",2015-08-02T13:40:20Z,2025-10-07T22:05:07Z,Haskell
table-js,bpmn-io/table-js,A blazing fast library for viewing and editing tables,2015-06-09T07:39:00Z,2025-09-27T20:57:28Z,JavaScript
algoliasearch-client-swift,algolia/algoliasearch-client-swift, A fully-featured and blazing-fast Swift API client to interact with Algolia.,2015-02-11T07:30:57Z,2025-10-07T10:23:54Z,Swift
algoliasearch-client-go,algolia/algoliasearch-client-go, A fully-featured and blazing-fast Go API client to interact with Algolia.,2014-03-14T05:41:02Z,2025-10-07T10:23:40Z,Go
blaze,http4s/blaze,Blazing fast NIO microframework and Http Parser,2014-01-06T03:59:24Z,2025-10-07T07:52:11Z,Scala
algoliasearch-client-csharp,algolia/algoliasearch-client-csharp, A fully-featured and blazing-fast C# API client to interact with Algolia.,2013-07-10T14:52:10Z,2025-10-07T10:23:35Z,C#
algoliasearch-client-ruby,algolia/algoliasearch-client-ruby, A fully-featured and blazing-fast Ruby API client to interact with Algolia.,2013-05-24T20:07:36Z,2025-10-07T10:24:17Z,Ruby
algoliasearch-client-python,algolia/algoliasearch-client-python, A fully-featured and blazing-fast Python API client to interact with Algolia.,2013-05-22T13:57:40Z,2025-10-07T10:23:49Z,Python
algoliasearch-client-javascript,algolia/algoliasearch-client-javascript, A fully-featured and blazing-fast JavaScript API client to interact with Algolia.,2013-05-20T14:35:15Z,2025-10-07T10:23:44Z,TypeScript
algoliasearch-client-php,algolia/algoliasearch-client-php, A fully-featured and blazing-fast PHP API client to interact with Algolia.,2013-05-20T12:37:37Z,2025-10-07T10:23:48Z,PHP
