name,full_name,description,created_at,pushed_at,language
Jereko,JesseKoldewijn/Jereko,Blazingly fast App Router based Next.js application used as my personal portfolio,2024-01-26T10:39:05Z,2026-03-24T00:28:49Z,TypeScript
complexipy,rohaquinlop/complexipy,"Blazingly fast cognitive complexity analysis for Python, written in Rust.",2024-01-21T07:11:09Z,2026-03-29T18:05:30Z,Python
hypertext,vidhanio/hypertext,A blazing fast type-checked HTML macro crate.,2024-01-12T03:34:30Z,2026-03-26T18:58:40Z,Rust
turbo-cache-server,brunojppb/turbo-cache-server,Blazingly fast Turborepo remote cache server written in Rust as a Github Action with Docker support for Linux and MacOS,2023-12-31T21:48:21Z,2026-04-01T07:05:37Z,Rust
rindexer,joshstevens19/rindexer,A no-code or framework to build blazing fast EVM indexers - built in rust.,2023-12-26T23:24:26Z,2026-04-01T08:17:41Z,Rust
NpgsqlRest,NpgsqlRest/NpgsqlRest,"Transform Your PostgreSQL Database into a Production-Ready, Blazing-Fast Standalone REST API Web Server With Static Type Checking and Automatic Code Generation",2023-12-15T10:14:38Z,2026-03-31T12:23:56Z,C#
lqth,0x61nas/lqth, Simple but blazingly fast screenshot utility,2023-12-11T21:50:20Z,2026-03-26T18:04:47Z,Rust
TypeScript-Boilerplate,rslucena/TypeScript-Boilerplate,"Blazing-fast TS Boilerplate featuring a Zero-Dep Template Engine, Auto-CRUD Scaffolding, i18n, and Smart Caching. Optimized for Bun. Experience the speed of Go with the familiarity of TypeScript.",2023-12-11T20:03:08Z,2026-03-31T23:10:19Z,TypeScript
SimpleW,stratdev3/SimpleW,SimpleW is Web server Library in .NET Core. Powerfully Simple and Blazingly Fast.,2023-11-05T12:58:38Z,2026-03-29T23:10:44Z,C#
seline,Nuxify/seline,SvelteKit template for building modern and blazing fast webapps. Flowbite/Tailwind included.,2023-10-25T01:21:22Z,2026-03-31T03:21:13Z,TypeScript
text-embeddings-inference,huggingface/text-embeddings-inference,A blazing fast inference solution for text embeddings models,2023-10-13T13:36:51Z,2026-03-31T20:01:32Z,Rust
FlyPhotos,riyasy/FlyPhotos,A blazing fast ultra-light photo viewer replacement for Windows. Works similar to Picasa Photo Viewer.,2023-10-12T09:54:03Z,2026-04-01T03:41:21Z,C#
sif,vmfunc/sif,the blazing-fast pentesting suite.,2023-09-01T14:58:27Z,2026-03-30T17:15:28Z,Go
beff,lucasavila00/beff,Efficient validators from Typescript types generated by a blazing fast compiler,2023-08-28T02:32:08Z,2026-03-22T18:58:28Z,Rust
gateway,Portkey-AI/gateway,"A blazing fast AI Gateway with integrated guardrails. Route to 200+ LLMs, 50+ AI Guardrails with 1 fast & friendly API.",2023-08-23T11:52:47Z,2026-03-25T09:33:55Z,TypeScript
CoDriver,RickyDane/CoDriver,Blazingly fast file explorer.,2023-08-13T10:40:59Z,2026-03-22T13:52:55Z,JavaScript
bang,wajeht/bang,your personal command center for blazingly fast web navigation,2023-07-08T22:00:32Z,2026-03-31T08:02:05Z,TypeScript
yazi,sxyazi/yazi," Blazing fast terminal file manager written in Rust, based on async I/O.",2023-07-08T11:45:55Z,2026-03-31T14:30:58Z,Rust
starknet-foundry,foundry-rs/starknet-foundry,Blazing fast toolkit for developing Starknet contracts.,2023-07-05T22:27:04Z,2026-04-01T07:26:39Z,Rust
melon-lang,melon-lang/melon-lang,"A programming language designed for creating blazingly fast automations on Apple devices, utilizing Siri Shortcuts.",2023-06-19T09:21:32Z,2026-04-01T01:36:20Z,TypeScript
hictk,paulsengroup/hictk,Blazing fast toolkit to work with .hic and .cool files,2023-06-07T20:27:51Z,2026-03-30T20:49:00Z,C++
algoliasearch-client-dart,algolia/algoliasearch-client-dart, A fully-featured and blazing-fast Dart/Flutter API client to interact with Algolia,2023-05-15T15:43:35Z,2026-03-24T21:27:24Z,Dart
pyromark,monosans/pyromark,Blazingly fast Markdown parser for Python written in Rust.,2023-05-07T12:54:53Z,2026-03-31T21:39:30Z,Python
txlogger,roffe/txlogger,"Blazing fast data logging for Trionic 5, 7 & 8 ",2023-05-06T10:12:06Z,2026-03-24T19:11:14Z,Go
fory,apache/fory,A blazingly fast multi-language serialization framework powered by JIT and zero-copy.,2023-04-28T03:57:00Z,2026-04-01T07:24:32Z,Java
solar,paradigmxyz/solar,"Blazingly fast, modular and contributor friendly Solidity compiler, written in Rust",2023-04-21T18:39:28Z,2026-03-29T15:24:29Z,Rust
openapi-python-sdk,openapi/openapi-python-sdk, A fully-featured and blazing-fast Python API client to interact with Openapi,2023-04-14T15:25:32Z,2026-03-24T10:14:16Z,Python
shurtle-ts,danihengeveld/shurtle-ts,"The open source, blazingly fast URL shortener.",2023-04-13T21:45:42Z,2026-03-28T07:05:57Z,TypeScript
datasaurust,araffin/datasaurust,"Blazingly fast implementation of the Datasaurus paper. Same Stats, Different Graphs.",2023-03-25T12:32:46Z,2026-03-22T07:18:03Z,Rust
setup-duckdb-action,opt-nc/setup-duckdb-action, Blazing Fast and highly customizable Github Action to setup a DuckDb runtime,2023-03-14T04:24:53Z,2026-03-30T21:36:04Z,TypeScript
whichlang,quickwit-oss/whichlang,A blazingly fast and lightweight language detection library for Rust,2023-03-07T05:32:29Z,2026-03-30T09:52:50Z,Rust
year-progress,mbacalan/year-progress,Years are passing blazingly fast,2023-03-03T21:28:04Z,2026-04-01T02:46:07Z,Rust
cloudtrail-cli,guessi/cloudtrail-cli,Blazing fast single purpose cli for CloudTrail log filtering,2023-02-23T17:55:28Z,2026-03-28T15:44:02Z,Go
nvim-config,oyinss/nvim-config," My Neovim Configuration in Lua  Powered by LazyVim  for a Blazing-Fast, Modular Workflow.",2023-02-07T07:22:17Z,2026-03-22T14:04:12Z,Lua
blazingly-fast,shakhzodkudratov/blazingly-fast,my approach in getting blazingly fast,2023-02-05T00:18:07Z,2026-03-28T06:45:54Z,Nix
Interstellar,UseInterstellar/Interstellar,One of the most popular modern web proxies with blazing fast speeds and a variety of games.,2023-01-05T21:57:19Z,2026-03-27T16:55:35Z,JavaScript
advent-of-code-rust,maneatingape/advent-of-code-rust,"Blazing fast Rust solutions for every Advent of Code puzzle from 2015 to 2025, solving 524 stars in less than 1 second.",2023-01-02T17:53:47Z,2026-03-31T23:59:59Z,Rust
ruby-polars,ankane/ruby-polars,Blazingly fast DataFrames for Ruby,2022-11-22T05:59:48Z,2026-03-25T20:24:31Z,Ruby
chhoto-url,SinTan1729/chhoto-url,"A simple, blazingly fast, selfhosted URL shortener with no unnecessary features; written in Rust.",2022-11-21T01:37:06Z,2026-03-30T01:47:23Z,Rust
falcon,cuihairu/falcon,"A blazing-fast, secure download manager for Windows, macOS,          + and Linux. Supports HTTP/HTTPS, FTP, BitTorrent, cloud storage          +  (AWS S3, Alibaba Cloud), and private protocols (Thunder,          + QQDL). Features multi-threaded downloads, encrypted          + credentials, and resume support. Open source C++ application.",2022-11-02T12:43:38Z,2026-03-29T16:27:17Z,C++
rapidyaml-python,biojppm/rapidyaml-python,Blazing fast YAML parsing - Python package,2022-10-16T17:55:46Z,2026-03-26T19:51:09Z,Python
reth,paradigmxyz/reth,"Modular, contributor-friendly and blazing-fast implementation of the Ethereum protocol, in Rust",2022-09-15T23:05:57Z,2026-04-01T08:12:11Z,Rust
cw-optimizoor,mandrean/cw-optimizoor,A blazingly fast compiling & optimization tool for CosmWasm smart contracts.,2022-07-17T04:11:40Z,2026-03-22T21:52:51Z,Rust
rsonpath,rsonquery/rsonpath,Blazing fast JSONPath query engine written in Rust.,2022-07-09T13:28:54Z,2026-03-30T21:22:50Z,Rust
fidget,mkeeter/fidget,blazing fast implicit surface evaluation,2022-06-24T23:12:47Z,2026-03-24T18:24:59Z,Rust
hugo-bootstrap-theme,filipecarneiro/hugo-bootstrap-theme,"Hugo theme for a secure, blazing fast and SEO-ready static website, using Bootstrap 5.",2022-05-15T11:23:56Z,2026-03-31T17:16:58Z,SCSS
lsp-bridge,manateelazycat/lsp-bridge,A blazingly fast LSP client for Emacs,2022-05-03T00:08:34Z,2026-03-31T18:22:43Z,Emacs Lisp
table,stacksjs/table," The modern way to work with tables. Blazing fast facet-filtering, sorting, and searching.",2022-04-28T05:10:59Z,2026-03-31T22:39:57Z,TypeScript
rules_oci,DataDog/rules_oci,blazing fast Bazel rules for building OCI Images,2022-01-10T20:50:39Z,2026-03-22T15:36:00Z,Go
node-trashkek,meetmonday/node-trashkek,blazing fast () hooeta ,2022-01-06T20:08:18Z,2026-03-25T19:25:29Z,JavaScript
gefyra,gefyrahq/gefyra,"Blazingly-fast :rocket:, rock-solid, local application development :arrow_right: with Kubernetes.",2021-11-18T16:57:16Z,2026-04-01T07:35:33Z,Python
QuadStore,fifthlang/QuadStore,"A blazingly fast, lightweight RDF database for .NET 10",2021-11-07T06:10:48Z,2026-03-22T22:47:46Z,C#
qsv-stats,dathere/qsv-stats,"Blazing-fast, parallelized statistical functions on streams for Rust.",2021-10-10T03:19:14Z,2026-03-30T18:39:12Z,Rust
themes,warpdotdev/themes,"Custom themes repository for Warp, a blazingly fast modern terminal built in Rust.",2021-09-23T01:19:51Z,2026-03-28T00:54:44Z,Python
foundry,foundry-rs/foundry,"Foundry is a blazing fast, portable and modular toolkit for Ethereum application development written in Rust.",2021-09-08T11:23:11Z,2026-04-01T08:16:51Z,Rust
nvim,Allaman/nvim,"Minimal, blazingly fast, and pure Lua based Neovim configuration for my work as DevOps/Cloud Engineer with batteries included for Python, Golang, Terraform, and, of course, YAML",2021-08-07T11:45:29Z,2026-03-31T00:02:06Z,Lua
100ms-docs,100mslive/100ms-docs," Blazing fast 100ms Documentation built with nextjs, preact , mdx , next-mdx-remote",2021-06-04T08:12:51Z,2026-03-30T18:43:13Z,TypeScript
sonic,bytedance/sonic,A blazingly fast JSON serializing & deserializing library,2021-05-25T03:52:51Z,2026-04-01T08:31:50Z,Go
parallel-disk-usage,KSXGitHub/parallel-disk-usage,"Highly parallelized, blazing fast directory tree analyzer",2021-05-16T07:03:18Z,2026-03-28T23:54:39Z,Rust
transcribe-anything,zackees/transcribe-anything,Multi-backend whisper app. Blazing fast. Mac-arm optimized. Easy install. Input a local file or url and this service will transcribe it using Whisper AI. Completely private and Free ,2021-05-09T00:41:07Z,2026-03-24T18:05:47Z,Python
Fastback.jl,rbeeli/Fastback.jl,Blazing fast Julia backtester.,2021-02-25T01:12:34Z,2026-03-23T00:45:27Z,Julia
qsv,dathere/qsv,Blazing-fast Data-Wrangling toolkit,2020-12-11T04:08:39Z,2026-04-01T04:43:42Z,Rust
minimap.vim,wfxr/minimap.vim," Blazing fast minimap / scrollbar for vim, powered by code-minimap written in Rust.",2020-09-24T13:07:56Z,2026-03-25T03:30:03Z,Vim Script
vc-frontend,VirtoCommerce/vc-frontend,Virto Commerce Frontend - B2B SPA is a fresh look on the field of eCommerce solutions. This is a place where common B2B and B2C scenarios are combined with the most bleeding edge technologies to deliver blazing fast and fully functional solution. It implements common business use-cases needed for a vast majority of projects we build.,2020-09-17T13:32:49Z,2026-04-01T08:33:04Z,TypeScript
bld,Kani-Maki-Gang/bld,A simple and BLAZINGLY fast CI/CD in the making,2020-08-31T19:59:00Z,2026-04-01T03:28:30Z,Rust
lasso,Sammyjo20/lasso, Lasso is a Laravel package created to make your deployments blazing fast.,2020-05-09T16:12:09Z,2026-03-25T22:41:51Z,PHP
logdna-agent-v2,logdna/logdna-agent-v2,"The blazingly fast, resource efficient log collection client",2020-04-30T10:31:39Z,2026-03-24T18:31:35Z,Rust
gitui,gitui-org/gitui,Blazing  fast terminal-ui for git written in rust ,2020-03-16T14:38:01Z,2026-04-01T02:54:56Z,Rust
sort-es,cosimochellini/sort-es,"Blazing fast, tree-shakeable, type-safe, modern utility library to sort any type of array",2020-02-16T14:58:28Z,2026-03-27T15:40:36Z,TypeScript
file.d,ozontech/file.d,"A blazing fast tool for building data pipelines: read, process and output events. Our community: https://t.me/file_d_community",2020-02-14T10:59:20Z,2026-03-31T13:44:07Z,Go
qiankun,umijs/qiankun,"  Blazing fast, simple and complete solution for micro frontends.",2019-05-15T05:27:23Z,2026-03-29T18:18:13Z,TypeScript
MNN,alibaba/MNN,"MNN: A blazing-fast, lightweight inference engine battle-tested by Alibaba, powering high-performance on-device LLMs and Edge AI.",2019-04-15T07:40:18Z,2026-04-01T02:45:53Z,C++
starship,starship/starship,"  The minimal, blazing-fast, and infinitely customizable prompt for any shell!",2019-04-02T03:23:12Z,2026-03-31T21:10:38Z,Rust
FastAsyncWorldEdit,IntellectualSites/FastAsyncWorldEdit,"Blazingly fast world manipulation for artists, builders and everyone else: https://modrinth.com/plugin/fastasyncworldedit",2018-12-20T17:22:31Z,2026-03-30T04:36:08Z,Java
devolutions-gateway,Devolutions/devolutions-gateway,A blazing fast relay server adaptable to different protocols and desired levels of traffic inspection.,2018-12-18T18:39:09Z,2026-04-01T08:36:15Z,Rust
validator,ValkyrieStudios/validator,A lightweight blazingly-fast highly extendable and configurable javascript validator that supports both standard objects and FormData,2018-11-19T19:26:40Z,2026-03-28T11:56:36Z,TypeScript
ignixa-fhir,brendankowitz/ignixa-fhir,"A blazing-fast multi-FHIR, multi-tenant, multi-database, data streaming reference implementation FHIR Server built in dotnet.",2018-11-16T12:32:09Z,2026-03-31T21:39:42Z,C#
Node-Cluster-Prime-Numbers,syedshahzebhasnain/Node-Cluster-Prime-Numbers,Blazing-fast prime number engine: segmented sieve + worker_threads + native crypto. 100x faster than trial division. Supports BigInt/Miller-Rabin for primes near 10^15.,2018-11-12T07:14:25Z,2026-03-24T22:41:02Z,JavaScript
picomatch,micromatch/picomatch,"Blazing fast and accurate glob matcher written JavaScript, with no dependencies and full support for standard and extended Bash glob features, including braces, extglobs, POSIX brackets, and regular expressions. Used by GraphQL, Jest, Astro, Snowpack, Storybook, bulma, Serverless, fdir, Netlify, AWS Amplify, Revogrid, rollup, routify, open-wc, imba, ava, docusaurus, fast-glob, globby, chokidar, anymatch, cloudflare/miniflare, pts, and more than 5 million projects! Please follow picomatch's autho",2018-11-05T12:06:49Z,2026-03-24T13:14:58Z,JavaScript
algoliasearch-client-kotlin,algolia/algoliasearch-client-kotlin, A fully-featured and blazing-fast Kotlin/Android API client to interact with Algolia.,2018-10-16T11:19:09Z,2026-03-24T19:30:05Z,Kotlin
doom-config,ztlevi/doom-config,Blazing fast Doom Emacs private configuration,2018-10-03T05:50:55Z,2026-04-01T00:14:39Z,Emacs Lisp
graphql-engine-heroku,hasura/graphql-engine-heroku,"Blazing fast, instant realtime GraphQL APIs on Postgres with fine grained access control, also trigger webhooks on database events.",2018-06-21T01:52:56Z,2026-03-25T22:44:23Z,Dockerfile
graphql-engine,hasura/graphql-engine,"Blazing fast, instant realtime GraphQL APIs on all your data with fine grained access control, also trigger webhooks on database events.",2018-06-18T07:57:36Z,2026-03-31T22:06:57Z,TypeScript
fast-stringify,planttheidea/fast-stringify,A blazing fast stringifier that safely handles circular objects,2018-06-02T13:47:19Z,2026-03-28T07:40:15Z,TypeScript
fast-copy,planttheidea/fast-copy,A blazing fast deep object copier,2018-05-11T10:25:00Z,2026-03-28T07:39:34Z,JavaScript
micro-memoize,planttheidea/micro-memoize,A blazing fast memoization library that is tiny but feature-rich.,2018-01-14T14:16:17Z,2026-03-28T07:39:53Z,TypeScript
fast-equals,planttheidea/fast-equals,"A blazing fast equality comparison, either shallow or deep",2017-10-15T13:07:00Z,2026-03-28T07:40:26Z,TypeScript
martin,maplibre/martin,"Blazing fast and lightweight PostGIS, MBtiles and PMtiles tile server, tile generation, and mbtiles tooling.",2017-09-30T10:53:46Z,2026-03-30T21:21:17Z,Rust
CoreProtect,PlayPro/CoreProtect,CoreProtect is a blazing fast data logging and anti-griefing tool for Minecraft servers.,2017-08-21T21:59:13Z,2026-03-23T20:59:08Z,Java
utils,ValkyrieStudios/utils,Zero-dependency collection of blazing fast single-function utilities for common tasks,2017-08-21T17:41:38Z,2026-03-28T11:10:11Z,TypeScript
lwc,salesforce/lwc," LWC - A Blazing Fast, Enterprise-Grade Web Components Foundation",2017-07-28T21:21:56Z,2026-03-26T14:29:06Z,JavaScript
odict,TheOpenDictionary/odict,"A blazingly-fast, offline-first format and toolchain for lexical data ",2017-07-03T04:47:38Z,2026-03-31T15:09:48Z,Rust
pablopunk.com,pablopunk/pablopunk.com,Blazing fast I guess,2017-03-08T03:46:27Z,2026-03-29T17:16:50Z,Astro
vue-virtual-scroller,Akryum/vue-virtual-scroller, Blazing fast scrolling for any amount of data,2016-11-29T15:07:14Z,2026-03-31T19:44:05Z,TypeScript
nanomq,nanomq/nanomq,An ultra-lightweight and blazing-fast MQTT Messaging Broker/Bus for IoT Edge & SDV,2016-11-13T06:18:34Z,2026-04-01T08:18:22Z,C
algoliasearch-client-java,algolia/algoliasearch-client-java, A fully-featured and blazing-fast Java API client to interact with Algolia.,2016-07-05T10:16:19Z,2026-03-24T19:30:00Z,Java
web-maker,chinchang/web-maker,A blazing fast & offline frontend playground,2016-05-02T11:42:54Z,2026-03-30T03:57:27Z,JavaScript
react-native-update,reactnativecn/react-native-update, Blazing Fast Hot Updates for React Native,2016-02-06T14:16:37Z,2026-03-31T13:50:44Z,TypeScript
algoliasearch-client-scala,algolia/algoliasearch-client-scala, A fully-featured and blazing-fast Scala API client to interact with Algolia.,2015-11-16T14:57:49Z,2026-03-24T19:30:13Z,Scala
PyMI,cloudbase/PyMI,A blazing fast replacement for the Python WMI module,2015-11-09T13:43:20Z,2026-03-25T14:11:45Z,C++
algoliasearch-client-swift,algolia/algoliasearch-client-swift, A fully-featured and blazing-fast Swift API client to interact with Algolia.,2015-02-11T07:30:57Z,2026-03-24T19:30:17Z,Swift
algoliasearch-client-go,algolia/algoliasearch-client-go, A fully-featured and blazing-fast Go API client to interact with Algolia.,2014-03-14T05:41:02Z,2026-03-24T19:29:58Z,Go
blaze,http4s/blaze,Blazing fast NIO microframework and Http Parser,2014-01-06T03:59:24Z,2026-03-31T14:31:23Z,Scala
algoliasearch-client-csharp,algolia/algoliasearch-client-csharp, A fully-featured and blazing-fast C# API client to interact with Algolia.,2013-07-10T14:52:10Z,2026-03-31T12:06:49Z,C#
algoliasearch-client-ruby,algolia/algoliasearch-client-ruby, A fully-featured and blazing-fast Ruby API client to interact with Algolia.,2013-05-24T20:07:36Z,2026-03-24T19:30:39Z,Ruby
algoliasearch-client-python,algolia/algoliasearch-client-python, A fully-featured and blazing-fast Python API client to interact with Algolia.,2013-05-22T13:57:40Z,2026-03-24T19:30:09Z,Python
algoliasearch-client-javascript,algolia/algoliasearch-client-javascript, A fully-featured and blazing-fast JavaScript API client to interact with Algolia.,2013-05-20T14:35:15Z,2026-03-24T19:30:02Z,TypeScript
algoliasearch-client-php,algolia/algoliasearch-client-php, A fully-featured and blazing-fast PHP API client to interact with Algolia.,2013-05-20T12:37:37Z,2026-03-27T16:43:30Z,PHP
