name,full_name,description,created_at,pushed_at,language
gateway,Portkey-AI/gateway,"A blazing fast AI Gateway with integrated guardrails. Route to 200+ LLMs, 50+ AI Guardrails with 1 fast & friendly API.",2023-08-23T11:52:47Z,2025-11-29T01:30:13Z,TypeScript
airup,sisungo/airup," Airup is a modern, portable and blazingly fast implementation of service supervisor and the init daemon.",2023-08-14T09:25:45Z,2025-11-21T14:44:30Z,Rust
CoDriver,RickyDane/CoDriver,Blazingly fast file explorer.,2023-08-13T10:40:59Z,2025-11-26T13:56:15Z,JavaScript
ciphercanvas,walker84837/ciphercanvas,CipherCanvas is a blazingly fast Wi-Fi QR code generator.,2023-07-31T16:47:13Z,2025-11-23T14:57:39Z,Rust
lla,chaqchase/lla,blazing fast `ls` replacement with superpowers,2023-07-31T13:51:59Z,2025-11-16T06:26:00Z,Rust
IceNvim,Shaobin-Jiang/IceNvim,"A beautiful, powerful and customizable neovim config that is blazing fast",2023-07-30T08:22:55Z,2025-11-16T12:00:51Z,Lua
goscrapy,tech-engine/goscrapy,"GoScrapy: Harnessing Go's power for blazingly fast web scraping, inspired by Python's Scrapy framework.",2023-07-27T06:47:50Z,2025-11-20T01:13:59Z,Go
statusline,yuki0iq/statusline,Blazingly-fast PS1 statusline for bash (mirror),2023-07-18T15:16:13Z,2025-11-21T08:46:10Z,Rust
date-interceptors,AdaskoTheBeAsT/date-interceptors,"Automatically converts ISO 8601 date strings in JSON responses into native Date objects  deeply, safely, and blazingly fast.",2023-07-16T19:28:27Z,2025-11-22T17:17:46Z,TypeScript
bang,wajeht/bang,your personal command center for blazingly fast web navigation,2023-07-08T22:00:32Z,2025-11-23T19:23:08Z,TypeScript
yazi,sxyazi/yazi," Blazing fast terminal file manager written in Rust, based on async I/O.",2023-07-08T11:45:55Z,2025-12-01T15:01:42Z,Rust
starknet-foundry,foundry-rs/starknet-foundry,Blazing fast toolkit for developing Starknet contracts.,2023-07-05T22:27:04Z,2025-12-02T08:38:42Z,Rust
markdown-it-pyrs,chrisjsewell/markdown-it-pyrs,"A Python interface for markdown-it.rs, using Rust for blazingly fast parsing  ",2023-06-08T11:59:45Z,2025-12-01T21:58:58Z,Rust
hictk,paulsengroup/hictk,Blazing fast toolkit to work with .hic and .cool files,2023-06-07T20:27:51Z,2025-12-01T21:19:11Z,C++
song-stitch,SongStitch/song-stitch,A blazingly fast web app for generating LastFM collages.,2023-05-20T21:07:46Z,2025-11-27T22:07:05Z,Go
algoliasearch-client-dart,algolia/algoliasearch-client-dart, A fully-featured and blazing-fast Dart/Flutter API client to interact with Algolia,2023-05-15T15:43:35Z,2025-11-26T13:26:22Z,Dart
pyromark,monosans/pyromark,Blazingly fast Markdown parser for Python written in Rust.,2023-05-07T12:54:53Z,2025-11-30T10:03:06Z,Python
txlogger,roffe/txlogger,"Blazing fast data logging for Trionic 5, 7 & 8 ",2023-05-06T10:12:06Z,2025-12-01T21:26:20Z,Go
fory,apache/fory,A blazingly fast multi-language serialization framework powered by JIT and zero-copy.,2023-04-28T03:57:00Z,2025-12-02T04:04:57Z,Java
solar,paradigmxyz/solar,"Blazingly fast, modular and contributor friendly Solidity compiler, written in Rust",2023-04-21T18:39:28Z,2025-11-30T22:19:06Z,Rust
Rust-Hands-on,ghrabla/Rust-Hands-on,"Rust is blazingly fast and memory-efficient: with no runtime or garbage collector, it can power performance-critical services, run on embedded devices, and easily integrate with other languages.",2023-03-27T10:06:23Z,2025-11-20T20:32:16Z,Rust
setup-duckdb-action,opt-nc/setup-duckdb-action, Blazing Fast and highly customizable Github Action to setup a DuckDb runtime,2023-03-14T04:24:53Z,2025-11-23T21:04:31Z,JavaScript
react-native-pdf-renderer,douglasjunior/react-native-pdf-renderer," A zoomable, blazing fast, zero dependencies, pure native, typed PDF Renderer for Android and iOS.",2023-03-09T11:19:24Z,2025-11-29T00:15:40Z,Java
kawa,runreveal/kawa,A blazingly fast event stream processing library powering the reveald event processing daemon.,2023-03-08T16:06:51Z,2025-11-24T16:12:03Z,Go
whichlang,quickwit-oss/whichlang,A blazingly fast and lightweight language detection library for Rust,2023-03-07T05:32:29Z,2025-11-24T22:44:59Z,Rust
year-progress,mbacalan/year-progress,Years are passing blazingly fast,2023-03-03T21:28:04Z,2025-12-02T01:45:27Z,Rust
cloudtrail-cli,guessi/cloudtrail-cli,Blazing fast single purpose cli for CloudTrail log filtering,2023-02-23T17:55:28Z,2025-11-29T14:25:15Z,Go
Neovim-Config,Sawansunar56/Neovim-Config,This is the config files that I would use to start a life of a superior programmer. I will go blazingly Fast now. ,2023-02-05T20:48:10Z,2025-11-20T18:44:04Z,Lua
blazingly-fast,shakhzodkudratov/blazingly-fast,my approach in getting blazingly fast,2023-02-05T00:18:07Z,2025-12-01T10:25:03Z,Nix
modeline.nvim,nvimdev/modeline.nvim,neovim statusline plugin blazing fast than any statusline plugin,2023-01-31T04:56:38Z,2025-11-30T05:18:41Z,Lua
FyUTILS,noahonfyre/FyUTILS," A utility command line application built with Go, offering blazing-fast performance and awesome utilities.",2023-01-20T21:16:14Z,2025-11-16T01:58:15Z,Go
grappling-hook,chrisgrieser/grappling-hook,Obsidian Plugin for blazingly fast file switching. For those who find the Quick Switcher still too slow.,2023-01-09T13:57:14Z,2025-11-24T11:00:01Z,TypeScript
Interstellar,UseInterstellar/Interstellar,One of the most popular modern web proxies with blazing fast speeds and a variety of games.,2023-01-05T21:57:19Z,2025-12-01T19:14:16Z,JavaScript
editor-configs,ImperialOps/editor-configs,Blazingly fast config,2023-01-03T20:09:19Z,2025-11-27T20:57:02Z,Lua
advent-of-code-rust,maneatingape/advent-of-code-rust,"2025 in progress! Blazing fast Rust solutions for every Advent of Code puzzle from 2015 to 2024, solving 500 stars in less than 1 second.",2023-01-02T17:53:47Z,2025-12-02T08:35:16Z,Rust
sapling,NavinShrinivas/sapling,"A custom static site generator, blazingly fast and built for developers to create website the developer way!",2022-12-30T04:43:35Z,2025-11-23T05:31:56Z,Rust
hashgen,cyclone-github/hashgen,hashgen - the blazingly fast hash generator,2022-12-16T02:27:27Z,2025-11-20T05:16:25Z,Go
OptiGUI,opekope2/OptiGUI,Blazing fast custom GUI textures on Fabric and Quilt with built-in OptiFine custom GUI resource pack support,2022-12-15T21:34:41Z,2025-11-27T22:34:53Z,Kotlin
ruby-polars,ankane/ruby-polars,Blazingly fast DataFrames for Ruby,2022-11-22T05:59:48Z,2025-12-01T00:55:27Z,Ruby
chhoto-url,SinTan1729/chhoto-url,"A simple, blazingly fast, selfhosted URL shortener with no unnecessary features; written in Rust.",2022-11-21T01:37:06Z,2025-12-02T02:50:19Z,Rust
RapidIntegrationTesting,hash-code-io/RapidIntegrationTesting,Opinionated integration testing libraries for a blazingly fast testing experience,2022-11-17T20:53:50Z,2025-11-21T14:00:10Z,C#
milosz08,milosz08/milosz08,"Personal website build on top of the my own blazing fast and concurrency Java SSG engine, powered with markdown and HBS templates.",2022-11-13T04:34:22Z,2025-11-26T09:16:42Z,Java
es-git,toss/es-git,"A modern Git library built for Node.js with blazing-fast installation and rock-solid stability, powered by N-API.",2022-11-10T15:14:35Z,2025-12-02T03:46:15Z,Rust
zap,elbywan/zap,Another [insert blazing fast synonym] JavaScript package manager ,2022-11-06T20:24:08Z,2025-11-30T12:41:47Z,Crystal
reth,paradigmxyz/reth,"Modular, contributor-friendly and blazing-fast implementation of the Ethereum protocol, in Rust",2022-09-15T23:05:57Z,2025-12-02T07:43:50Z,Rust
AtlasRedisAPI,Swofty-Developments/AtlasRedisAPI,Blazingly fast multi-purpose Redis API based on Jedis. Used and maintained by Atlas Network.,2022-08-06T12:34:35Z,2025-12-01T11:19:22Z,Java
dockerfuse,dguerri/dockerfuse,"Interact with filesystem in deployed Docker containers, via FUSE. Blazing fast :)",2022-08-05T13:08:06Z,2025-11-19T08:56:40Z,Go
termv-rs,Roshan-R/termv-rs,Termv. Now blazingly fast ,2022-08-02T15:25:56Z,2025-11-22T12:04:25Z,Rust
rsonpath,rsonquery/rsonpath,Blazing fast JSONPath query engine written in Rust.,2022-07-09T13:28:54Z,2025-12-01T23:48:43Z,Rust
nvim,veyxov/nvim,Blazingly fast neovim configuration,2022-07-03T11:36:38Z,2025-11-18T10:53:41Z,Lua
hyprpaper,hyprwm/hyprpaper,Hyprpaper is a blazing fast wayland wallpaper utility with IPC controls.,2022-07-01T18:16:44Z,2025-12-01T18:34:46Z,C++
Unity-Assets-Utils,Haoming02/Unity-Assets-Utils,A series of blazingly fast utilities that trivializes datamining Unity assets,2022-05-21T08:18:15Z,2025-11-26T09:58:32Z,Rust
Granite,pChochura/Granite,A blazingly fast markdown note editor,2022-04-01T18:43:09Z,2025-11-19T08:01:29Z,Kotlin
node-trashkek,meetmonday/node-trashkek,blazing fast () hooeta ,2022-01-06T20:08:18Z,2025-11-28T16:54:05Z,JavaScript
shapeshift,sapphiredev/shapeshift,Blazing fast input validation and transformation ,2021-12-10T15:21:09Z,2025-11-30T01:48:04Z,TypeScript
gefyra,gefyrahq/gefyra,"Blazingly-fast :rocket:, rock-solid, local application development :arrow_right: with Kubernetes.",2021-11-18T16:57:16Z,2025-11-27T12:37:54Z,Python
joke-api,UltiRequiem/joke-api, Blazing Fast Jokes API!,2021-10-21T02:10:07Z,2025-11-20T01:08:17Z,TypeScript
Passivhaus,wszczawinski/Passivhaus,This project leverages Gatsby with TypeScript and Sass to create a blazing-fast website with WordPress as headless CMS and automated deployment through GitHub Actions CI/CD.,2021-10-16T17:03:26Z,2025-11-26T19:05:44Z,TypeScript
foundry,foundry-rs/foundry,"Foundry is a blazing fast, portable and modular toolkit for Ethereum application development written in Rust.",2021-09-08T11:23:11Z,2025-12-02T06:36:53Z,Rust
nvim,Allaman/nvim,"Minimal, blazingly fast, and pure Lua based Neovim configuration for my work as DevOps/Cloud Engineer with batteries included for Python, Golang, Terraform, and, of course, YAML",2021-08-07T11:45:29Z,2025-11-23T15:20:19Z,Lua
otterscan,otterscan/otterscan,"A blazingly fast, local, Ethereum block explorer built on top of Erigon",2021-07-01T18:22:12Z,2025-11-28T16:06:32Z,TypeScript
100ms-docs,100mslive/100ms-docs," Blazing fast 100ms Documentation built with nextjs, preact , mdx , next-mdx-remote",2021-06-04T08:12:51Z,2025-11-25T10:19:24Z,TypeScript
sonic,bytedance/sonic,A blazingly fast JSON serializing & deserializing library,2021-05-25T03:52:51Z,2025-11-20T11:28:52Z,Go
parallel-disk-usage,KSXGitHub/parallel-disk-usage,"Highly parallelized, blazing fast directory tree analyzer",2021-05-16T07:03:18Z,2025-11-24T22:07:23Z,Rust
zzhack,mistricky/zzhack, Blazing fast terminal-style personal site built with Rust WASM,2021-04-28T17:29:27Z,2025-11-29T16:07:00Z,Rust
advent-of-code,MeanderingProgrammer/advent-of-code,Advent of Code - All Years - Blazingly Fast,2021-03-24T23:38:18Z,2025-11-19T07:42:36Z,Rust
Redskap,khellang/Redskap,A collection of blazing fast  Norwegian  utilities with a  modern API ,2021-03-01T22:06:02Z,2025-11-24T20:20:27Z,C#
word-cloud,knowledgepicker/word-cloud,Fast word cloud library for .NET. Uses Quadtrees for blazing-fast performance. Maintained by the KnowledgePicker team.,2021-02-26T10:11:45Z,2025-11-29T20:55:30Z,C#
lualine.nvim,nvim-lualine/lualine.nvim,A blazing fast and easy to configure neovim statusline plugin written in pure lua.,2020-12-30T14:35:10Z,2025-11-23T02:31:30Z,Lua
qsv,dathere/qsv,Blazing-fast Data-Wrangling toolkit,2020-12-11T04:08:39Z,2025-12-02T06:05:00Z,Rust
databend,databendlabs/databend,"-  . Blazing analytics, fast search, geo insights, vector AI. Built for multimodal analytics, Open-source Snowflake alternative. https://databend.com",2020-10-10T06:04:42Z,2025-12-02T08:22:26Z,Rust
t-rec-rs,sassman/t-rec-rs,Blazingly fast terminal recorder that generates animated gif images for the web written in rust,2020-10-08T23:16:40Z,2025-12-01T21:26:45Z,Rust
elixir-request-validator,heywhy/elixir-request-validator,"A blazing fast request validator for your phoenix app, which validates a request body before hitting the request handler in the controller.",2020-10-03T22:34:02Z,2025-12-01T21:59:19Z,Elixir
vc-frontend,VirtoCommerce/vc-frontend,Virto Commerce Frontend - B2B SPA is a fresh look on the field of eCommerce solutions. This is a place where common B2B and B2C scenarios are combined with the most bleeding edge technologies to deliver blazing fast and fully functional solution. It implements common business use-cases needed for a vast majority of projects we build.,2020-09-17T13:32:49Z,2025-12-02T08:20:34Z,TypeScript
debug-log-analyzer,certinia/debug-log-analyzer,"Salesforce Apex debug log analyzer for VS Code - blazing-fast: flame charts, SOQL/DML, Apex insights & more",2020-09-03T15:39:24Z,2025-12-02T04:23:35Z,TypeScript
hexapod,mithi/hexapod,Blazing fast hexapod robot simulator for the web. ,2020-05-20T12:45:28Z,2025-12-01T19:17:38Z,JavaScript
mlblog,marklaszlo9/mlblog, Blazing fast blog built with Gatsby and Cosmic JS ,2020-04-22T20:36:44Z,2025-11-18T16:14:55Z,JavaScript
deno_lint,denoland/deno_lint,Blazing fast linter for JavaScript and TypeScript written in Rust,2020-03-28T12:31:24Z,2025-11-27T14:22:25Z,Rust
gitui,gitui-org/gitui,Blazing  fast terminal-ui for git written in rust ,2020-03-16T14:38:01Z,2025-12-01T16:19:34Z,Rust
sort-es,cosimochellini/sort-es,"Blazing fast, tree-shakeable, type-safe, modern utility library to sort any type of array",2020-02-16T14:58:28Z,2025-11-18T07:56:05Z,TypeScript
file.d,ozontech/file.d,"A blazing fast tool for building data pipelines: read, process and output events. Our community: https://t.me/file_d_community",2020-02-14T10:59:20Z,2025-12-01T14:44:59Z,Go
padre,glebarez/padre,"Blazing fast, advanced Padding Oracle exploit",2019-12-30T13:52:03Z,2025-11-21T14:25:39Z,Go
FastEMRIWaveforms,BlackHolePerturbationToolkit/FastEMRIWaveforms,Blazingly fast EMRI waveforms,2019-11-22T21:09:08Z,2025-11-19T16:11:56Z,Python
aws-neuron-sdk,aws-neuron/aws-neuron-sdk,"Powering AWS purpose-built machine learning chips. Blazing fast and cost effective, natively integrated into PyTorch and TensorFlow and integrated with your favorite AWS services",2019-11-06T02:12:59Z,2025-12-02T06:04:00Z,Python
pro-gallery,wix-incubator/pro-gallery,Blazing fast & beautiful galleries built for the web,2019-08-14T16:53:50Z,2025-11-25T12:50:44Z,JavaScript
MNN,alibaba/MNN,"MNN is a blazing fast, lightweight deep learning framework, battle-tested by business-critical use cases in Alibaba. Full multimodal LLM Android App:[MNN-LLM-Android](./apps/Android/MnnLlmChat/README.md). MNN TaoAvatar Android - Local 3D Avatar Intelligence: apps/Android/Mnn3dAvatar/README.md",2019-04-15T07:40:18Z,2025-11-20T02:59:40Z,C++
starship,starship/starship,"  The minimal, blazing-fast, and infinitely customizable prompt for any shell!",2019-04-02T03:23:12Z,2025-12-01T09:12:27Z,Rust
Levenshtein,rljacobson/Levenshtein,A Blazingly Fast DamerauLevenshtein Edit Distance Function (UDF) for MySQL,2019-02-04T20:33:48Z,2025-11-21T02:12:21Z,C++
FastAsyncWorldEdit,IntellectualSites/FastAsyncWorldEdit,"Blazingly fast world manipulation for artists, builders and everyone else: https://modrinth.com/plugin/fastasyncworldedit",2018-12-20T17:22:31Z,2025-12-01T02:07:06Z,Java
devolutions-gateway,Devolutions/devolutions-gateway,A blazing fast relay server adaptable to different protocols and desired levels of traffic inspection.,2018-12-18T18:39:09Z,2025-12-02T04:45:22Z,Rust
ignixa-fhir,brendankowitz/ignixa-fhir,"A blazing-fast multi-FHIR, multi-tenant, multi-database, request and response streaming reference implementation FHIR Server built in dotnet.",2018-11-16T12:32:09Z,2025-12-02T04:58:12Z,C#
algoliasearch-client-kotlin,algolia/algoliasearch-client-kotlin, A fully-featured and blazing-fast Kotlin/Android API client to interact with Algolia.,2018-10-16T11:19:09Z,2025-11-26T13:26:30Z,Kotlin
doom-config,ztlevi/doom-config,Blazing fast Doom Emacs private configuration,2018-10-03T05:50:55Z,2025-12-01T21:30:31Z,Emacs Lisp
iced,icedland/iced,"Blazing fast and correct x86/x64 disassembler, assembler, decoder, encoder for Rust, .NET, Java, Python, Lua",2018-09-07T19:30:25Z,2025-12-01T09:08:50Z,Rust
RootAsRole,LeChatP/RootAsRole,A better alternative to sudo(-rs)/su   Blazing fast   Memory-safe   Security-oriented,2018-08-28T14:35:23Z,2025-11-16T19:15:54Z,Rust
sonicjs,lane711/sonicjs,SonicJs Headless CMS - Blazing Fast Headless CMS built on Cloudflare Workers. 100% Javascript Based,2018-08-15T22:49:14Z,2025-12-02T01:58:39Z,TypeScript
graphql-engine-heroku,hasura/graphql-engine-heroku,"Blazing fast, instant realtime GraphQL APIs on Postgres with fine grained access control, also trigger webhooks on database events.",2018-06-21T01:52:56Z,2025-11-17T21:21:59Z,Dockerfile
graphql-engine,hasura/graphql-engine,"Blazing fast, instant realtime GraphQL APIs on all your data with fine grained access control, also trigger webhooks on database events.",2018-06-18T07:57:36Z,2025-12-01T08:59:14Z,TypeScript
BBob,JiLiZART/BBob,"Blazing fast js bbcode parser, that transforms and parses bbcode to AST and transform it to HTML, React, Vue with plugin support in pure javascript, no dependencies ",2018-06-04T21:13:58Z,2025-12-01T22:06:40Z,TypeScript
fast-stringify,planttheidea/fast-stringify,A blazing fast stringifier that safely handles circular objects,2018-06-02T13:47:19Z,2025-11-27T16:41:07Z,TypeScript
charm,neoground/charm,"Experience Charm, a blazing-fast PHP 8 framework tailored for high-performance web apps & APIs. Unleash your business potential with this sleek, lightweight powerhouse. Level up your development!",2018-05-16T19:28:20Z,2025-11-22T20:18:05Z,PHP
fast-copy,planttheidea/fast-copy,A blazing fast deep object copier,2018-05-11T10:25:00Z,2025-11-18T04:09:54Z,JavaScript
micro-memoize,planttheidea/micro-memoize,A blazing fast memoization library that is tiny but feature-rich.,2018-01-14T14:16:17Z,2025-12-01T23:14:51Z,TypeScript
ESP-DASH,ayushsharma82/ESP-DASH,"Blazing fast library to create a functional, on-device dashboard for ESP32, RP2040+W and RP2350+W microcontrollers",2017-11-10T14:09:51Z,2025-11-22T02:31:18Z,C++
fast-equals,planttheidea/fast-equals,"A blazing fast equality comparison, either shallow or deep",2017-10-15T13:07:00Z,2025-11-27T16:22:58Z,TypeScript
martin,maplibre/martin,"Blazing fast and lightweight PostGIS, MBtiles and PMtiles tile server, tile generation, and mbtiles tooling.",2017-09-30T10:53:46Z,2025-12-02T04:08:18Z,Rust
CoreProtect,PlayPro/CoreProtect,CoreProtect is a blazing fast data logging and anti-griefing tool for Minecraft servers.,2017-08-21T21:59:13Z,2025-11-26T22:23:10Z,Java
lwc,salesforce/lwc," LWC - A Blazing Fast, Enterprise-Grade Web Components Foundation",2017-07-28T21:21:56Z,2025-12-02T03:28:47Z,JavaScript
odict,TheOpenDictionary/odict,"A blazingly-fast, offline-first format and toolchain for lexical data ",2017-07-03T04:47:38Z,2025-12-02T06:34:31Z,Rust
proteus,noboomu/proteus,Proteus is a blazing fast minimalist Java web server framework built atop Undertow.,2017-04-25T14:55:16Z,2025-11-17T20:12:57Z,Java
pablopunk.com,pablopunk/pablopunk.com,Blazing fast I guess,2017-03-08T03:46:27Z,2025-11-20T14:32:52Z,Astro
zap,issmirnov/zap,Blazing fast web shortcuts.,2017-02-22T05:38:33Z,2025-11-24T23:55:17Z,Go
nanomq,nanomq/nanomq,An ultra-lightweight and blazing-fast Messaging Broker/Bus for IoT Edge & SDV,2016-11-13T06:18:34Z,2025-12-01T06:16:21Z,C
algoliasearch-client-java,algolia/algoliasearch-client-java, A fully-featured and blazing-fast Java API client to interact with Algolia.,2016-07-05T10:16:19Z,2025-11-26T13:26:26Z,Java
zap,uber-go/zap,"Blazing fast, structured, leveled logging in Go.",2016-02-18T19:52:56Z,2025-11-19T21:22:20Z,Go
react-native-update,reactnativecn/react-native-update, Blazing Fast Hot Updates for React Native,2016-02-06T14:16:37Z,2025-11-27T06:59:22Z,TypeScript
algoliasearch-client-scala,algolia/algoliasearch-client-scala, A fully-featured and blazing-fast Scala API client to interact with Algolia.,2015-11-16T14:57:49Z,2025-11-28T08:42:04Z,Scala
table-js,bpmn-io/table-js,A blazing fast library for viewing and editing tables,2015-06-09T07:39:00Z,2025-11-21T07:45:33Z,JavaScript
algoliasearch-client-swift,algolia/algoliasearch-client-swift, A fully-featured and blazing-fast Swift API client to interact with Algolia.,2015-02-11T07:30:57Z,2025-11-26T13:26:39Z,Swift
algoliasearch-client-go,algolia/algoliasearch-client-go, A fully-featured and blazing-fast Go API client to interact with Algolia.,2014-03-14T05:41:02Z,2025-11-26T13:26:24Z,Go
binary-parser,keichi/binary-parser,A blazing-fast declarative parser builder for binary data,2013-11-02T14:49:35Z,2025-11-26T05:41:25Z,TypeScript
algoliasearch-client-csharp,algolia/algoliasearch-client-csharp, A fully-featured and blazing-fast C# API client to interact with Algolia.,2013-07-10T14:52:10Z,2025-11-28T08:41:57Z,C#
algoliasearch-client-ruby,algolia/algoliasearch-client-ruby, A fully-featured and blazing-fast Ruby API client to interact with Algolia.,2013-05-24T20:07:36Z,2025-11-26T13:26:36Z,Ruby
algoliasearch-client-python,algolia/algoliasearch-client-python, A fully-featured and blazing-fast Python API client to interact with Algolia.,2013-05-22T13:57:40Z,2025-11-26T16:39:58Z,Python
algoliasearch-client-javascript,algolia/algoliasearch-client-javascript, A fully-featured and blazing-fast JavaScript API client to interact with Algolia.,2013-05-20T14:35:15Z,2025-11-26T16:39:55Z,TypeScript
algoliasearch-client-php,algolia/algoliasearch-client-php, A fully-featured and blazing-fast PHP API client to interact with Algolia.,2013-05-20T12:37:37Z,2025-11-26T16:39:57Z,PHP
ws,websockets/ws,"Simple to use, blazing fast and thoroughly tested WebSocket client and server for Node.js",2011-11-09T22:32:45Z,2025-11-26T21:27:13Z,JavaScript
