name,full_name,description,created_at,pushed_at,language
Schnellxplorer,BUGO07/Schnellxplorer,"This is my attempt at making a blazingly fast file explorer, using rust.",2024-12-06T12:44:30Z,2025-01-14T05:07:26Z,Rust
BlazeFL,kitsuya0828/BlazeFL,A blazing-fast and lightweight simulation framework for Federated Learning.,2024-12-06T04:05:56Z,2024-12-25T07:07:25Z,Python
Interstellar-1,kelisas/Interstellar-1,One of the most popular modern web proxies with blazing fast speeds and a variety of games.,2024-12-05T21:20:46Z,2024-12-05T21:20:46Z,
speculative-edits,AtharvaKamble/speculative-edits,an benchmark implementation of speculative edits for blazingly fast inference,2024-12-05T19:46:07Z,2024-12-05T19:50:20Z,Python
gopsd,AryaanSheth/gopsd, Blazingly Fast GPSD Client For Go,2024-12-05T16:29:45Z,2024-12-11T13:11:06Z,Go
rustpotion,Aveygo/rustpotion,Blazingly fast word embeddings with Tokenlearn,2024-12-05T06:25:24Z,2024-12-07T07:37:47Z,Rust
nexum,nullisxyz/nexum,"Nexum: Blazing-fast Ethereum access, where Rust brings web and terminal together for hackers.",2024-12-05T05:54:15Z,2025-01-04T23:43:23Z,Rust
ephemeral-validator,magicblock-labs/ephemeral-validator,Blazing-Fast SVM Ephemeral Validator,2024-12-04T17:21:25Z,2024-12-12T21:03:17Z,Rust
altaria,SrGaabriel/altaria," |  Altaria is an asynchronous, memory-safe, lightweight and blazingly fast http server framework written in Rust",2024-12-03T21:48:16Z,2024-12-20T20:24:49Z,Rust
goqrcode,kalyanraju/goqrcode," A blazing-fast, lightweight API for generating QR codes with custom content and sizes. Built with Go and Gin, containerized with Docker.  Perfect for developers!",2024-12-03T13:49:36Z,2024-12-03T14:06:38Z,Go
nano-og,opensass/nano-og, A Blazingly Fast  AI-powered Open Graph Image Generator,2024-12-03T13:42:20Z,2024-12-23T10:46:11Z,Rust
utf8,nberlette/utf8,Blazing fast universal TextEncoder and TextDecoder ponyfills.,2024-12-03T07:52:19Z,2024-12-17T10:13:51Z,TypeScript
rafka-test,wyattgill9/rafka-test,"an Experimental, blazingly fast, async, gRPC, distributed message broker, built on a decentralized peer-to-peer architecture, deployable natively in Kubernetes, that ensures scalability, fault tolerance and efficiency. ",2024-12-03T03:25:39Z,2024-12-17T03:45:54Z,Rust
diffusion-rs,EricLBuehler/diffusion-rs,Blazingly fast inference of diffusion models.,2024-12-03T01:49:10Z,2025-01-08T22:50:20Z,Rust
freyda,Kani-Maki-Gang/freyda,A blazingly fast Socks5 Proxy,2024-12-02T21:36:46Z,2025-01-14T05:13:28Z,Rust
revmo,qzakwani/revmo,"Blazing-fast, minimal app launcher.",2024-12-02T21:18:00Z,2024-12-21T19:43:06Z,Rust
goVault,lif0/goVault,Blazing-fast in-memory database written in Go,2024-12-02T16:54:00Z,2025-01-08T08:23:17Z,Go
kctl,Ruivalim/kctl,"Welcome to kctl  a lightweight, blazing-fast CLI tool that makes managing Kubernetes easier and more intuitive. Whether you're peeking into pod logs or planning to take your Kubernetes management to the next level, kctl has got you covered.",2024-12-01T22:04:25Z,2024-12-03T16:04:02Z,TypeScript
Electro,pTinosq/Electro,"Electro is a blazingly fast image viewer built with Rust, featuring an integrated terminal for enhanced productivity.",2024-12-01T18:47:15Z,2025-01-18T10:04:14Z,TypeScript
Lean,ANDRVV/Lean, Blazing fast scientific computing library for Zig,2024-11-28T18:56:43Z,2025-01-05T15:16:10Z,Zig
polars-bio,biodatageeks/polars-bio,Blazing-Fast Bioinformatic Operations on Python DataFrames,2024-11-26T16:58:18Z,2025-01-18T06:49:32Z,Python
alfaker,maxifjaved/alfaker,"A blazing fast fake data generator for Alfred, powered by Deno and Faker.js. Generate realistic test data without leaving your workflow.",2024-11-26T08:04:54Z,2024-12-04T13:25:59Z,JavaScript
fuse_python,declaredata/fuse_python,PySpark-compatible Python client for DeclareData Fuse Server: a blazing fast data processing engine and drop-in alternative to Spark clusters.,2024-11-25T22:21:52Z,2025-01-12T20:31:45Z,Python
ByteNet-Max,Elitriare/ByteNet-Max,"An upgraded version of ByteNet by ffrostfall that includes queries (RemoteFunctions), using buffers to send data with low memory, optimising experiences to be blazing fast!",2024-11-22T23:42:34Z,2025-01-16T02:05:17Z,Lua
t-assistant,asamofal/t-assistant,"A blazing fast, lightweight tool for i18n: manage translation keys with ease.",2024-11-21T21:19:54Z,2024-12-12T08:55:06Z,TypeScript
n1smm,n1smm/n1smm,absoulutely amazing modest and blazingly fast software developer,2024-11-21T19:25:46Z,2025-01-05T13:08:06Z,
katsini,nightcodezero/katsini," A blazing-fast, lightweight, and user-friendly tool built with Go for retrieving app information from major app stores.",2024-11-20T00:09:00Z,2025-01-17T05:08:51Z,Go
BFTML,npetrangelo/BFTML,Blazingly Fast Text Markup Language. Standards designed for web apps. Browser implementation in Rust.,2024-11-19T05:43:01Z,2024-12-12T18:57:37Z,Rust
Relia,Mahinkumar/Relia,"A Self hostable, blazingly fast forms solution built with Rust. Scales on demand and includes a built-in load balancer and a suite of server management tools.",2024-11-18T16:05:51Z,2025-01-16T15:25:46Z,JavaScript
Kataglyphis-Inference-Engine,Kataglyphis/Kataglyphis-Inference-Engine,Deploy your AI easily on Linux/Windows/iOS/Android/Web with blazingly fast inference times and native UI. ,2024-11-16T14:21:19Z,2025-01-14T20:26:08Z,Dart
epub2audiobook,haydonryan/epub2audiobook,Blazingly fast EPUB to Audiobook converter,2024-11-15T19:04:04Z,2024-12-14T18:46:36Z,Rust
BoltSearch-Efficient-SearchEnigne,AdeelTahir-SE/BoltSearch-Efficient-SearchEnigne," BoltFind: A blazing-fast search engine delivering instant, accurate results.  Smart Ranking for relevant searches.  High Performance with scalable architecture.  intuitive interface for tailored experiences.  JSON Support for seamless data integration.",2024-11-14T11:29:15Z,2024-12-29T18:19:25Z,Python
Fluent,fluent-lang/Fluent,Blazing-fast programming language that aims to make programming simple.,2024-11-13T03:56:50Z,2025-01-10T21:46:24Z,Go
tripper,opensass/tripper,"(WIP)  Next Level Blazingly Fast  Full Stack Trip Planning SaaS Platform Powered by Dioxus, Dioxus Server Functions, Axum, Unsplash, AWS Bedrock AI & MongoDB.",2024-11-13T02:08:13Z,2025-01-13T05:05:21Z,Rust
hector,rbbalestrin/hector,Hector is a text editor blazing fast (written in Rust),2024-11-08T00:07:33Z,2024-12-08T01:06:58Z,Rust
shugart,Schema-JS/shugart,"Blazingly fast, decentralized P2P data-sharing in Rust, designed for an intuitive developer experience and seamless integration.",2024-11-07T20:50:20Z,2025-01-14T16:13:44Z,Rust
hyprgui,OpenMandrivaAssociation/hyprgui,"GUI for configuring Hyprland, written in blazingly fast Rust! ",2024-11-03T16:09:15Z,2024-12-25T08:49:47Z,
haneulracing,ohaneul/haneulracing,"My personal website written in HTML, CSS and JavaScript specifically aimed at being blazing fast and responsive with the technologies used, whilst still looking unique.",2024-10-31T17:55:41Z,2024-12-15T17:05:41Z,HTML
quarkus-fury,quarkiverse/quarkus-fury,A blazingly fast multi-language serialization framework powered by JIT and zero-copy.,2024-10-31T12:13:56Z,2025-01-16T12:29:27Z,Java
opensass,opensass/opensass,"(WIP)  A Blazingly Fast  Full Stack Blog App With Admin Panel & Landing Page Powered by Dioxus. Dioxus Server Functions, Axum & MongoDB.",2024-10-30T09:26:12Z,2024-12-16T20:34:03Z,Rust
PugiSwift,elihwyma/PugiSwift,Blazing fast XML Parser in Swift for all platforms,2024-10-29T14:13:50Z,2024-12-08T16:41:50Z,C++
trailbase,trailbaseio/trailbase,"A blazingly fast, open-source application server with type-safe APIs, built-in JS/ES6/TS runtime, realtime, auth, and admin UI built on Rust, SQLite & V8. ",2024-10-29T09:39:33Z,2025-01-18T23:35:53Z,Rust
tiny-http,gsmyridis/tiny-http,"A tiny library for creating simple and ""blazingly fast"" HTTP servers.",2024-10-27T22:05:24Z,2025-01-12T17:32:28Z,Rust
react-native-fast-io,callstackincubator/react-native-fast-io,"Blazing fast I/O for React Native, built on top of Nitro",2024-10-27T21:43:36Z,2024-12-23T19:39:08Z,C++
wazemmes,darkweak/wazemmes,"Wasm HTTP middleware, agnostic, efficient and blazing fast.",2024-10-26T20:22:56Z,2024-12-17T17:33:02Z,Go
Interstellar-V5,UseInterstellar/Interstellar-V5,One of the most popular modern web proxies with blazing fast speeds and a variety of games.,2024-10-26T02:32:12Z,2024-12-23T12:29:36Z,JavaScript
stormint,Confucian-e/stormint,A blazing fast crate that supports multi-account minting of FreeMint tokens,2024-10-24T09:26:18Z,2025-01-19T08:28:35Z,Rust
maalik.dev,MalikBagwala/maalik.dev,My personal blazing fast website built using Remix :),2024-10-22T08:43:26Z,2024-12-24T10:04:01Z,TypeScript
streamit,devvMuhammad/streamit,Blazingly Fast Live Streaming Application made with SvelteKit + Golang,2024-10-21T08:10:50Z,2025-01-15T12:13:50Z,Svelte
moonbyte.at,m00nbyte/moonbyte.at,"Blazing fast static website built with TypeScript, TailwindCSS, and Rollup.",2024-10-20T15:33:41Z,2024-12-12T22:30:29Z,HTML
zendriver,stephanlensky/zendriver,"A blazing fast, async-first, undetectable webscraping/web automation framework based on ultrafunkamsterdam/nodriver. Now with Docker support!",2024-10-19T22:12:23Z,2025-01-08T23:16:55Z,Python
duohub-py,duohub-ai/duohub-py,"Blazing fast graph RAG service, specifically designed to deliver context to voice AI and other low latency applications in under 50 ms",2024-10-18T16:06:02Z,2025-01-18T10:14:58Z,Python
dex-mev-arbitrage-bot,solguru310/dex-mev-arbitrage-bot,"A blazing-fast MEV Arbitrage Bot built with Rust is now available as open-source, offering valuable insight into MEV strategies for aspiring developers.",2024-10-14T19:25:25Z,2024-12-10T14:57:04Z,Rust
tcp-tunnel,yilmaz08/tcp-tunnel, Blazingly fast and simple TCP tunneling system,2024-10-09T10:21:37Z,2024-12-11T08:11:33Z,Rust
Cornflakes,blahberi/Cornflakes,"Cornflakes is a versatile, lightweight, blazingly fast Dependency Injection framework for .NET written in C#.",2024-10-07T02:23:30Z,2024-12-22T08:18:35Z,C#
Bolt,SynthesisLab/Bolt,Blazingly fast synthesis of LTL formulas!,2024-10-02T08:56:38Z,2025-01-09T11:02:45Z,Rust
shordly,dgox16/shordly,Shordly - URL Shortener Blazingly Fast,2024-10-01T01:02:46Z,2025-01-07T05:52:13Z,Astro
bun-pulse,stephenjason89/bun-pulse,"BunPulse is a lightweight, high-performance WebSocket server built on Bun, fully compatible with the Pusher protocol. With BunPulse, you can easily implement real-time communication in your applications, benefiting from blazing-fast performance, scalability, and secure connections with minimal setup.",2024-09-30T07:07:07Z,2025-01-15T19:57:26Z,TypeScript
cruise,tren03/cruise,"A Chrome extension for blazingly fast navigation, helping you 'cruise' through your tabs.",2024-09-27T17:32:36Z,2024-12-08T06:33:03Z,JavaScript
BlazinglySAC,enchanteddev/BlazinglySAC,SAC Backend for IIT Palakkad. But Blazingly Fast .,2024-09-24T22:09:15Z,2025-01-15T20:45:38Z,Rust
SmolLM-experiments-with-grouped-query-attention,MyDarapy/SmolLM-experiments-with-grouped-query-attention,(Unofficial) building Hugging Face SmolLM-blazingly fast and small language model with PyTorch implementation of grouped query attention (GQA),2024-09-19T07:34:16Z,2025-01-11T08:58:27Z,Python
eldarcpp,kerighan/eldarcpp,A blazing fast search engine with Python bindings written in C++,2024-09-17T08:26:29Z,2025-01-16T18:17:50Z,C++
PolyShare,monyasau/PolyShare,"A Blazingly Fast, Open Source Cross-Platform Local Network File Sharing",2024-09-15T20:26:51Z,2024-12-18T22:06:57Z,JavaScript
next-music-player,leerob/next-music-player,"A blazing fast, information dense media player built with Next.js.",2024-09-14T20:28:29Z,2024-12-08T22:04:40Z,TypeScript
spectral-php,cooldogedev/spectral-php,"Spectral is a blazingly fast and lightweight network engine built on UDP, designed for real-time, low-latency applications.",2024-09-12T18:43:11Z,2024-12-19T02:54:55Z,PHP
nvim,nicosalm/nvim,"minimal config, blazingly fast",2024-09-12T15:04:04Z,2025-01-17T06:58:37Z,Lua
shortr,4rkal/shortr,Blazingly fast URL shortener written in go,2024-09-11T14:55:59Z,2024-12-23T14:46:16Z,templ
snowmint,mxmlkzdh/snowmint,SnowMint is a blazingly fast unique and roughly sortable IDs generator based on X's Snowflake.,2024-09-10T02:33:12Z,2025-01-05T01:28:51Z,Go
spectral,cooldogedev/spectral,"Spectral is a blazingly fast and lightweight network engine built on UDP, designed for real-time, low-latency applications.",2024-09-06T18:26:57Z,2024-12-19T02:40:40Z,Go
anidl-gui,zerodev-exe/anidl-gui,A blazingly fast anime downloader (perhaps the fastest),2024-09-04T22:59:02Z,2024-12-19T00:26:59Z,Rust
anidl,zerodev-exe/anidl,This is a blazingly fast library to made to scrape anime from gogoanime,2024-08-29T15:02:10Z,2025-01-18T00:37:03Z,Rust
Frontend,viraxpress/Frontend,Energize your E-commerce with ViraXpress's blazing fast Magento New Front End + Elegant Theme + >95% SEO score + Open Source,2024-08-29T06:24:11Z,2024-12-13T06:45:00Z,HTML
dicom-echo,rusty-dicom/dicom-echo,A blazingly fast implementation of the C-ECHO DICOM procedure ,2024-08-24T20:00:45Z,2025-01-17T08:50:53Z,Python
sourcebot,sourcebot-dev/sourcebot,"Blazingly fast code search   Deployed as a single Docker image  Search million+ lines of code in your GitHub, GitLab, Gitea, and Gerrit repositories  MIT licensed ",2024-08-23T20:40:37Z,2025-01-17T23:24:22Z,TypeScript
dotfiles,rmenai/dotfiles,My dotfiles for blazing fast development,2024-08-20T11:01:21Z,2024-12-23T12:54:33Z,Shell
portfolio,mohdjami/portfolio,"My blazing fast, seamless Portfolio website built on nextjs",2024-08-20T09:34:29Z,2025-01-14T18:34:48Z,TypeScript
durian.js,mario-huang/durian.js,Run NestJS on Bun Blazingly Fast,2024-08-20T07:01:07Z,2024-12-25T04:26:30Z,TypeScript
marshal-rs,savannstm/marshal-rs,Blazingly fast Ruby-lang's Marshal implementation in Rust.,2024-08-19T16:20:36Z,2025-01-08T10:33:05Z,Rust
impactifier,wzslr321/impactifier,"Analyze the impact of your changes quickly, reliably and of course blazingly fast, thanks to Rust  ",2024-08-15T08:22:19Z,2025-01-01T00:38:10Z,Rust
catboost-cgo,mirecl/catboost-cgo,"CatBoost a fast, scalable, high performance Gradient Boosting on Decision Trees library. Golang using Cgo for blazing fast inference CatBoost Model ",2024-08-13T15:53:52Z,2025-01-18T04:10:03Z,C
toolkit,jux-io/toolkit,"Jux toolkit is a collection of tools for blazingly fast, rapid UI development ",2024-08-07T21:35:02Z,2025-01-15T10:34:12Z,TypeScript
hounddog,hounddogai/hounddog,Blazingly fast source code scanner for data security and privacy.,2024-08-01T10:25:14Z,2025-01-14T17:49:43Z,Shell
dla-experiments,ThanosFisherman/dla-experiments,BLaZiNgLy FAST :rocket: Diffusion-limited aggregation experiments,2024-07-31T22:56:52Z,2025-01-17T22:44:08Z,Kotlin
FERS_core,Jeroen124/FERS_core,"Blazingly fast solver for FEM beam calculations, written in Rust",2024-07-30T04:03:36Z,2025-01-13T17:54:26Z,Python
garbage-cat,garbagecatio/garbage-cat,Garbage Cat: The Blazing Fast Rug Ninja Sniper,2024-07-19T20:07:47Z,2024-12-17T00:19:31Z,Go
CodeWhisper,gmickel/CodeWhisper,CodeWhisper: AI-Powered End-to-End Task Implementation & blazingly fast Codebase-to-LLM Context Bridge,2024-07-18T23:48:59Z,2024-12-13T03:08:22Z,TypeScript
emval,bnkc/emval,emval is a blazingly fast python email validator written in rust.,2024-07-14T04:11:01Z,2024-12-05T17:55:40Z,Rust
eambfc-rs,eliminmax/eambfc-rs, Eli Array Minkoff's BFC (Blazingly Fast Edition),2024-07-13T17:09:29Z,2025-01-19T05:19:18Z,Rust
power-options,TheAlexDev23/power-options,Linux GUI application for blazingly fast and simple power-management.,2024-07-12T16:13:39Z,2025-01-07T09:16:40Z,Rust
pouchlite,pouchlabs/pouchlite,Next Gen Blazingly fast js storage engine,2024-07-12T15:56:40Z,2024-12-30T18:02:30Z,JavaScript
magnetite-cms,lukeh990/magnetite-cms,"A blazing fast, expandable, and easy to use CMS",2024-07-08T20:11:16Z,2024-12-15T06:07:05Z,Rust
hyprpaper,OpenMandrivaAssociation/hyprpaper,Blazing fast wayland wallpaper utility with IPC controls,2024-07-06T13:27:56Z,2024-12-25T08:45:51Z,
blazed.js,BlazeInferno64/blazed.js,"Blazing-fast, light weight, high-performance, promise-based HTTP client",2024-07-03T13:24:41Z,2025-01-17T17:41:17Z,JavaScript
bingus-blog,slonkazoid/bingus-blog,blazingly fast markdown blog software written in rust memory safe. Mirror of https://git.slonk.ing/slonk/bingus-blog,2024-07-03T11:36:55Z,2024-12-29T20:19:06Z,Rust
foxi-astro-theme,oxygenna-themes/foxi-astro-theme,"Foxi is an Astro theme crafted with Tailwind CSS, designed for blazing-fast performance and seamless user experience. Perfect for creating modern, responsive SaaS websites with minimal effort.",2024-07-01T13:17:06Z,2025-01-09T12:10:46Z,Astro
rbuilder,flashbots/rbuilder,"rbuilder is a blazingly fast, state of the art Ethereum MEV-Boost block builder written in Rust",2024-07-01T07:26:00Z,2025-01-17T21:08:34Z,Rust
kiwi,nemanja-m/kiwi,"KiWi is a lightweight RESP-compliant key-value store inspired by the Bitcask paper, designed for simplicity and blazingly-fast operations ",2024-06-28T11:10:16Z,2024-12-09T19:27:26Z,Java
unplugin-isolated-decl,unplugin/unplugin-isolated-decl, A blazing-fast tool for generating isolated declarations.,2024-06-25T12:12:48Z,2025-01-14T04:34:08Z,TypeScript
libh,ihasq/libh,blazingly fast zero dependency react alternative ahh javascript,2024-06-23T15:12:43Z,2025-01-19T06:20:57Z,JavaScript
textstat,walker84837/textstat,TextStat is a reliable and blazing fast text file analyser.,2024-06-19T10:41:40Z,2024-12-06T08:07:03Z,Go
lines,Moderrek/lines,Blazingly FAST concurrent line of code counter created in GO,2024-06-08T14:40:26Z,2024-12-04T21:40:23Z,Go
vk-gltf-viewer,stripe2933/vk-gltf-viewer,Blazingly fast Vulkan glTF Viewer,2024-06-05T16:11:33Z,2025-01-18T12:01:56Z,C++
hyperindex,enviodev/hyperindex, Blazing-fast multi-chain indexer,2024-05-24T08:52:11Z,2025-01-17T15:05:29Z,ReScript
archive_me_plz,MrDwarf7/archive_me_plz,"BLAZINGLY  FAST  archiving, written in Rust ",2024-05-24T08:21:56Z,2024-12-16T07:35:25Z,Rust
sap,MOZGIII/sap,Opinionated HTTP server for hosting static files of Single Page Apps from memory with blazing fast speeds,2024-05-20T05:50:38Z,2025-01-13T11:18:03Z,Rust
KMLightSpigotFree,radek203/KMLightSpigotFree,Minecraft blazing fast 1.8.x limbo server,2024-05-11T10:52:51Z,2025-01-15T14:20:10Z,Java
vortex,VortexSdk/vortex,Blazingly fast std for C++,2024-05-10T17:57:46Z,2024-12-12T13:46:39Z,C++
eigen-db,Eigen-DB/eigen-db,The blazingly fast in-memory vector database ,2024-05-07T20:38:55Z,2025-01-16T14:48:36Z,C++
ripmors,qsantos/ripmors,Blazingly fast Morse code encoding/decoding,2024-05-06T20:29:21Z,2024-12-24T15:26:08Z,Rust
FlashHash,vojtechgadurek/FlashHash,Blazingly fast hashing functions from ulong to ulong. ,2024-05-02T11:43:18Z,2025-01-01T17:51:55Z,C#
CileExplorer,OmarSiwy/CileExplorer,Blazingly Fast File Explorer using OpenCL,2024-04-30T21:34:16Z,2025-01-07T02:40:24Z,C++
Fast-Chat,sayan10rakshit/Fast-Chat,A blazing fast AI chat assistant.,2024-04-29T12:52:49Z,2024-12-14T16:21:50Z,Python
hanoi-speedrapp,SpeckyYT/hanoi-speedrapp,Blazingly fast Tower of Hanoi speedrunning app,2024-04-24T18:53:30Z,2025-01-01T10:16:21Z,Rust
HoverFast,choosehappy/HoverFast,Blazing fast nuclei segmentation for brightfield Whole Slide Images,2024-04-24T15:25:21Z,2024-12-18T10:44:21Z,Jupyter Notebook
flash-find,javis-admin/flash-find,blazing fast client-side search utility,2024-04-10T04:08:29Z,2024-12-11T11:33:45Z,JavaScript
xx,denghe/xx,blazing fast 2d game engine base on c++20 coroutine & opengl es3,2024-04-09T05:28:03Z,2024-12-10T03:00:09Z,C++
chalkydri,chalkydri/chalkydri,A blazingly fast FRC vision system,2024-04-08T02:07:29Z,2025-01-18T22:06:10Z,Rust
pevm,risechain/pevm,Blazingly fast Parallel EVM,2024-04-05T03:15:02Z,2025-01-17T02:49:50Z,Rust
tikkin,tikk-in/tikkin,"Simple, headless, lightweight, and blazing fast URL shortener",2024-04-05T03:04:44Z,2025-01-16T02:48:00Z,Go
express_server,HelloblueAI/express_server,"Engineered to turbocharge API development! Packed with must-have middleware, utilities, and precision-grade monitoring tools, powerhouse for crafting secure, scalable, and blazingly fast processing. ",2024-04-03T06:11:07Z,2025-01-11T09:19:12Z,JavaScript
anti-spam-matrix,mokurin000/anti-spam-matrix,A Matrix Bot to ban spammers that runs blazingly fast ,2024-03-31T01:40:07Z,2025-01-13T22:28:19Z,Rust
flexauth,Rajdip019/flexauth,"Your own flexible, blazingly fast , and secure in-house authentication system.",2024-03-30T17:35:21Z,2025-01-09T07:16:18Z,Rust
perfect-tetris,TemariVirus/perfect-tetris,Blazingly fast Tetris perfect clear solver with low RAM usage,2024-03-25T21:22:42Z,2025-01-03T16:20:13Z,Zig
sfs,Srlion/sfs,Srlion's Fast Serializer - Blazing fast and compact~~!,2024-03-24T02:58:27Z,2024-12-18T19:18:31Z,Lua
snipe,snipe-bio/snipe,Blazingly fast SRA-scale sequence analysis & QC,2024-03-23T04:25:51Z,2025-01-08T17:33:32Z,Python
spectrum,cooldogedev/spectrum,"Spectrum is a blazingly fast, lightweight, and easy to use Minecraft: Bedrock Edition proxy",2024-03-19T19:52:26Z,2025-01-12T14:08:26Z,Go
bot,enum314/bot,Simple advanced blazingly fast agnostic discord bot plugin framework,2024-03-15T16:59:43Z,2025-01-16T01:45:30Z,TypeScript
stud-ip-scraper,RedstoneMedia/stud-ip-scraper,A blazingly fast  library for interacting with Stud.IP  written in Rust ,2024-03-08T15:17:33Z,2024-12-23T19:55:51Z,Rust
dietcli,hstsethi/dietcli,"DietCli is a blazingly fast, cross-platform, command line nutrition tracker written in C++.",2024-03-08T05:14:51Z,2025-01-06T03:57:44Z,C++
days-since-blazingly-fast,ninpnin/days-since-blazingly-fast,,2024-02-28T22:05:33Z,2025-01-18T08:40:10Z,Python
bevy_serde_lens,mintlu8/bevy_serde_lens,"Blazingly fast, schema based human-readable serialization crate for the bevy engine.",2024-02-28T20:20:33Z,2024-12-23T07:18:12Z,Rust
mistral.rs,EricLBuehler/mistral.rs,Blazingly fast LLM inference.,2024-02-26T22:30:06Z,2025-01-18T22:48:23Z,Rust
nodriver,ultrafunkamsterdam/nodriver,"Successor of Undetected-Chromedriver. Providing a blazing fast framework for web automation, webscraping, bots and any other creative ideas which are normally hindered by annoying anti bot systems like Captcha / CloudFlare / Imperva / hCaptcha ",2024-02-20T12:19:28Z,2025-01-09T13:35:49Z,Python
bump2version,wiseaidev/bump2version, A blazingly fast CLI for managing version numbers in your projects.,2024-02-19T12:29:15Z,2025-01-13T02:18:21Z,Rust
flamework-binary-serializer,Fireboltofdeath/flamework-binary-serializer,"A blazing fast binary serializer, or something",2024-02-18T21:01:28Z,2025-01-04T05:43:39Z,TypeScript
go-email-consumer-aws-sqs,swarajkumarsingh/go-email-consumer-aws-sqs,"Production ready dynamic Golang email consumer service with AWS SQS(Simple Queue Service) & AWS SES(Simple Email Service) written in Golang for high availability, scaling & blazing fast performance , Dockerized for easy development & Deployment",2024-02-10T10:51:10Z,2024-12-11T18:12:09Z,Go
url-manager,mohdjami/url-manager,Created a blazing fast url Manager with Nextjs,2024-02-07T16:23:25Z,2025-01-18T14:43:12Z,TypeScript
Jereko,JesseKoldewijn/Jereko,Blazingly fast App Router based Next.js application used as my personal portfolio,2024-01-26T10:39:05Z,2024-12-19T16:41:49Z,TypeScript
GhostAI,CyberZenDev/GhostAI,Blazing Fast AI Based On Groq API,2024-01-26T03:25:04Z,2024-12-12T00:17:05Z,TypeScript
hypertext,vidhanio/hypertext,A blazing fast type-checked HTML macro crate.,2024-01-12T03:34:30Z,2025-01-13T06:51:12Z,Rust
nvim_config,bashergoingcrazy/nvim_config,This is my nvim configuration works best for me uses various lsps and prime's harpoon for blazingly fast experience,2024-01-09T15:34:29Z,2024-12-13T19:32:08Z,Lua
vex,TheSignPainter98/vex,"A blazingly-fast, hackable linter",2023-12-30T00:34:00Z,2025-01-09T23:11:06Z,Rust
rindexer,joshstevens19/rindexer,A no-code or framework to build blazing fast EVM indexers - built in rust.,2023-12-26T23:24:26Z,2025-01-06T14:05:37Z,Rust
DataRace,LukasLichten/DataRace,"Blazingly Fast Realtime Extendable Data Visualization Engine for SimRacing, Flightsim, Streaming, etc.",2023-12-23T23:46:24Z,2024-12-30T11:40:00Z,Rust
xchat,insipx/xchat,BLAZING fast Terminal chat for XMTP inspired by weechat/irssi,2023-12-16T19:56:58Z,2024-12-30T05:23:13Z,Rust
lqth,0x61nas/lqth, Simple but blazingly fast screenshot utility,2023-12-11T21:50:20Z,2025-01-13T13:26:18Z,Rust
openlgen,phukon/openlgen,"Generate licenses for your projects right from your terminal, blazing fast!",2023-12-04T14:26:06Z,2025-01-19T05:15:51Z,TypeScript
factorflow,walker84837/factorflow,FactorFlow is a blazing fast rewrite of the factor command.,2023-12-03T22:07:47Z,2024-12-12T23:39:56Z,Rust
cub,arthurlch/cub,"Cub is a lightweight, BLAZINGLY-FAST, terminal-based text editor built for speed, simplicity, and precision.",2023-11-30T15:02:18Z,2025-01-18T08:01:53Z,Go
convex-typegen,JamalLyons/convex-typegen,Blazingly fast type generator for ConvexDB,2023-11-28T17:52:47Z,2025-01-16T23:50:15Z,Rust
echo-vault,coalaura/echo-vault,A blazing fast minimal ShareX backend written in golang.,2023-11-27T17:31:36Z,2025-01-17T19:34:49Z,Go
blog,mxsaad/blog, Blazingly fast and beautiful blog made with SvelteKit. ,2023-11-22T00:08:20Z,2024-12-19T11:33:47Z,Svelte
nrr,ryanccn/nrr,"Minimal, blazing fast npm scripts runner",2023-11-17T12:00:42Z,2025-01-19T00:39:02Z,Rust
rwalk,cestef/rwalk,A blazingly fast web directory scanner written in Rust,2023-11-08T00:23:36Z,2025-01-15T13:02:33Z,Rust
game-node-search,game-node-app/game-node-search,"GameNode's search system, made with . BLAZINGLY FAST.",2023-11-04T16:22:32Z,2024-12-16T01:35:11Z,Go
Pinterest.js,rit3zh/Pinterest.js,A versatile library that allows you to get information from Pinterest without any hassle and blazingly fast  ,2023-10-26T13:12:06Z,2024-12-06T01:15:48Z,TypeScript
pulse,just-hms/pulse,a blazingly fast search engine written in golang,2023-10-26T09:30:34Z,2025-01-17T22:42:45Z,Go
