name,full_name,description,created_at,pushed_at,language
tibia-scraper,sosalejandro/tibia-scraper,"A blazing-fast Tibia data scraper built in Go, demonstrating the power of Communicating Sequential Processes (CSP). This project highlights Gos ability to handle everything, everywhere, all at onceusing goroutines and channels for safe, scalable, and highly concurrent web scraping. See Gos concurrency model in action!",2025-07-10T21:26:32Z,2025-11-26T02:35:22Z,Go
Rust-HTTP-Server,Mr-Rahul-Paul/Rust-HTTP-Server,"Blazingly Fast HTTP server , build in Rust",2025-07-09T19:40:34Z,2025-12-02T08:23:23Z,Rust
prompt-security,happytaoer/prompt-security,"Prompt Security is a blazing-fast, zero-config Go tool that automatically detects and filters sensitive data from your clipboardbefore it can leak to large language models ( LLMs) or online tools.",2025-07-05T04:42:13Z,2025-11-15T07:55:25Z,Go
CodeFlattener,uaktags/CodeFlattener,"A blazingly-fast, rust based, cli program to flatten a codebased to upload to AIStudio",2025-07-04T21:51:52Z,2025-11-19T19:15:05Z,Rust
obsidian-parser,CryptoGladi/obsidian-parser,Blazingly fast Obsidian vault parser with graph analysis,2025-07-04T21:26:07Z,2025-12-02T07:54:02Z,Rust
rtfm,alexeev-prog/rtfm,RTFM - blazingly fast util for searching manuals & docs,2025-07-01T19:53:30Z,2025-11-24T22:10:49Z,Rust
pgram,XyncNet/pgram,Blazingly fast start async telegram bot on top of the aiogram and tortoise-orm with postgres channels,2025-06-29T11:33:03Z,2025-11-21T07:27:23Z,Python
binius64,binius-zk/binius64,"Binary Proofs, Blazing Fast",2025-06-27T15:19:26Z,2025-11-30T15:15:40Z,Rust
Gecko,shiwildy/Gecko,"A blazingly fast, CLI-based local development environment for web development.",2025-06-26T12:08:01Z,2025-11-22T13:39:08Z,Go
ClipChronicle-Cross-Platform-App,hoangsonww/ClipChronicle-Cross-Platform-App," An open-source, AI-powered multi-platform Electron clipboard manager with local-first storage, blazing-fast search, and productivity-boosting features. Includes an Electron desktop app, Chrome extension, and interactive Next.js landing site - all fully customizable.",2025-06-23T01:57:44Z,2025-11-28T05:03:32Z,TypeScript
ezfetch,ofcyouritachii/ezfetch,"ezfetch is a blazing-fast, cross-platform system information tool written in Python. Its designed to mimic the aesthetic and functionality of neofetch, while remaining lightweight, fully customizable, and easy to extend.",2025-06-19T15:51:19Z,2025-11-22T17:37:55Z,Python
arbos-foundry,iosiro/arbos-foundry,"Foundry is a blazing fast, portable and modular toolkit for Ethereum application development written in Rust.",2025-06-18T08:22:22Z,2025-12-01T08:22:56Z,Rust
zqlite,GhostKellz/zqlite,"zqlite is a blazing-fast, standalone, embedded SQL-compatible database built from scratch in Zig.",2025-06-16T23:26:37Z,2025-12-01T15:14:32Z,Zig
laris,LaraPire/laris,"A blazing-fast and minimal CLI tool to streamline Laravel development. Run common Artisan commands like serve, make, migrate, and more  with fewer keystrokes and zero clutter.",2025-06-16T22:51:15Z,2025-12-01T22:11:35Z,PHP
solforge,nitishxyz/solforge,"AI-Powered Solana Development Suite  The next-generation Solana development environment combining blazing-fast localnet performance with integrated AI assistance. Build faster, debug smarter, ship sooner.",2025-06-16T15:05:43Z,2025-11-22T23:03:27Z,TypeScript
hps,hyperse-io/hps,HPS is a blazing fast frontend build tool based on Rspack that powers modern web applications with exceptional performance and developer experience.,2025-06-14T07:52:55Z,2025-11-30T01:25:00Z,TypeScript
tokenize,DefinitelyNotSimon13/tokenize,Tokenize your codebase blazingly fast into a single file for LLM Context ,2025-06-08T11:52:59Z,2025-11-23T10:23:17Z,Rust
verb,verbjs/verb,"A blazingly fast HTTP server framework for TypeScript and Bun, designed to outperform other servers with zero compromises on developer experience.",2025-06-02T23:50:22Z,2025-12-01T17:56:21Z,TypeScript
kdriver,cdpdriver/kdriver,"A blazing fast, coroutine-first, undetectable web scraping / browser automation CDP-based library for Kotlin",2025-05-26T23:32:38Z,2025-11-22T00:03:36Z,Kotlin
Nyx,auraluvsu/Nyx,"Nyx is a blazing fast chess engine written in Go, complete with machine learning in Python using PyTorch",2025-05-23T16:36:12Z,2025-11-27T14:36:43Z,Go
VenomStrike,5kidRo0t/VenomStrike,"VenomStrike: A lightweight, blazing-fast malware scanner that identifies known threats via SHA-256, MD5 hashes and YARA rules. Confirms if a file is a known malware sample. No bloat  just raw speed, simplicity, and full portability.",2025-05-23T10:57:55Z,2025-11-15T00:17:06Z,YARA
PigenAi-Image-Generator,Aditya-Agrahari1/PigenAi-Image-Generator," AI image generator that transforms text prompts into visuals instantly. Simple UI, blazing fast results, no login required, and unlimited free generations.",2025-05-20T14:34:26Z,2025-11-24T17:35:31Z,
rustyll,betterwebinit/rustyll,Future-Proof Blazing Fast Static Site Generator (SSG),2025-05-19T19:53:01Z,2025-11-21T20:40:47Z,Rust
uuid-gen-cli,hadzicni/uuid-gen-cli,"Minimal and blazing-fast CLI tool to generate UUIDv4 values  secure, RFC-compliant, and built with Go.",2025-05-17T22:31:52Z,2025-11-24T11:02:56Z,Go
zli,mahiremirhan/zli," A blazing fast Zig CLI framework. Build ergonomic, high-performance command-line tools with ease.",2025-05-17T04:54:46Z,2025-12-02T07:15:37Z,Zig
JBird,vsanthanam/JBird,"A blazing fast, type-safe library for working with JSON in Swift",2025-05-16T19:54:49Z,2025-11-30T18:27:48Z,Swift
kung-fu-screeps,jakewaldrip/kung-fu-screeps,Blazingly fast Screeps bot implemented in Rust,2025-05-14T21:50:56Z,2025-11-26T08:29:48Z,Rust
terrawiz,efemaer/terrawiz, Terrawiz - A blazing-fast open-source CLI tool for discovering and analyzing Terraform modules across multiple platforms.,2025-05-11T18:48:59Z,2025-11-15T21:56:23Z,TypeScript
minimalify,ragarwalll/minimalify,"Minimalify is a zero-dependency CLI/library for building blazing-fast, static HTML/CSS/JS sites with reusable components.",2025-05-11T12:24:52Z,2025-12-01T12:09:13Z,TypeScript
The-Pokedex-Database,YAVUZGIYIM/The-Pokedex-Database," An interactive Pokdex app built with Next.js, Tailwind CSS, and React Query for blazing-fast performance and smooth UX. Includes live search, item explorer, and a favorites system powered by local storage.",2025-05-11T00:57:31Z,2025-12-02T07:09:55Z,TypeScript
The-Pokedex-Database,hoangsonww/The-Pokedex-Database," An interactive Pokdex app built with Next.js, Tailwind CSS, and React Query for blazing-fast performance and smooth UX. Includes live search, item explorer, and a favorites system powered by browser storage.",2025-05-08T23:21:13Z,2025-11-27T01:40:25Z,TypeScript
kingfisher,mongodb/kingfisher,"Kingfisher is a blazingly fast and highly accurate tool for secret detection and live validation across files, Git repos, GitHub, GitLab, Azure DevOps, BitBucket, Gitea, AWS S3, Docker images, Jira, Slack, and Confluence",2025-05-08T17:27:15Z,2025-11-25T09:43:47Z,Rust
Yendo-cli,ricchiooo/Yendo-cli,"A blazing-fast, Al-assisted CLI for Solana wallet management, NFT minting, token transfers, and smart contract interaction - built for developers and crypto-native users.",2025-05-08T11:55:22Z,2025-11-16T18:12:28Z,JavaScript
lucia-rust,SirPigari/lucia-rust,"Lucia, but written in Rust, so its BLAZINGLY FAST",2025-05-06T21:02:56Z,2025-11-30T12:25:18Z,Rust
hashgen,Jhmmax/hashgen,"hashgen - the blazingly fast hash generator argon, base58, base64, bcrypt, cyclone, generator, hash, hashcat, hashgen, md5, mdxfind, mosecode, multithreaded, ntlm, sha, sha1, sha256, sha3, threaded, yescrypt",2025-05-03T18:54:18Z,2025-12-02T07:06:11Z,Go
DiffRhythm,ohhalim/DiffRhythm,DiRhythm: Blazingly Fast and Embarrassingly Simple End-to-End Full-Length Song Generation with Latent Diffusion,2025-05-03T12:03:37Z,2025-11-16T04:28:39Z,Python
meteoblue_api,TheRolfFR/meteoblue_api,Blazing fast Rust CLI to get JSON from meteoblue and forecast graph as png,2025-04-27T14:24:40Z,2025-11-17T12:24:16Z,Rust
Xtracta,V1vaStick/Xtracta,"Xtracta  blazingfast web XPath tester for XML/HTML with live node highlighting, largefile streaming & React+Node.js stack.",2025-04-26T21:12:04Z,2025-12-02T07:02:58Z,TypeScript
LiveCodeCraft,Kros13/LiveCodeCraft,"A blazing-fast online HTML/CSS/JS code playground built from scratch. Write code, see instant preview, and craft beautiful web snippets in real-time. Like your personal mini CodePen, made with  by Ajoy.",2025-04-25T10:56:06Z,2025-12-02T07:01:22Z,JavaScript
NebulaDB,Nom-nom-hub/NebulaDB,"NebulaDB is a high-performance, reactive, TypeScript-first, schema-optional, embeddable NoSQL database that runs in the browser, Node.js, and Edge environments. It features advanced indexing, optimized query processing, modular adapters for persistence, reactive live queries, extensibility via plugins, and blazing-fast in-memory...",2025-04-22T15:20:09Z,2025-11-25T17:07:20Z,TypeScript
portfolio,cojocaru-david/portfolio,"A modern, high-performance personal portfolio and blog built with Astro.js. Designed to showcase your projects and technical writing with blazing-fast performance and exceptional SEO.",2025-04-22T09:53:18Z,2025-12-02T04:48:25Z,TypeScript
liischte,VirtCode/liischte,a blazingly fast wayland bar for my personal use,2025-04-16T19:59:03Z,2025-11-21T16:34:00Z,Rust
solana-chio,4rjunc/solana-chio,setup your pinocchio project blazingly fast ,2025-04-16T04:01:44Z,2025-11-15T04:41:25Z,Rust
esimport,codingjoe/esimport,Blazing fast ESM compiler and importmap generator,2025-04-13T14:28:07Z,2025-11-21T21:48:57Z,JavaScript
Snapchat-Username-Checker,RAJGAMERZ001/Snapchat-Username-Checker,A Go-based Snapchat username checker using the app's private gRPC API  proxy support + blazing fast.,2025-04-11T16:59:27Z,2025-12-02T06:55:56Z,Go
THE-CUBE,cybruGhost/THE-CUBE,"A Movie Streaming web-site experience built for thrill-seekers, binge-watchers, and late-night explorers. Minimal design, powerful interface, blazing fast playback.",2025-04-10T17:27:10Z,2025-11-19T10:19:29Z,
cpufetch-rs,sm-moshi/cpufetch-rs,"A blazing-fast, modern, and elegant Rust rewrite of cpufetch.",2025-04-05T15:24:50Z,2025-11-24T22:44:05Z,Rust
WordWeaver,milkdrinkers/WordWeaver,A blazingly fast java translation library with Adventure support for Java 8 and up.,2025-04-02T02:38:24Z,2025-11-21T18:46:56Z,Java
OpenChat,ajanraj/OpenChat,"Every AI model, one blazing fast workspace - see how they think, schedule what you need",2025-03-30T14:34:28Z,2025-11-20T16:48:06Z,TypeScript
2web,hudson-newey/2web, A compiler-based web framework for blazing fast web apps,2025-03-26T12:36:45Z,2025-12-01T12:32:34Z,Go
react-app-starter,neetibut/react-app-starter,Build React with Vite for a blazing-fast startup and updates without the heavy framework overhead.,2025-03-19T23:52:19Z,2025-11-20T11:05:28Z,JavaScript
simple-frontend-stack,yerTools/simple-frontend-stack,"A lightweight frontend stack for rapid web app development powered by SolidJS, TailwindCSS, and DaisyUI. Includes optional PocketBase backend with Bun and Vite for blazing-fast development workflow. Features responsive design, component libraries, animations, and production-ready optimizations with comprehensive CI/CD pipeline.",2025-03-11T00:35:23Z,2025-12-02T03:10:45Z,TypeScript
minigrep,ibrahim-3595/minigrep,"MiniGrep: Rust CLI tool for blazing-fast text search in files. Regex-powered, parallel scanning. Shell-like pipeline: chain with filters, sort, uniq. Lightweight, zero-deps, cross-platform.",2025-03-09T19:40:21Z,2025-11-19T14:47:48Z,Rust
WorldEdit-CSharp,RussDev7/WorldEdit-CSharp,"A lightweight, blazing fast, csharp interpretation of the classic world edit.",2025-03-06T21:51:11Z,2025-11-29T01:34:54Z,C#
uncomment,Goldziher/uncomment,Blazingly fast CLI to remove comments from code using tree-sitter grammers,2025-03-05T06:11:12Z,2025-12-01T10:39:05Z,Rust
csv_validation,charro/csv_validation,Blazing fast CSV schema validations,2025-03-04T22:52:24Z,2025-11-17T12:53:46Z,Rust
fujin,fujin-io/fujin," Blazingly fast, cloud native, universal broker connector",2025-02-28T18:34:14Z,2025-11-26T20:02:31Z,Go
bun-curl2,Aslarex/bun-curl2,"BunCurl2 is a blazing fast, fetch-like HTTP client built with Bun and cURL in TypeScript.",2025-02-24T12:52:12Z,2025-11-27T09:58:31Z,TypeScript
DiffRhythm,ASLP-lab/DiffRhythm,DiRhythm: Blazingly Fast and Embarrassingly Simple End-to-End Full-Length Song Generation with Latent Diffusion,2025-02-23T07:13:00Z,2025-11-27T13:30:12Z,Python
kand,kand-ta/kand,"Kand: Blazing-Fast, Modern Technical Analysis in Rust, Python, and WASM.",2025-02-22T12:23:12Z,2025-11-17T08:02:50Z,Rust
timbal,timbal-ai/timbal,"Timbal is an open-source python framework for building reliable AI applications, battle-tested in production with simple, transparent architecture that eliminates complexity while delivering blazing fast performance, robust typing, and API stability in an ever-changing ecosystem.",2025-02-21T09:42:42Z,2025-12-01T09:01:32Z,Python
JaxDEM,cdelv/JaxDEM,Easy to use and blazing fast JAX-based library for high-performance 2D/3D Discrete Element Method (DEM) simulations.,2025-02-19T15:46:49Z,2025-12-01T23:36:49Z,Python
lintspec,beeb/lintspec,A blazingly fast linter for NatSpec comments in Solidity code,2025-02-14T12:44:21Z,2025-11-24T03:35:05Z,Rust
bundlemonkey,mkobayashime/bundlemonkey,Bundlemonkey is a userscript bundler designed to make developing browser userscripts blazing fast and efficient ,2025-02-02T18:25:36Z,2025-12-02T03:28:32Z,TypeScript
net-manthan,gopal-lohar/net-manthan,"A blazingly fast, multithreaded, resumable, asynchronous download manager written in rust",2025-01-22T17:19:46Z,2025-11-18T12:32:58Z,Rust
FlashSpace,wojciech-kulik/FlashSpace,FlashSpace is a blazingly fast virtual workspace manager for macOS ,2025-01-19T21:25:42Z,2025-11-18T21:48:38Z,Swift
phoenix.nvim,nvimdev/phoenix.nvim,A blazing-fast asynchronous in-process server providing word and path and snippets completion.,2025-01-19T12:20:59Z,2025-11-19T12:00:39Z,Lua
faster-chat,1337hero/faster-chat,"A blazingly fast, privacy first & OPEN AI Chat Interface",2025-01-18T07:25:52Z,2025-12-02T02:50:32Z,JavaScript
justified-layout,immich-app/justified-layout,"A blazingly fast implementation of the justified layout gallery view popularized by Flickr, written in Rust and exported to WebAssembly.",2025-01-10T02:11:48Z,2025-12-01T09:14:10Z,Rust
oxidasim,AndrejOrsula/oxidasim,Blazing fast utilities for simulations,2025-01-01T16:36:20Z,2025-12-01T06:47:19Z,Rust
rapidvpi,ArcSpecter/rapidvpi,"Blazingly fast, modern C++ API using coroutines for efficient RTL verification and co-simulation via the VPI interface",2024-12-31T23:58:08Z,2025-11-23T04:05:40Z,C++
v4.20,cesswhite/v4.20,"Minimal, blazing fast, and designed with developers in mind, v4.20 is your go-to starting point for modern web projects with Nuxt",2024-12-21T23:10:05Z,2025-12-01T17:20:50Z,Vue
Astra,ArkForgeLabs/Astra, Blazingly Fast  web server runtime for Lua,2024-12-21T08:17:31Z,2025-11-30T15:04:23Z,Lua
chicha-ip-proxy,matveynator/chicha-ip-proxy,The fastest and simplest solution for port forwarding. Blazing fast.,2024-12-14T09:46:08Z,2025-11-30T12:07:03Z,Go
rrelayer,joshstevens19/rrelayer,A opensource blazing fast EVM relayer - built in rust.,2024-12-08T18:55:32Z,2025-11-27T16:52:02Z,Rust
katsini,arisecode/katsini," A blazing-fast, lightweight, and user-friendly tool built with Go for retrieving app information from major app stores.",2024-11-20T00:09:00Z,2025-11-20T16:38:45Z,Go
Kataglyphis-Inference-Engine,Kataglyphis/Kataglyphis-Inference-Engine,Deploy your AI easily on Linux/Windows/iOS/Android/Web with blazingly fast inference times and native UI. ,2024-11-16T14:21:19Z,2025-11-26T19:55:37Z,Dart
zeptofetch,Gur0v/zeptofetch,"[ARCHIVED] Blazingly fast, ultra-minimal system information tool for Linux.",2024-11-16T12:32:28Z,2025-11-16T15:14:35Z,C
epub2audiobook,haydonryan/epub2audiobook,Blazingly fast EPUB to Audiobook converter,2024-11-15T19:04:04Z,2025-12-01T19:41:41Z,Rust
sockudo,RustNSparks/sockudo,Blazingly fast pusher drop-in replacement written in rust,2024-11-09T22:01:43Z,2025-11-18T01:17:56Z,Rust
nearust,yutanagano/nearust,Blazingly fast detection of similar strings,2024-11-03T17:42:28Z,2025-12-01T14:31:56Z,Rust
jsony,orsinium-labs/jsony, A blazing fast and safe Go package for serializing JSON,2024-11-01T07:45:07Z,2025-11-20T13:42:54Z,Go
quarkus-fory,quarkiverse/quarkus-fory,A blazingly fast multi-language serialization framework powered by JIT and zero-copy.,2024-10-31T12:13:56Z,2025-11-28T01:42:33Z,Java
neohtop,Abdenasser/neohtop," Blazing-fast system monitoring for your desktop (built with Rust, Tauri & Svelte)",2024-10-30T20:44:11Z,2025-11-28T18:50:40Z,Svelte
trailbase,trailbaseio/trailbase,"A blazingly fast, open-source application server with type-safe APIs, built-in WebAssembly runtime, realtime, auth, and admin UI built on Rust, SQLite & Wasmtime.",2024-10-29T09:39:33Z,2025-12-02T08:30:22Z,Rust
stormint,Confucian-e/stormint,A blazing fast crate that supports multi-account minting of FreeMint tokens,2024-10-24T09:26:18Z,2025-12-01T09:08:06Z,Rust
dotfiles,sergei-durkin/dotfiles, Blazing fast dotfiles for a modern terminal workflow.,2024-10-20T20:05:54Z,2025-11-17T12:52:08Z,Lua
zendriver,cdpdriver/zendriver,"A blazing fast, async-first, undetectable webscraping/web automation framework based on ultrafunkamsterdam/nodriver. Now with Docker support!",2024-10-19T22:12:23Z,2025-11-29T16:35:13Z,Python
StartSCH,kir-dev/StartSCH, Blazingly fast news aggregator site for the Schnherz Dormitory,2024-10-11T12:32:24Z,2025-11-26T15:39:08Z,C#
Diver,qompassai/Diver,Diver: Your blazingly Fast Everything Editor,2024-10-11T08:19:59Z,2025-12-02T01:57:16Z,Lua
ui-apple,shashwatttttt/ui-apple,"Welcome to my Apple-themed website, crafted with immersive 3D animations using Three.js and powered by the blazing-fast Vite build tool. This project showcases modern web development techniques, combining aesthetics and performance to deliver a seamless user experience.",2024-10-05T06:11:25Z,2025-11-18T16:08:07Z,JavaScript
bun-pulse,stephenjason89/bun-pulse,"BunPulse is a lightweight, high-performance WebSocket server built on Bun, fully compatible with the Pusher protocol. With BunPulse, you can easily implement real-time communication in your applications, benefiting from blazing-fast performance, scalability, and secure connections with minimal setup.",2024-09-30T07:07:07Z,2025-11-16T15:38:13Z,TypeScript
dotfiles,rmenai/dotfiles,My dotfiles for blazing fast development,2024-08-20T11:01:21Z,2025-11-30T10:45:20Z,Lua
quickfire,flashvenom/quickfire,"Quickfire is an insurance AMS built for P&C teams, independent agencies, wholesalers, and brokers. Its designed to seamlessly integrate third-party APIs, support customizable workflows, and provide agentic AI tools that streamline both renewals and new business. Quickfire delivers true desktop-grade speed on the blazing-fast Blazor framework.",2024-08-17T17:38:52Z,2025-11-15T03:13:32Z,C#
owc-fantasy-rs,Quintec/owc-fantasy-rs,now blazingly fast,2024-08-16T19:40:45Z,2025-12-01T04:52:41Z,Rust
catboost-cgo,mirecl/catboost-cgo,"CatBoost a fast, scalable, high performance Gradient Boosting on Decision Trees library. Golang using Cgo for blazing fast inference CatBoost Model ",2024-08-13T15:53:52Z,2025-11-29T08:10:10Z,C
overleash,Iandenh/overleash,Override your Unleash feature flags blazing fast,2024-08-06T21:36:52Z,2025-12-01T23:02:39Z,Go
FERS_core,Jeroen124/FERS_core,"Blazingly fast solver for FEM beam calculations, written in Rust",2024-07-30T04:03:36Z,2025-12-01T14:18:21Z,Python
CodeWhisper,gmickel/CodeWhisper,CodeWhisper: AI-Powered End-to-End Task Implementation & blazingly fast Codebase-to-LLM Context Bridge,2024-07-18T23:48:59Z,2025-12-01T04:30:44Z,TypeScript
hyprpaper,OpenMandrivaAssociation/hyprpaper,Blazing fast wayland wallpaper utility with IPC controls,2024-07-06T13:27:56Z,2025-11-21T16:00:01Z,
blazed.js,BlazeInferno64/blazed.js,"Blazing fast, light weight, high performance, promise based HTTP and DNS client for the Node",2024-07-03T13:24:41Z,2025-11-29T11:43:41Z,JavaScript
foxi-astro-theme,oxygenna-themes/foxi-astro-theme,"Foxi is an Astro theme crafted with Tailwind CSS, designed for blazing-fast performance and seamless user experience. Perfect for creating modern, responsive SaaS websites with minimal effort.",2024-07-01T13:17:06Z,2025-11-24T18:40:21Z,Astro
rbuilder,flashbots/rbuilder,"rbuilder is a blazingly fast, state of the art Ethereum MEV-Boost block builder written in Rust",2024-07-01T07:26:00Z,2025-11-27T12:48:01Z,Rust
s42-core,stock42/s42-core,"S42-Core  Blazing-fast Bun.js backend framework with zero-config clustering, intuitive SQL abstraction, and high-performance routing. 100% TypeScript  Minimal boilerplate  Built for speed.",2024-06-26T13:27:00Z,2025-11-25T17:03:27Z,TypeScript
unplugin-isolated-decl,unplugin/unplugin-isolated-decl, A blazing-fast tool for generating isolated declarations.,2024-06-25T12:12:48Z,2025-12-01T16:34:28Z,TypeScript
Utils,ValeriiKoniushenko/Utils,"Blazing fast C++ primitives for everyday coding - strings, colors, positions, delegates, and morefeaturing the insanely fast StringAtom",2024-06-23T19:52:04Z,2025-11-25T21:20:42Z,C++
seismic-foundry,SeismicSystems/seismic-foundry,"Seismic Foundry is a fork of Foundry: a blazing fast, portable and modular toolkit for Ethereum application development written in Rust",2024-06-18T15:38:56Z,2025-11-30T22:24:44Z,Rust
vk-gltf-viewer,stripe2933/vk-gltf-viewer,Blazingly fast Vulkan glTF Viewer,2024-06-05T16:11:33Z,2025-12-02T06:54:19Z,C++
lmutils.r,GMELab/lmutils.r,Tools for blazingly fast statistical analysis in R,2024-05-24T21:34:28Z,2025-11-28T18:09:17Z,Rust
ragoon,louisbrulenaudet/ragoon,"High level library for batched embeddings generation, blazingly-fast web-based RAG and quantized indexes processing ",2024-05-19T17:57:20Z,2025-11-17T20:30:44Z,Jupyter Notebook
KMLightSpigotFree,radek203/KMLightSpigotFree,Minecraft blazing fast 1.8-1.12.2 limbo server,2024-05-11T10:52:51Z,2025-11-17T20:03:30Z,Java
eigen-db,Eigen-DB/eigen-db,The blazingly fast in-memory vector database ,2024-05-07T20:38:55Z,2025-11-30T22:15:32Z,Go
stwo-cairo,starkware-libs/stwo-cairo,"Prove Cairo programs with the blazing-fast S-two prover, powered by the cryptographic breakthrough of Circle STARKs.",2024-04-24T13:23:25Z,2025-12-01T17:28:17Z,Rust
anti-spam-matrix,mokurin000/anti-spam-matrix,A anti-spam Matrix Bot that runs blazingly fast ,2024-03-31T01:40:07Z,2025-12-02T02:55:06Z,Rust
talosctx,bdronneau/talosctx,Blazing fast switcher for your talos contexts,2024-03-05T15:57:24Z,2025-11-24T08:21:20Z,Go
todo-cli,XnonXte/todo-cli,Blazingly fast cli app written in Rust.,2024-03-01T19:43:03Z,2025-12-02T01:45:12Z,Rust
days-since-blazingly-fast,ninpnin/days-since-blazingly-fast,,2024-02-28T22:05:33Z,2025-12-01T08:47:04Z,Python
mistral.rs,EricLBuehler/mistral.rs,Blazingly fast LLM inference.,2024-02-26T22:30:06Z,2025-11-27T02:20:07Z,Rust
react-ts-starter,yeasin2002/react-ts-starter,A production-ready full-stack starter template combining React 19 with TypeScript on the frontend and Nitro for the backend API. Built with Vite for blazing-fast development and optimized builds.,2024-02-16T20:17:05Z,2025-12-01T04:29:53Z,TypeScript
magicblock-validator,magicblock-labs/magicblock-validator,Blazing-Fast SVM Ephemeral Validator,2024-02-15T19:16:13Z,2025-12-02T08:45:49Z,Rust
witch-line,sontungexpt/witch-line,A blazing fast statusline for neovim based on reference concept ,2024-02-14T04:59:14Z,2025-11-26T01:32:52Z,Lua
ThumbGen,thesn10/ThumbGen,Customizable cross-platform blazing-fast video thumbnail generator with many options for .NET 8. Choose between System.Drawing engine or ImageMagick engine,2024-01-26T13:17:47Z,2025-11-29T12:30:57Z,C#
thought,lexoliu/thought,"A blazingly fast static site generator for your blog, written in Rust.",2024-01-24T09:51:10Z,2025-11-25T03:33:17Z,Rust
complexipy,rohaquinlop/complexipy,"Blazingly fast cognitive complexity analysis for Python, written in Rust.",2024-01-21T07:11:09Z,2025-11-26T17:20:25Z,Python
hypertext,vidhanio/hypertext,A blazing fast type-checked HTML macro crate.,2024-01-12T03:34:30Z,2025-11-21T06:10:11Z,Rust
turbo-cache-server,brunojppb/turbo-cache-server,Blazingly fast Turborepo remote cache server written in Rust as a Github Action and Docker for ARM64 and AMD64 Linux,2023-12-31T21:48:21Z,2025-12-01T08:51:41Z,Rust
rindexer,joshstevens19/rindexer,A no-code or framework to build blazing fast EVM indexers - built in rust.,2023-12-26T23:24:26Z,2025-11-26T12:34:00Z,Rust
NpgsqlRest,NpgsqlRest/NpgsqlRest,"Transform Your PostgreSQL Database into a Production-Ready, Blazing-Fast Standalone REST API Web Server With Static Type Checking and Automatic Code Generation",2023-12-15T10:14:38Z,2025-11-28T09:14:09Z,C#
lqth,0x61nas/lqth, Simple but blazingly fast screenshot utility,2023-12-11T21:50:20Z,2025-11-20T16:41:18Z,Rust
echo-vault,coalaura/echo-vault,A blazing fast minimal ShareX backend written in golang.,2023-11-27T17:31:36Z,2025-12-01T20:16:42Z,Go
SimpleW,stratdev3/SimpleW,SimpleW is Web server Library in .NET Core. Powerfully Simple and Blazingly Fast.,2023-11-05T12:58:38Z,2025-12-02T00:09:20Z,C#
cojocarudavid.me,cojocaru-david/cojocarudavid.me,Blazing fast personal website built with Astro.js and styled with Tailwind CSS. ,2023-10-16T19:36:58Z,2025-11-30T20:10:43Z,Astro
FlyPhotos,riyasy/FlyPhotos,A blazing fast ultra-light photo viewer replacement for Windows. Works similar to Picasa Photo Viewer.,2023-10-12T09:54:03Z,2025-11-19T04:53:01Z,C#
routerino,nerds-with-keyboards/routerino,SEO-optimized React micro-framework (static site generator & router) for blazing fast websites and applications,2023-09-25T13:39:10Z,2025-11-27T22:18:59Z,JavaScript
beff,lucasavila00/beff,Efficient validators from Typescript types generated by a blazing fast compiler,2023-08-28T02:32:08Z,2025-12-02T04:14:57Z,Rust
