name,full_name,description,created_at,pushed_at,language
try-rs,tassiovirginio/try-rs,"A blazing fast, Rust-based workspace manager for your temporary experiments.",2025-12-17T02:34:47Z,2026-03-29T21:33:02Z,Rust
plasmoid-updater,uwuclxdy/plasmoid-updater,Blazingly fast KDE Plasmoid updater.,2025-12-14T11:54:27Z,2026-03-31T19:12:25Z,Rust
RustService,SonnyTaylor/RustService,A blazing-fast portable toolkit for computer repair technicians powered by Rust with a built in AI agent.,2025-12-14T07:40:02Z,2026-03-25T02:01:13Z,TypeScript
Smart-Image-Vision,Asad-Aziz-001/Smart-Image-Vision,"AI-powered Streamlit app that instantly analyzes any image using Salesforce BLIP (deep vision model). Generates rich natural-language descriptions + detects dominant colors with RGB values. Modern glassmorphic UI, blazing fast, fully open-source. Built by ASAD-AZIZ",2025-12-11T19:27:30Z,2026-03-31T09:39:33Z,Python
Astrobot,Next-Mountain-Ventures-LLC/Astrobot,Repository for Astrobot.design: Futuristic AI-Powered Blazing Fast Websites with Human Designer Collaboration,2025-12-11T00:45:38Z,2026-03-27T21:19:44Z,TypeScript
tablers,monchin/tablers,A blazingly fast PDF table extraction library with python API powered by Rust,2025-12-09T07:27:48Z,2026-03-30T13:56:32Z,Rust
veil-rs,mt4110/veil-rs,"CI/CDPIIRust / Prevent secret leaks at commit & CI/CD stage. A blazing fast, local-first scanner specialized in Japanese PII (My Number, etc.). Features commercial-grade reporting.",2025-12-07T23:01:58Z,2026-03-30T01:00:29Z,Rust
csvq,abiiranathan/csvq,"A blazing fast, C-based command-line tool to pretty-print, filter, query, and convert CSV/TSV data",2025-12-07T15:11:05Z,2026-03-29T14:56:54Z,C
AkkaraDB-CXX,SwiftStorm-Studio/AkkaraDB-CXX,"The all-purpose KV store: blazing fast and reliably durable, scaling from tiny embedded cache to large-scale distributed database",2025-12-04T15:00:31Z,2026-03-31T14:41:31Z,C++
synfetch,SXSLVT/synfetch,"A simple, debloated and blazingly fast system fetch written in bash  works on many Linux distributions + macOS",2025-11-27T20:37:04Z,2026-03-31T19:47:03Z,Shell
gxhash,winstxnhdw/gxhash,"Python bindings for GxHash, a blazingly fast and robust non-cryptographic hashing algorithm.",2025-11-27T19:58:07Z,2026-04-01T04:46:16Z,Rust
PyOZ,pyozig/PyOZ,PyOZ - Zig's power meets Python's simplicity. Build blazing-fast extensions with zero boilerplate and zero Python C API headaches.,2025-11-26T00:08:48Z,2026-03-25T09:51:58Z,Zig
SwitchNet,cg955gtr/SwitchNet,A blazingly fast and easy to use networking module for reducing bandwidth and overhead across remotes.,2025-11-23T10:43:30Z,2026-03-24T10:53:53Z,Luau
RustyWeb,struggyyy/RustyWeb,"A blazing-fast Next.js administrative dashboard and landing page for the Rusty ecosystem. Built to help city admins efficiently review, map, and resolve abandoned vehicle reports submitted by the community.",2025-11-22T10:40:16Z,2026-03-29T14:49:02Z,TypeScript
heliumts,heliobentes/heliumts,Blazing fast and opinionated full-stack React + Vite framework,2025-11-20T01:56:08Z,2026-03-29T00:59:51Z,TypeScript
MultithreadedGameEngine,brotochola/MultithreadedGameEngine,"A blazing-fast multithreaded web game engine that handles 20,000+ NPCs without breaking a sweat.",2025-11-15T18:26:09Z,2026-03-28T00:26:59Z,JavaScript
queryverse,johnyenter-briars/queryverse,Perform SQL queries against Microsoft Dataverse  blazinglyfast.,2025-11-15T16:54:30Z,2026-03-29T00:05:09Z,TypeScript
OpenChat,ZerosAndOnesLLC/OpenChat,A Blazing Fast Full Featured Chat Platform Powered By Rust,2025-11-14T20:35:48Z,2026-03-24T23:59:35Z,Rust
DevShelf,qasimio/DevShelf,Blazing-fast offline search for 250+ CS books  built from scratch in Java.,2025-11-14T19:48:07Z,2026-03-29T20:03:41Z,Java
Blazingly-Fast-Discord-Client,Williamjacobsen/Blazingly-Fast-Discord-Client,,2025-11-13T23:04:51Z,2026-03-31T21:53:40Z,Rust
mockers,pokatomnik/mockers,Blazingly  fast HTTP mocking server written in Rust,2025-11-12T14:54:38Z,2026-03-30T19:45:04Z,Rust
zedis,vicanso/zedis,"Zedis: A blazing-fast, native Redis GUI built with Rust and GPUI.",2025-11-09T12:21:15Z,2026-03-28T08:01:01Z,Rust
audx-android,rizukirr/audx-android,Blazingly fast Android library for real-time audio denoising with built-in Voice Activity Detection (VAD) base on Recurrent Neural Networks,2025-11-09T11:57:22Z,2026-03-27T16:18:08Z,Kotlin
oval,tubblelive/oval,A blazingly fast geolocation microservice,2025-11-07T05:52:29Z,2026-03-24T21:11:03Z,Rust
wikistxr,t7ru/wikistxr,A blazingly fast Wikitext library for syntax highlighting or editing.,2025-11-02T15:48:27Z,2026-03-31T21:51:31Z,TypeScript
ntt,evgnomon/ntt,"A blazingly fast, modern terminal switcher built with Zig. NTT does this transparently, in a way that your terminal is still on top of everything else.",2025-11-02T11:06:21Z,2026-03-28T10:25:42Z,Zig
Surge,surge-downloader/Surge,Blazing fast TUI download manager built in Go for power users,2025-10-29T05:00:15Z,2026-03-30T13:21:54Z,Go
auroraview,loonghao/auroraview,"A blazingly fast, lightweight WebView framework for DCC (Digital Content Creation) software, built with Rust and Python bindings.",2025-10-27T10:35:19Z,2026-04-01T08:12:45Z,Rust
optimus-desktop,Geetansh-Jangid/optimus-desktop,Convert a minimal archinstall into a blazingly fast and productive desktop,2025-10-25T14:39:22Z,2026-03-31T04:33:13Z,Shell
eslint-plugin-oxfmt,ntnyq/eslint-plugin-oxfmt,:package: An ESLint plugin for formatting code with oxfmt - A blazing fast formatter powered by Rust.,2025-10-22T09:44:09Z,2026-04-01T03:41:15Z,TypeScript
rats,aharvey101/rats," Blazing fast fuzzy file browser built with Rust and Ratatui, featuring seamless Neovim integration",2025-10-19T12:21:42Z,2026-03-30T21:52:55Z,Rust
openapi-php-sdk,openapi/openapi-php-sdk, A fully-featured and blazing-fast PHP API client to interact with Openapi,2025-10-13T18:03:07Z,2026-03-30T16:45:22Z,PHP
Veloce-TS,ExcessHawk/Veloce-TS,"Veloce brings FastAPI's elegant developer experience to TypeScript. Built on Hono for blazing-fast performance (137k+ req/s), it combines decorators, automatic validation, OpenAPI docs, and dependency injection in a type-safe package that works everywhere.",2025-10-12T23:16:08Z,2026-03-30T04:35:45Z,TypeScript
fdv.lol.bot,Alpa8820/fdv.lol.bot,BLAZING-FAST client-side SOL memecoin radar with explainable GOOD/WATCH/SHILL.,2025-10-11T03:17:23Z,2026-03-31T23:01:29Z,JavaScript
fdv.lol.bot,hayaseta/fdv.lol.bot,BLAZING-FAST client-side SOL memecoin radar with explainable GOOD/WATCH/SHILL.,2025-10-11T02:29:29Z,2026-03-31T22:58:04Z,JavaScript
fdv.lol.bot,codekami45/fdv.lol.bot,BLAZING-FAST client-side SOL memecoin radar with explainable GOOD/WATCH/SHILL.,2025-10-11T02:17:32Z,2026-04-01T05:12:07Z,JavaScript
Sho,scapy47/Sho,"Search, Browse, and Watch Anime Directly from Terminal Blazingly Fast",2025-10-06T18:36:41Z,2026-03-28T19:06:13Z,Rust
tool-model-to-pipeline,SiMa-ai/tool-model-to-pipeline, Transform your FP32 ONNX YOLO model into a  blazing-fast SiMa.ai MPK pipeline  ready to deploy on edge hardware ,2025-10-02T14:20:58Z,2026-03-27T11:05:20Z,Python
gh-enhance,dlvhdr/gh-enhance,A Blazingly Fast Terminal UI for GitHub Actions,2025-10-02T13:29:51Z,2026-03-27T15:44:59Z,Go
SnipForge,ArtluxDM/SnipForge,"A blazing fast snippet palette that lives on your desktop. Save commands, code blocks, prompts, and templates. Search instantly, copy with variables.",2025-09-21T18:41:55Z,2026-03-29T20:44:29Z,Vue
duk_yyjson,HumanBodyMacAndCheese/duk_yyjson,Override the default JSON.parse method with yyjson's blazingly fast capabilities. ,2025-09-14T21:34:31Z,2026-03-27T20:20:42Z,C
vielzeug,helmuthdu/vielzeug,"Type-safe utilities, blazing-fast storage, flexible logging, and more  all in one monorepo.",2025-09-12T05:20:24Z,2026-03-26T06:36:50Z,TypeScript
project-indexly,kimsgent/project-indexly,"Local File Search Tool with SQLite FTS5. Blazing-fast Search, Tagging and Export",2025-09-07T13:27:50Z,2026-03-30T06:10:58Z,Python
Seeder,shivansh-pataku/Seeder,"A lightweight, responsive, and blazingly fast task and notes management application",2025-09-05T20:05:35Z,2026-03-28T17:16:20Z,JavaScript
ChronoGrapher,GitBrincie212/ChronoGrapher,"Powerful, developer-experience centric, blazingly fast and extensible job scheduler and workflow orchestration platform",2025-09-05T14:16:21Z,2026-03-31T16:03:18Z,Rust
rules_rs,hermeticbuild/rules_rs,"Next-gen Rust Bazel rules which provide a blazing-fast ergonomic `crate_universe` reimplementation, first-class Windows support, optimized toolchains, and more.",2025-09-05T12:43:28Z,2026-03-31T12:20:04Z,Starlark
YT-Forge,Shaikh-Suja-Rahaman/YT-Forge,"A blazing fast, minimalist desktop YouTube Video Downloader and yt-dlp GUI wrapper for Mac, Windows, and Linux",2025-09-02T14:08:54Z,2026-03-22T17:11:08Z,HTML
csm.rs,cartesia-one/csm.rs,Blazing-fast rust implementation of Sesame's Conversational Speech Model (CSM),2025-09-01T10:14:08Z,2026-03-26T18:32:57Z,Rust
fdv.lol,build23w/fdv.lol,"BLAZING-FAST client-side SOL memecoin radar with explainable GOOD/WATCH/SHILL. Trader (Auto), Sentry (Sniper), Hold, Follow, and bots.",2025-08-31T15:02:12Z,2026-04-01T08:38:09Z,JavaScript
blazediff,teimurjan/blazediff,Blazing-fast diff ecosystem for JavaScript applications,2025-08-29T10:59:23Z,2026-03-24T08:48:05Z,Rust
BUGSVIM,Abhra00/BUGSVIM,BLAZINGLY FAST NEOVIM SHUTTHEFUCKUP,2025-08-26T21:16:11Z,2026-03-25T19:33:42Z,Lua
Bootstrap,TheRickyZhang/Bootstrap,From zero to blazing fast workflow.,2025-08-26T17:03:46Z,2026-03-27T00:55:55Z,Lua
gopie,factly/gopie,"GoPie is an open-source platform for natural-language data analysis. GoPie turns datasets into blazing-fast, AI-ready databases with auto-generated APIs. No technical expertise required.",2025-08-22T03:51:04Z,2026-03-31T11:12:56Z,TypeScript
lupabase,sonicjhon1/lupabase,"Blazingly fast (work-in-progress) database written entirely in Rust and focuses on simplicity, portability with flexible storage backends",2025-08-13T11:37:12Z,2026-03-26T05:13:22Z,Rust
marwa-event,memran/marwa-event,"Blazing-fast, PSR-14compliant event dispatcher with Laravel-style ergonomics  no globals, container-friendly, and easy to test.",2025-08-12T15:28:24Z,2026-03-31T12:11:41Z,PHP
blaze,livewire/blaze,Pre-compile Blade components for blazing fast rendering performance,2025-08-08T01:00:41Z,2026-03-27T23:41:28Z,PHP
Gruxi,DaevTech/Gruxi,"High-performance Rust web server with built-in admin interface. Features blazing-fast static file serving, PHP support, TLS, HTTP/2, reverse proxy, load balancing, and caching for backend services.",2025-07-29T20:37:58Z,2026-03-29T21:37:29Z,Rust
cwal,nitinbhat972/cwal,Blazing-fast pywal-like color palette generator written in C.,2025-07-26T13:20:59Z,2026-04-01T07:37:14Z,C
v2go,Danialsamadi/v2go,"v2go is a blazingly fast Go V2Ray config aggregator that processes 20,000+ configurations in 11 seconds (99.7% faster than Python), automatically removing duplicates and generating fresh subscription files every 6 hours.",2025-07-22T21:41:02Z,2026-04-01T08:19:16Z,Go
batless,docdyhr/batless,"Minimal, blazing-fast syntax viewer for the terminal  never blocks, never pages, never hangs. Perfect for code, logs, and AI pipelines.",2025-07-22T19:36:29Z,2026-03-30T09:20:56Z,Rust
Foundatio.Mediator,FoundatioFx/Foundatio.Mediator,"Blazingly fast, convention-based C# mediator powered by source generators and interceptors.",2025-07-20T03:05:02Z,2026-04-01T02:21:26Z,C#
rustytime,ImShyMike/rustytime, blazingly fast time tracking for developers,2025-07-15T22:21:44Z,2026-04-01T06:29:25Z,Rust
parsecio,ejacobhayes/parsecio," A blazing-fast, self-updating dashboard for your GitHub stars  smartly categorized, beautifully designed, and fully static with zero dependencies.",2025-07-15T07:46:19Z,2026-04-01T05:28:07Z,JavaScript
proto-migrate,jackchuka/proto-migrate,"Protocol Buffer migrations done right - AST-aware, safe, and blazing fast ",2025-07-11T14:37:57Z,2026-03-31T01:44:27Z,Go
obsidian-parser,CryptoGladi/obsidian-parser,Blazingly fast Obsidian vault parser with graph analysis,2025-07-04T21:26:07Z,2026-03-28T12:30:49Z,Rust
fbuild,FastLED/fbuild,"A blazing fast build tool for Esp32, Teensy, Avr, Nrf, Raspberri PI, Stm, Mgm240 and more.",2025-06-29T20:47:28Z,2026-03-28T00:49:29Z,Python
binius64,binius-zk/binius64,"Binary Proofs, Blazing Fast",2025-06-27T15:19:26Z,2026-03-31T19:44:40Z,Rust
ezfetch,wtfenzo/ezfetch,"ezfetch is a blazing-fast, cross-platform system information tool written in Python. Its designed to mimic the aesthetic and functionality of neofetch, while remaining lightweight, fully customizable, and easy to extend.",2025-06-19T15:51:19Z,2026-03-23T05:15:31Z,Python
zeusdb-vector-database,ZeusDB/zeusdb-vector-database,Blazing-fast vector DB with real-time similarity search and metadata filtering,2025-06-18T04:24:07Z,2026-03-22T10:50:31Z,Python
rossby,climate-tensor/rossby,"Rossby is a blazingly fast, in-memory, NetCDF-to-API server written in Rust.",2025-06-16T12:19:02Z,2026-04-01T03:25:19Z,Rust
Reminist,AsterFlow/Reminist,"Blazing fast, zero-dependency, TypeScript-native router for any environment.",2025-06-12T15:30:56Z,2026-03-31T03:58:06Z,TypeScript
mongospec,diprog/mongospec, Blazing-fast async MongoDB ODM with msgspec serialization and automatic collection binding,2025-05-18T12:49:34Z,2026-03-31T15:23:08Z,Python
JBird,vsanthanam/JBird,"A blazing fast, type-safe library for working with JSON in Swift",2025-05-16T19:54:49Z,2026-03-31T03:25:57Z,Swift
The-Pokedex-Database,YAVUZGIYIM/The-Pokedex-Database," An interactive Pokdex app built with Next.js, Tailwind CSS, and React Query for blazing-fast performance and smooth UX. Includes live search, item explorer, and a favorites system powered by local storage.",2025-05-11T00:57:31Z,2026-04-01T08:08:40Z,TypeScript
kingfisher,mongodb/kingfisher,"Kingfisher is a blazingly fast and highly accurate tool for secret detection and live validation across files, Git repos, GitHub, GitLab, Azure Repos, BitBucket, Gitea, AWS S3, Docker images, Slack, Teams, Jira, and Confluence",2025-05-08T17:27:15Z,2026-03-31T02:43:47Z,Rust
hashgen,jaliyadev/hashgen,"hashgen - the blazingly fast hash generator argon, base58, base64, bcrypt, cyclone, generator, hash, hashcat, hashgen, md5, mdxfind, mosecode, multithreaded, ntlm, sha, sha1, sha256, sha3, threaded, yescrypt",2025-05-03T18:54:18Z,2026-04-01T08:07:38Z,Go
portfolio,cojocaru-david/portfolio,"A modern, high-performance personal portfolio and blog built with Astro.js. Designed to showcase your projects and technical writing with blazing-fast performance and exceptional SEO.",2025-04-22T09:53:18Z,2026-03-26T20:09:09Z,TypeScript
bad-placeholder-cli,DouglasBlackwood/bad-placeholder-cli,Download placeholder images from public domain sources blazingly fast,2025-04-15T13:09:32Z,2026-03-24T14:54:57Z,JavaScript
esimport,codingjoe/esimport,Blazing fast ESM compiler and importmap generator,2025-04-13T14:28:07Z,2026-03-31T15:33:16Z,JavaScript
THE-CUBE,cybruGhost/THE-CUBE,"A Movie Streaming web-site experience built for thrill-seekers, binge-watchers, and late-night explorers. Minimal design, powerful interface, blazing fast playback.",2025-04-10T17:27:10Z,2026-03-27T05:07:11Z,
baax,BaaxCli/baax,Baax is a blazing fast Backend build tool powering the next generation of web applications.,2025-04-06T07:46:11Z,2026-03-24T10:04:11Z,TypeScript
zvips,bernardassan/zvips,A blazingly fast image processing library in Zig using libvips,2025-04-05T13:03:18Z,2026-03-30T23:33:30Z,Zig
fluiva,ehabhosam/fluiva,"Blazing fast planning full-stack web app built with a React client, a Nest API and a Go service.",2025-03-29T13:25:48Z,2026-03-28T14:52:22Z,TypeScript
codestats,trypsynth/codestats,Blazing fast code analysis tool with tons of customization options.,2025-03-27T19:39:20Z,2026-04-01T00:29:27Z,Rust
subtitle-translator,rockbenben/subtitle-translator," Blazing-fast batch subtitle translation for SRT/ASS/VTT/LRC  70+ languages, AI-powered ",2025-03-23T10:13:20Z,2026-03-30T08:50:55Z,TypeScript
mockhttp-websockets,richardszalay/mockhttp-websockets,Write blazing fast tests for ClientWebSocket with no abstractions,2025-03-22T10:52:07Z,2026-03-26T23:59:51Z,C#
tgv,zeqianli/tgv,"Explore genomes in the terminal. Light, blazing fast , vim-motion.",2025-03-20T19:31:46Z,2026-03-27T13:38:56Z,Rust
tmux-fzf,tmux-contrib/tmux-fzf,"Blazing-fast project and session switching for tmux, powered by fzf",2025-03-17T11:03:21Z,2026-03-30T02:38:33Z,Shell
uncomment,Goldziher/uncomment,Blazingly fast CLI to remove comments from code using tree-sitter grammers,2025-03-05T06:11:12Z,2026-03-23T10:59:11Z,Rust
fujin,fujin-io/fujin," Blazingly fast, cloud native, universal broker connector",2025-02-28T18:34:14Z,2026-03-27T17:06:31Z,Go
fingerprint-oss,IntegerAlex/fingerprint-oss,"A Blazingly fast simple client-side fingerprinting library that logs user information, fingerprint users.",2025-02-22T21:08:07Z,2026-03-31T18:59:25Z,TypeScript
timbal,timbal-ai/timbal,"Timbal is an open-source python framework for building reliable AI applications, battle-tested in production with simple, transparent architecture that eliminates complexity while delivering blazing fast performance, robust typing, and API stability in an ever-changing ecosystem.",2025-02-21T09:42:42Z,2026-04-01T08:34:51Z,Python
JaxDEM,cdelv/JaxDEM,Easy to use and blazing fast JAX-based library for high-performance 2D/3D Discrete Element Method (DEM) simulations.,2025-02-19T15:46:49Z,2026-03-24T02:53:32Z,Python
emme,marlecce/emme,"High-performance C web server engineered trying to outpace industry giants like Nginx and Apache. Powered by io_uring and a custom in-place HTTP parser, it delivers ultra-low latency and blazing-fast responses.",2025-02-05T19:24:29Z,2026-03-27T20:24:52Z,C
bundlemonkey,mkobayashime/bundlemonkey,Bundlemonkey is a userscript bundler designed to make developing browser userscripts blazing fast and efficient.,2025-02-02T18:25:36Z,2026-03-31T05:52:05Z,TypeScript
logmerge-go,mmdemirbas/logmerge-go,Blazing fast log aggregator: merge massive log files and archives into a single time-sorted file,2025-01-16T23:20:51Z,2026-03-24T11:37:21Z,Go
justified-layout,immich-app/justified-layout,"A blazingly fast implementation of the justified layout gallery view popularized by Flickr, written in Rust and exported to WebAssembly.",2025-01-10T02:11:48Z,2026-03-31T12:10:12Z,Rust
orpheus,ajac-zero/orpheus,"A blazing fast OpenAI-compatible client for Python, written in Rust.",2025-01-05T05:53:11Z,2026-03-31T06:19:15Z,Rust
oxidasim,AndrejOrsula/oxidasim,Blazing fast utilities for simulations,2025-01-01T16:36:20Z,2026-03-30T06:40:57Z,Rust
php-handlebars,devtheorem/php-handlebars,"A blazing fast, spec-compliant PHP implementation of Handlebars.",2024-12-29T01:06:52Z,2026-03-30T22:13:32Z,PHP
crud-duckdb-python,Manikandan-Parasuraman/crud-duckdb-python,"A production-grade FastAPI backend implementing full CRUD operations with DuckDB. Built with professional Clean Architecture (Repository/Service pattern), Pydantic v2, and multi-stage Docker optimization. Blazing fast, local-first, and zero-infra cost.",2024-12-25T11:32:15Z,2026-03-24T17:05:25Z,Python
workshop,akshit-arora/workshop, A comprehensive DevX desktop toolkit for Laravel developers. Blazing fast Rust core + modern ReactUI.,2024-12-25T08:57:25Z,2026-03-28T15:38:17Z,TypeScript
Astra,ArkForgeLabs/Astra, Blazingly Fast  runtime environment for Lua,2024-12-21T08:17:31Z,2026-03-30T19:37:14Z,Lua
multilayer-perceptron,mylastresort/multilayer-perceptron,Blazingly fast neural network,2024-12-20T16:49:53Z,2026-03-25T01:04:02Z,HTML
fce-frontend,DishIs/fce-frontend,"Open-source Next.js frontend for FreeCustom.Email  ad-free, blazing fast disposable email UI. Plug in any API or self-host.",2024-11-30T07:35:11Z,2026-03-31T19:20:14Z,TypeScript
polars-bio,biodatageeks/polars-bio,Blazing-Fast Bioinformatic Operations on Python DataFrames,2024-11-26T16:58:18Z,2026-03-24T08:35:09Z,Python
BFTML,npetrangelo/BFTML,Blazingly Fast Text Markup Language. Standards designed for web apps. Browser implementation in Rust.,2024-11-19T05:43:01Z,2026-03-31T02:30:57Z,Rust
zeptofetch,Gur0v/zeptofetch," Blazingly fast, ultra-minimal system information tool for Linux.",2024-11-16T12:32:28Z,2026-03-28T17:54:55Z,C
epub2audiobook,haydonryan/epub2audiobook,Blazingly fast EPUB to Audiobook converter,2024-11-15T19:04:04Z,2026-03-30T02:11:38Z,Rust
sockudo,sockudo/sockudo,Blazingly fast pusher drop-in replacement written in rust,2024-11-09T22:01:43Z,2026-03-31T10:57:29Z,Rust
quarkus-fory,quarkiverse/quarkus-fory,A blazingly fast multi-language serialization framework powered by JIT and zero-copy.,2024-10-31T12:13:56Z,2026-03-28T08:45:12Z,Java
neohtop,Abdenasser/neohtop," Blazing-fast system monitoring for your desktop (built with Rust, Tauri & Svelte)",2024-10-30T20:44:11Z,2026-03-30T08:15:15Z,Svelte
stormint,Confucian-e/stormint,A blazing fast crate that supports multi-account minting of FreeMint tokens,2024-10-24T09:26:18Z,2026-03-30T04:38:20Z,Rust
dotfiles,sergei-durkin/dotfiles, Blazing fast dotfiles for a modern terminal workflow.,2024-10-20T20:05:54Z,2026-03-29T11:35:57Z,Lua
about-me,jruipinto/about-me,A blazingly fast page about me,2024-10-17T18:36:16Z,2026-03-27T22:02:25Z,TypeScript
HODL,clasen/HODL," HODL Wallet - Blazing-fast, transparent, and ad-free crypto wallet",2024-10-14T19:36:08Z,2026-03-31T14:05:30Z,JavaScript
Diver,qompassai/Diver,Diver: Your blazingly Fast Everything Editor,2024-10-11T08:19:59Z,2026-03-30T03:27:34Z,Lua
XTranslate,kzxl/XTranslate,"A modern, lightweight, and blazing-fast desktop translation tool for Windows. Built with WPF and .NET 8, inspired by QTranslate.",2024-09-17T02:27:29Z,2026-03-22T11:36:21Z,C#
run.nvim,Seba244c/run.nvim,Blazingly fast action runner for NeoVim,2024-09-04T13:33:20Z,2026-03-22T13:03:26Z,Lua
in-memory-azure-test-sdk,spotflow-io/in-memory-azure-test-sdk,"Drop-in fakes of Azure .NET SDKs to make your tests runnable locally, without real infrastructure, blazing-fast and reliable.",2024-08-09T13:40:48Z,2026-03-26T16:35:07Z,C#
overleash,Iandenh/overleash,Override your Unleash feature flags blazing fast,2024-08-06T21:36:52Z,2026-03-31T22:33:21Z,Go
blazed.js,BlazeInferno64/blazed.js,"Blazing fast, light weight, high performance, promise based HTTP and DNS client for the Node",2024-07-03T13:24:41Z,2026-03-27T11:11:30Z,JavaScript
foxi-astro-theme,oxygenna-themes/foxi-astro-theme,"Foxi is an Astro theme crafted with Tailwind CSS, designed for blazing-fast performance and seamless user experience. Perfect for creating modern, responsive SaaS websites with minimal effort.",2024-07-01T13:17:06Z,2026-03-31T06:32:05Z,Astro
rbuilder,flashbots/rbuilder,"rbuilder is a blazingly fast, state of the art Ethereum MEV-Boost block builder written in Rust",2024-07-01T07:26:00Z,2026-04-01T07:51:46Z,Rust
s42-core,stock42/s42-core,"S42-Core  Blazing-fast Bun.js backend framework with zero-config clustering, intuitive SQL abstraction, and high-performance routing. 100% TypeScript  Minimal boilerplate  Built for speed.",2024-06-26T13:27:00Z,2026-03-25T22:24:51Z,TypeScript
unplugin-isolated-decl,unplugin/unplugin-isolated-decl, A blazing-fast tool for generating isolated declarations.,2024-06-25T12:12:48Z,2026-03-31T14:56:33Z,TypeScript
Utils,ValeriiKoniushenko/Utils,"Blazing fast C++ primitives for everyday coding - strings, colors, positions, delegates, and morefeaturing the insanely fast StringAtom",2024-06-23T19:52:04Z,2026-03-27T21:13:40Z,C++
KMLightSpigotFree,radek203/KMLightSpigotFree,Minecraft blazing fast 1.8-1.12.2 limbo server,2024-05-11T10:52:51Z,2026-03-30T19:30:57Z,Java
rollup-plugin-fast-typescript,Septh/rollup-plugin-fast-typescript,"A Rollup plugin that uses esbuild, swc or sucrase (you decide!) for blazing fast TypeScript transpilation.",2024-05-04T03:17:01Z,2026-03-22T12:27:20Z,TypeScript
ZOTX,ZOTX0/ZOTX,"The code behind zotx.net. A blazing-fast, SEO-optimized personal portfolio built to showcase my background in Human Resources, and digital entrepreneurship.",2024-04-29T18:05:56Z,2026-03-30T04:32:00Z,HTML
hanoi-speedrapp,SpeckyYT/hanoi-speedrapp,Blazingly fast Tower of Hanoi speedrunning app,2024-04-24T18:53:30Z,2026-03-26T20:25:19Z,Rust
stwo-cairo,starkware-libs/stwo-cairo,"Prove Cairo programs with the blazing-fast S-two prover, powered by the cryptographic breakthrough of Circle STARKs.",2024-04-24T13:23:25Z,2026-03-31T14:12:02Z,Rust
gossiphs,williamfzc/gossiphs,"""Zero setup"" & ""Blazingly fast"" general code file relationship analysis. With Python & Rust. Based on tree-sitter and git analysis. Support MCP and ready for AI",2024-04-08T09:40:23Z,2026-03-28T04:04:26Z,Rust
Tsetlin.jl,BooBSD/Tsetlin.jl,"The Fuzzy-Pattern Tsetlin Machine library, with zero external dependencies, performs blazingly fast.",2024-04-06T22:13:27Z,2026-03-30T09:44:57Z,Julia
python-uv,a5chin/python-uv,"A production-ready Python development environment template using modern tools: uv for blazing-fast package management, Ruff for lightning-fast linting and formatting, ty for fast and reliable type checking, and VSCode Dev Containers for reproducible development environments.",2024-04-05T13:04:20Z,2026-03-29T21:05:37Z,Python
acronym-lookup,mfurak/acronym-lookup,Blazingly fast CLI tool for looking up acronyms,2024-04-05T11:33:29Z,2026-03-26T21:01:34Z,Rust
anti-spam-matrix,mokurin000/anti-spam-matrix,A anti-spam Matrix Bot that runs blazingly fast ,2024-03-31T01:40:07Z,2026-03-31T13:27:07Z,Rust
days-since-blazingly-fast,ninpnin/days-since-blazingly-fast,,2024-02-28T22:05:33Z,2026-03-31T08:55:36Z,Python
Rapid.js,Nightre/Rapid.js, A blazing-fast WebGL-based 2D rendering engine for games,2024-02-19T08:09:05Z,2026-03-28T06:24:21Z,TypeScript
magicblock-validator,magicblock-labs/magicblock-validator,Blazing-Fast SVM Ephemeral Validator,2024-02-15T19:16:13Z,2026-04-01T08:37:57Z,Rust
ofxBlend2D,Daandelange/ofxBlend2D,Lib Blend2D addon for OpenFrameworks : a blazing fast CPU 2D vector graphics renderer.,2024-01-29T13:38:01Z,2026-03-26T17:49:09Z,C++
