framework,full_name,description
,Myzel394/jsonfly.nvim, Fly through your JSON / XML / YAML files with ease. Search  blazingly fast  for keys via Telescope.
,bunny-ts/bunny,Blazingly fast framework for Bun
,nathan-barry/nathan.rs,My personal site using Hugo for static site generation. Blazingly Fast.
,arjunkomath/RustyInk,A blazing fast static site generator in Rust
,dgox16/shordly,Shordly - URL Shortener Blazingly Fast
,JesseKoldewijn/Jereko,Blazingly fast App Router based Next.js application used as my personal portfolio
,paulsengroup/hictk,Blazing fast toolkit to work with .hic and .cool files
,joshstevens19/rindexer,A no-code blazing fast EVM indexer tool built in rust.
,game-node-app/game-node-search,"GameNode's search system, made with . BLAZINGLY FAST."
,rishavmehra/goMeet,Blazingly fast Golang powered Video Conferencing app
,yuki0iq/statusline,Blazingly-fast PS1 statusline for bash (mirror)
,flashbots/rbuilder,"rbuilder is a blazingly fast, state of the art Ethereum MEV-Boost block builder written in Rust"
,blahberi/Cornflakes,"Cornflakes is a versatile, lightweight, blazingly fast Dependency Injection framework for .NET written in C#."
,henryco/BlazeJump-Obsidian,Plugin for Obsidian that makes text navigation blazingly fast.
,apache/fury,A blazingly fast multi-language serialization framework powered by JIT and zero-copy.
,Harvtronix/react-substate,"Blazing-fast, centralized state management with auto-guaranteed, immutable state changes"
,rusty-dicom/dicom-echo,A blazingly fast implementation of the C-ECHO DICOM procedure 
,falko-team/talkie,"Talkie is a framework for creating bots across messaging platforms. Write code once, deploy everywere (for Telegram, Discord, and more). Also, its lightweight and modular design, parallel processing and native AOT compilation, keep your bots blazing fast with minimal memory usage"
,huff-language/huff-rs,A low-level assembly language for the Ethereum Virtual Machine built in blazing-fast pure rust.
,OsakiTsukiko/nimrod,Blazingly fast uncentralized authority signing API written in Zig.
,fuzzland/ityfuzz,Blazing Fast Bytecode-Level Hybrid Fuzzer for Smart Contracts
,trailbaseio/trailbase,"A blazingly fast, single-file, and open-source server for your application with type-safe restful APIs, auth, admin dashboard, and more."
,unplugin/unplugin-isolated-decl, A blazing-fast tool for generating isolated declarations.
,chrisjsewell/markdown-it-pyrs,"A Python interface for markdown-it.rs, using Rust for blazingly fast parsing  "
,berkaygediz/PASPAS," Blazing-fast, lightweight and portable system maintenance software."
,Daandelange/ofxBlend2D,Lib Blend2D addon for OpenFrameworks : a blazing fast CPU 2D vector graphics renderer.
,blt-r/snekgame,"Highly customizable, cross-platform, and blazingly fast terminal snake game."
,FarhadF/geoip-server-rs,Blazing fast geoip server in Rust
,KSXGitHub/parallel-disk-usage,"Highly parallelized, blazing fast directory tree analyzer"
,Nitrrine/nitrrine.github.io,My blazingly fast personal website
,ValkyrieStudios/validator,A lightweight blazingly-fast highly extendable and configurable javascript validator that supports both standard objects and FormData
,rnag/dotwiz,A blazing fast dict subclass that supports dot access notation.
,runreveal/kawa,A blazingly fast event stream processing library powering the reveald event processing daemon.
,louisbrulenaudet/ragoon,"High level library for batched embeddings generation, blazingly-fast web-based RAG and quantized indexes processing "
,ykafia/SoftTouch.Spirv,"Blazingly fast SPIR-V parser and assembler in C#, low allocation and aot-compatible. Extended for the SDSL programming language"
,load1n9/caviar," Blazing fast, modern, Game Engine powered by WebGPU for Deno and the browser"
,Kampfkarren/selene,A blazing-fast modern Lua linter written in Rust
,noahzeisberg/FyUTILS," An OSINT and hacking command line application built with Go, offering blazing-fast performance and awesome utilities."
,jbrocksfellas/op,Make your navigation blazingly fast
,opekope2/OptiGUI,Blazing fast custom GUI textures on Fabric and Quilt with built-in OptiFine custom GUI resource pack support
,chibisafe/chibisafe,Blazing fast file vault written in TypeScript! 
,centre-for-humanities-computing/tweetopic,Blazing fast topic modelling for short texts.
,M64GitHub/libtsprites,"C++ shared library for truecolor unicode terminal sprites, effects, and animations. Blazingly fast 2.5D parallax rendering engine! Ideal for terminal games, or just more interesting user interfaces."
,x-tabdeveloping/neofuzz,Blazing fast fuzzy text search for Python.
,UltiRequiem/joke-api, Blazing Fast Jokes API!
,tadhglewis/issue-status,"A flexible, modern and blazingly fast  status page"
,SM-7603/JS_ASAP,Revising JS concepts blazingly fast  | This repo is essentially a collection of really concise notes on JS concepts to serve as a refersher for me 
,izcream/dotfiles,zsh and starship config files for blazing fast dx
,sourcebot-dev/sourcebot,"Blazingly fast code search   Deployed as a single Docker image  Search million+ lines of code in your GitHub, GitLab, and Gitea repositories  MIT licensed "
,Rico040/meowcraft-script,"A script which changes content of sounds.json to replace every sound with meowing, written in Rust (blazingly fast)"
,TomerAberbach/parse-imports, A blazing fast ES module imports parser.
,xandaaah/proton,"A high-level, easy to use, blazing fast and modern web-application framework."
,Alwatr/nitrobase,"Nitrobase is a blazingly fast, lightweight database built on JSON. It stores data entirely in memory for lightning-quick access, while also providing a JSON file backup for persistence. You can easily serve your data over the web using our high-performance accelerated Nginx server."
,Zilliqa/otterscan,"A blazingly fast, local, Ethereum block explorer built on top of Erigon"
,joyant/fire,"A blazingly fast, intuitive, and powerful form validation library for Go"
,tunakasif/rustureng,*Blazingly fast* CLI tool for using tureng.com
,Tnixc/replacer,A BLAZINGLY FAST and flexible cli to replace strings in files or a directory from a mapping
,JiLiZART/BBob,"Blazing fast js bbcode parser, that transforms and parses bbcode to AST and transform it to HTML, React, Vue with plugin support in pure javascript, no dependencies "
,common-repository/methi-blazing-fast-mobile-optimized-search,Mirror of WordPress.org plugin: methi-blazing-fast-mobile-optimized-search
,orsinium-labs/jsony, A blazing fast and safe Go package for serializing JSON
,hyprwm/hyprpaper,Hyprpaper is a blazing fast wayland wallpaper utility with IPC controls.
,Yashiru/evm-rs-emulator,A blazingly fast in-memory Ethereum Virtual Machine (EVM) emulator written in Rust
,SynthesisLab/Bolt,Blazingly fast synthesis of LTL formulas!
,monosans/pyromark,Blazingly fast Markdown parser for Python written in Rust.
,radek203/KMLightSpigotFree,Minecraft blazing fast 1.8.x limbo server
,frroossst/tameta,"A simple, blazingly fast pomodoro timer with as few dependencies as possible, written in Rust"
,hyprutils/hyprgui,"GUI for configuring Hyprland, written in blazingly fast Rust! "
,TomerAberbach/get-all-files, A blazing fast recursive directory crawler with lazy sync and async iterator support.
,rhasanm/spotlight-search,"A blazingly fast file and application launcher for Windows, inspired by macOS Spotlight. Built with Rust for performance and reliability."
,alibaba/MNN,"MNN is a blazing fast, lightweight deep learning framework, battle-tested by business-critical use cases in Alibaba"
,Rdkang/woopaper,a blazing fast opinionated wallpaper program
,uatuko/grpcxx, Blazing fast gRPC server (C++)
,filipecarneiro/hugo-bootstrap-theme,"Hugo theme for a secure, blazing fast and SEO-ready static website, using Bootstrap 5."
,piguycs/neonctl-rs,a blazingly fast cli to manage neondb
,webermania/MicroExpressionEvaluator,"High-Performance C# Logical Expression Parser and Evaluator. MicroExpressionEvaluator is a blazing-fast, lightweight .NET library for parsing and evaluating complex nested logical expressions. Designed for real-time applications."
,mirecl/catboost-cgo,"CatBoost a fast, scalable, high performance Gradient Boosting on Decision Trees library. Golang using Cgo for blazing fast inference CatBoost Model "
,snipe-bio/snipe,Blazingly fast SRA-scale sequence analysis & QC
,cestef/rwalk,A blazingly fast web directory scanner written in Rust
,victrme/pocket-editor,Blazingly fast block style wysiwyg editor that returns markdown
,RajaRakoto/react-boilerplate,"Minimalistic boilerplate to quick-start React.js development in TypeScript, optimized for blazing-fast performance Bun & Vite "
,MOZGIII/sap,Opinionated HTTP server for hosting static files of Single Page Apps from memory with blazing fast speeds
,dhruvdabhi101/rusty-leaf-backend,"Backend for Rusty Leaf, built with blazingly fast Rust btw"
,ankane/ruby-polars,Blazingly fast DataFrames for Ruby
,koseka/jairika,A blazing fast cross-language cross-platform machine learning framework built with Rust.
,Ukalus/GQM_CSBME,"The best, blazingly fast solution for your GQM needs"
,websockets/ws,"Simple to use, blazing fast and thoroughly tested WebSocket client and server for Node.js"
,algolia/algoliasearch-client-csharp, A fully-featured and blazing-fast C# API client to interact with Algolia.
,devvMuhammad/streamit,Blazingly Fast Live Streaming Application made with Next.js + Golang
,cooldogedev/spectral-php,"Spectral is a blazingly fast and lightweight network engine built on UDP, designed for real-time, low-latency applications."
,DomDew/blazematch,Blazingly fast content fuzzymatching built in Rust
,foundry-rs/starknet-foundry,Blazing fast toolkit for developing Starknet contracts.
,Teddy-94/.config-nvim,Minimal and Blazingly fast neovim config
,prantomollick/fast-react-pizza-typescript-app," Fast React Pizza App: A blazing-fast, TypeScript-based pizza ordering web app. Built with React, it provides a sleek UI for customizing your pizza, managing orders, and enhancing your culinary experience. Ideal for developers and pizza lovers alike! Enjoy your code and your slice! "
,Portkey-AI/gateway,"A Blazing Fast AI Gateway with integrated Guardrails. Route to 200+ LLMs, 50+ AI Guardrails with 1 fast & friendly API."
,rtfmkiesel/drivebyte,"A blazingly fast, cross-os cli tool to discover and take automated screenshots of websites"
,HugoPeters1024/fastneat,A blazingly fast implementation of NEAT algorithm
,itw-creative-works/ultimate-jekyll,"A boilerplate with Jekyll, Webpack, and Node.js to kickstart the development of blazingly fast, feature-rich, & SEO-ready static sites."
,BestMat/uytxt, Blazingly fast terminal editor written in C
,jux-io/toolkit,"Jux toolkit is a collection of tools for blazingly fast, rapid UI development "
,qdrant/quaterion,Blazing fast framework for fine-tuning similarity learning models
