framework,full_name,description
,EKQRCalamity/fs-cleaner-rs,"Delete your files, now blazingly fast!"
,0x61nas/lqth, Simple but blazingly fast screenshot utility
,MathisWellmann/gym-rs,OpenAI's Gym written in pure Rust for blazingly fast performance
,IntellectualSites/FastAsyncWorldEdit,"Blazingly fast world manipulation for artists, builders and everyone else: https://www.spigotmc.org/resources/13932/"
,alexeev-engineer/zennet,Blazing fast network tool
,Megakuul/gorbit,Simple and Blazingly Fast TCP Network-Loadbalancer
,k-rush/cosmic-vibrations-website," This is the composer starter project for Pico, a stupidly simple, blazing fast, flat file CMS. "
,rupurt/zodbc,A blazing fast ODBC Zig client
,JiLiZART/BBob,"Blazing fast js bbcode parser, that transforms and parses bbcode to AST with plugin support in pure javascript, no dependencies "
,domsleee/posh-tabcomplete,Blazing fast tab completion for powershell.
,Infinimol/dextro,Dataset indexer for blazing fast O(1) random access with virtually no memory overhead.
,mrcbax/pushparse,"An example on how to parse the Pushshift Reddit database ""blazingly fast"""
,anthdm/hollywood,Blazingly fast and light-weight Actor engine written in Golang
,roneli/fastgql,"Blazing fast, instant realtime & extendable GraphQL APIs powered by gqlgen"
,LetUsFlow/Rusty-BruhBot,A blazingly  fast  Discord soundboard
,Pritamkaranjkar/Expense-Manager-Using-Qwik,"Qwik.js: Blazing-Fast Web Apps, Instantly Interactive Qwik.js is a revolutionary JavaScript framework designed to deliver instant-loading, highly interactive web applications, regardless of their size or complexity. It prioritizes speed and performance, offering a unique approach compared to other popular frameworks."
,Sawansunar56/Neovim-Config,This is the config files that I would use to start a life of a superior programmer. I will go blazingly Fast now. 
,wszczawinski/Passivhaus,This project leverages Gatsby with TypeScript and Sass to create a blazing-fast website with WordPress as headless CMS and automated deployment through GitHub Actions CI/CD.
,issmirnov/zap,Blazing fast web shortcuts.
,readloud/BlackPhish,Super lightweight with many features and blazing fast speeds.
,nathan-barry/nathan.rs,My personal site using Hugo for static site generation. Blazingly Fast.
,domgolonka/foretoken,"A blazing fast, highly customizable, modern-day defence tool using (in memory) SQL & REST/gRPC protocols."
,hasura/graphql-engine,"Blazing fast, instant realtime GraphQL APIs on your DB with fine grained access control, also trigger webhooks on database events."
,dalisoft/commitlint-sh,Blazing fast minimal commitlint validation script written in Bash with presets support
,http4s/blaze,Blazing fast NIO microframework and Http Parser
,timvisee/pixelpwnr-server,:fireworks: Blazingly fast GPU accelerated pixelflut server written in Rust.
,killing-vodka/pico-arrayksort,"Plugin to sort an array by key. Pico is a stupidly simple, blazing fast, flat file CMS."
,solzimer/nsyslog,"Blazing fast, modular, next gen logagent"
,rudovc/arach-no-bot-rs,The funniest discord bot ever just became blazingly fast
,StardustXR/magnetar,"Workspaces client for Stardust, now blazingly fast in rust"
,FunnyGuilds/dependency-injector,Blazingly fast and lightweight dependency injection framework for Java 
,skyplane-project/skyplane, Blazing fast bulk data transfers between any cloud 
,stable-os/pkg-builder,A blazingly fast package builder
,a16z/magi,A blazing fast OP Stack rollup client written in Rust
,iWas-Coder/kurama,"A simple, blazingly fast, cloud-native job scheduler and orchestrator written in Go."
,vidhanio/hypertext,A blazing fast type-checked HTML macro crate.
,Pometry/Raphtory,"Blazingly fast, vectorised, parallel, and scalable temporal graph engine for Rust, Python and JavaScript"
,dhruvdabhi101/rusty-leaf-backend,"Backend for Rusty Leaf, built with blazingly fast Rust btw"
,Kapsyloffer/RUSTBU, Backend for an online SHOBU client; powered by Rust. (BLAZINGLY FAST!!)
,nulluser0/OpenA0,"No BS, Blazing Fast, Censorship-resistant VPNs"
,painfulexistence/create-cxx,Set up a modern C++ project blazingly fast!
,OthelloEngineer/tissue,Todo-ISSUE transfomer: A blazingly fast todo-comment to github issue transformer
,Devolutions/devolutions-gateway,A blazing fast relay server adaptable to different protocols and desired levels of traffic inspection.
,maraisr/tctx,Blazing fast w3c Trace Contexts for any JS runtime
,EricLBuehler/mistral.rs,Blazingly fast LLM inference.
,algolia/algoliasearch-client-csharp, A fully-featured and blazing-fast C# API client to interact with Algolia.
,alunit3/alunite-1111,Blazing fast stable diffusion setup on colab!
,sxyazi/yazi," Blazing fast terminal file manager written in Rust, based on async I/O."
,M64GitHub/libtsprites,"C++ shared library for truecolor unicode terminal sprites, effects, and animations. Blazingly fast 2.5D parallax rendering engine! Ideal for terminal games, or just more interesting user interfaces."
,manodeep/Corrfunc,Blazing fast correlation functions on the CPU.
,gatariee/gocheck,DefenderCheck but blazingly fast
,stanleyogada/lite-neovim-distro,"Welcome to Lite Neovim Distro, a minimalist Neovim distribution designed to provide a blazing fast, and lightweight Neovim setup in just a few seconds."
,wfxr/minimap.vim," Blazing fast minimap / scrollbar for vim, powered by code-minimap written in Rust."
,Senth/blazingly-type,"Learn to type blazingly fast in a ""short"" amount of time"
,tanav-malhotra/RapidBreeze,A blazingly fast file manager written in Rust.
,JSchlensok/VespaG,Expert-Guided Protein Language Models enable Accurate and Blazingly Fast Fitness Prediction
,ZilaWS/client,ZilaWS is a blazingly fast and very lightweight library that provides an extremely easy-to-use way to transmit data via websockets between clientside and serverside using eventhandlers and async waiters.
,KomputeProject/kompute,"General purpose GPU compute framework built on Vulkan to support 1000s of cross vendor graphics cards (AMD, Qualcomm, NVIDIA & friends). Blazing fast, mobile-enabled, asynchronous and optimized for advanced GPU data processing usecases. Backed by the Linux Foundation."
,Based-Programmer/titans,Blazingly fast scraper
,LukasLichten/DataRace,"Blazingly Fast Realtime Extendable Data Visualization Engine for SimRacing, Flightsim, Streaming, etc."
,hyprwm/hyprpaper,Hyprpaper is a blazing fast wayland wallpaper utility with IPC controls.
,uber-go/zap,"Blazing fast, structured, leveled logging in Go."
,Altanis/kinetics,"A blazingly fast physics engine for both servers and the web, written in TypeScript "
,snprajwal/lost,A Blazingly Fast general-purpose programming language
,oystr29/dalamkotak-astro,Blazingly fast portofolio 
,knowledgepicker/word-cloud,Fast word cloud library for .NET. Uses Quadtrees for blazing-fast performance. Maintained by the KnowledgePicker team.
,yongkangc/rustygram,rustygram is a minimal and blazing fast telegram notification framework for Rust
,Naseem780/Portfolio-Website,"Dive into my portfolio website, a vibrant display of my development journey, built with React and supercharged by Vite for blazing-fast performance. It's a responsive, interactive showcase of my projects, designed to reflect my skills and creativity in front-end development. Experience it live and let's connect to bring ideas to life."
,uoregon-libraries/rais-image-server,"RAIS: A IIIF-compliant, 100% open source image server for blazing-fast deep zooming"
,Teddy-94/.config-nvim,Minimal and Blazingly fast neovim config
,Poietic/poietic,Blazingly fast CMS written in rust using actix.
,filipecarneiro/hugo-bootstrap-theme,"Hugo theme for a secure, blazing fast and SEO-ready static website, using Bootstrap 5."
,mokurin000/anti-spam-matrix,A Matrix Bot to ban spammers that runs blazingly fast 
,rayattack/heaven,"Extremely Stupid Simple, Blazing Fast, Get Out of your way immediately Microframework for building Python Web Applications."
,AndreiCocan/spry,"A blazingly FAST environment setup, ready to deploy with a single command line !"
,wanjohiryan/warp,Blazingly fast audio and video streaming with HTTP3/QUIC
,MadebyAe/serverless-plugin-rust,Serverless framework plugin for blazingly-fast rust functions. 
,algolia/algoliasearch-client-dart, A fully-featured and blazing-fast Dart/Flutter API client to interact with Algolia
,divyesh87/Avocado-Gas-Estimator,Blazingly fast API to estimate Avocado Wallet gas fees (ERC 4337 Account abstracted wallet) 
,uatuko/grpcxx, Blazing fast gRPC server (C++)
,melotic/enum.land,blazing fast subdomain enumeration on the web
,williamhCode/cyclone,"Cyclone is a blazingly fast and simple to use 2D graphics library for Python. Written in Cython, Python, and OpenGL."
,fuzzland/ityfuzz,Blazing Fast Bytecode-Level Hybrid Fuzzer for Smart Contracts
,Dlurak/retch,A simple and blazingly fast system fetcher
,dylanbr0wn/mlti,A blazingly fast (maybe?) process runner written in Rust
,grassrootseconomics/w3-celo,Package w3 implements a blazing fast and modular Celo JSON RPC client with first-class ABI support.
,syedzaidi-kiwi/Extreme-RAG,Blazingly Fast RAG Bot using LPU Approach 
,Ru-Ri-z/Fasti-mongo,"Building a blazing fast REST API with Node.js, Fastify and MongoDB"
,scorpion-26/gBar,Blazingly fast status bar written with GTK
,DocAssert/doc-assert,DocAssert will help your documentation to never get outdated. Written in Rust. Blazing fast 
,Roblox/picomatch-lua,Blazing fast and accurate glob matcher written in Lua. This is a read-only mirror
,Intsights/PyDomainExtractor,A blazingly fast domain extraction library written in Rust
,algolia/algoliasearch-client-kotlin, A fully-featured and blazing-fast Kotlin/Android API client to interact with Algolia.
,puzzle-js/puzzle-js, Micro frontend framework for scalable and blazing fast websites.
,dalist1/reedee, A blazing fast online PDF reader with Dark Mode & PWA support.
,daUnknownCoder/NeutronVim," Unleash the Power  with A Highly Customizable  & Blazingly Fast  Neovim Configuration, Inspired by the Unyielding Force  of Neutron Stars , harnessing the incredible gravitational pull of Neovim's capabilities , offering a star-studded constellation of features and plugins  for a seamless and efficient coding journey !"
,algolia/algoliasearch-client-python, A fully-featured and blazing-fast Python API client to interact with Algolia.
,philzippy/BetterFox,"A secure, blazing fast browsing experience. Without breakage."
,Kirisakiii/Chika,A blazing fast SPA server & api reversed proxy server for NekoBlog project
,archibate/genius.nvim,Blazing fast  code completion in NeoVim powered by  GPT-3.5-Turbo
