framework,full_name,description
,wangsizhu0504/kn,"Minimal, blazing fast Node.js package manager and scripts runner"
,ersinkoc/Log,"Blazing fast, plugin-based logging for Node.js and browsers with micro-kernel architecture."
,Titoot/KeyDot,"Blazingly Fast, Static Godot Engine Encryption Key Extractor"
,sockudo/sockudo,Blazingly fast pusher drop-in replacement written in rust
,GhostKellz/zgui,"blazing-fast, async-native GUI framework and WASM toolkit for Zig "
,libredb/libredb-studio,"A modern, blazing-fast SQL IDE for the cloud era. Query PostgreSQL, MySQL, SQLite & MongoDB from anywhere  your browser is your new database studio."
,BooBSD/Tsetlin.jl,"The Fuzzy-Pattern Tsetlin Machine library, with zero external dependencies, performs blazingly fast."
,IntellectualSites/FastAsyncWorldEdit,"Blazingly fast world manipulation for artists, builders and everyone else: https://modrinth.com/plugin/fastasyncworldedit"
,gitui-org/gitui,Blazing  fast terminal-ui for git written in rust 
,gustcol/smartcopy,"SmartCopy is a blazingly fast, intelligent file copy utility designed for High-Performance Computing (HPC) environments. Built in Rust for maximum performance, memory safety, and zero-cost abstractions."
,Nikaidou-Shinku/fvp-unpacker,A blazing fast tool to unpack FVP archive.
,ararog/vetis," A blazingly fast, minimalist HTTP server built for modern Rust applications."
,loglizzy/rbx-instance-serializer,A blazing fast & size effective roblox instance serializer.
,evengarli/rustbuster,"A blazing fast, async directory brute-forcing tool written in Rust"
,docdyhr/batless,"Minimal, blazing-fast syntax viewer for the terminal  never blocks, never pages, never hangs. Perfect for code, logs, and AI pipelines."
,kimsgent/project-indexly,"Local File Search Tool with SQLite FTS5. Blazing-fast Search, Tagging and Export"
,satendra03/npm-node-fast-server,A blazing fast CLI to scaffold a production-ready Node.js + Express server in one command.
,LucasGdosR/deque,Blazingly fast ring-buffer deque with both low level and high level API.
,devmonixtechnologies/goblin,"An advanced, blazing-fast, and effortlessly approachable JavaScript UI framework with a batteries-included toolchain for compiling .gbln component files, rendering on client and server targets, and wiring modern developer workflows."
,paradigmxyz/reth,"Modular, contributor-friendly and blazing-fast implementation of the Ethereum protocol, in Rust"
,luqastw/OxidClean,A blazingly fast Arch Linux system cleaner and TUI package optimizer written in Rust.
,loonghao/auroraview,"A blazingly fast, lightweight WebView framework for DCC (Digital Content Creation) software, built with Rust and Python bindings."
,fardhanrasya/dream-journal,"A minimal, blazing fast CLI tool to record, manage, and explore your dreams from the comfort of your terminal."
,PlayPro/CoreProtect,CoreProtect is a blazing fast data logging and anti-griefing tool for Minecraft servers.
,omarirfa/Jetxl,Blazing fast xlsx generator 
,davidevofficial/anything,"File search GUI inspired by Everything, blazingly fast, made for Linux"
,Rushmore75/foss.cooking,Spirtual successor of based.cooking  A FOSS and blazingly fast recipe site 
,segvyfault/svbar,Custom written bar for myself in  blazingly fast rust
,VijaiAaditya/AppTrace,"AppTrace is a blazing-fast, local-first observability toolkit for capturing, storing, and querying OpenTelemetry-compliant logs, traces, and metrics. Built with .NET 9, Blazor WebAssembly, gRPC, Dapper, and PostgreSQL  designed to be minimal, dependency-free, and production-ready."
,egeominotti/flashq,Blazingly fast job queue server. Process millions of jobs/sec with sub-millisecond latency. Built with Rust.
,Gur0v/zeptofetch," Blazingly fast, ultra-minimal system information tool for Linux."
,maneatingape/advent-of-code-rust,"Blazing fast Rust solutions for every Advent of Code puzzle from 2015 to 2025, solving 524 stars in less than 1 second."
,905timur/dockyard,A blazingly fast and resource-efficient Docker management TUI built for VPS environments
,vmfunc/sif,the blazing-fast pentesting suite.
,rslucena/TypeScript-Boilerplate,"Blazing-fast TS Boilerplate featuring a Zero-Dep Template Engine, Auto-CRUD Scaffolding, i18n, and Smart Caching. Optimized for Bun. Experience the speed of Go with the familiarity of TypeScript."
,hyperse-io/hps,HPS is a blazing fast frontend build tool based on Rspack that powers modern web applications with exceptional performance and developer experience.
,Jhmmax/hashgen,"hashgen - the blazingly fast hash generator argon, base58, base64, bcrypt, cyclone, generator, hash, hashcat, hashgen, md5, mdxfind, mosecode, multithreaded, ntlm, sha, sha1, sha256, sha3, threaded, yescrypt"
,roneli/fastgql,"Blazing fast, instant realtime & extendable GraphQL APIs powered by gqlgen"
,alibaba/MNN,"MNN is a blazing fast, lightweight deep learning framework, battle-tested by business-critical use cases in Alibaba. Full multimodal LLM Android App:[MNN-LLM-Android](./apps/Android/MnnLlmChat/README.md). MNN TaoAvatar Android - Local 3D Avatar Intelligence: apps/Android/Mnn3dAvatar/README.md"
,ejacobhayes/parsecio," A blazing-fast, self-updating dashboard for your GitHub stars  smartly categorized, beautifully designed, and fully static with zero dependencies."
,builders-toronto/fdv.lol,"BLAZING-FAST client-side SOL memecoin radar with explainable GOOD/WATCH/SHILL. Trader (Auto), Sentry (Sniper), Hold, Follow, and Volume bots."
,chongliujia/fermi-infer,"The Rust-native inference engine for Small Language Models (SLMs), Run efficient models locally with blazing fast speeds, instant startup times, and full Metal acceleration on Apple Silicon."
,TheRickyZhang/Bootstrap,From zero to blazing fast workflow.
,npetrangelo/BFTML,Blazingly Fast Text Markup Language. Standards designed for web apps. Browser implementation in Rust.
,glueful/runiva,"Run Glueful on modern runtimes like RoadRunner, Swoole, and FrankenPHP for blazing-fast performance and persistent worker handling."
,paradigmxyz/solar,"Blazingly fast, modular and contributor friendly Solidity compiler, written in Rust"
,avivmaman/blog-public-api,"Open-source public blog API. Blazing fast, infinitely scalable. No limits, no fees. Own your content delivery."
,bilinearlabs/quixote,"Blazing-fast blockchain event indexer, powered by Rust. Data from the blockchain to your database."
,winstxnhdw/gxhash,"Python bindings for GxHash, a blazingly fast and robust non-cryptographic hashing algorithm."
,riyasy/FlyPhotos,A blazing fast ultra-light photo viewer replacement for Windows. Works similar to Picasa Photo Viewer.
,cojocaru-david/cojocarudavid.me,Blazing fast personal website built with Astro.js and styled with Tailwind CSS. 
,mistricky/zzhack, Blazing fast terminal-style personal site built with Rust WASM
,FoundatioFx/Foundatio.Mediator,"Blazingly fast, convention-based C# mediator powered by source generators and interceptors."
,SinTan1729/chhoto-url,"A simple, blazingly fast, selfhosted URL shortener with no unnecessary features; written in Rust."
,marshallku/blog,"A blazing-fast, memory-efficient static site generator built in Rust "
,roffe/txlogger,"Blazing fast data logging for Trionic 5, 7 & 8 "
,AdrianVollmer/XTreeViewer,A blazing fast TUI (Terminal User Interface) application for viewing tree structures from serialized data files.
,milosz08/milosz08,"Personal website build on top of the my own blazing fast and concurrency Java SSG engine, powered with markdown and HBS templates."
,clasen/HODL," HODL Wallet - Blazing-fast, transparent, and ad-free crypto wallet"
,satendra03/npm-react-fast-app,"A blazing fast CLI to bootstrap a React project with Vite, Tailwind CSS, and ShadCN UI  all in one command."
,AlessandLaZagne/arsenal,"The classic launcher, evolved. A blazing fast, Go-based command library equipped with 150+ cybersecurity cheat-sheets. Just install and start hacking."
,noahonfyre/FyUTILS," A utility command line application built with Go, offering blazing-fast performance and awesome utilities."
,PRRPCHT/BlazingWebP,Your blazingly fast batch WebP converter for MacOS and Windows!
,saul/demofile-net,"Blazing fast cross-platform demo parser library for Counter-Strike 2 and Valve's Deadlock, written in C#."
,magicblock-labs/magicblock-validator,Blazing-Fast SVM Ephemeral Validator
,vaulthalla/vaulthalla-core,A next-gen self-hosted file platform forged for the modern age. Blazing-fast C++ backend. Debian native. libfuse3 ACID compliant metadata and authentication layer.
,Jason2866/esp32tool,"The esp32 swiss army knife for reading, writing and backup anything blazing fast"
,MahmoudAshrafYadem/Smart-Search-CLI," Blazing-fast Windows CLI search utility bypassing bot protection. PowerShell automation tool supporting PDF, YouTube, Images, Books, Articles, and default searches with intelligent URL encoding and multimodal search capabilities."
,surge-downloader/surge,"Surge is a blazing fast, open-source terminal (TUI) download manager built in Go."
,cdpdriver/kdriver,"A blazing fast, coroutine-first, undetectable web scraping / browser automation CDP-based library for Kotlin"
,stratdev3/SimpleW,SimpleW is Web server Library in .NET Core. Powerfully Simple and Blazingly Fast.
,skydiver/typescript-starter,A clean and modern setup for blazing-fast TypeScript development.
,Ayley/white_desert,Blazing fast BDO .paz file explorer powered by a custom Rust-interop engine and FluentAvalonia.
,manabuaota/FiveM-NUI,A blazingly fast JavaScript library for FiveM NUI resources
,tassiovirginio/try-rs,"A blazing fast, Rust-based workspace manager for your temporary experiments."
,mkobayashime/bundlemonkey,Bundlemonkey is a userscript bundler designed to make developing browser userscripts blazing fast and efficient.
,rmenai/dotfiles,My dotfiles for blazing fast development
,zeykatecool/luaPNG,Blazingly fast PNG encoder and raster toolkit for Lua and LuaJIT.
,ArkForgeLabs/Astra, Blazingly Fast  web server runtime for Lua
,asmshaon/mini-crm,Mini CRM with blazing fast search
,Thonny-Developer/Aura-Host-Site,"AuraHost is a modern, high-performance web hosting platform designed for developers and businesses looking for reliable infrastructure with blazing-fast speeds and enterprise-grade security"
,veyxov/nvim,Blazingly fast neovim configuration
,SolverForge/solverforge,"SolverForge is a constraint programming framework and solver written in Rust. It allows you to solve any planning problem, blazing fast!"
,yuki0iq/statusline,Blazingly-fast PS1 statusline for bash (mirror)
,Confucian-e/stormint,A blazing fast crate that supports multi-account minting of FreeMint tokens
,jimmystridh/rloc,A blazingly fast line-of-code counter written in Rust. Full-featured cloc replacement.
,timbal-ai/timbal,"Timbal is an open-source python framework for building reliable AI applications, battle-tested in production with simple, transparent architecture that eliminates complexity while delivering blazing fast performance, robust typing, and API stability in an ever-changing ecosystem."
,burakhanulusoy/Kaira_Dapper_Project,"""Kaira is a cutting-edge e-commerce platform that blends fashion with artificial intelligence. Built on the blazing-fast .NET 9.0 and Dapper ORM, it features an integrated AI Stylist (Google Gemini) and a text-to-image design generator (Replicate AI) to revolutionize the user shopping experience."""
,nakayamaryo0731/tablex,A blazingly fast database management tool built with Rust + Tauri
,brendankowitz/ignixa-fhir,"A blazing-fast multi-FHIR, multi-tenant, multi-database, data streaming reference implementation FHIR Server built in dotnet."
,precizer/precizer,"precizer is a lightweight and blazing-fast CLI application designed for file integrity verification and comparison, making it particularly useful for checking synchronization results. The program recursively traverses directories, generating a database of files and their checksums for quick and efficient comparisons."
,cybruGhost/THE-CUBE,"A Movie Streaming web-site experience built for thrill-seekers, binge-watchers, and late-night explorers. Minimal design, powerful interface, blazing fast playback."
,otterscan/otterscan,"A blazingly fast, local, Ethereum block explorer built on top of Erigon"
,guessi/cloudtrail-cli,Blazing fast single purpose cli for CloudTrail log filtering
,MitchellBauer/Context,A blazing fast CLI tool written in Go that scans your project and copies the full context (file structure + content) to your clipboard for use with LLMs.
,eval-exec/neomacs,"NeoEmacs: Emacs with Modern Display Engine with GPU, Feature Rich Multimedia support, and Blazing fast elisp machine"
,Dmitry-Ship/go-chat,blazingly fast real time chat app
,mizila-firox/macLangAlfred,"Fast Mac dictionary for quick translations between English, Portuguese, Russian, and Chinese (with Pinyin), personally made to save ~10 seconds per word lookup compared to online translators.    -- room for improvement by downloading all 4 dictionaries and making it blazing faster, would gain few more precious seconds."
,thombruce/sherwood," A Rust-based, compile-it-yourself static site generator for blazing fast site generation!"
,walker84837/textstat,TextStat is a reliable and blazing fast text file analyser.
