framework,full_name,description
,arjunkomath/RustyInk,A blazing fast static site generator in Rust
,biodatageeks/polars-bio,Blazing-Fast Bioinformatic Operations on Python DataFrames
,bcmcmill/nimbus," Nimbus: Blazing-fast, zero-copy RPC framework built in Rust, powered by RKYV serialization and ntex async networking. Effortlessly ergonomic, SIMD-optimized, and production-ready."
,Devolutions/devolutions-gateway,A blazing fast relay server adaptable to different protocols and desired levels of traffic inspection.
,w4/rgit, blazingly fast web frontend for git repositories
,Chaunice/corpus_dispersion," A blazing-fast Python extension (wheel) for advanced lexical dispersion metrics,  powered by Rust & PyO3."
,deminimis/Minimal-eReader,"Blazing fast PDF and eReader built on muPDF. Including the ability to save ""highlights"" and notes like on Kindle. "
,op30mmd/pro-video-compressor,A Blazing fast video compressor with professional features. its cross-platform and uses ffmpeg as backend.
,ProgrammerNomad/tostishop,"A blazing-fast, fully responsive WooCommerce theme designed for mobile-first eCommerce experiences."
,ArenRedd/arenredd.github.io,"Built a blazing-fast, privacy-respecting blog using the Chirpy Jekyll theme, but on Kali Linux  because why not go full rogue? This repo is a live dev journal of breaking things, fixing them, and documenting every gritty detail. Think of it as a how-not-to followed by a how-to. "
,sapphiredev/shapeshift,Blazing fast input validation and transformation 
,VaishakhVipin/whispers-final, Whispers Talk. Recall. Repeat. A blazing-fast voice journal that remembers everything you say  searchable with AI.   What is Whispers? Whispers is a voice-first journaling app powered by:   <300ms Latency Streaming Transcription (AssemblyAI)   Algolia MCP for instant search of your thoughts
,Singh327/IPL-Fan-Page," dynamic and modern fan-made web application dedicated to the legendary **Chennai Super Kings** . This site is a one-stop destination for all things CSK  built with React, Tailwind CSS, and Vite for blazing-fast performance and beautiful design."
,Md-Siam-Mia-Code/P.U.R.G.E,"A blazing-fast, cross-platform, and user-friendly GUI for debloating Android devices, built with the safety and performance of Rust. This tool provides a simple and effective way to remove unwanted bloatware from your phone, freeing up resources and improving privacy."
,alexandrelam/slam-poker,"Modern, blazingly-fast, real-time planning poker application for fun agile teams"
,huggingface/text-embeddings-inference,A blazing fast inference solution for text embeddings models
,zimfw/zimfw,"Zim: Modular, customizable, and blazing fast Zsh framework"
,arifulmrislam/TechFlow,"TechFlow is a blazing-fast, beautifully styled web app that fetches and displays developer articles from dev.to using React and Tailwind. It uses animated gradient headlines, markdown rendering, and responsive UI components to deliver a clean reading experience with interactive feedback (like toasts, loaders, etc.)."
,apache/fory,A blazingly fast multi-language serialization framework powered by JIT and zero-copy.
,trinhminhtriet/gloc," gloc  A blazing-fast LOC (Lines of Code) counter in Go, inspired by tokei. Simple & efficient!"
,efemaer/terrawiz, Terrawiz - A blazing-fast open-source CLI tool for discovering and analyzing Terraform modules across multiple platforms.
,RetroRealm/playmatch,A blazingly fast microservice for matching ROM file hashes and caching game metadata. Originally designed for RetroRealm.
,halil-yesilyurt/code-and-tech,"Code & Tech is a blazing-fast, SEO-optimized tech blog built with Next.js and headless WordPress"
,SylverbladeX/ValoriumX," Core protocol of ValoriumX  blazing-fast, secure L1 blockchain using the VIC consensus. $VQXAI >  Valorium X is **not associated** with *Valorium AI* or *VALORIUM.AI*, launched June 23 2025"
,Zer0C0d3r/Heist,"Heist is a blazing-fast, cross-platform terminal shell history analyzer with both interactive TUI and CLI modes."
,algolia/algoliasearch-client-javascript, A fully-featured and blazing-fast JavaScript API client to interact with Algolia.
,rmenai/dotfiles,My dotfiles for blazing fast development
,bravo1goingdark/blipmq,"BlipMQ simplifies real-time communication between microservices and distributed systems with a lightweight, blazing-fast broker that just works  no complex setup, no compromises."
,sm-moshi/cpufetch-rs,"A blazing-fast, modern, and elegant Rust rewrite of cpufetch."
,DrInfinite/naparajith,"My developer portfolio built with advanced web standards, optimised SEO and blazingly fast performance."
,moonbot777/Rust-Copytrading-Bot,A blazing-fast copytrading bot built with Rust for ultra-low latency performance and precision trading. Designed for crypto traders who want to mirror the trades of target wallets in real-time.
,codingjoe/esimport,Blazing fast ESM compiler and importmap generator
,bikash138/Neurofy,"Neurofy is a blazing-fast, offline-capable, and AI-powered second brain that helps you capture, organize, and rediscover thoughts  seamlessly synced across all your devices in real time."
,Nightre/Rapid.js, A blazing-fast WebGL-based 2D rendering engine for games
,wix-incubator/pro-gallery,Blazing fast & beautiful galleries built for the web
,PranitThorat/WiFire,":   WiFire  A blazing-fast automated Wi-Fi attack tool! Scan networks, send deauths, capture WPA2 handshakes, and crack passwords in style  Designed for red teamers  and ethical hackers. Just pick a target and let WiFire do the burning. "
,ozontech/file.d,"A blazing fast tool for building data pipelines: read, process and output events. Our community: https://t.me/file_d_community"
,BooBSD/Tsetlin.jl,"The Tsetlin Machine library, with zero external dependencies, performs blazingly fast."
,Kani-Maki-Gang/bld,A simple and BLAZINGLY fast CI/CD in the making
,Gabbar-v7/Ascent,"A blazing-fast Flutter mobile app for managing tasks, notes, and focus sessions with intuitive gestures and smooth performance."
,gitui-org/gitui,Blazing  fast terminal-ui for git written in rust 
,Allaman/nvim,"Minimal, blazingly fast, and pure Lua based Neovim configuration for my work as DevOps/Cloud Engineer with batteries included for Python, Golang, Terraform, and, of course, YAML"
,tinymvc/tinymvc,TinyMvc is a minimalist PHP framework to craft blazing-fast RESTful APIs and modern web apps.
,zedddie16/ctvtcntr,Simple Hyprland activity counter written in Rust (blazingly fast btw)
,ragarwalll/minimalify,"Minimalify is a zero-dependency CLI/library for building blazing-fast, static HTML/CSS/JS sites with reusable components."
,UBC-iGEM/jumpdrive,"A minimal,  blazingly fast HTTP server with websocket support"
,XyncNet/pgram,Blazingly fast start async telegram bot on top of the aiogram and tortoise-orm with postgres channels
,Shaheer-op9872uw/VIO_V3," VIO v3: Redefining AI with Velocity  A blazing-fast, plug-and-play sequence model that crushes Transformers and outperforms Mamba in real-world compatibility. Built for high-speed text-based ML on massive datasets, VIO v3 is the future-ready architecture engineered for developers who demand speed, clarity, and power."
,npetrangelo/BFTML,Blazingly Fast Text Markup Language. Standards designed for web apps. Browser implementation in Rust.
,hasanxdev/DispatchR,"Fast, zero-alloc alternative to MediatR for .NET  minimal, blazing fast, and DI-friendly."
,rsonquery/rsonpath,Blazing fast JSONPath query engine written in Rust.
,mirecl/catboost-cgo,"CatBoost a fast, scalable, high performance Gradient Boosting on Decision Trees library. Golang using Cgo for blazing fast inference CatBoost Model "
,cdelv/JaxDEM,Easy to use and blazing fast JAX-based library for high-performance 2D/3D Discrete Element Method (DEM) simulations.
,vidhanio/hypertext,A blazing fast type-checked HTML macro crate.
,loonghao/PyRustor,A blazingly fast Python code parsing and refactoring tool written in Rust with Python bindings
,engrnoorfatima/ChatApp,"A full-stack real-time **chat application** built using the **MERN stack** with a blazing-fast frontend powered by **React + Vite**. Users can sign up, log in, and chat in real time with friends in a clean and modern UI."
,Atish019/AI-Powered-RAG-Document-Chatbot,"Ask intelligent questions from your PDF documents using Retrieval-Augmented Generation (RAG), Groq's blazing-fast LLaMA3, HuggingFace Embeddings, and Streamlit UI."
,Portkey-AI/gateway,"A blazing fast AI Gateway with integrated guardrails. Route to 200+ LLMs, 50+ AI Guardrails with 1 fast & friendly API."
,amberframework/amber,"A Crystal web framework that makes building applications fast, simple, and enjoyable. Get started with quick prototyping, less bugs, and blazing fast performance."
,shounakdev/Gitdock-cli," CLI tool for GitDock  a blazing-fast, Go-based Git alternative with RBAC and smart storage backends."
,Alacritty-for-Windows-Mac-Download/.github,"Download Alacritty for Windows  a blazing-fast, minimalist terminal emulator with GPU acceleration and cross-platform support."
,Iandenh/overleash,Override your Unleash feature flags blazing fast
,KavinsProjects/ChatBot,"Ollama ChatBot is a blazing-fast, privacy-first AI chatbot built using the power of Ollama's local large language models and the robustness of the Django web framework"
,Novfensec/KvDeveloper-Client,"Instantly load your app on mobile via QR code or Server URL. Experience blazing-fast Kivy app previews on Android with KvDeveloper Client, Its the Expo Go for Python devshot reload without the hassle."
,amirhosseinghanipour/dw,"A blazingly fast download accelerator, written in Rust"
,mudomi/pdf-service,Blazing Fast PDF Microservice using Typst
,SheepTester/video-sort-ai,Sort videos on Android. Written in blazing fast Rust 
,oyinbra/nvim-config," My Neovim Configuration in Lua  Powered by LazyVim  for a Blazing-Fast, Modular Workflow."
,denoland/deno_lint,Blazing fast linter for JavaScript and TypeScript written in Rust
,jackchuka/proto-migrate,"Protocol Buffer migrations done right - AST-aware, safe, and blazing fast "
,SongStitch/song-stitch,A blazingly fast web app for generating LastFM collages.
,thehackersplaybook/micro-search,Blazing fast text search for Node JS. Just blaze it! 
,andi-nugroho/chat0space,"Blazingly-fast, free, open source AI chat app"
,cojocaru-david/portfolio,"A modern, high-performance personal portfolio and blog built with Astro.js. Designed to showcase your projects and technical writing with blazing-fast performance and exceptional SEO."
,homebrew-ec-foss/Chronicle,A blazing fast real-time collaborative Markdown editor 
,KSXGitHub/parallel-disk-usage,"Highly parallelized, blazing fast directory tree analyzer"
,justinedoc/hono-api-template," Blazing-fast Hono API starter: TypeScript, OpenAPI, auth, tests & deploy"
,matafonoff/monobuild,"A blazing-fast CLI tool for incremental monorepo builds, supporting Angular, Nx, Yarn workspaces, and more  with dependency-aware sorting, build caching, and customizable build commands."
,mehranTaslimi/Ferrix,"Fast, modern, cross-platform download manager built with Rust and Tauri  supports resumable downloads, clean UI, and blazing performance."
,EricLBuehler/mistral.rs,Blazingly fast LLM inference.
,8b-is/smart-tree,"  A blazingly fast, context-aware directory tree tool co-created by human and AI for optimal information density across multiple output formats. Smart Tree bridges the gap between human readability and AI token   efficiency, providing fixed-width formats for parsing, ultra-compact modes for bandwidth optimization, and AI-specific formats.  HEX MODE"
,maindotmarcell/Vim-IDE-Config,Minimalist Vim motion config for blazingly fast workflows on common IDEs/editors with Vim Extension...
,sopaco/saga-reader," Blazing-Fast and Extremely-Lightweight Internet Reader driven by AI! Your AI-Powered think tank assistant.(Built with Rust, Tauri & Svelte)"
,NewGenesis04/InventoryFlow,"InventoryFlow is a blazing-fast, API-first inventory management system that helps you organize stock, manage orders, and automate communication across your supply chain  all with clean code and a modular design."
,ShivangSrivastava/fynd,"A blazing-fast, cross-platform, content-aware file search engine written in Go"
,Shreyansh5SS/SynapseX," **SynapseX** is a high-efficiency runtime tool offering blazing-fast execution, streamlined performance, and dependable operation.    Designed with an intuitive interface, seamless auto-maintenance, and cutting-edge compatibility for modern platforms.    Ideal for dynamic code interaction in sandboxed environments with low overhead and full "
,ds2050-git/Groq_Langchain_Chatbot,"A high-speed, local chatbot powered by Groq's LPU inference and integrated with LangChain for advanced conversational memory, retrieval-augmented generation (RAG), and custom prompt workflowsideal for blazing-fast, intelligent Q&A and knowledge-based interactions."
,joshroyelliott/zipfr,Blazingly fast Zipfian text analysis with interactive TUI
,milosz08/milosz08,"My own blazing fast and concurrency Java SSG engine, powered with markdown and HBS templates."
,shuntia/Lunatic-Core,"Cross-platform, Open Source, and Blazing fast video editor for oto-MADs."
,chinchang/web-maker,A blazing fast & offline frontend playground
,algolia/algoliasearch-client-swift, A fully-featured and blazing-fast Swift API client to interact with Algolia.
,Vaishnav-Sabari-Girish/ComChan,A Blazingly Fast Minimal Serial Monitor written in Rust
,mohammadkarrar14/wp-fastproxy,A blazing-fast Node.js proxy server that sits between your frontend and WordPress REST API.
,mintlu8/bevy_serde_lens,"Blazingly fast, schema based human-readable serialization crate for the bevy engine."
,UseInterstellar/Interstellar,One of the most popular modern web proxies with blazing fast speeds and a variety of games.
,manateelazycat/lsp-bridge,A blazingly fast LSP client for Emacs
,http4s/blaze,Blazing fast NIO microframework and Http Parser
,stephieprez/primo3,A blazing-fast algorithm to compute the next prime using optimized jumps and base-3 heuristics
,NilloGabriel/onfire-dwm,"A blazing fast, minimal and highly customizable dwm fork with essential patches applied."
