framework,full_name,description
,kimberlyidcne/tpaiexil,"Unlock blazing-fast Taipei proxies for seamless browsing, top privacy, and geo-unlocking! Boost your online freedom now with reliable, secure, and affordable Taipei proxy services. Try risk-free today!"
,helenuotyz/ptyala,"Unlock blazing-fast, secure Pattaya proxies for seamless browsing! Access geo-blocked content, boost privacy, and elevate your online experience with top-rated, reliable Pattaya proxy services today!"
,maryetjsg/tblrunear,"Unlock unlimited secure browsing with TunnelBear MOD APK! Enjoy blazing-fast VPN access, bypass geo-blocks, and protect your privacy effortlesslydownload now for the ultimate online freedom and security!"
,sarahepvlg/sfvpmxqz,"Unlock unlimited security and blazing-fast speeds with SafeSurf VPN Mod APK! Experience private, unrestricted browsingdownload now for free and stay safe online like never before!"
,karenekmku/crptstmvpn,"Unlock ultimate online freedom with Cryptostorm MOD APK! Experience blazing-fast, secure VPN access for streaming, privacy, and censorship bypass. Download now for unrestricted, anonymous internet browsing!"
,ruthoxpcb/brigtevon,"Unlock blazing-fast, secure browsing with Bridgetown Proxies! Experience anonymous access, seamless streaming, and ultimate online freedom. Boost your privacy todaytry Bridgetown Proxies for unbeatable performance and reliability!"
,helenuotyz/pogica,"Unlock blazing-fast, secure browsing with Podgorica proxies! Experience unmatched anonymity, high-speed connections, and reliable access to geo-restricted content. Get your Podgorica proxy todaybrowse smarter, safer, faster!"
,kimberlyidcne/sakoa,"Unlock blazing-fast, secure Osaka proxies for seamless browsing and unbeatable online privacy. Experience top-tier IP rotation, unlimited bandwidth, and 24/7 supportboost your digital freedom today!"
,susanorfnm/tigera,"Unlock blazing-fast, secure Gitega proxies for anonymous browsing and seamless geo-unblocking. Experience unmatched privacy and performance. Get your reliable Gitega proxy nowboost speed and stay hidden instantly!"
,sarahepvlg/rvpmdak,"Unlock unlimited secure browsing with Rav VPN Mod APK! Experience lightning-fast, free, and unrestricted access to any website. Download now for ultimate privacy and blazing speeds!"
,michelleeueij/prdexlaptop,"Unlock blazing-fast, secure browsing with top desktop proxies! Experience unmatched anonymity, boost online access, and protect your data effortlessly. Try premium proxies today for flawless performance and privacy!"
,ruthamack/pof7ultra,"Unlock lightning-fast, secure browsing on your POCO F7 Ultra! Discover the best VPN for ultimate privacy, blazing speed, and seamless streaming. Stay safedownload the top POCO F7 Ultra VPN today!"
,karenekmku/elptfmvpn,"Unlock unlimited browsing with ElephantVPN MOD APK! Enjoy blazing-fast speeds, enhanced security, and free premium features. Download now for safe, anonymous internet access anywhereexperience true online freedom today!"
,kimberlyozebg/chdraxpl,"Unlock blazing-fast Chad proxies for ultimate anonymity & seamless streaming. Secure, reliable, and highly ratedboost your online freedom today with top-tier proxy solutions!"
,kimberlyidcne/vzltarae,"Unlock blazing-fast Valletta proxies for secure, anonymous browsing. Boost online privacy, bypass geo-blocks, and experience seamless accesstry Valletta Proxy today for unbeatable speed and reliability!"
,michelleamggg/frproxlym,"Unlock blazing-fast, 100% free proxies for anonymous, secure browsing! Access blocked sites instantly with reliable, high-speed proxiesboost your privacy today. Try Free Proxies Proxies/Proxy now!"
,denghe/xx,blazing fast 2d game engine base on c++20 coroutine & opengl es3
,susanorfnm/pnamza,"Unlock blazing-fast, anonymous browsing with Panama proxies! Experience unbeatable security, geo-unlocking, and private access. Get your reliable Panama proxy now and surf without limitsboost your online freedom today!"
,helenuotyz/mlezaqru,"Unlock blazing-fast, secure internet access with Mal Proxies! Experience unlimited anonymity, seamless streaming, and reliable connections. Get your premium Mal proxy now for ultimate online freedom and privacy!"
,karenekmku/dgbtvpn,"Unlock unlimited privacy with DigibitVPN MOD APK! Enjoy blazing-fast, secure, and free VPN accessbypass geo-blocks effortlessly. Download now for ultimate online freedom and protection!"
,karenekmku/dtpvpn,"Unlock unlimited privacy and blazing-fast speeds with DotVPN MOD APK! Experience secure, unrestricted browsing and access geo-blocked content effortlessly. Download now for free and boost your online freedom!"
,paradigmxyz/solar,"Blazingly fast, modular and contributor friendly Solidity compiler, written in Rust"
,mkobayashime/bundlemonkey,Bundlemonkey is a userscript bundler designed to make developing browser userscripts blazing fast and efficient 
,kimberlyozebg/cvbrode,"Unlock blazing fast, secure Cabo Verde proxies for anonymous browsing, seamless streaming, and global access. Boost your privacy and unblock websites instantly with reliable Cabo Verde proxy services today!"
,michelleamggg/iprypexal,"Unlock blazing-fast, anonymous browsing with IP Royal Proxies! Experience top-tier, reliable proxy solutions for SEO, scraping, and privacy. Boost your online freedom todaytry IP Royal Proxies now!"
,wecoded-dev/Aquascript,"Welcome to   your fast, simple, and developer-friendly platform  for generating blazing-fast fake JSON data APIs , perfect for seamless development, testing, andprototyping  "
,dorothyemfxn/srafexy,"Unlock blazing-fast proxy speeds with our top-rated proxies! Experience seamless browsing, enhanced privacy, and unbeatable performance. Get the fastest proxies nowboost your online freedom instantly!"
,maryetjsg/xtmtpvnmod,"Unlock unlimited internet freedom with XTM Tunnel VPN Mod APK! Experience blazing-fast, secure, and unrestricted browsingdownload now for ultimate online privacy and unbeatable connectivity!"
,danilovilhena/turbosql-releases,"Blazing-fast, AI powered SQL editor"
,helenuotyz/csnhvraqpl,"Unlock blazing-fast internet with Chiinu proxies! Experience secure, anonymous browsing and bypass geo-blocks effortlessly. Get reliable Moldova-based proxies nowboost your online privacy and speed today!"
,dorothyemfxn/munchivix,"Unlock blazing-fast, secure internet access with Munich Proxies! Experience anonymous browsing, bypass geo-restrictions, and boost your online privacy today. Get reliable Munich proxy services now!"
,helenuotyz/futafenil,"Unlock blazing-fast, secure access with Funafuti proxies! Experience seamless browsing, enhanced privacy, and unrestricted content anywhere. Get your reliable Funafuti proxy nowboost speed and protect your online identity instantly!"
,kimberlyidcne/pvzotra,"Unlock blazing-fast, secure access with Port Vila proxies! Bypass geo-restrictions, enhance privacy, and boost browsing speed. Get reliable Port Vila proxy services now for seamless online freedom!"
,maryetjsg/xvpmotnek,"Unlock unlimited security and blazing-fast internet with Xtunnel VPN MOD APK! Experience premium features for free, bypass restrictions, and surf anonymouslydownload now for ultimate online freedom!"
,michelleamggg/spirkos,"Unlock blazing-fast, secure browsing with ISP proxies! Boost anonymity, bypass geo-restrictions, and enhance online privacy. Get reliable, high-speed proxy solutions todaysurf smarter and safer now!"
,kimberlyozebg/mvldsraze,"Unlock blazing-fast, secure Maldives proxies for seamless geo-unblocking and anonymous browsing. Boost your online privacy today with top-rated, reliable Maldives proxy services! Try now!"
,karenekmku/clokvpn,"Unlock blazing-fast, secure browsing with CloakVPN MOD APK! Experience unlimited access, premium features, and total privacydownload now for the ultimate VPN freedom and online protection!"
,kimberlyozebg/jmkaeza,"Unlock blazing-fast, secure Jamaica proxies for unlimited access and private browsing. Boost your online freedom now with top-rated, reliable Jamaican proxy servicesexperience seamless, anonymous internet like never before!"
,donnaayzsr/zcehta,"Unlock blazing-fast Czechia proxies for secure, anonymous browsing! Get reliable, high-speed IPs ideal for web scraping, streaming, and geo-unblocking. Boost your online privacy todaytry Czechia proxies now!"
,maryetjsg/wpvmodak,"Unlock unlimited privacy and blazing-fast speeds with Wagner VPN Mod APK! Get free premium features, secure browsing, and bypass geo-restrictions effortlessly. Download the latest MOD APK now!"
,ruthoxpcb/mnbaar,"Unlock blazing-fast access with Manama Proxies! Secure, reliable, and anonymous proxy solutions tailored for Manama users. Boost your online freedom and privacy now! Get started today!"
,dorothyemfxn/b4gpzkrn,"Unlock blazing-fast, secure 4G proxies for seamless browsing and ultimate anonymity. Discover the BEST 4G proxies todayboost speed, privacy, and access geo-restricted content effortlessly!"
,michelleamggg/clafprox,"Unlock blazing-fast, secure browsing with Cloudflare proxies! Protect your privacy, bypass geo-blocks, and boost online anonymity effortlessly. Get reliable Cloudflare proxies now for ultimate internet freedom!"
,ruthamack/jdthaeqz,"Unlock blazing-fast, anonymous browsing with Jeddah proxies! Access geo-restricted content, enhance security, and boost online freedom today. Get reliable Jeddah proxies nowexperience seamless, private internet access!"
,sarahepvlg/spvpned,"Unlock blazing-fast, unlimited browsing with Speed VPN MOD APK! Enjoy secure, private access worldwidedownload now for free and experience internet freedom like never before!"
,sarahepvlg/rusvpnmdiuo,"Unlock unrestricted internet with Russia VPN MOD APK! Fast, secure, and free access to geo-blocked sites. Download now for ultimate online privacy and blazing-speed browsing. Get it today!"
,hoangsonww/The-Pokedex-Database," An interactive Pokdex app built with Next.js, Tailwind CSS, and React Query for blazing-fast performance and smooth UX. Includes live search, item explorer, and a favorites system powered by local storage."
,sarahepvlg/sqvpnmokap,Unlock unlimited privacy and blazing-fast speeds with Square VPN Mod APK! Download the latest MOD APK now for free premium features and secure browsing without ads. Get it today!
,kimberlyidcne/nyroxalq,"Unlock blazing-fast New York proxies for seamless, anonymous browsing! Boost security, access geo-restricted content, and maximize performance with premium NYC proxy services. Get started today!"
,maryetjsg/vupvamok,"Unlock unlimited privacy and blazing-fast streaming with Vu VPN MOD APK! Download the latest version now for free, enjoy premium features, no ads, and secure your online freedom instantly!"
,helenuotyz/chnelaixr,"Unlock blazing-fast Chennai proxies for seamless browsing, enhanced privacy, and unmatched security. Experience top-tier anonymous access with Chennai proxiesboost your online freedom now!"
,sandraiftpk/prshwcktx,"Unlock blazing-fast Shadowrocket proxies for ultimate privacy and seamless browsing! Experience stable, secure connections with top-rated proxies. Get yours now and browse without limits!"
,dorothyemfxn/prmegxozy,"Unlock blazing-fast, secure browsing with Mega Proxies! Experience anonymous, reliable proxy services perfect for streaming, gaming, and privacy. Get your ultimate proxy solution nowboost speed and safety today!"
,helenuotyz/klapurmu,"Unlock blazing-fast, secure browsing with Kuala Lumpur proxies! Experience anonymous access, bypass geo-blocks, and boost online privacyperfect for marketers, gamers, and streamers. Get your KL proxy today!"
,sarahepvlg/swvpnmdiuo,"Unlock unlimited internet freedom with Swift VPN Mod APK! Experience blazing fast, secure, and unrestricted browsing. Download the latest mod now for free and surf anonymously with no limits."
,maryetjsg/vpfmdkz,"Unlock blazing-fast, unlimited browsing with Very Fast VPN MOD APK! Experience secure, anonymous access and bypass geo-restrictions instantly. Download the latest mod APK for total online freedom now!"
,david-ta-ming/quadrivium,"Quadrivium is a blazing-fast, parallelized Java library for generating magic squares of arbitrary order using evolutionary search."
,helenuotyz/paisa,"Unlock blazing-fast, anonymous browsing with Apia Proxies! Experience secure, reliable, and lightning-speed proxy services designed to boost your online privacy and access geo-restricted content effortlessly. Try now!"
,kotgres/kotgres,Blazing-fast Postgres-only ORM for Kotlin
,kimberlyidcne/honiavulu,"Unlock blazing-fast, secure Hanoi proxies for seamless browsing, privacy, and geo-unblocking. Boost your online freedom today with reliable, high-anonymity proxy servers tailored for Vietnam users!"
,dorothyemfxn/frpxepro,"Unlock blazing-fast, secure browsing with our Free Proxies! Stay anonymous, bypass restrictions, and boost online privacy instantly. Click now to access top-rated, reliable proxy servers for free!"
,lane711/sonicjs,SonicJs Headless CMS - Blazing Fast Headless CMS built on Cloudflare Workers. 100% Javascript Based
,sopaco/saga-reader," Blazing-Fast and Extremely-Lightweight Internet Reader driven by AI! Your AI-Powered think tank assistant.(Built with Rust, Tauri & Svelte)"
,michelleamggg/lnprxeya,"Unlock blazing-fast, secure browsing with Luna Proxies! Experience top-tier anonymity, unlimited bandwidth, and 24/7 support. Boost your online freedomtry Luna Proxies today!"
,sarahepvlg/rvmpla,"Unlock unlimited secure browsing with Run VPN Mod APK! Enjoy blazing fast speeds, unlimited access, and top privacy features. Download the latest MOD APK now for a seamless online experience!"
,hasura/graphql-engine,"Blazing fast, instant realtime GraphQL APIs on all your data with fine grained access control, also trigger webhooks on database events."
,bettyucyre/prvamedex,"Unlock blazing-fast Virgin Media proxies! Experience seamless browsing, enhanced security, and unrestricted access with top-rated proxies tailored for Virgin Media users. Boost your online freedom todayclick to explore!"
,helenexsgg/xoyprahs,"Unlock blazing-fast, secure access with top Yahoo proxies! Boost privacy, bypass geo-blocks, and enjoy seamless browsing. Get your reliable proxy nowexperience Yahoo like never before!"
,sarahepvlg/svmpaqlz,"Unlock unlimited secure browsing with Simple VPN Mod APK! Enjoy blazing-fast speeds, unrestricted access, and top-notch privacydownload the MOD APK now for free and surf without limits!"
,ruthamack/tlaxphez95,"Unlock ultra-fast, secure browsing with the TP-Link Archer AXE95 VPNultimate protection, blazing Wi-Fi 6E speeds, and seamless setup. Discover why its the best choice for VPN users today!"
,maryetjsg/vpmakrayv2,"Unlock limitless browsing with V2Ray VPN Mod APK! Experience blazing-fast, secure, and unrestricted internet access. Download the latest MOD APK now and stay anonymous online effortlessly!"
,unplugin/unplugin-isolated-decl, A blazing-fast tool for generating isolated declarations.
,michelleamggg/fpxreo,"Unlock blazing-fast, free proxy proxies for anonymous browsing, enhanced security, and unrestricted access. Discover top-rated, reliable proxy servers nowboost your privacy and surf the web instantly!"
,kimberlyidcne/abdihu,"Unlock blazing-fast, secure Abu Dhabi proxies for anonymous browsing, geo-unblocking, and data scraping. Experience top-tier privacy and ultimate online freedom todayget your Abu Dhabi proxy now!"
,kimberlyidcne/zubja,"Unlock blazing-fast, secure internet with Abuja proxies! Experience unmatched privacy, bypass restrictions, and boost your online freedom today. Get reliable Abuja proxy services tailored just for you!"
,kimberlyidcne/snaza,"Unlock blazing-fast, secure Sana'a proxies for anonymous browsing and unbeatable access. Boost your online privacy with top-rated Sana'a proxy servers todayexperience seamless, geo-unrestricted internet like never before!"
,donnaawhfu/prxjioalv,"Unlock blazing-fast Jio proxy access with reliable, secure proxies! Boost your online privacy, bypass geo-restrictions, and enjoy seamless browsing with top Jio proxies today. Get started now!"
,dathere/qsv,Blazing-fast Data-Wrangling toolkit
,maryetjsg/zpvmodapk,"Unlock unlimited privacy and blazing-fast speeds with Z VPN Mod APK! Experience flawless streaming, secure browsing, and bypass restrictions effortlessly. Download now for free and enjoy ultimate online freedom!"
,ruthoxpcb/stpvrexa,"Unlock blazing-fast, secure browsing with Sao Tome and Principe proxies! Access geo-restricted content, boost online privacy, and enjoy seamless streamingtry top-rated Sao Tome proxies today for ultimate internet freedom!"
,kimberlyidcne/lsbonzqgp,"Unlock blazing-fast, secure Lisbon proxies for seamless browsing and ultimate online privacy. Boost your business and access geo-restricted content effortlessly. Get reliable Lisbon proxy solutions now!"
,heleneeijt/pc4mzv,"Frustrated by constant Pico 4 lag and blocked content? The secret to blazing-fast, unrestricted VR awaitsunlock your devices full potential with the best VPN youve never heard of."
,susanorfnm/vzenlara,"Unlock blazing-fast, secure internet in Venezuela with top-rated proxies! Bypass restrictions, protect privacy, and enjoy seamless browsing. Get the best Venezuela proxies now for unbeatable speed and anonymity!"
,sandraiftpk/promezxylan,"Unlock blazing-fast, secure access to Mega.nz with premium proxies! Bypass restrictions, boost download speeds, and stay anonymous. Get the best Mega.nz proxy now for seamless file sharing!"
,arisecode/katsini," A blazing-fast, lightweight, and user-friendly tool built with Go for retrieving app information from major app stores."
,EmamSaimon592/GSAP_project01," GSAP (GreenSock Animation Platform)  A blazing fast  JavaScript animation library  for professional-grade animations  on the web . Smooth, performant, and insanely flexible . Perfect for UI/UX, games , and interactive websites . #JavaScript #Animation"
,SunusiAA/suichain-gpt,"About SuiChain GPT simplifies DeFi for everyone. Its an AI-powered assistant that helps users simulate, plan, and execute DeFi strategies using Suis blazing-fast blockchain. Powered by GPT and Walrus, it offers real-time strategy recommendations, risk analysis, and one-click smart contract execution."
,kimberlyidcne/gzhnauro,"Unlock blazing-fast, secure browsing with Guangzhou proxies! Perfect for privacy, geo-unlocking, and web scraping. Get reliable, anonymous Guangzhou proxy services todayboost your online freedom instantly!"
,donnaayzsr/xrlzugmep,"Unlock blazing-fast, secure browsing with top Luxembourg proxies! Enjoy anonymous, reliable access to geo-restricted content. Get yours now and elevate your online freedom instantly!"
,maryetjsg/vspnkmxra,"Unlock unlimited VIP Sniper VPN MOD APK now! Experience blazing-fast, secure browsing with premium features unlocked. Download the latest version for free and surf anonymously like a pro today!"
,kimberlyidcne/mexicyo,"Unlock blazing-fast Mexico City proxies for secure, anonymous browsing. Experience unmatched geo-targeting, high-speed connections, and reliable accessboost your online freedom today! Click now for exclusive deals!"
,dorothyemfxn/bskprxylz,"Discover the best SOCKS5 proxies for blazing-fast, secure browsing. Unlock anonymous internet access nowboost privacy, speed, and reliability with top-rated SOCKS5 proxy providers today!"
,maryetjsg/wvpmdka,"Unlock unlimited secure browsing with Wang VPN Mod APK! Experience blazing-fast, unrestricted access to all websites. Download the latest MOD APK now for free and stay protected anytime, anywhere!"
,tunakasif/rustureng,*Blazingly fast* CLI tool for using tureng.com
,magicblock-labs/magicblock-validator,Blazing-Fast SVM Ephemeral Validator
,stephanlensky/zendriver,"A blazing fast, async-first, undetectable webscraping/web automation framework based on ultrafunkamsterdam/nodriver. Now with Docker support!"
,sarahepvlg/rflvpnmkxa,"Unlock unlimited secure browsing with Rocket Fly VPN MOD APK! Experience blazing-fast, unrestricted internet access and enhanced privacydownload the latest mod now for ultimate online freedom!"
,sarahepvlg/suvpenbrap,"Unlock unlimited privacy & blazing-fast speeds with SuperbVPN MOD APK! Enjoy secure, unrestricted browsing and premium features for free. Download now and experience ultimate online freedom!"
,kimberlyidcne/asunicor,"Unlock blazing-fast, secure Asuncin proxies for anonymous browsing and instant geo-unblocking. Boost your online freedom with reliable, affordable proxy solutions tailored for Paraguay users. Try now!"
,michelleamggg/dcaproxet,"Unlock blazing-fast, reliable datacenter proxies for seamless online anonymity and unlimited access. Boost your scraping, gaming, & SEO with top-tier proxy solutions today!"
