framework,full_name,description
,vojtechgadurek/FlashHash,Blazingly fast hashing functions from ulong to ulong. 
,IndianBoy42/lsof-rs,Blazing Fast (not really) Super Safe (probably) Modern lsof-style utility
,CWood-sdf/lazyline.nvim,A blazingly fast statusline that lazy loads components and supports asynchronous jobs
,IntellectualSites/FastAsyncWorldEdit,"Blazingly fast world manipulation for artists, builders and everyone else: https://www.spigotmc.org/resources/13932/"
,acidflow-noita/noitamap,Blazingly-fast superzoom map for Noita
,manodeep/Corrfunc,Blazing fast correlation functions on the CPU.
,mokurin000/anti-spam-matrix,A Matrix Bot to ban spammers that runs blazingly fast 
,noahzeisberg/FyUTILS," An OSINT and hacking command line application built with Go, offering blazing-fast performance and awesome utilities."
,MrGilli/Quplexity,Quplexity is a blazingly fast and lightweight application for Simulating Quantum Computer logic and circuits without an expensive GPU on traditional hardware.
,nvimdev/modeline.nvim,neovim statusline plugin blazing fast than any statusline plugin
,daUnknownCoder/NeutronVim," Unleash the Power  with A Highly Customizable  & Blazingly Fast  Neovim Configuration, Inspired by the Unyielding Force  of Neutron Stars , harnessing the incredible gravitational pull of Neovim's capabilities , offering a star-studded constellation of features and plugins  for a seamless and efficient coding journey !"
,event33/pumpkin,"pumpkin.css & pumpkin.js are new blazingly-fast, beautiful and lightweight js and css frameworks"
,EduardoNeville/blitz_guard,Blazingly fast oxidezed VPN
,TheOpenDictionary/odict,"A blazingly-fast, offline-first format and toolchain for lexical data "
,PlayPro/CoreProtect,CoreProtect is a blazing fast data logging and anti-griefing tool for Minecraft servers.
,anujkumarnath/starship-custom-config,"Custom configuration for Starship (The minimal, blazing-fast, and infinitely customizable prompt for any shell!)"
,victrme/pocket-editor,Blazingly fast block style wysiwyg editor that returns markdown
,Voidheart88/splice,Splice - A blazingly fast Spice simulator
,0x61nas/lqth, Simple but blazingly fast screenshot utility
,TomerAberbach/get-all-files, A blazing fast recursive directory crawler with lazy sync and async iterator support.
,opekope2/OptiGUI,Blazing fast custom GUI textures on Fabric and Quilt with built-in OptiFine custom GUI resource pack support
,ninpnin/days-since-blazingly-fast,
,javis-admin/flash-find,blazing fast client-side search utility
,mazshakibaii/bun-merkle-tree,A CLI merkle-tree implementation in Typescript on the Bun runtime. Using worker threads for BLAZINGLY FAST processing.
,BlazeInferno64/blazed,"Blazing Fast, All in one HTTP requests library"
,iresharma/reach-auth-proxy,Authentication proxy for reach servers written in go for blazing fast session validations.
,AmenRa/ranx,"A Blazing-Fast Python Library for Ranking Evaluation, Comparison, and Fusion "
,nyabinary/nyanbinary.rs,Blazing Fast Website
,bytedance/sonic,A blazingly fast JSON serializing & deserializing library
,jassuwu/psgoogle,A blazingly fast search engine for psgtech.edu.
,Moderrek/lines,Blazingly FAST concurrent line of code counter created in GO
,GitArika/gatsby-first-blog-site, Blazing fast blog built with Gatsby and Cosmic JS 
,gotzmann/comet,Modern PHP framework for building blazing fast REST APIs and microservices
,Kaweees/kiwi-app,"A blazingly-fast, modern, and sensible monorepo architecture for creating full-stack web applications."
,JesseKoldewijn/Jereko,Blazingly fast App Router based Next.js application used as my personal portfolio
,neoground/charm,"Experience Charm, a blazing-fast PHP 8 framework tailored for high-performance web apps & APIs. Unleash your business potential with this sleek, lightweight powerhouse. Level up your development!"
,meetmonday/node-trashkek,blazing fast () hooeta 
,alex1988m/go-pscan,blazingly fast utility to scan hosts ports
,Portkey-AI/gateway,A Blazing Fast AI Gateway. Route to 200+ LLMs with 1 fast & friendly API.
,rayy40/sports,"A sports website that shows data for various sports such as basketball, football, AFL, NFL, baseball, hockey and rugby. The date is being fetched with async await in next js server components which makes the website blazingly fast."
,ztlevi/doom-config,Blazing fast Doom Emacs private configuration
,GoodBoyNeon/sprofile, Blazingly fast TUI application for viewing your Spotify listening activity.
,tensorwavecloud/commandant-rs,Blazingly Fast Enterprise Infrastructure Benchmarking & Diagnostic Kit
,Pismice/rename-i3-workspace,Allow i3 users to blazingly fast rename their i3 workspaces
,Narayanbhat166/blazer,A blazingly fast terminal type racer built with rust and ratatui
,fuzzland/ityfuzz,Blazing Fast Bytecode-Level Hybrid Fuzzer for Smart Contracts
,knowledgepicker/word-cloud,Fast word cloud library for .NET. Uses Quadtrees for blazing-fast performance. Maintained by the KnowledgePicker team.
,cyclone-github/hashgen,hashgen - the blazingly fast hash generator
,imadafa/System-Tools,"System tools repository as my first rust project, CLI interface blazing fast with unlimited functionality (soon)"
,a16z/magi,A blazing fast OP Stack rollup client written in Rust
,jpmorganchase/depcom,A blazing fast go / npm package that extracts imported dependencies from Javascript / Typescript / CSS source files.
,wilsonjs/wilson,"The blazing fast website framework. Build next-gen, fully-featured documentation websites and developer blogs!"
,StardustXR/server,"Stardust XR Reference Server, now blazingly fast in Rust :D"
,Bigguysahaj/blazingly-fast-gallery,
,Sharko64/Blaze-Editor,Blazingly fast code editor with huge modular hack-yourself extentability 
,OutdatedGuy/package_rename,A Blazingly Fast way to configure your Bleeding Edge flutter project to be production ready.
,JiLiZART/BBob,"Blazing fast js bbcode parser, that transforms and parses bbcode to AST with plugin support in pure javascript, no dependencies "
,chrisjsewell/markdown-it-pyrs,"A Python interface for markdown-it.rs, using Rust for blazingly fast parsing  "
,VArtzy/Bun-Book-Management-API,"Crazy blazing fast book management TS rest api with bun, hono, sqlite, pino, drizzle and more."
,hasura/graphql-engine-heroku,"Blazing fast, instant realtime GraphQL APIs on Postgres with fine grained access control, also trigger webhooks on database events."
,willothy/veil.nvim,"A blazingly fast, animated, and infinitely customizeable startup / dashboard plugin (currently unmaintained, but with plans for a ground-up rewrite)"
,huggingface/text-embeddings-inference,A blazing fast inference solution for text embeddings models
,JorgenVatle/atshop-service-models, Service models for the ATShop 2.0 API. Enables blazing fast and intuitive interaction with the data layer of ATShop.
,suhasasumukh/turbox, Turbox is a blazing-fast in-memory Vector Database API
,TemariVirus/perfect-tetris,Blazingly fast Tetris perfect clear solver
,SongStitch/song-stitch,A blazingly fast web app for generating LastFM collages.
,shadcn/gatsby-themes,"A collection of open source, well designed, highly customizable and 100% free Gatsby themes for blazing fast sites. We are working on the next version of the Flex theme. See https://github.com/reflexjs/reflexjs"
,algolia/algoliasearch-client-kotlin, A fully-featured and blazing-fast Kotlin/Android API client to interact with Algolia.
,rodabt/vduckdb,"A blazing-fast DuckDB wrapper built with the V language, making it easier to leverage its power in your projects. "
,mbacalan/year-progress,Years are passing blazingly fast
,bytestring-net/bevy_lunex,"Blazingly fast path based retained layout engine for Bevy entities, built around vanilla Bevy ECS."
,louisbrulenaudet/ragoon,Improve large language models (LLM) retrieval using dynamic web-search based on blazingly fast query generation from Groq chips   
,algolia/algoliasearch-client-php, A fully-featured and blazing-fast PHP API client to interact with Algolia.
,JSchlensok/VespaG,Expert-Guided Protein Language Models enable Accurate and Blazingly Fast Fitness Prediction
,Daaviddev/vite-dashboard-starter,"Jumpstart your next dashboard with Vite Dashboard Starter  a cutting-edge, feature-rich boilerplate designed for modern web development. This meticulously crafted starter kit combines the blazing-fast Vite build tool with React's powerful ecosystem, all wrapped in the type-safety of TypeScript."
,StardustXR/core,"libstardustxr, written from scratch blazingly fast in Rust!"
,wormtql/yas,Blazingly fast Genshin Impact/Honkai: Starrail artifacts scanner
,douglasjunior/react-native-pdf-renderer," A zoomable, blazing fast, zero dependencies, pure native, typed PDF Renderer for Android and iOS."
,alphazen618/zenbt,"A production ready, blazing fast, python backtester, powered by rust"
,Meenachinmay/dev-pay,"A blazing fast gRPC and TIgerbeetle server which can process 1,000,000 accounts creation in just 0.19s."
,sxyazi/yazi," Blazing fast terminal file manager written in Rust, based on async I/O."
,uber-go/zap,"Blazing fast, structured, leveled logging in Go."
,MarcosTypeAP/pegasus,A blazingly fast WSGI web server written from scratch (gunicorn killer).
,foundry-rs/starknet-foundry,Blazing fast toolkit for developing Starknet contracts.
,cswinter/LocustDB,Blazingly fast analytics database that will rapidly devour all of your data.
,ChmielewskiKamil/nvim,"My blazingly fast Neovim config for Solidity, Rust and Go."
,ethanelliott/rxs,"A super simple, type-safe, and blazingly fast RxJS store."
,icedland/iced,"Blazing fast and correct x86/x64 disassembler, assembler, decoder, encoder for Rust, .NET, Java, Python, Lua"
,roneli/fastgql,"Blazing fast, instant realtime & extendable GraphQL APIs powered by gqlgen"
,AnirudhG07/awesome-yazi,"Blazing Fast Yazi's Plugins, flavours and resources."
,nathan-barry/nathan.rs,My personal site using Hugo for static site generation. Blazingly Fast.
,VirtoCommerce/vc-theme-b2b-vue,Virto Commerce Frontend - B2B SPA is a fresh look on the field of eCommerce solutions. This is a place where common B2B and B2C scenarios are combined with the most bleeding edge technologies to deliver blazing fast and fully functional solution. It implements common business use-cases needed for a vast majority of projects we build.
,warpdotdev/keysets,"Custom keyboard shortcut presets for Warp, a blazingly fast modern terminal"
,aws-neuron/aws-neuron-sdk,"Powering AWS purpose-built machine learning chips. Blazing fast and cost effective, natively integrated into PyTorch and TensorFlow and integrated with your favorite AWS services"
,wszczawinski/Passivhaus,This project leverages Gatsby with TypeScript and Sass to create a blazing-fast website with WordPress as headless CMS and automated deployment through GitHub Actions CI/CD.
,dasph/lnkr-web,"A web client for the blazingly fast, minimalistic link shortener."
,100mslive/100ms-docs," Blazing fast 100ms Documentation built with nextjs, preact , mdx , next-mdx-remote"
,hyprwm/hyprpaper,Hyprpaper is a blazing fast wayland wallpaper utility with IPC controls.
,SinTan1729/chhoto-url,"A simple, blazingly fast, selfhosted URL shortener with no unnecessary features; written in Rust."
,wochap/nvim,Blazingly fast nvim config inspired by NvChad and LazyVim
